sha256,pkgName,categoryID,description
A059C454A9F1A87A87E5A17037A6018DB2FEB75CD54A82ED5153F85357005776,com.kpmoney.android,FINANCE,"[The one of best tools for keeping accounts, efficiently tracking each expense report]  [ Support Web, iOS and Android ]  web:   https://web.andromoney.com/  Thanks for recommendation of Shady Al Aref Bellah : https://nazzam.com/easily-track-expenses  AndroMoney is a personal finance tool for use on your mobile phone. By using this tool, we hope you can better manage your wealth.   We focus on: 1.Ease of use: keep it intuitive to operate 2.Powerful:daily accounting, managing categories, or even drawing detail reports, AndroMoney can easily manage it.  As this App's name suggests, we hope AndroMoney will be the best personal finance tool on Android! If you have any problems about how to use it or ideas about how to improve it, feel free to email us. We appreciate your feedback!  features - Multiple accounts and support account balance & account transfer - Cloud Storage (Dropbox , Google Docs) - SYNC with other devices  - Any currency with downloadable rates - Number pad with calculation - Hierarchical categories with custom attributes - Simple/ Detail / Custom Budgets - Trend, Pie and Bar charts for Expense and Cash Flow - Password Protection - Overview your expense and income summary - Back up data to Excel/ Mac Number  *Recommended by Appgovideo.com (http://www.appgovideo.com/)  Manage your expense and money easily !  If you have problem please e-mail to us! ( We can't reply you on google play...) service@andromoney.com Thank you!  Special thank to  Mario Lüthy for German translation. Mike Kazonis for Greek translation. Jean Marie for French translation. Елена Трифонова for Russia translation. Alessio Salerno and Carlo Pite for Italian translation."
448A71E9983C8588FB6E1CB6209AD3CABABB9A59D72472EC9455B2EF9790024F,com.Splitwise.SplitwiseMobile,FINANCE,"Splitwise is the easiest way to share expenses with friends and family and stop stressing about “who owes who.” Millions of people around the world use Splitwise to organize group bills for households, trips, and more. Our mission is to reduce the stress and awkwardness that money places on our most important relationships.   Splitwise is great for: - Roommates splitting rent and apartment bills - Group trips around the world - Splitting a vacation house for skiing or at the beach - Weddings and bachelor/bachelorette parties - Couples sharing relationship costs - Friends and co-workers who go out to lunch or dinner together frequently - Loans and IOUs between friends  - And so much more  Splitwise is simple to use: - Create groups or private friendships for any splitting situation - Add expenses, IOUs, or informal debts in any currency, with support for offline entry - Expenses are backed up online so any everyone can log in, view their balances, and add expenses - Keep track of who should pay next, or settle up by recording cash payments or using our integrations   Endorsements: “Makes it easy to split everything from your dinner bill to rent.” - NY Times ""Fundamental for tracking finances. As good as WhatsApp for containing awkwardness."" – The Financial Times “I never fight with roommates over bills because of this genius expense-splitting app”- Business Insider “The Single Best App You Can Download for Group Trips of Any Kind” - Thrillist   Here are some of our industry-leading features: - Multi-platform support for Android, iOS, and web - Simplify debts into the easiest repayment plan - Expense categorization - Calculate group totals - Export to CSV - Comment directly on expenses - Split expenses equally or unequally by percentages, shares, or exact amounts - Add informal debts and IOUs - Create bills that recur monthly, weekly, yearly, fortnightly - Add multiple payers on a single expense - See total balances with a person across multiple groups and private expenses - Custom user avatars - Cover photos for groups  - Activity feed and push notifications help you stay on top of changes - View your edit history for changes to an expense - Any deleted group or bill can be restored easily - World-class customer support - Pay back using our integrated payments: Venmo and PayPal (US only), Paytm (India only) - 100+ currencies and growing - 7+ supported languages  Get Splitwise Pro for even more amazing features! - Convert expenses to different currencies using our Open Exchange Rates integration - Access to “spending by category” budgeting tools and other charts - OCR integration for scanning and itemizing receipts - Store high-resolution receipts in the cloud (10GB cloud storage) - Backups to JSON, downloadable from our website - Search full expense history - Save default splits"
274A6FD6EC63F09D1C53F136386900C3E73B0B41CB276509C0B1143A7D344D41,com.zoho.expense,BUSINESS,"Automate expense reporting by scanning your receipts on the go.  Zoho Expense is designed to automate expense tracking and travel management for your organization. Scan your receipts on the go by using the Autoscan receipt scanner to create expenses, then add them to reports and submit them instantly. Plan your business travel by creating itineraries for your trips. Managers can approve reports and trips with just a single tap.  To encourage small businesses and freelancers, Autoscan is now available for Zoho Expense free plan users for up to 20 scans per calendar month.  Here's what Zoho Expense offers:  * Store receipts digitally and drop the paper receipts. * Track mileage with a built-in GPS tracker. Zoho Expense records mileage expenses for your trips. * Scan receipts in 15 different languages using the receipt scanner. Take a picture from your Zoho Expense app and an expense will be created automatically. * Connect your personal and corporate credit cards to Zoho Expense and track your daily card spends. Click to convert them into expenses. * Record and apply cash advances to your expense report. The expense app automatically adjusts the total expense amount. * Create new trip itineraries and get them approved. * Catch up on pending expense reporting tasks with the help of Zia, your assistant. * Approve reports instantly and move them toward reimbursement. * Receive instant notifications and stay updated on the status of your submitted reports and trips. * Get quick insights on your business spend with analytics. * Add expenses when you are offline and have them synced once you are back online.    Awards won: 1. Zoho Expense has been recognized as the winner in the Business category in the AatmaNirbhar Bharat App Innovation Challenge organized by the Government of India.  2. Voted one of the Best Products for Finance by G2.  3. ""Expense Management"" category leader on G2.  Download & sign up for a 14-day free trial to manage your business expense reports on the go."
8C3942B425A3AB06DCE34705FF3705CBB2B59DF1FAA5CEB6196ADE901EEF858C,ru.zenmoney.androidsub,FINANCE,"Rely on numbers when making decisions: 1. Clear analysis shows where your money is being spent. 2. Statistics from previous months provide financial insights, such as how much is needed for necessary expenses, and how much you can spend on coffee, books, a trip to the movies or your next adventure.  3. Planning tools help you to understand how much of your money is available for investing or saving towards important goals.    We know that budgeting and expense tracking can be tedious and difficult. We’re here to do the hard work, so you don’t have to.  <b>Creating a complete picture of your personal finances</b> Zenmoney brings together data from all of your accounts and cards to create a complete picture, then categorizes each of your transactions. You no longer need to spend time manually tracking your expenses — they update automatically, and are secured by strong encryption.  Account balances and spending statistics will always be up-to-date.  <b>Getting your expenses organized</b> With Zenmoney, you can see where your money is going. Spending statistics offer insight on how much you need for regular bills, and how much you can spend on coffee, books, movies and travel. Payment forecasts spotlight unnecessary or costly subscriptions and remind you about important recurring payments. Together, these features can help you to set your financial priorities and avoid expenses that are no longer needed.  <b>Spending according to plan</b> Our budgeting tools allow you to plan for both scheduled expenses and for categories of monthly expenses. In the Budget section, you can see how much has already been spent in each category, and how much is left to spend. And the Safe-to-Spend widget calculates how much money is left over at the end of each month. This makes it easier to understand how much money can be saved towards important goals, invested, or kept for spontaneous expenses.  What’s more, we have a helpful bot in Telegram! He can: — warn you if something isn’t going according to plan — remind you about upcoming payments and subscriptions — highlight a significant increase in spending in a specific category — send regular updates regarding your financial status, such as comparing expenses from this month and last month — show the difference between your income and expenses.  If you have any feedback, come join us at Telegram-chat: https://t.me/zenmoneychat_en"
F050BEDBAA6DB444375FFE83D4B40B8E792511EE892A8A4E7334F0CC96153381,at.markushi.expensemanager,PRODUCTIVITY,"Manage your expenses directly on your smartphone. Easily keep track of your finances.   This app allows you to record your expenses easily. Optionally you can assign a category to your expense in order to get detailed statistics and helpful insights.  Features: - Simple Design - Ad-Free - Record expenses - Assign categories - Manage monthly overheads - Manage categories - Set a monthly limit - Homescreen widget for even faster usage - DashClock Integration - Expense History - Spreadsheet Export - Group your expenses by week, month or year - Backup/Restore Feature - Record incomes (In-App purchase) - Detailed Stats (In-App purchase) - Expense Distribution (In-App purchase)   Permissions Network Communication: Send feedback to the developer inside the app. Error reports  Storage: For CSV export"
93B7BB25A3835A7ECFD27593DC0D0505C5B01158E8E278BF6E1D2AFDFB3D5887,com.mobilecreditcards,FINANCE,"Discover the insights you need to make the most of your money. Start with the big picture and see all your financial accounts on one screen. Or zoom in on the details of your cash flow, expenses, credit score and net worth. Plus, get Nerd-approved tips to build it all.   Here’s how our personal finance tracking app works:   KNOW YOUR CASH FLOW  - Track spending across multiple cards  - Get detailed spending insights  - Track your bills, expenses and more - Discover ways to cut back or save - Compare spending month-to-month  - See your top spending categories and trends  KEEP UP WITH YOUR NET WORTH  - See how your income, debts, investments, and home value all add up - Follow the history of your net worth - Zoom into the details of your net worth and track individual accounts over time  MONITOR & BUILD YOUR CREDIT  - Access your credit score and credit report any time - Get score change notifications  - Understand the factors that affect your score - Learn ways to keep building – whether it’s increasing your credit utilization or paying your bills earlier, and more  SMART MOVES FOR YOUR MONEY  - Quickly find and compare more rewarding credit cards, better loan rates, and higher-earning bank accounts"
FE42F545306DBEB5289EC1EC66924AFE9AC2B826F96999059EA9F0C2403333D2,com.seshadri.padmaja.expense,FINANCE,"Day To Day Expenses is a FREE ,SIMPLE AND SECURE expense tracker app. Day to Day expenses is one of the best expense and money manager available for Android devices. With this app installed in your phone, you can quickly make a note on your spending on the go. It is as convenient and as easy as it is to write it down on your pocket hand book.   You just have to enter your income and expenses as you earn and spend, and the app does the math for you.    CATEGORIZATION OF INCOME/EXPENSE:   You can mark your income/expenses with different categories and the app gives you the total category wise. There are many categories provided by default and you are free to create your own categories too. Colorful and meaningful icons represent each category for easy identification.   DAILY / MONTHLY / YEARLY REPORTS:   Unlike other apps, Day to Day Expenses gives you an instant report of your earnings and expenditure at a glance under three simple tabs.   SAVE AS PDF / EXPORT TO EXCEL :   Not just viewing , you are able to save your summary in PDF format with just a click.   With ""Export Data as Excel Sheet Option "" , one can save entire data in excel format and share it.   BACK UP TO GOOGLE DRIVE :   Your data is not saved anywhere else other than your own Google Drive. This way your data is safe and secure. Day To Day Expenses do not store any of your personal data.   CHART VISUALIZATION:  Allergic to numbers?? See your spending statistics on colorful pie chart.   MULTIPLE PROFILES AND ACCOUNTS:  You can create your own profiles for managing professional or personal finance under settings - 'Profiles and Accounts’.  Each profile can have multiple accounts. You can create an account for each of your bank accounts, credit cards, e-wallets, meal coupon cards, cash and so on.  OTHER OPTIONS:   Search for an entry, apply your favorite theme, set reminder to note expenses, custom date range reports and so on.  Available in Tamil, Telugu, Hindi, English, Marathi, Gujarati, Bengali, Punjabi, Malayalam and Kannada languages.   --------------------------------------------------------------------------------------------- Note : Do not download this app from any other sources other than Google Play Store."
7409CB6A36EAA9D8A72B7C39A7B2101339FE11379FA5161BE7CA792C7B80EA19,com.advance.expensemanager.moneymanager.expensetracker,FINANCE,"Expense Tracker is primarily developed for 'Personal Capital' to manage expenses, income, monthly budget, bills, loans, savings, and currency converter. This budget app has a proper spending tracker which will give you day-to-day reports plus you can check monthly, quarterly, and yearly records of your expenditures. You can easily find Daily Expense Track in this best Budget Planner app.  Our best budget app functionality is too vast in that you can manage your whole month's expenses. Which includes your gross income, expanse, bill reminder, food budget, and shopping expenditure, along with this it also does currency exchange which can easily be used as any money converter. Our Financial Planner is an easy-to-use and eye-catchy user interface used as a 'Money Saving App' to track all your Personal Finance.  By using this expense tracker, you can quickly review all your financial activities without any special effort. Now you don’t need to worry about a budget tracker, currency converter, savings, and loan because our money manager will do all the things for you in a single click. All you need is to add your gross income and expenditures in the expense manager you will find all calculations in a single go.  You can use this app for any business to track expenses. Expense tracker is useful in generating expense report with daily expense track at anywhere. It has the facility of a currency converter which will give you currency exchange rates on daily basis.  Expense tracker is used to keeping track of all your home budget. You'll need a daily budget planner, which you can access through our budget app which works efficiently. Financial Planner helps you to attain financial stability by managing all your Personal Finance. Along with this, you can also get a currency converter as well. This 'Money Saving App' is also beneficial for developing savings habits for your home budget. With our budget planner, you can organize your Personal Finance and say goodbye to all of your financial errors. You can easily create a Monthly Budget, track expenses, establish an expense report, and view all of your financial transactions in a monthly report. You can also compare monthly reports with the previous month's reports. Spending tracker generates a monthly report and you can save that report for future use. You can easily determine your spending pattern in this budget planner and improve 'Personal Capital' in the future. Expense Manager can save reports in PDF & Excel Format. Plus, it will do money converter of multiple countries Prime Features  ● Expense manager allows you to add income and expenses. ● Add your day-to-day expense report in the Personal Finance app. ● Organize bills on a daily, weekly, monthly & yearly basis in this budget planner. ● Currency exchange of all your transactions with a money converter. ● Budget app generates reports of your transactions. ● 'Personal Capital' reserves and future earnings in the same place. ● Add your own categories in 'Money Saving App'. ● Track expenses category-wise. ● This budget tracker allows you to create and maintain daily expenses. ● Day-to-day report of Daily Expenses. ● Check daily rates of different currencies in the money converter. If you’re looking for any Financial Planner or ‘Spending Tracker’ app then your search comes to an end, because this is the best 'Expense Tracker' and currency converter app for you. So what are you waiting for? Download the Expense Manager: Budget app on your smartphone and manage all your expenses easily!!!"
BA9B397B14F0D7D650AB71652039BAB38D4159DD12D20CA503076B1132E3216C,com.mountform.wimm,FINANCE,"Track your income, expenses, analyse your spending habits with WIM Money Manager & Expense Tracker. Know your finances & manage them in one place!  ★ Features ★ 👆 Add income & expenses in one move  🗂 Tags, search & categorise expenses 📅 Calendar overview 💵 Multi-currency account ⛵ Set financial goals & save money 📊 Analyze your spending with insightful reports & enlightening charts 💳 Credit / Debit Card management 🔑 Passcode Protection 🏡 Household expense tracker & finance planner 📮 Expenses, Income, Debts overview  📲 Setup automatic expenses mode  💾 Backup / Restore ( Google Drive) 🙋 Friendly Tech Support  Track debts & savings, keep an eye on your finances with beautiful, simple & intuitive user interface.  Analyze your financial situation, costs, and income using reports and graphs. Add all your transactions over the day, money manager will show you where your money went on an informative & interactive chart. You will be able to plan a budget for all categories of expenses, as well as plan your income. Simple and convenient accounting of debts/loans. Who, to whom, and how much, when owed. All in one place, without extra windows.  Create as many accounts, targets in any currency of your choice, with exchange rates updated automatically on daily basis. Figure out how much money you spend, decide on your priorities, track your spending, say goodbye to debt & start saving money 💰💰💰💰  If you have any questions or feedback, contact us via email at bazimogmbh@gmail.com or to telegram @WimMoneyTracker"
F10CB944A6C4E5AB1CEA7B01DD5C7FC18228E2BF1F49981126E5F6D989177255,com.artezio.costtrack.android,FINANCE,"Cost Track is a simple and easy-to-use app for tracking income and expenses and handling your budget!  Cost Track allows you to: -        Use your money wisely -        Keep track of your personal and family budget -        Quickly enter your income and expenses -        View income and expenses grouped by category and location -        Know exactly where your money goes, how to save money and where to get the best deals -        View your current balance for all accounts and each one separately and know the amount of money you currently have -        Save your spending history where you can always find the required entry  An overview of key features: •        Cost sheets -        A cost sheet is a list of entries (income and expenses) grouped by various features, for example, accounts (Cash, Debit Card, Bank Account, PayPal, WebMoney, etc.) or events (Wedding, Summer Holidays, Apartment Renovation, etc.) -        Create and manage as many cost sheets as you need* -        Each cost sheet can have its own currency -        The app calculates and displays your overall balance and statistics in the base currency -        Remove a cost sheet from tracking if you don’t want it to impact your overall balance and statistics -        Make transfers between cost sheets in various currencies  •        Income and Expenses -        Create new entries in seconds specifying a category as the only required field -        Change date and time of your entries, add a comment to know exactly when and how you spend your money -        Specify a location to see where you spend your money and also get statistics by location -        Add a photo of a paper receipt, a product, etc. to your entries -        Calculate your expenses with the built-in calculator -        Convert currencies directly in the Expenses  •        Sync via Dropbox for joint budget management*  •        The app supports more than 150 different currencies and automatically updates currency exchange rates  •        The app contains more than 25 pre-installed income and expenses categories. You can change, delete, or add new categories to customize them in a convenient way  •        Statistics – view statistics of your income and expenses grouped by time, category, and location  •        Diagrams – get a visual image of your income and expenses  •        Customize your statistics and diagrams in a convenient way using a filter  •        Create CSV reports  •        Search entries by description, category, and location  •        Password and fingerprint – protect your data with a pass-code and use your fingerprint for better experience  *Please note that the free version is intended to provide users a preview of the functions of the app. It has a limited number of cost sheets and entries (5 cost sheets and 20 entries in a cost sheet), no synchronization feature (via Dropbox) for joint budget management. To remove all restrictions, please upgrade to the full version with a one-time purchase or buy a subscription (monthly or annual).  The current subscription price is specified on the purchase screen of the app. Payment will be charged to your Google Account at the confirmation of purchase. The monthly subscription automatically renews every month, and the annual subscription automatically renews every year, being charged to your Google Account, unless cancelled.  If you like Cost Track, please take a moment to rate it in the Google Play!  Leave your comments and suggestions through the ""Feedback"" section in the settings, then we'll be able to get in touch with you, solve your problems or answer your questions."
E49FC3FD665A0E4AAA842CDD282C32D024974297D730D8421B742BBE3347C8A0,expense.tracker.income.receipt.budget,FINANCE,"Brought to you by the #1 award winning app.   Welcome to <b>Bookipi Expense</b> your brand new <b>FREE</b> budgeting and expense tracker.   Trusted by over 400,000 small business owners and freelancers in 179 countries, Bookipi is now delivering the FULL experience.   Keep track of ALL your income, items, & expenses.   Become a master of <b>financial planning</b> and <b>SAVE MONEY TODAY.</b>   <b>KEY FEATURES:</b>  <b>FREE Unlimited Wallets</b> Users are able to track all of their financial activity with ease; using multiple wallets for multiple occasions, you’re guaranteed to never lose track of your spending.  <b>Budget Planning</b> Easily create monthly or weekly budgets to go by, receive notifications for when you are nearing your limit.  <b>Unique Categorisation</b> Users are able to log and categorise each entry as either an expense or income; complete with unique icon assigning.  <b>Charts & Breakdowns</b> Each wallet has a unique daily breakdown of monthly income & expenses; enabling you to analyze your monthly financial activity with ease.  <b>Receipt Storage</b> Users are able to take photographs of receipts to store on our secure databases. This is done to ensure ease of retrieval.   <b>Data Exporting</b> Generate instant summaries of your wallets with a tap through our CSV exporting feature.  <b>Automatic Bookipi Invoicing Data Synchronising</b> Bookipi Invoice users are rewarded with automatic data syncing. Allowing you to keep track of all of your income and expenses in one seamless process.   <b>Other outstanding features:</b>  In-App Chat Support 129 Global Currency support Intuitive UI Design Frequently updated video tutorials  <b>Help us improve the app</b> Since the app is still in beta, we'd love to hear from you. Go to settings > Support and chat with us live and let us know how to improve."
DD1DAD3F6768FA46CE10E52ABC9DA0B81A15A42DD453D3E5032B0388F2030505,com.jojdevx.expense.tracker,FINANCE,"Our Mony app will help you find out where your money is going. If before that, accounting for finances was a boring and long task, then our application will easily solve this problem! We will give you the ability to easily keep track of expenses and income, save money and achieve financial goals. No more heavy accounting!  Add spending alone with a small action, you just need to enter the amount and you're done! Simple management and calculation of finances.  The application will be able to calculate your current balance from all your accounts and show you the current state of your finances. You no longer need to keep everything in your head or constantly look into your wallet and account to know your current financial condition."
