sha256,pkgName,categoryID,description
A921DE6B88FD01C496040C310EA389BF78B3F1728BF6DA96795E4BE995294150,br.com.gerenciadorfinanceiro.controller,FINANCE,"Get the most out of your personal finances with Mobills, the budget planner that provides the insights you need to control your financial accounts, expenses, cash flow, and credit card on one screen. Download the app!  Mobills is a Budget app that allows you to create a custom monthly budget that will help you take control of your money. You are able to manage your money, track your spending, and achieve your financial goals all in one place.    Budgeting just got easy Mobills helps you create a monthly budget.  When you create a plan for your money, you are then able to ensure that you will always have enough for the things you need and the things that are important to you. By using Mobills you can planner yours bills payments, you can also stay out of debt, and save money.  ▸ Track your expenses and income The app has an intuitive and easy to use interface so that you can track your budget hassle-free.  ▸ Know where your money is going Avoid scattered information in notes, statements, and expense spreadsheets. With Mobills, you can analyze your personal finances in a comprehensive manner, using graphs and reports.  ▸ Budget Planner and Bill Reminder You are able to plan your finances and goals by creating categories. Thus, creating a customized budget that works for you and your family, while tracking your expenses throughout the month.  ▸ Credit card control  Can manage all your credit cards in one place. Track your limit, total amount due, and never lose control of your  personal finances again with a built-in bill payment reminder.  ▸ Learn how to save and keep your finances under control When you take control and categorize your expenses, you will know exactly what you are spending and how you can avoid overspending.   ▸ Never miss a bill's due date You will be alerted every time a bill needs to be paid. Which allows you to take control of due dates, and gives you financial tranquility.  Do you have difficulties save money? Think about saving and having budget planner? Are you in search of a personalized financial guide and the best finance app?  Mobills is a budget app with features created for you to replace your monthly spending spreadsheet.  Some Features  ▸ Credit card manager ▸ Customized graphs and reports ▸ Advanced filters by bill, category, and tag ▸ Cloud synchronization (you can use it online and offline) ▸ Financial goals manager ▸ Expenses with geolocation (location permission) ▸ Store and save your receipts ▸ Exporting and importing of EXCEL, OFX and PDF spreadsheets (media permission) ▸ Bill payment alerts (notification by email) ▸ Monthly and Annual cash flow graphs ▸ Bill Reminder   Mobills Free is personal finance app with some limitations.  However, Premium Users have access to all the features described above."
E34FC74F6D281545E4850405A371B8523AE587A5FD33E084C64877E5124DEC94,com.droid4you.application.wallet,FINANCE,"<b>Wallet is a market-leading personal finance manager, built to help you save money, plan for the future, and see all your finances in one place.</b> With Wallet you can stay on top of your daily expenses automatically with bank synchronization, dive into weekly reports on your spending, manage debt, and track bills. Share specific features with loved ones to get on top of your budgets together.  <b>Wallet allows you to see your finances your way: anywhere, any time.</b>  <b>WHY YOU SHOULD USE WALLET</b>   Toss your notebooks and spreadsheets, and budget for clear, tangible goals that are easy to track in real-time. Tracking your spending just got a whole lot easier. Gain full control of your finances with beautifully designed reports on your accounts.   Wallet is a money manager and bill tracker designed to help you from day one. With continuous financial insights, you’re able to stay in control of your personal finance and budget for the long-term.  You can easily control your spending, budget, and save more money using this finance tracker and bill organizer.    <b>WHAT MAKES WALLET UNIQUE:</b>   🔗<b>Automatic Bank Updates</b> - Transactions are automatically and securely synced, then smartly categorized, and factored into your budget.. With 3,500 participating banks worldwide, you’ll save loads of time not having to track every penny by tracking all your finances in one place.  💰<b>Flexible Budgets</b> - Budgets help you plan your spending & to save money for the future thanks to the integrated money manager. Whatever it is you need to accomplish, from paying off debt to buying a car or saving for retirement, this budgeting app offers the flexibility to meet your goals and cleverly react to any changing financial circumstances. With Wallet, budgeting expenses has never been easier.   📊<b>Insightful reports</b> - Easy-to-understand graphs and financial overviews give you actionable insights about the state of your finances, across accounts, credit and debit cards, debts and cash. Gain insights on where you should be budgeting more or could save more. And don’t forget about your income & expense report!   ⏰<b>Planned Payments<b> - Never miss a due date with this bill tracker.  Organize bills and keep track of due dates.  See upcoming payments and how the payments will impact your cash flow.  🤝<b>Sharing selected accounts</b> - Selected accounts can be shared with family, friends or colleagues who need to cooperate on a budget. Everyone can contribute from any platform, whether it be Android, iPhone or the Web.  🗂<b>Imports or Manual Updates</b> - You can now import all your transaction data from sources of your choice so you will get a full report for simple expense tracking. Be it from your bank or your own spreadsheets.  Other features: Multiple currency support, Automatic cloud sync, Receipt and warranty tracking, Categories and templates, geo-mapping transactions, hash-tagging, Shopping lists, Exports to CSV/XLS/PDF, debt management, PIN security, Standing orders, notifications, reports and more.  Check out our Wallet Now and Wallet Life section for great financial tips and advice! Learn about different budgeting methods and how other finance gurus have managed their expenses and made the most of their money. Apply your favorite techniques to your spending.   With Wallet, you can expect updates with new features and improvements routinely.     <b>HOW TO START USING WALLET</b> 1. Download the app 2. Create Account 3. Get going: budget and track expenses like a master!    <i><b>Wallet is certified with eTrust </b></i></b></b>"
6AC958DF4B9D503BB92A794556A36C415E980704A6F2C10829DAA608C5A307BB,com.cleevio.spendee,FINANCE,"<b>Save money effortlessly! Spendee is a FREE budgeting app already loved by almost 3.000.000 people around the world that track their spendings and optimize their budgets.</b>  Seeing all your financial habits enables you to stick to your goals and be organized in what's important. Take responsibility and know exactly where your money goes. With Spendee, you can be your own money manager. It's that easy!   <h1><b>MAKE YOUR MONEY SHINE</b></h1>  <h2><b>💰 See All of Your Money in One Place</b></h2> Connect Spendee with your online banking, E-Wallet (e.g. PayPal) or crypto-wallet (e.g. Coinbase) and see your wealth in one place.  <h2><b>📈 Organize & Analyze Your Expenses</b></h2> We'll help you see your finances in the big picture! Imagine your data is automatically categorized, displayed in simple infographics, stylish graphs and clever insights that help you on your way to your dream savings and proper financial health!   <h2><b>💸 Optimize Your Spendings</b></h2> Save money for categories you spend the most on by creating budgets and sticking to them! We'll notify you on your progress to make sure you are in green numbers and maintaining positive cash flow.  <h2><b>👩‍🎓 Learn Through Personal Insights</b></h2> Embrace financial awareness. Let us become your best financial friend which proactively helps you to manage your personal finances and build a sustainable emergency fund. We're ready to give you tips & tricks to help you with your daily decision making.   <h1><b>MORE KEY FEATURES </b></h1>  👉<b> Budgets</b> - to help you stick to your financial goals 👉<b> Wallets</b> - organize your cash, bank accounts or different financial occasions  👉<b> Shared Finances</b> - to efficiently manage money with partners or flatmates 👉<b> Multiple Currencies</b> - to handle vacation finances with ease 👉<b> Labels</b> - to mark and analyse transactions in more depth 👉<b> Dark Mode</b> - to enjoy in an eye-friendly environment 👉<b> Web Version</b> - to see your finances on a bigger screen 👉<b> Secure Data Sync</b> - to keep your details private, confidential and safe   <h1><b>AWARD-WINNING DESIGN</b></h1>  Starting with Spendee is easy thanks to its intuitive design. And the more you use it, the more valuable it gets, rewarding you with attractive charts that show you where your money is going, how you're doing compared to previous periods & much more. We believe in beautiful design - and thanks to that, we'll guide you to better financial decisions with ease.  Download Spendee now! Sync your bank account to be your own money manager & get ahead of your finances. It's easy, effective and enables you to save and plan for the future.    <h2><b>Follow us on</b></h2> https://www.instagram.com/spendeeapp https://facebook.com/spendeeapp https://twitter.com/spendeeapp"
B336CF083FD15B6A1A63C8BEB4A36985E4AD1F467986ACFC2DC5433BC20E4521,com.everydollar.android,FINANCE,"Budgeting doesn’t have to be boring and tedious. Seriously. You just need a budgeting app made with you in mind. That’s where EveryDollar can help.  EveryDollar has helped over 10 million people learn to love budgeting by taking the stress out of planning and managing money.  Create your first budget in about 10 minutes. Then customize categories, track spending, set up savings goals, and more! You can also pay off debt faster, build lasting wealth, and plan for your future.  Tell Your Money Where to Go EveryDollar is built on zero-based budgeting. You give every dollar a job to do (see where we got the name?) before the month begins—so your income minus your expenses always equals zero. No complicated percentage-based or “month ahead” planning required—just simple budgeting that puts you in control of your finances.   Spend Smarter Worried about overspending? Wondering how your cash flow looks throughout the month? Want to see where all your money really goes? You can address all of that and more by budgeting. For real. You’ll see how you really spend your money now and how to make smarter spending choices in the future.  Find and Save More Money When you start to tell your money where to go instead of wondering where it went, you’ll feel like you got a raise. In fact, budgeters find an average of $332 in their first month using EveryDollar.    Start budgeting with the free version of EveryDollar or unlock the premium features with a free trial.  What’s included with the free version of EveryDollar? - Create unlimited budgets on the mobile app or on desktop. - Sync budget data across all devices. - Personalize categories and line items in a way that makes sense for you. - Adjust or reset your budget throughout the month. - Split expenses across multiple budget lines. - Stay on top of spending. - Manually track transactions. - Set up savings funds and track progress along the way. - Check your budget from anywhere. - Sign up for our monthly newsletter with budgeting tips and articles.   What’s included with the premium version of EveryDollar? - Everything in the free version, plus: - Connect to your bank so transactions automatically stream in straight from your bank account. - Avoid overspending throughout the month with the paycheck planning feature. - Stay on top of your goals with the goal setting feature. - Learn all about money from certified financial coaches. - See custom reporting on income and spending habits. - Get one-click transaction tracking suggestions (desktop only). - View all your connected account balances in the app. - Export transactions and download as CSV (desktop only). - Fast-track your debt payoff with automatic balance updates. - Get priority callback support from our customer success team. - Set due date reminders three days before a bill is due (mobile app only).   Download EveryDollar and start budgeting today.  Privacy Policy: https://www.ramseysolutions.com/company/policies/privacy-policy  Terms of Use: https://www.ramseysolutions.com/company/policies/terms-of-use"
2EF593B8752B5E57A7D07B665B1B68FD7151C0DD4469C1A5A79F675BB15D1487,com.mint,FINANCE,"Experience a fresh way to manage money with Mint budgeting app. Reach your financial goals with personalized insights and custom budgets. Use Mint as a subscription manager and track your money spending ---all for free. See your monthly bills, create budgets, grow savings, & build stronger financial habits. Get the #1 personal finance and free budgeting app now*.  Mint is the free money manager and financial tracker budgeting app that brings together all of your finances. Plan ahead! From account balances and budget planners to tracking expenses and debt payments, all your money management is now in one place.  <b>ALL YOUR MONEY IN ONE APP</b> Track transactions & account balances Monitor your monthly expenses Control spending with our money spending tracker Receive bill reminders Connect your cash, credit cards, loans, track investments etc with just one tap!  <b>MONITOR YOUR CASH FLOW</b> Mint is your personal finance manager and bill tracker - it helps you track expenses, transactions, monthly budgets, account balances, subscriptions, expenses and taxes. We calculate your net worth and spending trends and help you with your budget plan. We’ll help manage subscriptions and notify you when prices go up.  <b>SPEND SMARTER AND SAVE MONEY WITH PERSONALIZED MINTSIGHTS™</b> Take a deep dive into your accounts and uncover new ways to use this savings app and reach your money goals.  Alerts will improve your budgeting & spending habits.  Use our money tracker to get a quick view of your finances, account balances, credit score, bills and more.   <b>BETTER BUDGETING, MONEY MANAGEMENT & EXPENSE MONITORING</b> Make every dollar count with our free budget app. Get a smart expense budget based on your spending on day 1. Mint provides budgeting tips & advice to help you save for your financial goals. Plus, keep tabs on your balances with our budget tracker. We’re here to make expense tracking simple.  <b>MANAGE BILLS LIKE NEVER BEFORE</b> Track bills and your financial goals alongside your account balances. Get monthly bill reminders to end late fees. Plus, you can track expenses to help you reach your financial goals sooner.   <b>STAY FOCUSED ON YOUR FINANCIAL GOALS</b> Set custom financial goals in our budgeting app and get actionable tips tailored to you. With our money management advice and budget calculator, you can see and celebrate your progress. Mint is your refund tracker that checks your status when you file with Turbotax.   <b>CRYPTOCURRENCY IS NOW SUPPORTED IN MINT</b> If investing in crypto is part of your financial strategy you can connect your account in Mint to see your full financial portfolio. Supported by the platforms; Binance, Blockfi, Coinbase, Coinbase Pro, GEMINI, Kraken, Paypal and Robinhood.  <b>HOME LOANS WITH ROCKET MORTGAGE AND MORE</b> Apply for home loans with our partner, Rocket Mortgage. We’ll pre-fill your app with Mint data so you can easily apply for a new mortgage or refinance. Plus, get money-saving offers from our partners. This includes credit cards, investment savings, loans, & more.  <b>STAY SECURE</b> We’re serious about keeping your account safe and are constantly improving our security measures. See more here: https://www.mint.com/how-mint-works/security#toc  *based on all-time app downloads  <b>FROM INTUIT INC.</b> Mint is part of a suite of financial tools that include TurboTax®, QuickBooks®, QuickBooks Self-Employed™, and ProConnect™.  To learn how Intuit works to protect your privacy, please visit https://security.intuit.com/index.php/privacy  By installing or using Mint, you agree to our Terms: https://mint.intuit.com/terms.  Mint currently connects to US and Canadian financial institutions only."
1A3091A7574AA4A6C8CA1D22844FD95BE574DF7E1CB9643594921BCEDDD91092,com.monefy.app.lite,FINANCE,"How do you manage your budget and watch every dollar? With Monefy, your financial organizer and finance tracker, it’s simple. Each time you buy a coffee, pay a bill, or make a daily purchase, you only need to add each expense you have — that's it! Just add new records each time you make a purchase. It’s done in one click, so you don’t need to fill anything except the amount. Tracking daily purchases, bills, and everything else you spend money on has never been so quick and enjoyable with this money manager.  How do you track your personal expenses successfully? What about your personal capital?   Let's face it — saving money in today's world is not easy. You need a budget. Luckily, Monefy is more than a money tracker, it's also one of the best savings apps to help you with money management. Keep track of your personal expenses and compare them to your monthly income with the budget planner. Keep your monthly budget in mint condition. Your new budgeting app will help you become a budgeting master and start saving money with Monefy.   Do you own multiple mobile devices? Maybe you want to share budget and expense tracking with a significant other. Monefy helps by safely synchronizing data between multiple devices. Create or change records, add new categories or delete old ones, and the changes will be made on other devices right away!  Key features which make tracking enjoyable and powerful:  - Add new records quickly with the intuitive and easy-to-use interface - See your spending distribution on an easy-to-read chart, or get detailed information from the records list - Safely synchronize using your own Google Drive or Dropbox account - Take control of recurring payments - Track in multi-currencies - Access your spending tracker easily with handy widgets - Manage custom or default categories - Backup and export personal finance data in one click - Save money with budget tracker - Stay secure with passcode protection - Use multiple accounts - Crunch numbers with the built-in calculator   Our mission is to empower people to be in control of their lives by bringing awareness of their finances.  Find more information on our website - https://www.monefy.me  Facebook - https://www.facebook.com/pages/Monefy/632478933465457"
A3A344BBAAA142DA199EC4295D98377B3B7B89C1133BCE74EACCBD4781154CC5,com.benoitletondor.easybudgetapp,FINANCE,"Let’s face it: Most budget apps are too complicated and their design looks like it come straight from... 1994. If you are looking for a <b>clean and easy-to-use app</b> to manage your money then here's the good news: With EasyBudget you just found what you need!  A list of what EasyBudget does <b>NOT</b> do:  • Manage multiple accounts: 1 account is all you need (and probably all you got) • Classify expenses into categories: Ain't nobody got time for that! • Show charts and statistics: What for? Check your balance in 1 second and go on with your life!  This app is simple, seriously simple. Exactly what you expect your budget management to be. Oh and.. <b>It's free</b>!"
D922DED8DA939BFEF3B07EFACD5C1E18DEE2C36507A2C66D7563F3772E2B0878,com.finart,FINANCE,"<b>Expense tracker app to track expenses and plan family budget automatically based on SMS alerts or App notifications from banks, credit cards, e-wallets and business. FinArt saves you time for more important things in life</b>  FinArt expense manager is free to download with 5-days free trial so you can try all premium features before you decide to join subscription.  <h2>Key features</h2> <b>Track Expenses</b> <b>Know your Income vs Expenses</b> <b>Plan household budget</b> <b>Get due bill reminders</b> <b>Track active subscriptions</b> <b>Check account balance instantly</b>  <h2>Detailed feature list</h2> • <b>Expense manager</b> Manage expenses automatically based on SMS alerts received for each transaction from banks, credit cards and business. Expense tracker also allows manual entries. • <b>Family budget planner</b>  Plan household budget, including category wise budget, to save money for life goals such as child education, retirement etc • <b>Bill reminders</b>  Never miss due bills and save money on late payment charges as FinArt will remind you for outstanding bills such as credit card, mobile, utility and many more. • <b>Personal and business expenses</b>  Expense manager provides separate profiles for managing personal and business expenses.  • <b>Track subscriptions</b>  Expense tracker tracks all your premium subscriptions and recurring payments such as Netflix, Amazon Prime, iTunes, Spotify and many more. No more surprise auto debits from your credit cards! • <b>Track bank balance</b>  Automatically check account balance and credit card limit based on SMS alerts  • Automated categorization of your spends like groceries, travel, office, business expenses etc • Manage family expenses - Sync expense data across multiple devices in your family • Split expenses - Split group expenses, shared expenses and EMIs/ installments • Multi currencies  • Custom start day of the month  • Ad free experience, forever.  <h2>Data privacy and security controls</h2> At FinArt, we care a great deal about privacy and security of your expense data. expense tracker & expense manager offers robust & unprecedented data privacy and security controls for managing your credit cards and other financial data:  ✅ No email/phone number registration. ✅ Private Mode Option - It ensures your sms text or bank transaction data isn't sent to FinArt servers. ✅ Store backup on your own Google Drive instead of 3rd party server ✅ Does not connect to your bank accounts  <u>Why app needs SMS permission?</u> SMS permission is optional and required only if you want to track expenses and family budget automatically based on SMS inbox.  Stop manual tracking of expenses & bills. Free up your mind for more important things in life. Download FinArt expense tracker now!"
701425720B75A27A536FFB0450431A95D7414D6B1BDCAD267161D6566A5E3682,com.hg.moneymanager.budgetapp,FINANCE,"<b>🎉  A simple and easy-to-use Budget App. Budget App makes managing personal finances as easy as pie! 🎉  Daily income and expense recorder, budget planner, and balance calculator. 🎉  Automatic generation of money statistics charts and clear money trends. 🎉  Rapid operation, 3 seconds to enter one record.</b>  ======  Main Features  ======  👉  <font color=""#2962ff"">Money Manager</font> Income and expense recorder, good expense tracker.  👉  <font color=""#2962ff"">Budget Planner</font> You can set the budget line of each month in this budget app.  👉  <font color=""#2962ff"">Balance Calculator</font> The balance can be calculated and displayed automatically.  👉  <font color=""#2962ff"">Money Statistics Chart</font> Money statistics charts and reports can be generated automatically, and you can view the trend of expenses, incomes, balances and budgets by defining the dates yourself.  👉  <font color=""#2962ff"">Detailed Classification</font> You can add, delete or rename the categories in the Budget App..  👉  <font color=""#2962ff"">Edit Records</font> You can view or edit previous records in the Budget App.  👉  <font color=""#2962ff"">Set Start Date</font> You can set the one-month cycle as starting from and ending on specified days.  👉  <font color=""#2962ff"">Data Backup and Recovery</font> You can backup the data to Google Drive or recover the data to the device.  👉  <font color=""#2962ff"">Excel Export</font> You can export the data to an Excel file.  👉  <font color=""#2962ff"">Switch Colors</font> You can select different display colors for the Money Manager. You can set a dark theme.  👉  <font color=""#2962ff"">Search</font> You can search all data.  👉  <font color=""#2962ff"">Small Yet</font> Small occupancy in memory, power saving.  📌  You can use the Budget App completely for free  (with adds). 📌  Or pay for the Budget App to upgrade to VIP (no adds).  🌟🌟🌟🌟🌟  If you like the Budget App, please grade us,  Thank you!"
