sha256,pkgName,categoryID,description
179C29701DFEF5D144716A06F5BA7FBA5A881AB02A40D5C84B0C3CA811CDBC96,com.macrovideo.v380pro,TOOLS,"Through ""V380 Pro"" video monitoring service, you can easily view live stream and replay of apartments,villas,stores,factories,working offices and so on；through ""V380s Pro"" alarming service,you can receive any abnormal message of places you concern. [Remote Monitoring] Viewing video on App remotely,know what is going on at home anywhere anytime. [Voice Talkback] Voice Talkback anywhere,as if you are at home. [Device Sharing] Share the device with your family,view together,more at ease. [Motion Trajectory Tracking] Automatically capture motion trajectory,real time tracing shooting alarm,more intuitive. [Motion Detection Alarm] Instant alarm and picture capturing on abnormal situation,view what happened on recordings,guard your security. [Cloud recording Service] Videos reserved on cloud,do not have to worry about device loss or damage,highly encrypted data,convoys your information security."
6511E5D71DA03D088BFCA74DDA164FC53275228887189B2F720484FA989268AA,com.kogan.smarterhome,HOUSE_AND_HOME,"When your home works for you, your life gets easier.  Connect via Google Home or Amazon Echo, set up automated actions which are triggered by temperature or time, and get real-time notifications straight to your smartphone. KoganSmarter Home takes the hassle out of everyday so you can get more done.  * Remotely control your compatible Kogan Smart devices * Voice control via Amazon Echo & Google Home * Receive real-time alerts and notifications * Add and control multiple devices  * Automate your devices to stop/start based on location, temperature, time & more * Clear interface that’s simple to use and easy to understand * Save actions and preferences to customise your experience"
A62460A161D324D55969AEC0858F6A9F011A5698F4BB254C770AEA5846525202,com.iot.airam,LIFESTYLE,"Airam SmartHome helps you to enjoy your home even more. Airam SmartHome consists of smart Home products which can be controlled via Airam SmartHome App. No hub, no gateway needed -just easy to set up by connect with your WiFi."
A12495CBBC47B79AFD4D1ED770D3C79B5E06D0D730DE7E3C8E981209CE080157,com.midea.ai.overseas,TOOLS,"MSmartHome is an elegant, easy-to-use app which provides real-time updates and notifications to elevate the Midea Smart Home experience.  You can simplify your life through voice control from Amazon Alexa and Google Home assistants with your natural language to operate your appliances effortlessly.  Connect and control devices such as compatible air conditioners, dishwashers, ovens, refrigerators, robotic vacuums and more, all through this single app.  Key features: •	Cool your house, or preheat your oven while you commute home through a full featured control interface. •	Want to know if the oven is finished baking or how much time before the dishwasher cycle is completed? Receive real-time status updates and notifications of appliance activities. •	Use natural conversation to control your appliances such as “Alexa, defrost 12 ounces of chicken” or “Hey Google, turn on the AC”.* •	Invite family members to share control of appliances.  App Requirements: - Android 5.0 or later.  Access Permissions:  The following access permission is necessary for the MSmartHome app to provide the best experience. - Bluetooth: Find nearby devices using Bluetooth or BLE. - Location: Detect home WLAN network and enable device connection. *When connected to compatible Amazon Alexa and Google Home devices. *Available devices and voice commands vary in different regions."
1020A32C5013456EC643150ECC741B5DE45E2B0196C412D95DA3A82E1F679F0E,com.hama.smart,TOOLS,"Smart elements for the home don't have to be complicated. Our mission is to offer you a simple solution that will transform your home into an intelligent comfort zone piece by piece.  Smart Home from Hama is all this: 1.	Comfortable Simple controls for maximum convenience Our smart home devices are easy to set up and operate. For extra convenience in device control, we have developed an app - so you have an overview of all connected devices and full control, no matter where you are. 2.	Easy to retrofit Without any construction costs Expand your home, step by step, very easily with smart products from our extensive range. The possibilities are endless and the integration of new products is particularly easy. 3.	Compatible Can be combined with other smart products You can also combine our products with smart devices from other manufacturers, as long as they are compatible with Amazon Alexa and Google Assistant. 4.	Gatewayfree Simple and cheap Many smart home applications on the market require an additional element as a bridge / gateway so that they can communicate via your network. Our smart home products do not need this additional hub. This makes installation easier and cheaper to buy. 5.	Easy  Control via app The app enables you to operate and monitor your smart home from anywhere using your smartphone or tablet, e.g. open the garage door by motion detection when you are coming home. 6.	Intuitive  Control by voice With a voice command, you can conveniently pass on your wishes to the respective smart home device, e.g. switching the light on and off - without a smartphone, without getting up.   Home smart home! There the family, the partner, the beloved pet and - your own comfort zone are waiting. If this home also thinks for itself, it makes your day easier and you have more time for the important things in life. That is why app or voice-controlled smart home systems such as lights, motion detectors or alarm systems are getting more and more important during apartment and house construction. But what if the apartment or house are already built? With our smart home products, you can also design your home intelligently after renovation or construction, so that everyday processes are carried out automatically. The installation and operation of the smart home gadgets are very easy - even when you are on the go."
A99841284250F917FCE01ECE9AD83A105AC4BFA40B35B2F8DB9AB6EA84E0E5F8,com.deltaco.smarthome,LIFESTYLE,"The official DELTACO SMART HOME app for controlling and customizing all your smart DELTACO products directly from your Smartphone.  The app gives you increased control of your life - check what your kids are doing, turn on / off the lights or regulate the temperature. No matter where you are, at work, vacation or just everyday life at home – you can manage lighting, temperature, plugs and surveillance at will. Smart, huh?  YOUR HOME, YOUR WAY Remote control Manage via the app, when your lamps or plugs are to be switched on / off Timer Function Turn off your devices, at the selected time Grouping Connect your products in the app and decide, e.g. if / when all lamps should be switched on / off simultaneously Scheduling Program your devices to switch on / off, at the selected time  Energy Consumption Measure your energy consumption by day, week, month or year  Scenes Create smart scenarios in the app to control and manage the products in the selected event process, to maximize home automation New products and features are constantly being developed to make your life at home simpler.  Discover more on: www.deltaco.se/Sidor/deltacosmarthome.aspx"
88C6A910F4E9065EEAADD242BEE4E49139FAC79F3C8F06C44BC7E0F41C15F5CB,wipro.com,TOOLS,"Use Wipro Next Smart Home App to control Wipro smart lights and other Wipro smart devices. Create your own smart home with smart scenes and home automation. * Mobile control your home lighting system * Amazon Echo, Google Home voice control * Remotely control your smart devices anytime anyplace * Easily device sharing to other App users * Real-time notifications and real-time monitoring * Fast network connectivity for instant user experience"
C9C281ECFBB0C1563A89B3FF47DBE8F3DCCB2E4652E830E23F4E2AA8510DB8EA,com.merkuryinnovations.geeni,TOOLS,"Meet Geeni. Your wish is Geeni's command.  Control all Geeni smart home devices in one easy app, or by voice using Amazon Echo, from ANYWHERE in the world. Geeni is easy enough for anyone to use and combines the SIMPLICITY of an on/off switch with PREMIUM features such as:  - Easy, powerful control of each device. Choose a color or mood of our Color bulbs, perfectly Dim a white bulb, track energy usage of a plug, all from the same app! - Group devices and control by room - Set smart scenes for automated actions - Schedule when devices turn on and off to allow more control and security - Choose which devices your friends, guests, roommates, or your family can control thanks to account sharing - Cloud based services so you can log in and control your home from any phone - and more.   Compatible with all Geeni-enabled smart devices. No complicated hub required; each Geeni device is smart enough to connect directly to your home wifi network."
8F5170FBA64F9C35E4A1D533526ECAF8830BF7CB242EC30116B4BF5F8A73930F,com.laser.smarthome,HOUSE_AND_HOME,"Take the hassle out of your everyday!   With the Laser SmartHome app, you can connect and control multiple devices quicker and easier. Paired with Google Home or Amazon Echo, you can set up automated actions which can be triggered on schedule, temperature or location. Get real-time notifications sent straight to your smartphone.   No matter where you are, you can monitor and control your Laser SmartHome devices.  - Remote control and check the status of your compatible Laser SmartHome devices - Voice control via Google Home & Amazon Echo - Alerts and notifications allow you to receive real-time status information about your Laser SmartHome devices - Add and group multiple devices to control them simultaneously - Automate your devices based on schedule, temperature, location & more - Customise your experience and save your frequently used actions & preferences"
A73B18BCEF6098224D4F37E2E8A0696224F5EA56B060AD79991FEC8D4968211E,com.connect.smarthome,HOUSE_AND_HOME,"Make your home smarter with Connect SmartHome!   The Connect SmartHome app let's you add and control multiple devices quicker and easier from your smartphone. You can set up automated actions which can be triggered on schedule, temperature or location. Get real-time notifications sent straight to your smartphone.   No matter where you are, you can monitor and control your Connect SmartHome devices.  - Remote control and check the status of your compatible Connect SmartHome devices - Alerts and notifications allow you to receive real-time status information about your Connect SmartHome devices - Add and group multiple devices to control them simultaneously - Automate your devices based on schedule, temperature, location & more - Customise your experience and save your frequently used actions & preferences"
9E3C3412D03B55AA6EFFDE541E2AFABC8E5FF389758FDDC3AC8CC49FB8E596D1,com.nedis.smartlife,HOUSE_AND_HOME,"Nedis SmartLife is a reliable and easy-to-use Smart Home system with an extensive product range covering the most important use cases and a growing service offering. It allows you to control and monitor your home appliances and devices from your smartphone or tablet with only one App!  With the Nedis Smartlife app, you can easily set up, manage and control your lights, plugs, thermostats, cameras and other Nedis SmartLife devices, from anywhere and at any time. The app provides you with a centralized and user-friendly interface to manage all your smart devices, giving you the ability to create customized routines, set schedules and receive notifications. With Nedis Smartlife, you can turn your home into a smart home and enjoy the convenience and peace of mind that comes with it.  Features in the app: •	Add devices from 4 main categories (security, energy, health and comfort) directly to your Wi-Fi network within seconds •	Control your smart devices from anywhere using one app. •	Schedules to automatically run your devices during set times •	Devices start/stop work automatically based on temperature, location and time •	Create smart scenarios and execute them automatically: Combine many of our products. •	Push notification to your phone, to ensure you are quickly informed •	Insight into your energy consumption •	Easily share controls between family members •	Voice control with Google Assistant and Amazon Alexa •	The Nedis SmartLife app works seamlessly with any smart home device powered by Tuya"
592E0A08D048446FF247FA6B201D369ABC3D4247790C4F1D4B485FC7DC6317B2,com.denver.smartliving,TOOLS,"DENVER SMART HOME 1. Remote control: control smart home appliances & security systems anywhere 2. Watch use: smart watch, can record exercise data, check phone calls, SMS, application messages 3.Simultaneously control: control multiple devices with one app 4. Device sharing: one tap to share devices with family members 5. Easy connection: app to device connection are quick and easy"
FE7A0D6A9D66BE84A1E42C4D47A3F043AE68BCD32E5A62319F41CE6FB792EB2D,com.smarthomy.mobile,TOOLS,"With Smart Homy, you can connect and control hundreds of Wi-Fi devices quickly and easily. No matter where you are, you can monitor and control your smart devices such as cameras, lighting, appliances, air conditioning, TV, vacuum cleaners and more.  [Main functions] ❶ Remotely check the status of Wi-Fi devices registered in your Smart Homy account. ❷ Group different devices in one Scene and operate them simultaneously with one button. ❸ Automate different devices to activate or deactivate when one or more conditions are met. ❹ Schedule your devices to activate or deactivate at certain times and days of the week that you need. ❺ Use the climatic conditions of your geographical area to program the operation of your devices. ❻ Share devices like Cameras, Locks or Alarms with your family or friends so they can assist you when you are disabled. ❼ Control devices in different locations such as home, office and more from a single account. ❽ Operate your devices with your voice using Google Assistant. ❾ Receive notifications with information about the status of your device wherever you are. ❿ Perform network diagnostics to check the status of your devices.   [Compatible Devices] ❶ On the website https://www.smarthomy.com/works-with/ you will find an updated list of  compatible devices, features and step-by-step guides for its installation and operation. ❷ Wi-Fi devices that operate in the frequency of 2.4Ghz  [Application Requirements] ❶ Some mobile devices may not be compatible. ❷ RAM size: greater than 1 GB  [Application Permissions] The following permissions are required for the application service. For optional permissions, the default service functionality is enabled, but you do not have the permissions.  [Mandatory Access Permission] • Location Permission: Search and Add nearby devices via Bluetooth or BLE.  [Optional Permission] • Camera Permission: Scan QR codes."
6ECBDEE9ACCA1465CAC3647C29BE3BC48098F0BAD39CC8C8F0AB6B0C1DB12F0B,com.ogemary.smarthome,PRODUCTIVITY,"The Switcher app allows you to control your boiler from anywhere at any time, defined your weekly and daily schedule and presents your history of electric consumption.  With the Switcher you will save Time and Money."
3BF1DA6049D86705764E593634E6FA472AA72D5D9C9301ECFE1E091F08839A27,com.coolkit,LIFESTYLE,"One app, countless devices eWeLink is the app platform that supports multiple brands of smart devices including SONOFF. It enables connections between diversified smart hardware and integrates popular Smart Speakers such as Amazon Alexa and Google Assistant.  All these make eWeLink your ultimate home control center.   Features Remote control, Schedule, Timer, Loop timer, Inching, Interlock, Smart Scene, Sharing, Grouping, LAN mode, etc.  Compatible Devices Smart curtain, Door Locks, Wall Switch, Socket, Smart Light Bulb, RF Remote Controller, IoT Camera, Motion Sensor, etc.  Voice Control Connect your eWeLink account with the smart speakers such as Google Assistant, Amazon Alexa, and control your smart devices by voice.  eWeLink works with everything Our mission is “eWeLink Support, Works with everything”. “eWeLink Support” is what you should look for when buying any smart home devices.   eWeLink is also a full-fledged IoT Smart Home turnkey solution which includes WiFi/Zigbee/GSM/Bluetooth module and firmware, PCBA hardware, global IoT SaaS platform, and open API, etc. It enables brands launching their own smart devices at minimal time and cost.  Keep in touch Support email: support@ewelink.zendesk.com Official website: ewelink.cc Facebook: https://www.facebook.com/ewelink.support Twitter: https://twitter.com/eWeLinkapp"
ED0B19026464B6662828F44AD15477B077C5681124F1E091D0FCD002C75EBBD6,com.lgeha.nuts,LIFESTYLE,"Connect your washer, air conditioner, TV, and other appliances to the ThinQ app. Get away from the busy routine and enjoy a relaxing home life with smart ThinQ. ☕  ■ Get immediate notifications The ThinQ app will keep you informed with all notifications you need so that your laundry will not smell musty or your pizza in the oven will not get overcooked. ThinQ will periodically diagnose the state of your products by itself.  ■ Control your home from anywhere You can check the indoor temperature of your house and turn on your air conditioner even while you are out. You can also remotely run your washer from outside and proceed with the drying process right after coming back home.  ■ TV remote control in my smartphone Change TV channels and adjust the sounds with the ThinQ app. You can enjoy your mobile content in your smartphone gallery on a TV screen. You can also use the Magic Remote feature with your app. ※ The availability of products and services may vary depending on the models you own or the region/country you reside in.  ■ ThinQ will automatically access the current state of your products Get the state of your products smartly assessed in detail. Smart Diagnosis will catch problems and help you troubleshoot them.  The LG ThinQ app supports Android OS 7.0 and higher versions. If you are using an Android OS version older than 7.0, we recommend that you contact the smartphone manufacturer to upgrade the OS.  The accessibility API is used only to transmit the signal that users input to the TV remote control to the smartphone when using the ‘View Phone Screen on TV's Larger Screen’ function in the LG ThinQ app. We do not collect or use your information except for the minimum information necessary to operate your smartphone.  * Access Permissions  To provide service, optional access permissions are required as shown below. Even if you do not allow optional access permissions, you can still use the basic functions of the service.  [Optional Access Permissions] • Calls/Contacts - To contact the LG Service Center  • Location - To find and connect to nearby Wi-Fi when registering the product. - To set and save the home location in Manage Home - To search for and use information about current locations, such as weather. - To check your current location in the ""Routines"" function.  • Nearby devices - To find and connect to nearby Bluetooth devices when adding a product to the app.  • Camera - To take a profile picture - To share a home or account scanned from a QR code. - To add products recognized by  QR codes. - To take and attach photos in ""1:1 Inquiry."" - To record and store purchase receipts when registering additional information about the product.  • Files and media - To attach and set my profile picture in Photos. - To take and attach photos in ""1:1 Inquiry."" - To record and store purchase receipts when registering additional information about the product.  • Microphone - To check product status via Smart Diagnosis"
DB99853E4F2FFC03222E13A240EF6AC6DF8A31371F8C75D8ECD5D31DBF2413BC,com.ucontrol.activity,TOOLS,"Enjoy peace of mind knowing that you’re always connected to your home and your family. Rogers Smart Home Monitoring customers can use this application to securely view and control their system anytime, anywhere on a smartphone or tablet.   With Rogers Smart Home Monitoring, you can* •	Control and secure your smart home from anywhere – use just one app to manage your choice of devices •	Stay in the know – watch live video from cameras; get instant alerts when doors or windows are opened •	Save on energy usage and costs – set automated rules and routines to manage lighting and heating •	Help protect your home and loved ones – monitor for alarms, smoke, carbon monoxide or water leaks •	Relax with hassle-free installation and 24/7 support •	Customize your solution – add devices as your needs grow  Getting Started: •	Download and install the Rogers Smart Home Monitoring app on your smartphone or tablet •	Launch the app and sign in using your MyRogers username and password •	Select ""Remember me"" for even faster sign in next time   Requirements: •	Rogers Smart Home Monitoring subscription •	MyRogers username and password to access the app   For more information see: rogers.com/smarthome  *App functionality will depend on compatible hardware and subscribed package and features"
B6039160A638E7D45AC41A1AA2494E87DBDDFB5ADBF0D8BD81FAE90047EB9D56,com.ezviz,VIDEO_PLAYERS,"EZVIZ – Security Video For Smart Life  The EZVIZ app is designed to work with our series of Security Cameras and other Smart Home products. By using this app, it is so easy to manage your camera and other smart home devices remotely from across the globe any time.   You can get full access and remote control of all devices functions at fingertips, and take necessary actions to ensure the safety of your homes, businesses and loved ones when receiving immediate motion detection alerts on your phone.  Key features: - View high-definition live stream from anywhere - See in the dark with IR light on - Playback recorded videos with CloudPlay or an SD card - Talk via Two-Way Audio - Get instant alerts when motion is detected - Customize detection zones and sensitivity - Set schedules to record the moments that matter - Share devices with friends and family  Contact Us Technical Support: support@ezvizlife.com General Enquiries: info@ezvizlife.com"
0B1609A26A03E59EF15ADB5A153C9DD44AE6F9BEFC27060E515F42B1D56ECC37,com.netatmo.camera,LIFESTYLE,"Leave your home with peace of mind thanks to the Netatmo smart security solutions! Receive an alert on your smartphone when a visitor rings your doorbell, if there is a break-in attempt, or if smoke is detected. The notifications are smart so that you can act as quickly as possible when necessary, avoiding false alarms. Create an environment adapted to your needs, install the products yourself and access all their features from the Netatmo app, with no subscription fees or extra costs.  SMART VIDEO DOORBELL Allows you to see who's at your door and answer it from wherever you are.  SMART INTERNAL UNIT WITH ALEXA BUILT-IN Receive notification when someone is calling, answer the call and open the gate from wherever you are.  SMART OUTDOOR CAMERA WITH SIREN Alerts you and deters intruders with its siren.  SMART OUTDOOR CAMERA Lights up and alerts you as soon as a person, animal or vehicle enters your property.  SMART INDOOR CAMERA Alerts you as soon as a stranger enters your home.  SMART INDOOR SIREN Works with the Smart Indoor Camera - Triggers automatically and scares away intruders.  SMART DOOR AND WINDOW SENSORS Works with the Smart Indoor Camera - Fitted on the doors and windows of your choice, they alert you in the event of a break-in attempt.  SMART SMOKE ALARM Alerts you if there is a fire, no matter where you are. You can take action even when you're not at home.  SMART CARBON MONOXIDE ALARM Alerts you if there is carbon monoxide in your home, no matter where you are. You can take action even when you are away"
AF54EBC8F02973853958313CBECE8205302AE26291468F71898D3876AFD0B520,com.ringapp,LIFESTYLE,"Watch over your property from anywhere with Ring Video Doorbells, Security Cameras, Alarm systems, and Smart Lights.  Ring Doorbells and Cameras can send you instant alerts when someone’s at your door or motion is detected. Keep an eye on what matters with live HD video and greet visitors with Two-Way Talk. With a compatible Ring Protect Plan subscription (or free trial), you can review, save, and share Ring videos.  Ring Smart Lights let you control and schedule lighting easily. Some models can even notify you about motion nearby, and trigger other compatible Ring devices to record.  Ring Alarm systems let you monitor entrances and indoor spaces, and detect certain safety hazards. Enroll in Ring Alarm professional monitoring (compatible Ring Protect Plan subscription required) to request dispatch of emergency responders when your Ring Alarm is triggered.  Whether you’re halfway around the world or just busy with the kids upstairs, with Ring, you’re always home."
