sha256,pkgName,categoryID,description
6F046742E226E3A01C7883DD255CEE8DB64DE556CFB6FDAF092A50C9AA8D37A3,plus.home_connect.android,LIFESTYLE,"MORE CONVENIENCE, COMFORT, AND EFFICIENCY FOR YOUR SMART HOME Dive into the world of Home Connect Plus. No matter what smart home device, no matter what brand – with the Home Connect Plus app you can quickly and easily design your personal smart home. And you don’t have to be a technology expert. With a user-friendly interface, you can connect all your devices and systems, even those from different brands, to create your own individual smart home.   SMART HOME – MADE EASY Simple, intuitive, and free: no subscriptions, no in-app purchases. Download, connect compatible devices, and get started. The Home Connect Plus app serves as a single control unit and notification center for your smart home. Simply your app for all smart home devices   EASILY CONNECT DEVICES Whether it’s smart shutters, heating thermostats, plugs, security cameras, or simply a smart entertainment system with smart speakers, and corresponding lighting – Home Connect Plus offers you a simple solution to centrally control your entire smart home system. In the future, all your smart devices from different brands will converge into a single smart home solution under a uniform and easy-to-use interface. At the heart of the app are customizable automations that allow you to better adapt your smart home devices to your habits.    MAKE YOUR LIFE SMARTER Customize the app and the interaction of your smart devices to your personal needs and everyday situations. By automating your devices, you gain time for the things that are really important to you.   APP FEATURES:  BOARDS Home Connect Plus gives you maximum creative freedom. Create individual boards according to your taste: choose your favorite color, find an illustration you like, or invent your own names for your personal home automation. Sort your smart devices by function or time, and choose your favorites.   CREATE AUTOMATIONS With the app you can create automations very easily and intuitively. Try it out – it’s really fun! The result is an ideally coordinated interaction of your smart devices: everything is controlled with just one click or automatically at a certain time.   CONNECT DEVICES  With Home Connect Plus, you can keep an eye on the most important functions of your devices at all times and control them conveniently from a single app.   MORE TO DISCOVER  Find out how Home Connect Plus can make your home even more comfortable, secure, and efficient. In the “Discover” section, you can always stay up to date on the topic of smart homes and find new smart home ideas.   SMART POSSIBILITIES:  • Central operation: control smart devices and home automation with just one app.  • Connect and automate smart lights, shutters and blinds, or the entertainment system • Smart heating and thermostats: be clever, use smart temperature control – and save money in the process • Smart alarm systems and surveillance cameras: always have everything under control • Important push messages directly to your smartphone • More garden comfort with smart garden tools • Smart home doorbell and garage: keep an eye on your smart home via livestream • Smart household appliances: vacuum cleaner robots, along with ovens and stoves, support you in everyday life • Support: Home Connect Plus provides competent assistance if you have questions    A SELECTION OF OUR PARTNERS: • Bosch Smart Home (Outdoor siren and water alarm not supported) • Bosch Home Appliances • Bosch Lawnmowers • Bosch Thermotechnology  • Bose • Buderus • Busch-Jaeger • DoorBird • Easee • FIBARO • Flic • FRITZ! • Gaggenau • hansgrohe • Home Connect • Homematic IP (CCU3 not supported) • iRobot • Ledvance • LIFX • Liebherr • myStrom • Nanoleaf • Netatmo • NEFF • Nuki • Philips Hue (motion sensor not as trigger supported) • Samsung Home Appliances (Smart TVs not supported) • Siemens Home Appliances • Somfy • Sonos • TP-Link • Vaillant • VELUX • Yale • Yeelight  See the full list of our partners: www.home-connect-plus.com"
5729E0C3E640E56AF068BF32EDD0A1E85A423EC02067A19CF1F04F0691A5F376,com.telekomaustria.smart.home,LIFESTYLE,"A1 Smart Home brings comfort security.  By using the app, the system learns your routines and habits and adapts lighting, temperature and alarm to your life.  When you're away, you can take an secured (encrypted) look at your home and in case you can activate presence simulation to deter potential burglars. If a burglary, water damage or fire does occur, you will be alerted immediately via in-app-notification, SMS and automatic call.  Manual or automatic control of devices and lighting is of course also part of a modern smart home, this can also be simplified via rules, presets and voice control."
FA419644D90EC85B67B165762F3B2D76A56583E89037C2E029A178808FB66102,com.ikea.inter.homesmart.system2,LIFESTYLE,"With IKEA Home smart app and DIRIGERA hub, it's easy to create smarter everyday moments with lighting, speakers, blinds and air quality products.   Picture yourself waking up as your smart lights gently rise. Your favorite songs play on the speakers and you still haven't gotten out of bed. How lovely, right? Smart products like lighting, speakers, blinds and air purifiers can make a lovely addition to your everyday life. When you improve the IQ of your home, life itself runs a bit smoother.  The magic happens when you combine two or more smart products from IKEA, tell them what to do in the app and save it as a 'Scene'.  A great scene is one you will use often. Think about waking up and going to bed, cooking and eating, date night and family time, or leaving and coming home. All everyday moments when we can support you with the best lighting, sound that suits your mood, and cleaner air.  When it comes to control, we think of everyone, from young to old and even visitors. So while the app gives you total control to customize your smart home, our range of remotes make it easy for everyone to live with and use a smart home.  In control  • You can control products individually or in groups. You can turn whole rooms on and off or the whole home, all at once. • Dim and change light colors, adjust blinds, speaker volume, and much more. • Set the scenes you need and trigger them with schedules, a shortcut button or use the app.  Easy to use • The home screen gives a fast overview of your whole home. Quickly control products, access rooms, or start/stop scenes. This is also where you add new products, rooms, and scenes.   Organized and personal • Organizing your smart products in rooms gives fast access to the products you want to control. • Personalize the app with your choice of icons, names and colors for rooms and products • Create personal scenes, for example your own combination of cosy lighting and your favorite music.   Integrations  • Connect to Amazon Alexa or Google Home to use a voice assistant."
0F894F6A24E7A9E6FDC70C64D7AEC6E8B35B1DD56DBA96D676D23D8004AAD2F9,com.tcl.smarthome,TOOLS,1. Remote control: control home appliances from anywhere 2. Simultaneously control: control multiple devices with one App 3. Timer: set timer to perform multiple functions  4. Device sharing: One tap to share devices among family members 5. Easy connection: easily and quickly connect App to devices
1D81528BDAD2BDD476B08AA6055B3E6B12F45CD27406424D9591E267015D6A71,com.amazon.dee.app,LIFESTYLE,"Use the Amazon Alexa App to set up your Alexa-enabled devices, listen to music, create shopping lists, get news updates, and much more. The more you use Alexa, the more she adapts to your voice, vocabulary, and personal preferences.  DISCOVER MORE • Get more out of your Echo device through personalized feature recommendations from Alexa • Discover and enable recommended Alexa skills • Pick up where you left off directly from the home feed with lists, shopping, or recently played Music and Books  MANAGE YOUR DEVICES • Set up your Alexa-enabled devices, control or check status of your compatible smart lights, locks and thermostats at home or on the go • Create routines to automate your smart home devices  MUSIC & BOOKS • Connect to music services like Amazon Music, Pandora, Spotify, TuneIn, and iHeartRadio. Choose a song or playlist and listen on your Alexa-enabled devices • Create speaker groups to play music across your compatible Echo devices for multi-room music  ORGANIZE YOUR DAY • View and edit shopping and to-do lists on the go, get weather and news updates, manage timers and alarms, and more  STAY CONNECTED • Use Drop In from your app to connect instantly with your compatible Echo devices, like a two-way intercom  • Call or message supported Alexa-enabled devices, at no additional cost"
9DB1EE4693754F2A9185DF9626885184BE51577C8386A83163A0A67E31EE15C2,com.roc_connect.rocapp.smarthome.ozom,HOUSE_AND_HOME,"New to OZOM or connecting new devices from compatible brands? OZOM 2.0 is the right app to use!  The new app OZOM 2.0 allows you to configure and control thousands of smart products from different compatible brands using a single app, plus new functionalities like:  - Voice control with Google Home and Alexa compatible products. - Create rules to define smart actions between your devices. For example: turn on a light when the doorlock is opened. - Choose among smart operating modes according to your need (active, night, armed). All this only using WiFi connection to your home Internet.  Download and discover this simple and innovative solution to make your home a smart home. For more information please visit www.ozom.com"
3AAD6D6267C3F5E9165D2BD9DBE92937B9E0B2ECB174BFEEB925F742C55CEE11,com.smarthome.myuniden,TOOLS,"Uniden is a worldwide leader in Wireless Communication Including Security Cameras, Baby Monitors, Dash Cams, UHF Radios and So Much More.      Use the My Uniden App to connect your smartphone to compatible Smart Uniden Products.      The My Uniden makes your home work smarter ensuring you are kept up to date with what is happening at home when you are not there.      These Include Security Cameras and Baby Monitors which make it simple to protect and connect what matters most. Stream and play recorded and live clips from your cameras, and stay aware of what’s happening.      * Remotely control your compatible Uniden Smart devices  * Voice control via Amazon Echo & Google Home  * Receive real-time alerts and notifications  * Add and control multiple devices   * Clear interface that’s simple to use and easy to understand  * Save actions and preferences to customise your experience      Uniden even works with Amazon Alexa and Google Assistant, for selected compatible product so you can build the smartest home in the street."
F469C65923A7376EDE92CB7CF865F7E056EFC888B43CEC2E30495DCF0D15EEE3,com.goodway.smarthome,LIFESTYLE,"gw-link, smart home.smart life 1. Remote control: control home appliances from anywhere 2. Simultaneously control: control multiple devices with one App 3. Timer: set timer to perform multiple functions  4. Device sharing: One tap to share devices among family members 5. Easy connection: easily and quickly connect App to devices"
3BE8DFE313F5C7F47EB4B4B884E5511D9763C98E19EE949ACD15DD4BBAD5FC97,com.orange.be.smarthome,LIFESTYLE,"Available for all Orange Belgium customers, the Orange Smart Home application allows you to quickly and easily manage your connected devices at home. It's free, ad-free, and accessible anytime, anywhere. Orange Smart Home allows you to: • Switch on, switch off and change the intensity of your lighting; • Switch on and off your plugs, consult the power consumption of your devices or program them; • Control your cameras and remotely view what is happening in your home; • Receive instant notifications in case of intrusion; • Create the atmosphere of your choice and program your favourite scenarios. Orange currently supports the following devices:  - Konyks Camini Max - Wi-Fi rotating interior Camera with 'privacy mode' - Konyks Priska+ Mini - Wi-Fi Smart plug 16A with power consumption control - Konyks Antalya A70 - Smart LED light RGB+W Wi-Fi E27 10W Those products are available in Orange shops and online via orange.be/smarthome GOOD TO KNOW: - The application is available for smartphones only (not for tablets) - The application is compatible with devices sold by Orange or any other device with logo ""Powered by Tuya"" - The application will request your permission to access your device location to enable some features e.g. smart scenarios, setting home location, even when the app is closed or not in use."
698EA08B4FEF2B7861E030456BDEB102EFA341B54B6068F504D1593FA1A26B85,com.cmhk.smarthome,LIFESTYLE,"ONE Home - Smart Home Fresh new smart home management app for your home living  1. Remote control: control home appliances from anywhere 2. Simultaneously control: control multiple devices with one App 3. Timer: set timer to perform multiple functions  4. Device sharing: One tap to share devices among family members 5. Easy connection: easily and quickly connect App to devices  ONE Home Mobile App ONE App for all your Home Devices, Remote Management, Voice Control and Scene Automations  ONE Home Smart Devices Various home gadgets and appliances to control For details： CMHK website http://bit.ly/onehome-cmhk"
9E61DFA5E489B350E277AFDDD7BE1B687CCEC4B9E54CD56B81127CAB121917B5,com.enerjsmart.home,LIFESTYLE,1.Remotely control home appliances from anywhere; 2.Simultaneously control multiple devices with one app; 3.Set timer to easily perform multiple functions;
2D5D5D6161E59BDF65F0426E9CDBC54BCFF6E9EF4769CC71805D26FEC8435C27,com.navigator.smarthome,TOOLS,An  app. for  managing your Navigator  intelligent devices:  -  home devices control from anywhere -  multiple devices control  with one App -  one tap for device sharing among family members -  ability of  timer setting to perform multiple functions                                                         Easy connection: easily and quickly connect App to devices
F0D51A943BE164127721E6A8E7585E421A4B49F1C32F7E0BA84E8EB8B0AB97ED,com.avatarsmart.home,TOOLS,"AvatarControls , smart life, smart living 1. Remote control: control home appliances from anywhere 2. Simultaneously control: control multiple devices with one App 3. Timer: set timer to perform multiple functions  4. Device sharing: One tap to share devices among family members 5. Easy connection: easily and quickly connect App to devices"
E4F2A682DC0DB9411B5173BBABEF308B2AE1E884554B6E972B93075ADFB61333,com.sharp.smarthome,TOOLS,"The app enables the connection between smart phones and the Sharp Smart Appliances with Wi-Fi communication. Smart products enable comprehensive monitoring of a product’s condition, operation and external environment through sensors and external data sources. With Sharp Home, smart products can be also controlled through remote commands that are built into the cloud, which provides customization option to user. The rich flow of monitoring data from smart products, coupled with the capacity to control product operation, allows user to optimize product performance in numerous ways. Combination of monitoring, controlling, and optimization capabilities, experiencing the smart products will allow user to achieve a previously unattainable level of autonomy.  With Sharp Home App, you can; * Remotely Control & Access & Monitor your smart device. * Allows to recieve status information about smart device."
B541B0B202E4BFAB7C7FD9C43B3380F2B41D1F2540C0C8592E1E32F3CDEE1A9D,com.wifi.smarthome,LIFESTYLE,"The main function of ""WiFi Smart"" is to control smart appliances,Switch on/off,change mode,set temperature,etc.Different devices can be linked to each other,also you can preset the device and set a variety of scene mode(all the device will be turned on when trigger the mode""in home"" )"
6C4FC322D3BA1EA90E3C318B4F7F3176F56C58189EA39601221626A165B8A6B1,com.trust.smarthome,LIFESTYLE,"Trust Switch-in makes a smart home accessible. With a wide range of affordable and wireless products, your home - from lighting to curtains to security - can be easily controlled remotely or even automated from a single app.  Make everything smart; from your lights to window coverings to garage door. From now on, you control everything in your home remotely. 1. Choose the receiver suitable for your application, such as a built-in dimmer or plug-in switch. 2. Now choose the control that best suits your living situation, e.g. a remote control or wireless wall dimmer. Once you have chosen a transmitter, pair it with your receiver in no time and your smart solution is a reality. 3. Link your receivers and transmitters to the Trust Switch-in app by using the Smart Bridge and use your smartphone or tablet to control, manage and automate your system as desired."
6066AC35322313007D2022A7A8C3D7B751E705377B79B4723D3D4656140361D5,com.humlabs.smarthome,LIFESTYLE,"With the Livy app, you can access your Livy devices from anywhere, anytime. The app lets you know at a glance that everything is OK at home or notifies you if something unusual happens. So that you are not alone in an emergency, you can share the access with your community. This can be other residents, relatives, neighbours or trusted persons.   Basic functions:  - Video live streaming - Manual activation / deactivation of the alarm - Push message in case of alarm - Community: Invitation of friends, neighbours or family to be notified in case of alarm - Actual display of sensor values - Premium service: Additional value-added services  *******  With Livy Plus you can also book additional services for an even smarter home.  Livy Plus in detail:  - GeoAssistant for automatic alarm activation - SMS alarm message - Healthy Air Guide for air analysis and history - Silent alarm function - motion detection without siren - Community status display: Who is at home? - 2 way audio - Video recording in case of alarm - 30 days cloud storage for video sequences"
84BC7DAF5F850A50BD00211CAE0CD12A811695ADC97A5B9326A15B477D8FF7DB,com.mercurybroadband.smarthome,COMMUNICATION,"Control your smart home experience with MERCURY @ HOME. Manage your network by assigning devices priority, implementing parental controls, and creating your own guest networks.  View network usage, perform speed tests, and manage your SSID for total control."
14CA02E51AC4BA3C9DB52D6A036005B6B91D9FD23B5E279E0C6BED04B9973104,com.summitllc.rcasmarthome,HOUSE_AND_HOME,"Control all your RCA smart devices in one beautiful app, from anywhere you are - from 1 foot away, to across the world -  with amazing features and ease of use. • Per device control - Set color, brightness, and warmth on your light bulbs, set a schedule for your switches, and check the status of your door and window sensor from anywhere in the world • Create groups of devices to control many devices simultaneously. • Create automations that are triggered by any device of your choosing for example ""Turn on hallway lights when motion is detected after 12 AM"" • Set schedules for devices based on time and day of week. • Share your home with household members, friends, or anyone visiting temporarily. • Compatible with all RCA-enabled smart devices without needing a separate expensive hub. • Control with your voice; Alexa and Google assistant compatible."
FC1FD1BF1C453A37BD339C1ADD0F8DB071876DDE2C6BAEBA3F2C9AECD7EEB5E9,de.insta.enet.smarthome,LIFESTYLE,"With the app, you can control your intelligent home and make all the settings for eNet SMART HOME there – from anywhere. Control light, venetian blinds and other functions with your smartphone or tablet (Android device) via a secure connection. There is one prerequisite for this: the eNet Server with software version 2.0 or higher. For information about the update, see ""update.enet-smarthome.com"". eNet SMART HOME is a professional home automation of strong brands that pursues a mission: to make your everyday life as comfortable as possible. And ""comfort"" begins with installation. After a specialist has installed your system professionally, you can conveniently control your home via the app for maximum user-friendliness. Thus, you can use eNet SMART HOME intuitively. The app is password protected. This prohibits access to the home control system for unauthorised persons. After all, it is only you who decides who has which access rights in your home – i.e. who is allowed to make the settings and who can only use existing functions.  MAIN FUNCTIONS  Remote control. With eNet SMART HOME remote integrated remote access, you can control your home from wherever you are.  Designing scenes. Combine different functions and create scenes. In this way, your home adapts to your mood.  Creating routines. Create time schedules for your home. Right on the minute, individual functions and scenes begin.  Setting rules. When a certain event occurs, a function can automatically follow. All you have to do is to set up the rules.  Setting as favourite. Set the most important devices and functions as your favourite. They can then be retrieved with just a tap of your finger.  Controlling. Operate your devices individually or together. You decide whether you want a single luminaire to go on or the light in the whole house.  Relaxing. We have predefined comfort situations for you. Therefore, just lean back and start controlling.  Saving. You always know which device is currently consuming power. This allows you to quickly identify unnecessary power guzzlers.  Seeing. Install motion detectors outdoors. And your way to the front door will always be enlightened.  Encrypting. Thanks to eNet SMART HOME secure, the communication between your devices is encrypted – whether you control them from home or on the move.  Overviewing. With the room overview, you always know which devices are currently active in your home.  You do not have an eNet Server yet? But are you interested in eNet SMART HOME? On our homepage ""www.enet-smarthome.com"" you will find specialists in your area and further information. This is how you get professional advice.  And otherwise: Download the eNet SMART HOME app and start controlling."
1C630DA2867DA1488233D29110C33245551EF9E81042992D6017F7BB97D22C61,com.spciot.smart,LIFESTYLE,"All your devices are linked via our SPC IoT app which allows you to manage your home, wherever you are; cleaning, lights, temperature or security. A unique app for complete IoT device control.  Lighting  Control your home lighting, remotely. Turn lights on/off from your Smartphone while you’re out and about.  Power Not sure whether you’ve left an electrical appliance plugged in? Disconnect it conveniently using your app. Worry free.  Security  Look after your children or elderly family members. Connect the security camera to your app and worry less as you know that they’re ok.  Comfort  Go home to a clean house by activating your cleaning robot while still at work by simply connecting to SPC IoT.  This app also allows you to contact the SPC Technical Support Services, directly. Any questions? We’re here to help!"
EBBCE01BAC622EB50202E054B2D114F10EF2A7B20576FE258F994A38054D5860,com.acome.wook,TOOLS,"1. One application connect and control multiple devices quicker and easier 2. No matter where you are, you can monitor and control smart devices, home appliances 3. Support family sharing the smart life 4. Set tasks depending on your needs and with more precise execution 5. Its easy for the old and children to use it"
A027FC9CEB1856A08BF941B06CF2BC15C38078F59E496F139E7769D2CB901991,com.bneta.iot,TOOLS,The Smart Way to Control You Home 1. Remote control: control home appliances from anywhere 2. Simultaneously control: control multiple devices with one App 3. Timer: set timer to perform multiple functions  4. Device sharing: One tap to share devices among family members 5. Easy connection: easily and quickly connect App to devices
2CB7F7607E783ACBE2BC6EF181E849FD03904780B0540DDC0B267239E6F5778B,com.hiper.smartiot,HOUSE_AND_HOME,"IoT, Smart Home, Internet of Things, Smart Home 1. Remote control: control your home appliances from anywhere 2. Simultaneous control: control multiple devices with one application 3. Timer: execution of scripts at a specified time 4. Device Sharing: Easily share devices with your loved ones 5. Simple connection: easily and quickly set up your IoT devices 6. Scenarios: set up automatic scenarios when sensors or other actions are triggered 7. Combining several devices of the same class into one virtual device (5 bulbs in one chandelier, controlled as one bulb) 8. Compatible with smart voice assistants: Marusya (mail.ru), Alisa (yandex.ru), MTC Smart Home (smarthome.mts.ru), Google Assistant, Siri Quick Scripts (apple.com), Amazon Alexa 9. Supports connection protocols: Wi-Fi, Bluetooth, ZigBee, RF433Mhz"
