sha256,pkgName,categoryID,description
1C4B5023BB2B8E3A10B909218BCD4DA990CCF5488E6E0E7EBDEE283CEEAE54B5,com.nest.android,LIFESTYLE,"At Google Nest, we make products that are beautiful, helpful and easy to use. The Nest app is no exception.  Control your Nest thermostat, arm and disarm your Nest Secure alarm system, see your home with Nest Cam, and get an alert if Nest Protect goes off – all in one place. And receive notifications on your Android phone or tablet.  Nest uses sensors, algorithms, and the location of your phone to do the right thing automatically, turning off the heat and turning on the camera when you leave. Forget to set the alarm? It will notice, and send you a Remind Me alert.  Nest Learning Thermostat and Nest Thermostat E  Thermostats that program themselves to help you save energy.  - Change the temperature from the subway or the sofa using your phone. - See how much energy you used, and why. - View and edit your schedule. - Get extreme temperature alerts before your home gets too cold.  Nest Secure alarm system  - Arm and disarm your home remotely from the app. - Receive a Remind Me alert if you leave home and forget to set the alarm. - Receive a security alert on your phone telling you what triggered the alarm – a door or window opening, or someone entering a room.  Nest Protect  The smoke and carbon monoxide alarm that thinks, speaks, and alerts your phone.  - Get an alert if Nest Protect senses smoke or carbon monoxide. (Requires Wi-Fi and a working internet connection.) - Silence an alarm from your phone with App Silence. (Nest Protect 2nd gen only.) - See the status of your batteries, sensors, and Wi-Fi connection. - Run a Safety Checkup to test all your alarms at once. (Nest Protect 2nd gen only.) - See your Safety History so you know when alerts happened and why.  Nest Cam IQ Indoor and Outdoor, Nest Cam Indoor, Nest Cam Outdoor, and Dropcam  The security cameras that let you see your home on your phone, inside and out.  - Get alerts when there’s activity, and talk back to get someone’s attention. - See what you missed with snapshots of the last three hours. - Check in 24/7 with crisp 1080p HD video (Nest Cam and Dropcam Pro only). - Get person alerts (or familiar face alerts with Nest Cam IQ) and up to 30 days of video history when you subscribe to Nest Aware. (Subscription service sold separately.)  Nest Hello  Know who’s knocking.  - 24/7 video streaming means you’ll never miss a moment. - Designed to show you everything at your doorstep – people head to toe, or packages on the ground. - Knows the difference between a person and a thing. - Notifies you about visitors, even if they don’t ring the bell. - HD Talk and Listen lets you have a seamless conversation with someone at your door. - When you can’t answer the door, quick responses let you reply to visitors with prerecorded audio messages.  Nest x Yale Lock  The lock for a more secure connected home.  - Instead of sharing keys, assign passcodes to people you trust in the Nest app. - Get an alert when someone locks or unlocks the door. - With Home/Away Assist and Auto-Lock, your door can lock itself when you leave.  Some features require a working internet connection, Wi-Fi, and/or Bluetooth."
5C1AD8F77AA5AEDD3DF41FA617158CDA11995771F5C4F0D26012680972D8BDB5,com.tplink.kasa_android,LIFESTYLE,"** Kasa Smart is currently only compatible with TP-LINK Smart Plug HS100/110/107 KP200/400/EP10, Smart Plug Mini HS103/105 KP105, Smart Switch HS200/210/220, Smart Power Strip HS300/303, Smart Bulb LB100/110/120/130/200/230, KL50/60/110/120/130, IP Camera KC100/105/110/115/120/200/300/310/400/410S/420WS, Smart Router SR20, and Range Extender RE270/370/350K **  Kasa Smart lets you add, configure, monitor, and control your connected TP-LINK Smart Home devices from anywhere in the world. You can schedule your appliances to turn on or off according to your schedule, or set them to Away Mode to deter would-be burglars. And that’s just the beginning. Purchase a TP-LINK Smart Home device and download the app to get started today."
CF195EFB8959F8263B74ED17B0EAD81DDF5BD6CF207EEB3A41F0A1B7D6F5E38D,com.ants360.yicamera.international,LIFESTYLE,"Control all your YI-connected devices in one place. YI Home app connects you with your family, pets, and things you love through real-time video and audio anytime, anywhere just a fingertip away.  With a simple tap on your mobile phone, you can initiate a 2-way conversation with your family remotely. Its specially designed microphone and speaker ensure loud and clear voice quality.  By simply panning your mobile phone left and right, a complete panoramic view will be displayed to provide a better viewing experience. The gyroscope support, integrated in the YI Home App, is able to follow the mobile phone orientation, making it easier to see every corner being monitored.  YI Home cameras always keep an eye on things that are important to you. With built-in high accuracy motion detection technology, the camera sends notifications to your YI Home app detailing what movement was detected so you always stay on top of things that you care about, instantly!  The YI camera can support up to 32GB SD card, it stores video and audio of special moments, fully indexed, for you to cherish at the touch of your fingertip. Best yet, a built-in mode triggers store actions only when image change is detected to achieve the best storage capacity optimization.  The adaptive streaming technology automatically adjusts to the optimal viewing quality based on your network conditions.  YI Home app supports all YI products."
3F46A7E1EC4A33F51EA887688FCF16F17C56D99B131F1C17A9B440AAC95CD3E3,com.ivuu,HOUSE_AND_HOME,"AlfredCamera is a <b>free and reliable security camera app</b> for your home, baby, and pets. Join more than <b>70 million families</b> and use Alfred to care for your loved ones remotely. It’s a simple safety at your fingertips that keeps you enjoy peace of mind no matter you're at home or away.  PORTABLE VIDEO MONITOR Finally being able to travel somewhere to enjoy the summer, beaches, and outdoor activities, you must not want to let your guard down when you're not at home. To make sure your hotel room is safe at all times, Alfred security camera provides you with the smart motion detector that will send you an instant alert when it finds an intruder. You can also scare the intruder away by immediately speaking through the walkie-talkie. Moreover, you can zoom in and use night vision (low-light filter) to capture as many details and use them as evidence to help identify the suspect.   HEALTH & SAFETY TRACKER WHEN RETURNING TO NORMALCY Are you worried about your loved ones who may have been suffering from post-pandemic anxiety, yet still feel hesitant to embrace the normal lifestyle? Alfred home security camera can help you watch over your loved ones who are still ready to leave the pandemic bubble. By simply turning your old phones into security cameras, you can always keep an eye on the health and safety of your beloved families with real-time live tracking. Moreover, with remote calls, you can stay connected to ease their anxiety from anywhere. Enjoy Alfred's interactive technology which can simplify your lifestyle.  SECURITY CAMERA FOR THE SMARTPHONE AGE People love Alfred! The all-in-one app provides more features (24/7 Live feeds, night vision/low-light filter, HD quality and more...) than a basic, expensive security camera. You can get live stream, smart intruder alert, night vision (low-light filter), walkie-talkie, and unlimited cloud storage to store, share, and playback your recorded videos.   FREE, STABLE, & RELIABLE If you want a CCTV to keep an eye on your belongings, a baby monitor to look after your newborn, or a pet cam to entertain your lovely pets, AlfredCamera is your number one choice.  SUPER EASY TO SET UP DIY your own home security camera in 3 minutes. No cost, no hard skills; just one creative idea! Alfred home security Camera is home surveillance system with professional-grade features, period.  ANYTIME, ANYWHERE To defend your front door and backyard, you don’t even need a security guard! AlfredCamera will take care of what matters the most to you. Unlike traditional CCTV cameras or home surveillance cameras, you can put Alfred wherever you need to strengthen security. What's more, you can add or remove a camera whenever you like.  SMART, CONVENIENT, ECO-CONSCIOUS First time choosing a CCTV camera? Still hoping to find good reviews on expensive baby monitor, pet cam, or IP camera? You can protect your home with a smarter solution. You don’t even need to buy a real CCTV camera, baby monitor, IP cam, or IP webcam.   Besides the cost of the equipment, these smart home appliances often charge a monthly fee. With home camera apps like Alfred, you can eliminate complicated installation, IP settings, and contracts. You only have to download the Alfred app and repurpose your old devices as a DIY IP camera or baby monitor: pure and simple.   The multi-functional home surveillance camera you can ever find: Free, reliable, versatile and easy to use. No hidden upfront costs or additional monitoring fees. Alfred is also an essential component of any home improvement or home automation project if you are interested in building a smart home or experimenting with Google Assistant.   Everyone is taking advantage of their unused phones by turning them into remote chat rooms, health trackers, portable hotel guards, or fitness devices. So why not use yours as a baby cam, nanny cam, pet cam, surveillance camera, webcam, or IP cam?  Some features of this app require Device Administrator permission."
712F88A8ABC1BEC4F7B738B8D2747413AC90A22B7BA926B8D797E6925A95293F,com.ajaxsystems,TOOLS,"Ajax will protect your family and business from burglars, fire, and flooding. If something bad happens, the system will instantly activate the sirens, notify of danger and call the security company patrol dispatch.  IN THE APP:  ◦ Manage security modes and your smart home from anywhere in the world ◦ Get alarm notifications ◦ Monitor system events ◦ View the photos taken with the detectors of the MotionCam lineup, and security camera footage ◦ Set up devices, automation scenarios, and security schedules  • • •   “Intruder Alarm of the Year”—Security & Fire Excellence Awards, London “Security & Firefighting Risks”— silver medal at Expoprotection Awards, Paris “Intruder product of the year”—PSI Premier Awards 2020 “Security System of the Year”—Ukrainian People Choice Award 2021  1.5 million people in 130 countries are protected by Ajax.  • • •  AGAINST BURGLARS The detectors instantly capture an intruder on your property, doors or windows opening, and glass breaking. As soon as a person enters a protected area, they will be captured by the photo camera of the MotionCam detector lineup. You and the security company will know what happened.  ONE CLICK AND HELP IS ON THE WAY Press the panic button on the app, key fob, or keyboard in an emergency. Ajax will call a security company patrol dispatch or medical help and notify all system users about the danger.  DETECTING FIRE AND CARBON MONOXIDE Fire detectors notify of smoke and temperature spike and promptly alert about a dangerous carbon monoxide (CO) concentration with no color, smell, or taste. The built-in sirens will wake up even those who are fast asleep.  INFORMING ABOUT FLOODING The detectors notify of a pipe break, a washing machine leak, or an overflowing bathtub. The system will inform users, while scenarios with relays automatically turn off the water. And if the upstairs neighbors flood your apartment, you will get the app notification.   VIDEO CAMERA IN THE SMARTPHONE  Watch video from security cameras directly in the app. Connecting the Dahua, Uniview, Hikvision, and Safire cameras and DVRs takes a minute. Equipment from other manufacturers is connected via an RTSP link.  SMART HOME Change security modes up to a schedule, program the outdoor lighting to turn on when strangers are detected on your property, or implement an anti-flood system. Manage gates, electric locks, lighting, heating, and electrical appliances. In the app, automatically by scenario or by pressing a smart button.  PROFESSIONAL LEVEL OF RELIABILITY The hub runs on OS Malevich, protected from failures, viruses, and cyberattacks. Thanks to the backup battery and communication channels, the system is resistant to power outages or the lack of Internet connectivity. The account is protected by session control and two-factor authentication. Ajax has been rated Grade 2 by five independent labs.  CONNECTING TO THE SECURITY COMPANY MONITORING STATION 3,500 security companies in 130 countries work with the Ajax security systems.  • • •  Ajax equipment is required to work with the app. You can buy the devices from authorized Ajax partners in your region.  Learn more: www.ajax.systems  Have any questions? Write to support@ajax.systems"
C5F2ECE6337C32F8C77347C36DFB8021AC3E08844162FC07BC4D8E30C59537CB,com.irobot.home,LIFESTYLE,"The new iRobot Home App is here. With it, enhanced maps, the ability to clean specific objects, custom routines, seasonal suggestions, and intuitive smart home integrations*. Every aspect of the iRobot Home App has been redesigned to give you ultimate control over your clean.   YOUR LIFE. YOUR HOME. YOUR CLEAN: Unlock a cleaning experience designed around you. Create cleaning schedules, save favorites, and adjust them on the fly. Get personalized cleaning recommendations based on what’s happening in your home, and even tell your robots to clean while you’re away with smart home integration. Turn cleaning from something you do to something that happens around your life.   CLEANING, CONTROLLED: Customizable maps of your home enable your robots to go to the mess, cleaning by room, object, or area while staying away from Keep Out Zones*.  * Feature availability varies by robot model   ADAPT TO YOUR SCHEDULE: Use Automations to connect to your smart devices and personalize your cleaning experience by scheduling your robot to clean when you leave the house.   CLEAN WITHOUT LIFTING A FINGER: Keep doing what you’re doing! All connected robots are compatible with select voice assistants so you can clean with your voice*.  *Works with Google Assistant and Alexa enabled devices *Alexa and all related logos are trademarks of Amazon.com or its affiliates. *Google is a trademark of Google LLC   ALWAYS GETTING SMARTER: Your robot will stay up to date with automatic software updates.   REQUIREMENTS:  • Wi-Fi® connected Roomba® 900, 600, 800 and e Series vacuuming robot models only support Wi-Fi® networks with 2.4GHz band  • Roomba® i Series robots support both Wi-Fi® networks with 2.4GHz and 5GHz band  • Braava jet™ 240 mopping robot uses Bluetooth Low Energy (also known as BLE or Bluetooth Smart) built in to most common mobile devices"
E5DB02CF7C6A0A6E4A27CCAA62B4C091FE80FCEE29AE0FED147A8E2DF7FE96EF,com.tado,TOOLS,With tado° you control your heating and air conditioning more easily and conveniently than ever before.  tado° helps you create a comfortable and healthy climate at home. Its intelligent control works to  save energy - good for the environment and for your wallet.  For all Smart Thermostats and the Smart AC Control from tado°.
18DCDC4E64367C8C13F3F933AF61CE75EAED0E923642579679215F66A351ECE3,com.philips.lighting.hue2,LIFESTYLE,"The official Philips Hue app is the most comprehensive way to organise, control and customise your Philips Hue smart lights and accessories.   Looking for the Hue Bluetooth app? You can now use this app to control your Philips Hue smart Bluetooth lights!*    Organise your smart lights your way  Whether you use just a few bulbs or have completely outfitted your home in Philips Hue, you can organise your smart lights with ease. Group your lights into Rooms or Zones – your entire downstairs floor or all the lights in the living room, for example – that mirror the physical rooms in your home.   Easily control your lights – from anywhere  Adjust your lights’ brightness, temperature and colour and control multiple lights across Rooms or Zones all from the Hue app – and it doesn’t matter where you are. You can use the app to control your lights wherever you have an Internet connection.     Extraordinary light experiences   Created by professional lighting designers, scenes transform your room in an instant. Create a unique atmosphere with the Honolulu scene, the vibrant colours of Soho and more. Browse the Hue scene gallery and tap a scene to set it – or create your own based on a photo or your favourite colour palette.   Light recipes for your daily routines  Use the four light recipes designed by lighting experts to support your wellbeing throughout the day. Start the day with the cool daylight of Energise to give you a morning boost, followed by the brighter Concentrate setting to help you get things done. The Read light recipe gives you the perfect shade of light in which to read your favourite book, while the dimmed golden glow of Relax helps you wind down.    Personalise with automations  Make your smart lights work around your daily routine. Whether you want your lights to gently wake you up in the morning or greet you when you get home, setting up customisable automations in the Hue app is effortless – and fun!  Sync your smart lights  Make your lights flash, dance, dim, brighten, and change color in sync with your screen or sound! Use the Sync tab to sync your lights with the Philips Hue Play HDMI sync box or Spotify.  Hands-free voice control  Use Apple HomeKit, Amazon Alexa or Google Assistant to control your smart lights with just your voice. Simple voice commands let you turn lights on and off, dim and brighten or even change colours without you ever lifting a finger.   Create widgets for quick control Control your smart lights even faster by creating widgets on your home screen. Turn lights on or off, adjust brightness and temperature or set scenes – all without even opening the app.   Find out more about the official Philips Hue app: www.philips-hue.com/app.   *Some features in this app require a Hue Bridge. "
DEE31653683D9B4320823C6379E21B1D34EC66B42944FBE469B44496A13561E8,com.rubetek.client,HOUSE_AND_HOME,"RUBETEK: Turn your home into a smart Digital Home.  With Rubetek mobile app, gain full control and security over your home at your finger tips. Get notified about every activity taking place at your home, anywhere-anytime. Get the best from your experience with the Internet while making your house more comfortable and secure than ever. Rubetek is here to make your life better by providing control over multiple smart home appliances with a simple intuitive app.   Rubetek offers a unique collection of smart home devices which are connected to Sensors, relays, outlets, cameras to name a few, which are all combined under your control to create a thoughtful assistant for keeping your home on the same wave length as your needs and desires. Use your mobile device to get everything you want from a smart home. With this app, you will be able to monitor your home environment; • See if your children are okay while you are away.  • Get snapshots of visitors at your door.  • Control kitchen appliances and roll up curtains.  • Set up home temperature and light levels. • Get instant mobile notifications when doors or windows are left open, or any other abnormalities( gas leakages, smoke or fire alerts) • Communicate with visitors without necessary moving to the door. Remotely open and close doors for visitors  Most importantly, be the supervisor of your home by essentially having the ability to do as such in your grasp with the Rubetek mobile application  USER FRIENDLY Set up any Rubetek device within minutes with the clear step-by-step instruction.  VIDEO MONITORING Monitor your home environment while away. Watch real-time streams captured by security video cameras, and store recordings via popular cloud services.  NOTIFICATIONS Set up instant push or sms notifications to always be the first to know if something’s going on at home.  STATISTICS Save your funds by monitoring the energy consumption levels of your appliances.  SCENARIOS Save time by customizing series of actions, such as turning on the lights when you enter the room, or heating the bathroom floor 30 minutes before your arrival.  GUEST ACCESS Share your smart home settings with your family members by giving them access via the Invitation system.  VOICE CONTROL Use the voice control to command Rubetek devices."
D7078032C37BD5963B57ED67F1941C4182F6B614E8D132028B15AB6FE11E069D,com.xiaomi.smarthome,LIFESTYLE,"Manage and communicate to devices. Connect devices to network. Connect devices to each other.  Xiaomi Home app obtained the Kitemark™ Certification for Secure Digital Applications.https://trust.mi.com/security  tips: device support are different in different areas, please refer to product manual or official website"
F767A67DE2D7E1C9788BABBAA4E48CA0D9AE12F581B3D703C9519478108D52AB,com.honeywell.android.lyric,LIFESTYLE,"At Resideo we're on a mission to make our future better for our planet, together. We create products and services that automate homes and buildings to make every day better.  We're on a mission to create a world where homes and buildings are good for the planet, where technology works to simplify everyday life. Where people are happy, healthy and secure.  Resideo products help simplify home comfort, security, and awareness by allowing easy control with a single app. Our heritage and experience in and around the home means you can trust each of our products to perform brilliantly and give you a smarter, more comfortable home.  Together, we can protect our time, our water, our energy, our air, our homes, our families, and our planet.  Together, we help protect what matters most.  Learn more about the Resideo and Honeywell Home family of connected products at www.resideo.com and www.honeywellhome.com"
D6AE006E4E2DBFA960C6FD6A3914DA1404A6296B0B7C813CE63FA0374C279148,com.bshg.homeconnect.android.release,LIFESTYLE,"Control your smart kitchen and home appliances in a simple and convenient way with the Home Connect app. Download the free Home Connect app now!  Intelligently connected to your household  Make the best of your home appliances from Siemens, Bosch, Neff, and Gaggenau by connecting them to the Home Connect app.  ✓	Control and monitor your kitchen and home appliances ✓	Start, stop, select programmes, or set timers ✓	Get push messages when your programme has finished ✓	Automate everyday tasks and routines ✓	Easier use of appliances via the app ✓	Exclusive in-app functionalities  ✓	Recipes and endless cooking inspiration with Kitchen Stories   Control and manage your smart appliances anytime  Did I switch off the oven? Instead of heading back home to check, simply take a look at the app. You will see the status of your appliances straight away with immediate access to important functionalities, whether at home or on the go.   Be aware of all that’s important  Oh, the fridge door has been left open? When do I need to descale the coffee machine? Important notifications and reminders regarding maintenance and care will be sent to you automatically. And even if things don’t go to plan: Using remote diagnostics our customer service will help you out with resolving the issue. You can also simply check the manual which is conveniently stored in the app.   Voice-control your household via Google Assistant or Amazon Alexa  Whether it’s making coffee, preheating the oven, or starting the washing machine: Voice your command and Google Assistant or Amazon Alexa will take care of the rest. What’s more, you can use predefined or individual routines for recurring tasks, like having your coffee made at the same time each working day.    Finding the best programme and other little helpers  Dishwasher, dryer, or oven – depending on the appliance and task at hand, the app will recommend the right programme with the ideal settings, whether it’s a pile of dirty dishes, a load of washing, or the cheesecake recipe for your next family reunion. And with Coffee Playlist you can even fulfil your guests’ coffee needs to match that cheesecake.  Never run out of dishwasher tabs again  Are you fed up being out of dishwasher tabs over and over again? With Home Connect and our tab counter you will never have to think about it again. Connected to Amazon Alexa and its smart reordering service your dishwasher tabs will be reordered on demand before you run out.   Control your home with your smartwatch  Monitor and manage your appliances with your Wear OS by Google or Fitbit smartwatch. All you need is the Home Connect Watch App for your smartwatch in addition to the Home Connect app.  Is my data safe?  Absolutely. All connections to Home Connect and our partners use TLS, a cryptographic protocol ensuring data transfer security. Additionally, each version of the Home Connect app is certified by TÜV TRUST IT (Austria).  Do you have any questions or feedback? Drop us a message at service.uk@home-connect.com, we’re happy to hear from you.  Find comprehensive information on Home Connect and all suitable appliances from Siemens, Bosch, Neff, and Gaggenau:  Website: https://www.home-connect.com Instagram: https://www.instagram.com/homeconnectapp/ YouTube: https://www.youtube.com/c/HomeConnectGlobal/"
