sha256,pkgName,categoryID,description
41FCEF16984E573CEAB0BC2FE96E40CB2AECED3FC4B2CCA31320A6D0FE700361,com.asim.metoo.calculator,EDUCATION,"This calculator is tool to calculate every thing you need only in one single step. After searching a function, enter the values  it will give result.  Besides the basic functions you can get reminder, you can calculate average, you can calculate percentage, you can convert degree into radian and vice versa. Further you can use this calculator to find area of rectangle, Perimeter of rectangle, Circumference of circle, Area of circle etc. It can be used to convert Celsius into Fahrenheit and Fahrenheit into Celsius temperature. And there are many more functions you can use it very easily for."
233285598E09D9ED6D62E8606891D59F3AFF48993251D8ECCD5404521A2A4CDA,com.calculator.meroni,TOOLS,"Generic Calculator is a very simple, easy to use calculator application. It is based on a real calculator in design and operation. The aim of this application is to provide a daily experience in using calculators.  This Application is absolutely FREE with NO advertisement and NO other permission in stealing your personal information.  Generic Calculator offers: - Most Easy and Simple calculator interface - Basic arithmetic, Square root and Percentage calculation - Graphic interface and operation logic same as big brand calculator - 10 digits screen - one memory storage(m+) - percentage key logic  Please help to rate this application if you like it."
20DB29BEE73DFF413A0F39ADBB497194E0348563B03C275994339346D51609E2,com.acrongames.cascalculator,PRODUCTIVITY,"Requires monthly or lifetime subscription.  30 day free trial included with first-time installs.  • Simplify and Factor Polynomials • Solve Systems of Equations • Derivatives, Integrals, and Limits • First-Order Differential Equations • Time-Value of Money, Depreciation, Annuities • Vectors and Matrices  • Supports both WYSIWYG and RPN input modes  <small>Acron Calculator is powered by the <a href=""https://www.google.com/url?q=https%3A%2F%2Fgithub.com%2Faxkr%2Fsymja_android_library&sa=D&sntz=1&usg=AOvVaw24dudvZJ3lv0-iBM6NDxcg"">Symja symbolic math library</a>.</small>"
A24DCB9CF86040DD03C386491094B8292F0A4B88F4EBA5CCEDEA9566F99113F4,com.mgcalculator,TOOLS,This Application will help you provide you an accurate calculation of numbers in just a second
2C7EA94C1BF7C8E404093AFB1C2982958E1E74C4B24866DFB9228547BE89433D,com.always.on.calculator,TOOLS,"This is a perfect Calculator app for Daiy usage.  This is not a scientific calculator . This is a Basic calculator for normal calculation .  This calculator has Addition , Substraction , Multiplication , Division and Square Root , percentage , positive negative and decial points. This app is perfect for daily grocery calculation. It keeps the display on for long use. You can check complete calculation in List view."
44DC725585B49943F291E28963337F370BC17E1FC839E872524057842F2FA950,com.calc_forfunc,TOOLS,"Calc for func is a free, easier to learn and use scientific calculator. Calc for func includes the following features: - complex numbers - unlimited number of variables; - contains a math handbook (see help); - save/open your functions to SD-card; - Physical constants table (see help); - Graphs maker; - Simple mode; - Linear systems; - Square and cubic equations; - The ability to calculate several functions with shared variables at the same time; - The ability to use memory cells in functions;"
7C39A403EEBEF1FD059497A26F5C0FEC48FE2A5BF4AA8E77D127081FEAF716C8,appinventor.ai_shahpurvansh710.professionalcalculator,TOOLS,A simple calculator which helps you to solve your basic mathematical calculations. Easy to use and also FREE!!
D32BED093BC56401D2D390C2C9502AEDBD182405344B0263A090F1E074B13C87,com.aliencalculator,PRODUCTIVITY,"<h1>💙 <b>THE BEST FREE CALCULATOR APP FOR ANDROID</b> 💙</h1>  👽  🔶 <b>What can you do in Free versión?</b> - Sums - Subtraction - Divisions - Multiplications - Negative number - Decimals - Use the memory buttons - Square roots - Raise numbers - Play two different games about mathematical intelligence and mental math game  🔶 <b>What can you do in Pro versión?</b> - Remove ads - Use all the features of the free version - Customize all the colors of the calculator. There are 99 different colors !!! - Customize the sounds of the calculator clicks. There are 99 different sounds !!!   ✅ Please, before making a negative comment, write to developer explaining in detail the problem, so the developer could put a solution."
2321889E2D32083139A19AD0301C82258AD49FE6832090BB3BCD532136488F00,net.satis.clipcalc,TOOLS,"It has the following functions. ■ Continuous calculation function ■ Memory calculation (has storage area of Ans, @A ~ @Z) ■ Floating point / Fraction / Mixed fraction calculation ■ Complex number calculation ■ 2 to 16 base calculation of signed type or unsigned type ■ Time calculation ■ Trigonometric function calculation / Inverse trigonometric function calculation ■ Hyperbola / Inverse hyperbolic function calculation ■ Logarithmic calculation / Exponential calculation ■ Program function (Up to 26 functions can be programmed) ■ Angle unit / Radix / Time conversion tool  Of course you can use it for simple calculations!  It corresponds also to the skin. You can set your favorite images on the Internet as the background."
455AD71C805E9B5793863EEC76143EF418D93EBA810B03ADF306FC800DB168D1,com.rwaltersapps.calculator2,TOOLS,"<b>Scientific Calculator</b> An advanced scientific calculator with a comprehensive set of mathematical functions including trigonometric, hyperbolic, logarithmic, exponential, factorial, combination and permutation. Over 125 mathematical and scientific constants are accessible in an easy-to-navigate list. Implicit multiplication and operator precedence are supported for faster input, while the unique memory mode also provides a facility for statistical functions.   <b>Financial Calculator</b> A calculator with a variety of functions for performing financial calculations, such as determining the monthly payments on a loan or the price of an item after tax has been applied. Individual rates can be set for markup, discount, tax and interest. Perfect for students and professionals who wish to verify the results of time value of money calculations.   <b>Programmer Calculator</b> A powerful tool for conversions between decimal, hexadecimal, octal and binary number bases, with a unique view for entering ASCII keys. Bitwise operations including AND, OR, XOR and NOT are available, in addition to functions not usually found in a programmer calculator, such as square and factorial.   <b>Basic Calculator</b> A simple, easy-to-use calculator for quick, everyday calculations.   <b>Currency Converter</b> A currency calculator providing accurate conversions between 150+ World currencies. The exchange rates are easily updated to real-time values from the Open Exchange Rates API, while favourite currency conversions can be saved for easy comparisons.   <b>Unit Converter</b> A comprehensive unit converter with over 200 units across 26 categories, including temperature, fuel consumption, viscosity, radiation and more."
E09FD9BCD34D193750EAB3AA13318C218F87B77922CE9661D6B4699F09758340,air.com.intemodino.calculatorwithparentheses,PRODUCTIVITY,"Basic calculator with parentheses is an easy to use and handy calculator for everyday tasks.   Features:  Calculator performs basic calculations: addition, subtraction, multiplication, and division.   Percentage calculations (%).  In addition to basic operations, the calculator supports expressions with nested parentheses.  History of recent calculations (25 entries).   Shares history via email.  Back and forward buttons to check and use recent calculations.  Backspace button.  Current expression is displayed above the result.  Portrait and landscape modes.  7 color themes to customize background and button colors."
6DB98FDE9FDA329E6EC5A58F2D46586A5504DE5BBD08E83980D2F7C47A47479B,com.Karen.calculator.simple,TOOLS,"A simple calculator designed to perform subtraction, addition, multiplication, division, and calculation of percentages. Quite small and beautiful. With Dark mod"
6652213624A2F96E2CC68E4E4D9DDD2C9EF9BB632E1EB87A7C801A410EE8DD0F,com.mynewcalculatorappforplaystore,TOOLS,A calculator with three themes.
51EEBAF74026B294CD683BC3377BB40F2C2AAF8A68DF06405BA45AD90E0C8D98,com.scientificcalculator.app,EDUCATION,"This free scientific calculator offers useful features allowing you to carry out advanced calculations.  Its simple and intuitive design makes it a pleasure to use. The calculator has all the functions that would be expected of a basic scientific calculator and a number of more advanced features too, including complex numbers and logic functions Features: • Math, Trig, Logarithmic, Statistics and more • Binary, octal and hexadecimal numeral systems • Logical operations • Configurable number format and precision • Fixed, scientific and engineering mode • Scientific notation sign inside the expression • Using of 300 scientific constants [CODATA] • Conversion among 600 units • High-quality themes and expression color sets  User Interfaces: • Advanced settings dialog box • Intuitive interface for keeping values • Intuitive interface for keeping expressions • Statistical calculator with stack entries • Scientific constants arranged by subjects • Result dialog box with expanded options • Bitwise shifts and rotations • Statistics calculations by stack entries • Trigonometric functions with complex support • DMS supports (Degrees, Minutes, Seconds) • Percentages calculations inside the expression • Using parameters inside the expression (PRO) • Quick navigation in expressions history • Angular mode: Degrees, radians and grads • Share menu and clipboard options • Advanced angular unit conversions dialog box • Extended user guide"
1E736BC50A64E837493678A641E8A411EA6183F8C27D607CD8EDE6D4A006D909,com.calculatorsin.foz,TOOLS,"This calculator math retains the natural display, which means that you can enter equations and expressions exactly as written. Fractions, radicals, expressions with p, and calculus function templates are all there. Exact answers can include fractions, square roots, and coefficients of p. i love to save you time and effort. I remember all your operations and leave you the choice to see them again when you want, which makes me the ideal tool to add receipts, keep your accounts or even calculate taxes. In addition, if you quit the application to do something else, your data is kept for next time. No need to type the same operation twice. we have a nice design for this calculator scientific its very easy for using and different calculator you can using like a statistics calculator. with the calculate include GST, calculate simple and advanced math functions in an ergonomic application.  Features  - Algebra calculator. - Supports most of the features of fx 500, fx500, JX570ms, 570vnplus, 991es plus, 991ms, fx570esplus, fx-82 or TI-30XB, fx 4500, 82ms, 82es, fx-82AU PLUS II, 100AU, fx 4500pa, 991ex, fx 260. - Display of memory keys. - Choose between a simple or complete keyboard. - Option pour activer / désactiver le mode vibrations. - Displays operator symbols when calculating. - Haptic feedback. - Result history. - Copy the clipboard calculation result by touching the display area.        ""we hope to download this scientific calculator it will not take much of your cell phone space."""
5120D2C45C42215B26108EC2B405C07B5AE6B759CAA97E873F634AC45E2C7BA4,com.moin.calculator,TOOLS,"A calculator is a device that performs arithmetic operations on numbers. The simplest calculators can do only addition, subtraction, multiplication, and division. More sophisticated calculators can handle exponent ial operations, roots, logarithm s, trigonometric functions, and hyperbolic functions."
0545C4D3C32AF460B48241B1341A72DCAEDF49C61253F5E2AE95117CE81C8F2B,com.ashish.bodcalc,TOOLS,"<b>BodCalc</b> is a simple calculator app that performs calculation based on <b>BODMAS</b> rule.  If you are unaware of BODMAS, it is an abbreviation for the order of precedence of operators in Arithmetic world. i.e. B = Brackets O = Of D = Division M = Multiplication A = Addition S = Subtraction  Along with these, you can deal with some more useful operators in BodCalc namely: P = To the Power ( ^ ) R = Remainder  But BodCalc has some more special functions which makes this app feel special in the category. M( ) : Modulus or Absolute value F( )  : Fractioner S( )  : Simplification.  The M( ) is used to get positive only result as its name describes.  F( ) is a special function when added to the expression, returns the result in fraction if or not the result was expected as a repeating or non-repeating decimal number.  S( ) is another special function of BodCalc which is used to find the ratio among comma separated numbers. There is no limit on the number of comma separated values. Along with this it also displays the HCF, LCM and common factors among the numbers.  ---------------------- That's it !! Download and enjoy calculating. Do provide rating to BodCalc if you liked it. If you have any question, suggestion, feedback or found a bug in BodCalc, don't hesitate to write on my e-mail address or in the review section. Proper and our level best assistance will be provided. ***Thanks***"
99298FCFDFA8EBBF971AF4D2CEEFB68C98DCD88E955872DB6BD55854CF7C79A3,com.calculator.shelina,TOOLS,"• Perform basic calculations such as addition, subtraction, multiplication, and division • Do scientific operations such as trigonometric, logarithmic, and exponential functions"
829206D6ED17B7C086D8D47CA466647F87FE5BB2F4ABE87E13D451795A7295CA,com.ivymobi.calculator,TOOLS,"<b>IVY Calculator is a simple and easy-to-use calculator app, </b>with all the scientific capability you need for work and school or daily life just a swipe up. It’s easy to use with large buttons, simple and stylish interface, and provides a powerful functionality and a great user experience for daily calculations. A must have tool for every Android device! With this powerful Calculator, you can calculate taxes or discounts when going shopping or do homework study for school, add up receipts, some calculation at your workplace and calculate a tip at restaurant.  <b>Highlights of Calculator: </b> -Simple and intuitive interface -Basic operation like addition, subtraction, multiplication and division -Easy to use with large buttons to minimize errors -Percentage calculation available -Displays calculated expression -Display calculation history -Option to turn on/off vibration touch -World Time Converter: Transform the time of 400 or more cities around the world -Health Calculator: Measure the body mass index (BMI)  -Unit Calculator Easy conversion between various units -Date Calculator: Calculate the specific date or anniversary to be remembered   <b>More features will come soon, please stay tuned. Including: </b> -Displays your calculations with thousand separators to make it easy to read -Do scientific operation such as trigonometric, logarithmic, and exponential functions -Option to turn on/off memory buttons -Currency Converter: automatically calculates using real time exchange rate -World Time Converter: Daylight saving time will also be reflected -Health Calculator: Measure the basal metabolic rate (BMR)  Google+: https://plus.google.com/u/0/communities/113134139742239607331  Join our Google+ Community, to be a volunteer tester, enjoy the latest version of Calculator in advance, and help us improve Calculator to provide much better user experience. If you have better localization translation for Calculator and its description, or any questions and suggestions, please feel free to contact us via: support@ivymobile.com."
8BDBBD5A913D1B2BC82F778E3EB28596D32E54AB3DA329A00B20C23118431424,com.fothong.calculadora,TOOLS,"Simple calculator.  Made with practicality in mind, Calculator is a simple and easy calculator app, ideal for your daily use.   It's easy to use, with large buttons, a clean and elegant design, and it offers the basic functionality most people need for everyday calculations. For example, Calculator is perfect in situations like adding up income, calculating taxes or discounts while shopping, doing homework for school, some calculations at your place of work, or even when you calculate a tip at restaurants.   *This is a free version of Calculator, which does not contain ads at the bottom of the screen.   [Resources]  - Beautiful, simple and elegant design  - Easy to use, with large buttons to minimize errors.  - Option to choose between vibrate/sound.  - Option to enable/disable vibration on contact.  - Option to enable / disable sounds by pressing.  - Backspace button to delete the last digit to correct a simple error.  - Backspace button can also clear everything by pressing and holding it.  - Displays operator symbols on buttons.  - Displays your calculations with thousands separators to make it easy to read.  Please read our privacy policy to avoid confusion or misunderstandings in the future.  If you find a bug or have any suggestions for improvement, please feel free to contact me at: support@fothong.com   Thanks!"
BEEFD77C9AF9ECDFB8CFBEE73E5A97892C2E8C6552D7FF805D12927EAA65C150,scientific.math.calculator,PRODUCTIVITY,"<b>Calculator Pro</b>, a professional calculator, <b>EASY and FAST</b> to solve math problems in no time! Doing Math Problem not only about <b>scientific</b> and normal calculator, but  it also can solve Equations. <b>BMI Calculator</b> is also another important part, which can help you remember your BMI DATA and help you. With Calculator PRO - Free Scientific Equation Solver, Basic Calculator and Scientific Calculator is all do good for solving Math Problem, Equation Calcualtor can handle multi lines of Math Problem, which is a good Math Problem helper. It's the best FREE Calculator APP for Android, basic calculator, scientific calculator, equation calculator for solving math problems. All students, even those who not very good at calculating, can rely on this math solver, tap to calculator the math problems, solve equation step by step, be aware of scientific calculator and basic calculator, and take full of control of your math homework of this app.   <b>Fast and simple calculator,  full - functional  </b> Fast calculating feature in this tiny app, we Calculator Pro makes you feel better and easy to use in our calculator. It can calculate your math problem and also BMI, which will care about your health and body.  <b> Equation solver, a smart calculator, simple and clear </b> Solve equation or equation set contains of 2 or 3, solve equations contain x/y/z. Input your equations problems of math, calculus problems will be just as easy.   <b> Scientific calculator, powerful calculating </b> By using Calculator PRO, you can solve trigonometric and calculus problems, also complex math equations. Calculating has been so easy since than. Feel inputs then accurate answers will show.   <b> Base calculator, simple to use and easy to get answers. Good helper in daily life. </b> A clean and clear interface to solve math problem, meets everybody's daily life!  A math calculator, including powerful scientific calculate and easy - to - use base calculate, and accurate equation solve. One calculator to solve all math problems.  If you have any question please feel free to contact : agnesisdev@outlook.com  https://sites.google.com/view/calculatorpropp/home ~"
797B27FA1E45A04D0E2C017D62CC2611A3E05446C845DDBD836C443F763CF41C,com.structsoftlab.appcalculator,EDUCATION,"Scientific on-screen calculator for the students, engineers and scientists. More useful calculator with engineering functions.  Version 2.0 : delete and copy functions are added. Make use of e and E. Version 2.1 : Add several functions and function keyboard. Variable assignment is now possible and comparative as well as logical operators are implemented. Math engine becomes developed to line interpreter."
368656A2EB6D7267C6DE4D0C9C4063B2B9E7C5530D9D559DA76931342F3F5B1A,sparking.calculator.lions.llc,TOOLS,"Use smart calculator for business problem, maths calculation problem solve and any other calculation problem solve easy. Real Calculator 2019 gives you all the functionality like addition, multiplication, subtraction, division, percentage with MU , M+, M-, Correct , Check and many more here you get and calculation became more easy.  Smart Classic Calculator application has been designed and engineered for easy operation at any level. The natural display and enhanced features makes it versatile and the perfect choice for high school and college students alike.  Features :-  - Simple and Smart Calculator interface - Easy Calculation - All operators gives perfect calculation - Easy to use - Free For All - Percentages - Memories - Use Anywhere and Any place   Real Calculator 2019 application has been designed and engineered for easy operation at any level. Solve all your math equation with perfect solution for any query."
DBECF9075E9CE8C947D90B8918D5B8BB4BACE05AABE9BCEE7878E3BC0C28D172,com.fwervwe.simplecalculator,TOOLS,"Calculator is the essential tool for your smartphone, simple and easy to use with a sleek design - the perfect calculator for Android.  Characteristics : - A clear display format and easy to read. - An intuitive and attractive design that facilitates calculations every day. - You can use the backspace key to correct a simple mistake. - You can change theme easily."
606BDAA9A51E3A3521CFF38F29CBABBFE46DE08AC1233072296AF74E762C3A08,com.simple_calcy.simple_calcy,TOOLS,Simple Calcy is a calculator app that performs simple operations for daily calculations with few additional functions. It is equipped with a backspace button and history button to help you keep track of your previous calculations. The application is free and does not contain ads.  Here are the differents functions found: -Addition -Subtraction -Division -Multiplication -Square root -Square -Percentage -History
97E977C5EFAA4355A0C06E3450CDF2C2ECFD1D4A6B2DDA7DEA8CECBD0878A6E3,yumekan.android.stickycalc,PRODUCTIVITY,"~FusionCalc for Android~ Try the new calculator at smartphone era.  - Calculation results movable. - Put it freely like Magnet. - Drag result to clipboard, send and share. - Drag to trash if the results do not use. - One button click to get all Magnets sums. - Basic function calculator for use in daily life. - Skin of theme  Let's try ease-of-use Calculator now."
387FD8F2326AEF712A45C13EFADC9F87C4BD54C36C2309944ADCE4E13F0B8918,com.wyesoft.luacalcfree,TOOLS,"WyeSoft Lua Calc (Free) is a free scientific calculator, powered by the Lua scripting language. Knowledge of Lua scripting is not required to use Lua Calc as a scientific calculator, but it will allow you to use the software for more complex tasks, as you can make use of Lua functions in your calculations.  The scientific keypad is made up of 36 keys, and there is also a basic keypad which allows you to use Lua Calc as a simple calculator with larger buttons. Variables can be stored and recalled.  As well as a powerful calculator, Lua Calc can be a great aid to programmers, and can even help with learning Lua or programming in general.  WyeSoft Lua Calc (Free) is technically ad-supported but we've made sure these advertisements are as small and non-intrusive as possible."
