sha256,pkgName,categoryID,description
80D3FE4FD1EDDA6BADF298E72991D5BDAA35BF63E07ACD20E116028F7111CDA1,com.swashapps.supercalcfree,PRODUCTIVITY,"The most popular Calculator application is now available on Android devices and Android TVs!  Calculator Plus is the smart calculator. You can enter very long expression and calculate in one go!  This application is designed to help you in performing simple as well as scientific mathematical calculations in an easy way. The application consists of a 'Standard Calculator' with scrollable advance / scientific operations. It allows you to pick standard scientific constant values and use them in the calculations. You can copy the expression as well as answer from this calculator and paste anywhere outside the application. It has all - standard arithmetic operations, trigonometry, logarithms, exponential, percent calculation, braces, memory storage and much more.  Calculator plus is a smart calculator application for your smart device. It keeps on observing the expression you enter and does not allow entering invalid expression. Therefore, it prevents the user from making unwanted mistakes. It keeps track of all your calculations and so you can retrieve and reference them any time in future.  The application is supported on almost all Android devices (Phones, Tablets, TVs) and works in portrait as well as landscape mode.  Main Features: • Complete Expression solver • Standard calculator mode • Scientific operations • Trigonometry, Logarithms, Exponential operations • Percent calculation, braces, memory storage and much more • Predefined scientific constants picker • Copy entered expression and answer to clipboard • Persistent and reusable calculation history • Supports portrait as well as landscape mode • Works for Phones, Tablets, Android TVs"
C16507B84DB1759B8806042CE716339FC66A0150F9975B1641CA0F69595B2639,com.burton999.notecal,TOOLS,"CalcNote is a new generation of calculator designed for the smart phone. Just type a expression, the answer will be displayed instantly. No need to tap equals. It works like notepad or your word processor, you can see multiple questions and answers all at once. It's like a spreadsheet but much easier and simpler. If you make a mistake, you don't need to start again, you just fix the wrong expression.  <strong>Instant calculator & realtime results</strong> CalcNote will instantly evaluate any mathematical expression and display result in real-time. With a Notepad-style interface you write operations on each line and see results instantly. You can combine text-lines with calculations.  <strong>Multi-line calculations & references</strong> Every line in CalcNote is evaluated so you can write different operations on each. It even allows referencing lines as in Spreadsheet so you can do multi-line combined calculations (i.e. $2+$3 adds up the results from line 2 and 3).  <strong>Different keypads with operations</strong> Swipe right-left to switch between different keypads with multiple operations you can perform. Regular mathematical operations, logarithmic, trigonometric functions (i.e. sin, cos), permutations/combinations as well as a percentage calculator and unit converter.  <strong>Save & Export</strong> In CalcNote you can organize your calculation sheets, save them individually and even export expressions if you want to use them elsewhere (i.e. in Spreadsheet, in a scientific paper, etc.).  <strong>Customize appearance</strong> You can customize CalcNote by changing its background/text color, showing/hiding line numbers, fonts, display format, customize the keypad layout and much more.  <strong>List of other features</strong> - Supports mix text and numbers in your calculations - Supports a line reference - Supports declaring a variable inline - Percentage calculations - Modulo operation - Supports hexadecimal, octal and binary operations - Calculate Power, Factorial, Permutations Combinations, Square root and Cube root - Trigonometric functions - Aggregate functions - Logarithm, Natural logarithm, Natural exponential function - Unit conversion (Area, Length, Weight, Speed, Temperature, Time, Volume) - Currency conversion (Supports 156 currencies and 5 cryptocurrencies)  <strong>Please refer to online manual for more details</strong> https://github.com/burton999dev/CalcNoteHelp/blob/master/documents/en/index.md  This is a free version of CalcNote, which displays ad at the top of the screen. If you'd like to remove ads, you can upgrade to Pro. https://play.google.com/store/apps/details?id=com.burton999.notecal.pro  <strong>Disclaimer</strong> burton999 makes no warranty as to the accuracy or reliability or suitability of any calculation results or information provided through the CalcNote. burton999 is not also responsible for any damages, direct or indirect, which may occur by the calculation results or information provided through the CalcNote.  CalcNote aims to offer Soulver on Android. Special thanks go to Zac Cohan, the creator of Soulver.  If you have any concerns, feedback, or questions email me at burton9999dev@gmail.com I hope this app will be helpful for you. Many thanks."
F9D6B87CD5D2FD1A4D1965007662F53F9C882915C4433918A5EDB0E1348270DA,com.sawicki.piotr.calculator.simple.simplecalculator,PRODUCTIVITY,"This is a perfect tool for daily calculations. Thanks to a big, contrastive display and large colourful buttons one can use it even on devices with a small screen. Because of tiny application size, it launches really fast and it can run smoothly on low-end smartphones. Last but not least, it is completely free and without ads.  Available functions: - addition - subtraction - multiplication - division - percentage - square root - memory - constant mode"
4C370892290001BE9A13EAFB424991DF0AE49359ACE633A008BFA3754D705CFE,net.camijun.CamiCalc,TOOLS,"Cami Calculator performs the same function as the Casio Calculator.  Cami Calculator is easy to use, because size of button is designed larger. Support the buttons on a variety of themes, so depending on personal taste or mood, try changing the theme of a button.  Please use it habitually."
03763BEE2692F18D15D2010DFB70C834765D2D7D32A96010AA2780F88F4F0CF0,com.jee.calc,TOOLS,"Multi Calculator is the best application of mathematical and financial calculation that contains several useful calculators and converters.  Try these powerful computing capabilities and intuitive and elegant application designed.  We support Wear OS. (Only supports Standard Calculator and Currency Converter)   List of calculators are included:   <b>✓ Standard Calculator</b> • Keeps the function of a pocket calculator and adds parentheses and some math operators. • Remembers the last calculation condition and checks the calculation history records any time you want. • Use the calculator on your home screen   <b>✓ Currency Converter</b> • Provides real-time currency exchange rates • Once the currency exchange rates are updated, you can use the currency converter in the offline.   <b>✓ Interest Calculator</b> • Provides various options for calculating interest: Installment savings, Regular savings, Simple Interest, Compound Interest, etc. • Enhanced compound interest calculations. Monthly, Quarterly, Half-Yearly and Yearly are available. • If you wonder how to gather 100 million dollar in 5 years, try the future value function.   <b>✓ Anniversary Calculator</b> • Keep track of your anniversaries - with a photo! • View as D-Day or Day count • Add photo widgets on your home screen   <b>✓ Discount Calculator</b> • Calculate Discount price / Discount % • Calculate with Additional discount   <b>✓ Loan Calculator</b> • Supports Level payment / Fixed principal payment / Balloon payment • Set interest only period • Calculate any type of loan such as Mortgage, Auto loan.   <b>✓ Unit Converter</b> • Supports Length, Area, Weight, Volume, Temperature, Time, Speed, Pressure, Force, Work, Angle, Data and Fuel   <b>✓ Health Calculator</b> • Use Health Calculator for your healthy body • Calculate BMI(Body Mass Index), BFP(Body Fat Percentage) and Ideal Weight in one screen • Easy to switch between metric and imperial systems   <b>✓ Tip Calculator</b> • Calculate tip and split the bill • Separate your bill from Sales Tax and calculate tip   <b>✓ VAT Calculator</b> • Calculate VAT easy and fast   <b>✓ Fuel economy Calculator</b> • You can calculate Fuel economy, Distance, Expected fuel amount & cost   <b>✓ Shopping Calculator</b> • Make a shopping list and calculate them right away while you are shopping.   <b>✓ Size Converter</b> • Helps you to convert clothing / shoe / pants / shirt / bra / hat / ring sizes for most countries • Don't forget your size with memos   <b>✓ Time Calculator</b> • Helps you to calculate time in Year / Week / Day / Hour / Minute / Second. (2 hours 5 minutes + 79 minutes = ?)  <b>✓ Unit Price Calculator</b> • Helps to get the unit price from the price and the quantity • Also you can compare unit prices  <b>✓ Number Converter</b> • Provides conversion between binary, octal, decimal and hexadecimal  Purchasing the premium version, you get an ad-free and support us to make better apps.   • If you encounter any problem with this App or incorrect wording, please contact us via:   - https://www.facebook.com/MultiCalculator   - jeedoridori@gmail.com"
640A2CCD309E34DB0C3992ABF28B4A05F9FE91152F51CC81FA85693E7E60284D,com.snappyappz.c_calc,PRODUCTIVITY,"Construction Calc is a free calculator application designed by, and for, construction workers, carpenters, engineers or anyone else who works with measurements in feet and inches or in metric.  C-Calc is a full function calculator that works as a standard calculator but more importantly allows you to work in feet, inches, and fractional inches and meters, centimeters, and millimeters.  Features include;  - add, subtract, multiply, divide, power, root, and more with measurements in feet, inches, and fractional inches  - use the scaling feature to quickly and easily scale drawings  - reuse any entered or calculated value from the history list  - automatically round results to a user defined precision (ie. sixteenths)  - reduce fractions and fractional inches to their lowest common denominator  - 50 memory locations featuring add, subtract, set, recall, and clear  - split screen shows decimal value, feet/inch value, memory, and scaling all at once in large easy to read fonts  - calculate areas and volumes easily  - full instructions and video tutorial available at www.snappyappz.com"
9811A24A396379DD362702D83E6E8354128279E7191C6896D62E9EE4D9CFF53C,jp.ne.kutu.Panecal,PRODUCTIVITY,"　Panecal is a scientific calculator app that allows you to display and modify formulas. It allows you to enter formulas while checking them, which prevents you from typing incorrectly or making calculation errors. It is also possible to reuse past formulas and use variable memory to change only certain values to calculate them. 　The display shows the cursor, and you can tap or press the arrow keys to quickly navigate to where you want to edit. It has a powerful, flexible and intuitive user interface with support for swiping to scroll through formulas and long-tap to copy and paste.  Features - Easy editing formulas by using a cursor operation - Copy and paste text - Formulas history and answers history table - N-base number calculation and conversion (Max.32bits) - Memory and variable(A-F) memory - Arithmetic operations, trigonometric functions, logarithmic functions, degrees-minutes-seconds and percent calculations - Angle units (DEG,RAD,GRAD) - Decimal point character and grouping separator settings - Portrait and Horizontal screen settings - Vibration settings  Disclaimer Please note in advance that Appsys is not responsible for any damage or lost profits caused by the use of this software, or any claims from third parties."
98EBC93DDABC7EDD9BDD0207A82D24A60A95171DCB9203F4A8D5B738A61325AF,org.solovyev.android.calculator,TOOLS,"Are you looking for an efficient and easy-to-use calculator? Do you want to solve both simple and complex problems? Try Calculator++, a multipurpose calculator app with slick and intuitive user interface!  ★ Save your time!  • Access additional features from the main screen of the app using gestures. For example, to use «%» slide button «/» up  • You don't need to press «=» anymore - result is calculated automatically  • Copy/paste with a single button press  • App supports both portrait and landscape screen orientations  ★ Personalize!  • C++ has two layouts: standard and engineer. Choose one which suits you best either from the initial wizard or from the application settings  • Set theme you like  • Add home screen widget  ★ Do calculations without switching between the apps! Calculator++ can work in a separate window floating over other applications on your phone  ★ Calculate percentages, square roots, powers, trigonometric functions! Calculator has a big variety of built-in functions and supports adding new user-defined functions  ★ Plot 2D and 3D graphs! Several functions can be plotted simultaneously  ★ Use powerful mathematical capabilities of the app:  • Do calculations with variables and constants  • Use built-in functions or add your own  • Integrate and differentiate  • Do calculations with fractions and simplify expressions  • Do calculations with complex numbers  The app supports devices with Android version 2.2 and higher and is open source. The app contains adverts which are shown on the secondary screens. To remove them please purchase a special option from the application settings.  Calculator++ on Facebook: http://facebook.com/calculatorpp Calculator++ on Vkontakte: http://vk.com/calculatorpp"
28667C4B6F13816C2F0E24187397D7A7525ED80807743D9F1716E5AC8FBB09B6,mobi.appplus.calculator.plus,TOOLS,"Your calculator has any features such as: touching to edit number and operator, reusing previous calculation result for the next calculation, sharing and storing result with note app? <b>—> Calc can do all of them.</b>  <b>Calc is the special calculation app</b>. It is the smartest and the most powerful until now. Besides, the interface was designed user-friendly with flat style, and more beautiful themes.   <b>Specific features compared with other apps:</b>  ★ Calculate numbers with operators and display each calculation on one line, you can take a look at all of your calculations.  ★ Reuse the previous result for continuing to calculate.  ★ Allow editing numbers and operators when you input incorrect them at any position.  ★ Update calculation ’s result automatically in concern with edited numbers or operators, reduce effort for calculating.   ★ Share the calculation ’s history for your friend easily, or store it with some note ’s apps.  ★ Store calculation ’s history for continuing to calculate later.  ★ More themes are suitable for your interests. (Material design, Android L Theme...)"
CFA34B5CF69CBCB08867B9476E17310827696FF5DEB0DBACC81C690E20B065D1,com.everydaycalculation.allinone,PRODUCTIVITY,"<b>All-in-one Calculator</b> is the most comprehensive calculator app for Android with many useful additional features.  MAIN CALCULATOR  • Perform basic calculations such as addition, subtraction, multiplication, and division • Advanced mode supports scientific operations such as trigonometric, logarithmic, and exponential functions • Percentage key to quickly add percentage to a number or subtract percentage from a number  ADDITIONAL CALCULATORS  <b>Unit conversion</b> • Supports all common units used for measuring length, mass, temperature, area and volume  <b>Construction</b> • Right triangle calculator to help with 3-4-5 rule • Area and volume of geometric shapes • Land area calculator using compass  <b>Finance</b> • Finance module has calculators for savings and loan repayment • Interest calculation using simple and compound interest • Currency converter (not realtime, currency rates updated 4 times a day)  <b>Everyday Math</b> • Add/ subtract fractional numbers • Calculators for finding discount price, tip amount and price per unit when out shopping or dining • Calculate profit margin and tax-included/ tax-excluded price of goods and services  <b>Date/ Time</b> • Calculate past and future dates by adding/ subtracting days, weeks, or months • Days between two dates  <b>Health</b> • Age calculator • BMI calculator"
E6664B8B345FDCBFCE44EF32544C797CD9E18A09AC047275AE5FAA9F9A4C52E2,calc991.calculator.scientific.xs30.t34.free,EDUCATION,"This app contains a series of calc: - Pro scientific calculator 30 plus: the calcu 30 can perform all the basic fraction calculations like fractions. The x30 offers the same capabilities, include factorial, random integer and mixed fraction. - Free scientific calculator 34 emulator: Factor integer into prime in Math menu,  derivatives and integrals  These calculators are also contains same set of features of es, ex calc series: - Advanced calculator 991 es plus: quadratic equation solver, cubic equation solver and newton solver. - Scientific calculator 115 es plus: complex number is supported."
BB8C766791612C7FA76EE8A35D648143AF0B42AFFDED8EBF41431A69DA2E7374,thanhletranngoc.calculator.pro,PRODUCTIVITY,"Dear you,   This Extensive Calculator app allows you to easily handle all the calculations necessary for everyday life with a single application. A Calculator app with a simple interface and practical functions! It can replace your default calculator.   This calculator app don't require ANY PERMISSION on your phone. And it is light and fast.  With Extensive Calculator Pro on your Android, you do not need to bring your calculator anymore. This calculator app serves you everything from A - Z.  List of calculators currently supported: 1. Standard Calculator • Quick and easy. • Basic features such as: %, +, -, x, /, 0 - 9, ( and ). • Memory function such as: M+, M-, MR, MC.  2. Scientific Calculator • All features such as: sin, cos, tan, %, !, 0-9, (, ), RAD and DEG, log, ln, Mod, +, -, x, /, SQRT, SQR, signed,... • You can use EXP is E (sam as 10 ^ ) to calculate large decimal number. If you need to get previous result of calculator, you can use ANS button.  3. Radix Calculator • Covert from one thing to the other things is very simple. • Base 2, 8 ,10, 16  4. Time Calculator • Three primary function is hour (h), minute (m), second (s), millisecond (s) with basic features such as: %, +, -, x, /, 0 - 9, ( and ). • History available. And you can reuse by pressing calculation history (this feature is available in standard, scientific and time calculator).  5. Loan Calculator • Suitable for car, bank loan • Three primary input are loan amount, interest rate, loan term.  6. Date Calculator • Calculate difference between of two date. • Add and subtract days   7. Unit Converter Supports many Unit of measurement commonly used in everyday life such as:  • Weight converter: kg to st, lbs to grams, lbs to kilograms, ... • Length converter: size converter, meters to kilometers, ... • Speed converter: km/h, cm/s, m/s, m/s to km/h, ... • Temperature converter: c to f, f to c, c to kelvin, ... • Angle converter: degree to radian, convert radians to degrees, ... • Data converter: byte to bit, bit to byte, ... • Area converter: km2 to m2, 1 hectare to km2, cm2 to m2, ... • Time converter: minute to second, year to second, ... • Energy converter: joule, kwh, ... • Pressure converter: atmospheres, bars, kilopascals, pascals, ... • Volume converter: gallons to qts, teaspoon, cups, liters, cubic feet, ... • Fuel Converter: many units,...  8. Support function in this calculator • Format number type: 1,234.56 or 1.234,56. • Percentage method calculation:  	- 100 + 5% = 105 and 100 x 5% = 500. 	- 100 + 5% = 100.5 and 100 x 5% = 5. 	- 100 + 5% = 100.05 and 100 x 5% = 5. • Rounding number: from 0 to 10. • Operation priority:  	- 2 + 2 x 2 = 6 (OP). 	- 2 + 2 x 2 = 8 (WOP).  Thank you for using the Calculator app, if you have questions I am always ready to answer you. I think you will find this app useful and use it with pleasure.  The list will be increased!  See privacy policy: https://kineita.github.io/privacy_policy.html"
685AADF60E74C48C5B7A7FBF759424BB99E7C0AE14BE2026886C4F7830DD0ADE,org.whiteglow.quickeycalculator,TOOLS,"Easy calculator with a percentage keys and memory keys.  Features: * Percentage key (%). * Memory keys (M+,M-,Mr) * Tape for calculation history. * Answer key. * Calculator shows work. * RPN calculator. * Free calculator app for download."
AB07871C117D1A188FDD637AFE5E1291F978F31EB0134129FDF47642112FDFEA,com.spsm.calculatorapp,TOOLS,"Scientific calculator for both basic and advanced calculations with support of variables, constants, plots, matrices, calculus, geometry, statistics, anova, special functions, fourier transform, complex numbers, trigonometry, vectors, basic math functions, variable argument functions, spreadsheet data, graphical view, unit conversion and file save/open.  Save complete calculations to memory/storage and reuse them in future calculations instantly. Saved calculations/expressions are shown on the main screen as a list and can be reused with a click of button.  Powerful mathematical expression builder with support of most common functions with parameters.  Also supports commonly used special functions. In built support for complex numbers and calculations in both rectangular and polar form.  Matrices calculations supported with any number of rows and columns.  Support for numerical differentiation and numerical integration.  Ability to define variables and constants in VAR editor and provide separate range of input values to variables.  Plot 2D and 3D graphs of expressions.  Find roots of polynomials with support of finding complex roots of higher degree polynomials.  Ability to create/read data from spreadsheets and plot/perform calculations on file row/column data.  Multilanguage input of spreadsheet data supported for both numeric and categorical values.  The app is optimized to directly read large spreadsheet files in xlsx, csv, tsv or any text format to process huge raw data (Subject to device and OS capabilities/limits) as well as processed/summarized data.  Support for finding fast fourier transform/fourier series of math expressions using variables or from raw data from file.  Geometry calculator.  Descriptive statistics, standard deviation, variance, mean, median, mode, quartile, percentile, skewness, kurtosis, histogram, frequency polygon, ogive, covariance, correlation, ranked correlation, coefficient of determination, regression and scatter plots. Categorical variables statistics, contingency tables, t-test (Student's t-test), f test (F statistics/distribution), z test, anova one way, anova two way and chi square test from both raw data and input tables with p value.  Statistical process control, SPC/SQC : Control charts: Individual I-MR/X-MR charts, Range XBar-R charts, XBar-S Charts, Attribute P Charts, NP Charts, C Charts, U Charts, Special CUSUM and EWMA charts. UCL, LCL, Zones and Run tests with advanced configurations. Pareto Chart for Defects/Costs Root Cause Analysis. Capability Analysis and Performance: Cp, Cr, Cpl, Cpu, Cpk, Cpm, Cpmk Pp, Pr, Ppl, Ppu, Ppk, Ppm, Ppmk, Confidence Interval.  Multi line expression representation. Edit any part of expression easily. Create complex nested mathematical expressions easily. View your mathematical expressions, calculation results and plots in html reports and save them. Save you calculation results as html files. See calculation results as you type. File save/open support.  Unit Converter.  Vector Algebra - Add, Subtract, Dot Product, Cross Product, Triple Product, Projection and angle  Personal Finance Calculations - Loan, EMI, Fixed/Term Deposits and Recurring Deposits. (FD/RD/Loan/EMI)  Name your calculation and add remark to each calculation. Supports both light and dark theme. New features added with regular updates. and lots more ..."
FECB4A985C87EB80949947A775EEB48D444E79917554B6DE949C696C50EF064D,b4a.configulator_calculator,PRODUCTIVITY,"●16 keys [F0-F15] can be configured to provide extra functions.   This allows the user to define operations that are relevant to them, not what the designer has decided.  Some of these keys are programmed at installation but can be re-programmed. ●Most in-built features are intuitive.   ●User defined functions can [Again] be exported/imported. ● Operates in Portrait and Landscape modes. ●A downloadable help file is included.  This APP is totally free and AD FREE.  ORIGINALLY POSTED 1 Jan 2015"
59B22138606671F676DD85AE3DAF83F32AECC3EB897D30D3E96E2A2F6CAFFF51,com.acrongames.rpncalculator.free,PRODUCTIVITY,"Try the Acron RPN Calculator before you buy.  The lite version has the following limitations: - Answers are always displayed as floating point.  For instance, the full version knows that the sin(45) = sqrt(2)/2, but the free version only knows that it is 0.707106... - Functions that cannot use floating point numbers as input have been disabled.  This includes factor, gcd, lcm, factorial, and all of the binary/decimal/hexidecimal integer functions. - Macros, in-line editing, and statistics are not available in the free version.  Check out our tutorials at http://www.acrongames.com/rpncalculator.html"
