sha256,pkgName,categoryID,description
177CDD3B811802276990EB3A6A8071F024AA5FB85C494F154E7E22682D4D210B,com.apps.calculator.thecalculator,TOOLS,"The Calculator: fast, simple, convenient. 1. Basic features 2. Decimal number 3. Row separator 4. Delete backup key 5. Calculation history 6. Copy calculation 7. Easy operation 8. Fast Startup 9. Sound Keyboard 10. Keyboard lift Aim for simplicity and convenience. Our calculator I will solve the basic calculations allowed in your life. Fast startup, easy task saving time is also an advantage. Please experience and if you love this application, please share and rate it to support the developer. Thank you!"
C0EF4A047689706525831F676F8C4989998BB584246EF264FB753A936A47BFC6,com.simplemobiletools.calculator,TOOLS,"This stylish modern calculator offers great user experience that you will love seeing. You can copy the result or formula to clipboard by long pressing it. You can also use this calculator as a currency converter to calculate your daily income and other amount in different country's currency. With eye soothing dark theme, it is now easy for you to see buttons and numbers more easily and use this calculator for simple calculations or use it as a currency converter. You can also use this math calculator as a mortgage calculator.  The app is a simple helper for fast calculations with many basic functions including multiplying, dividing, root and powers. It also comes with dark theme so that you can use this new technology to make your calculator look more smooth and easy to use rather than using sharp colors provided in different calculators that can't help you concentrate on your complex calculations in this math calculator.  You can make it vibrate on button presses to make you confident during inserting your values. The exquisite colors used in this app are cool and look smooth to eyes so you can easily distinguish between all the buttons and calculate with ease. This calculator can be used to solve complex root problems or it can also be used as currency converter or graphing calculator.  There is an option in setting to prevent the phone from sleeping while using the app for comfortable usage.  The text color of the resizable widget can be customized, as well as the color and the alpha of the background. Press the result or formula in the widget to open the app.  You can access a history of the operations to quickly scan through recent calculations.  It comes with material design and dark theme by default, provides great user experience for easy usage. The lack of internet access gives you more privacy, security and stability than other apps.  Contains no ads or unnecessary permissions. It is fully opensource, provides customizable colors.  Features: - Easy to use calculator. - Operations history. - Comes with dark theme to allow smooth usage of calculator. - Works as a currency converter to help you calculate your incomes and other amounts. - Customizable text color to make it look more cool and according to your needs. - Buttons sized according to the average finger tapping on screen to make calculations more comfortable.  Check out the full suite of Simple Tools here: https://www.simplemobiletools.com  Facebook: https://www.facebook.com/simplemobiletools  Reddit: https://www.reddit.com/r/SimpleMobileTools  Telegram: https://t.me/SimpleMobileTools"
8172D4E84F2BC91006C82F7881919BB17C8EA7DD84465A7FBE2C9FF078A6AB44,free.scientific.calculator.t36.ti36.pro,EDUCATION,"Complete calculator 36 which provide from basic calculator 36 to advanced calculator 30 includes: math, equation solver, system of equation solvers, .... The display displays expression as same as it written in text book. The calculator 36 x pro supports more than 12 digits, unlimited number of digits. There are some scientific features:      The most power scientific calculator 36 pro supports matrix and vector calculation, math, number, sin cos tan      Advanced calculator 36 provides set of advanced features for engineering students such as equation solver, integral, integer, derivative, system equations solver, prime factor.      Engineering calculator 36 is a useful instruments for students. This calculator is designed same as calculator 30, calculator 36 pro x, calculator 84      Smart scientific calculator contains statistics, regression,  hypothesis.    The 991 es plus emulator: the set of math functions is same as calculator 991 ex, 300 es plus and even the calculator 115 es plus.  With this calculator, you do not need to buy a calc 36 or calc 30 because it is design for users used calc 30, 36"
25AD16BDC964A3EBB4F9265A423742C31147DE8FBA78A870B5F84102DAE24153,com.bng.calculator,PRODUCTIVITY,"[Key features] Perform four fundamental operations and engineering calculations.  To start the engineering calculator, tap the engineering calculator icon.  To check the calculation history, tap the calculation history icon.  You can use all the previously inputted formulas. Tap the formula you need from the calculation history.  [Additional features] To convert units, tap the unit calculator button. You can easily convert various types of Currency, Area, Length, Temperature, Volume, Mass, Data, Speed, Time, Date, BMI, Discount, Age, Numeral System, GST, Split bill, Frequency, Fuel, Angle, Pressure, Force, Power, Loan   To change theme mode, tap the night mode icon.  To specify the time of night mode, select time range from settings.  To change color, chose the color you want from settings  To delete a history, long press on it in the history page  To change language, select preferred language from settings.  To play a beep or vibrate when pressing a button, go to settings.  To change numerals, select preferred numerals from settings (All numerals are supported)  To change number format, select the preferred format from settings  To change decimal places after the comma, select the number of decimal places from settings  To enable / disable full screen, enable / disable it from settings.  To keep calculation record, enable/disable it from settings.  To keep the screen on, enable/disable it from settings. To hide an icon, go to settings.  ***** Last but not least, all of these features come in small size and it is completely free."
71560844D70A38BD8781301693419A3C1AA385F0A85F46FD4BA252F8C7C8A033,com.buta.caculator,EDUCATION,"HiEdu Scientific Calculator He-570:  app provides help with a variety of problems including arithmetic, algebra, trigonometry, calculus, statistics, complex, matrix, vector and other topics using an advanced AI powered math solver. Simply input a problem on app. HiEdu Scientific Calculator problem solver instantly recognizes the problem and helps you to solve it with 🔥FREE Step-By-Step Explanations🔥. Quickly look up related concepts. Get help with your homework problems and gain confidence in mastering 💯 the techniques 🔥It is absolutely FREE🔥   <b>KEY FEATURES</b> <b>Scientific calculator</b> • It is a scientific calculator app supports most of the features of real calculators: calculator for fractions, calculator algebra, calculator derivative, calculate integral, calculate differential,  calculator square root, calculator with exponents, calculator with log, calculator with remainder, calculator division,  calculator with variables,.. In addition, the calculator has factorial, absolute, combination, permutation... help you calculate easily • Natural Display makes it possible to input and display fractions and certain functions (log, x2, x3, x^), "", x−1, 10^, e^ , d/dx, Σ, Abs ...) just as they are written in your textbook • Get interactive Step-by-Step explanation & Graphing calculator • Save history, select a calculation in list history and edit it                  • Create favorite calculations that make calculations faster      <b>Standard calculator</b> • This is a perfect tool for daily calculations such as: independent memory (M+, M-),  figuring percentages with memory functions similar to a small handheld calculator • Income Tax Calculator :  income tax personal, income tax calculation, sales tax calculator, tax return calculator   <b>Complex number calculation</b> Complex is useful to find a complex number as a result of addition, real part of complex number, imaginary part of complex number, subtraction complex numbers calculator, multiplying complex numbers calculator and dividing complex numbers calculator  <b>Matrix calculator</b> It’s main task – calculate mathematical matrices Supported matrix operations: matrix inverse calculator, matrix determinant, matrix addition, matrix subtraction, matrix multiplication, matrix transposition  <b>Vector calculation</b> This calculator app has many functions: vector calculation, calculate cross product, calculate dot product, unit vector, find angle between two vectors  <b>Graphing calculator</b> • Easily graph functions such as: drawing graph, graphing calculators, find special points of functions  <b>Solve the equation</b> • Solve quadratic equations • Solve cubic equations • Solve inequalities • Solve the system of equations  <b>Converter</b> • Available unit conversions include: + Currency conversion + Temperature converter + Length converter  + Mass/Weight  + Speed converter  + Area conversion  + Cooking Volume + Pressure converter  + Power converter  + Energy  + Time converter  + Fuel Consumption converter  + Digital Storage conversion   <b>Mathematics formulas</b> • This app has 1000+ math formula and more to come. • Now no need to make paper notes to remember mathematics formulas just have this app put all the formulas on your favourite phones. • you'll find formulas very simply explained in app with necessary figures will help you to understand very easily  <b>Physics formulas</b> • The application is a physical handbook. Contains most physical formulas for students and undergraduate help users quickly refer to any Physics formulas for their study and work.  <b>Important Note</b> : Our app products are not related to physical calculators such as casio scientific calculator, hp scientific calculators, texas scientific calculators… The app was developed by the research of the company team."
B1CC84E93B1B1C70BCD2AC61556055CC0A102EB74E9BD0092DD9D23C9D761856,com.locus.scientificcalculator,PRODUCTIVITY,"A power calculator that helps solve math formulas with various functions such as permutation and combinations. The scientific calculator also comes with logarithm, exponential, and modulus operations.  With the power calculator, solve various arithmetic problems and math formulas for school or work. Stellar is a great app for any student studying mechanical engineering, physics, or mathematics.  The calculator app includes fractions, complex numbers, advanced statistics, and history and memory registers as well as trigonometry formula functions using Sin Tan Cos.   Scientific Calculator Feature Summary: - Logarithm and exponential functions - Permutation and combinations - Save your values in 9 custom memories - Copy & paste Clipboard support - Solve multiple calculations at the same time - View previous calculations history - Arithmetic & Trigonometric functions - Operations for basic mathematics such as addition, subtraction, division, multiplication, and modulus - Texas Calculator - Can be used as a School Calculator - Geometry Calculator - Engineering calculator  Great for anyone looking for a math Calculator to solve their daily arithmetic problems."
012B58929EF4B4FC5DD1E3ED21E9D7FB32E49D98E7AC1BB79E9B9E64832BF7C5,com.AppAuxin.ios_calculator,TOOLS,"iPhone Calculator is best calculator,but it not for Android. We want you can use it everytime,everywhere, so developed ICalculator .  It's one of the most full-featured calculator apps around - smart calculator, fast calculator, scientific calculator. Includes features such as swiping on the display to delete a number.  Calculator iOs is the best tool for your Android phone, simple and easy to use with a iOs, iPhone design - the perfect calculator for Android.  Characteristics : - A clear display format and easy to read by iPhone Calculator - Easy editing by using a cursor operation by Ios Calculator - You can use the backspace key to correct a simple mistake by Apple Calculator - You can change theme easily.  If you like app, please rate 5 stars for us and if find a bug or have suggestions for improvement, please contact us: AppAuxin@gmail.com"
95A4788B60398D814093E98F9326B61F281C3C90B143882CBC005F8D0917636E,com.NhaGames.Calculator,PRODUCTIVITY,"Scientific Calculator (NHA) is 100% free, ad-free, useful, powerful.  User manual: https://sites.google.com/view/nhagames/user-manual/scientific-calculator  Features: • No Ad. • Natural input method: Infix notation, cursor edit,... • Storable variables. • Solve Function (Newton's Method). • Differential, Integration calculations. • Fraction calculations. • Percentage calculations (e.g. calculate discount, premium,...) • Degree, minutes, seconds calculations (e.g. calculate time) • Complex Numbers Calculator. • Statistics Calculator: 	Standard Deviation. 	Regression Calculations: Linear, Logarithmic, Exponential, Power, Inverse, Quadratic. • Programmer Calculator (Base-n Calculations). • Equation Calculator: Degree, Unknowns. • Matrix Calculator. • Vector Calculator. • Number format: Normal, Fixed-point, Scientific (Exponential), Engineering Notation. • And many more features.   Subscribe to my YouTube channel to be informed when my future games are released: https://www.youtube.com/channel/UChbn4K1hl-oKUmLTUu22iLA"
45AE380FC01E3640E38568FACD8EA70C5143C00F4CA421B72165CA705A2EC9AD,scientific.graphing.calculator.t84.t36.t83,EDUCATION,"The full-feature scientific graphing calculator 84 plus provides many useful features for students: - Graphing calculator 83 plus supports graphing, draw graph of many functions such as parametric, polar and functions - Scientific graphing calculator 84 plus working as well as calculator t1 83 by supporting equation solver, newton root finding, fraction calculation. - Graphncalc calculator 89 plus include integral calculator, symbolic derivative - Statistics and regression: one variable statistics and two variables statistic, linear regression, quadratic, quartic, ...  This graphing calculator 84 plus emulates as an emulator 84 plus, students can use as an instruments tools for homework. The robust equation solver can solve all of equations such as 83 x ^ 4 - 84 x ^ 3 + 89 x = 83 Finally, grafischer taschenrechner 84 includes full function documentation and examples."
064765ADF44FB17D93D18F079ADBA999387E95757B85EFBC1AE15B19F0BA55EC,calculator.converter.conversioncalculator.calculatorapp,TOOLS,"Welcome to use this handy calculator, a simple and practical tool for your daily life with a clean interface!  The calculator can meet all your needs perfectly, like:  ✔️Basic & Scientific Calculations ✔️Currency & Common Units Converting ✔️Tips, Discounts & Tax Calculating  <b>Key Functions You Can Get:</b>  <b>1. Basic & Scientific calculator</b> • Support 4 basic math operations. • Support scientific calculations: Square + Root + Parentheses + Percentage + Trigonometric + Exponential + Logarithmic functions.  • Edit expressions freely with a movable cursor. • Keep the last expression after an accidental quit. • History available for copy-and-paste.  <b>2. Unit conversion</b> • Applicable for various types of unit conversion: length, weight, area, volume, time, and data size.  • Offline assistant for you to do the math in daily life.  <b>3. World currency conversion</b> • Include 150+ currencies to convert, like dollar, euro, pound, yuan, yen, etc. • Support converting 4 currencies altogether. • Get the real-time exchange rate of all currencies automatically.   <b>4. Tip calculations</b> • Get the total bill, tips and amount per person instantly by inputting the billing amount and tip rate. • Tax optional. • Split the bill easily by sharing results with your friends.  <b>5. Discount & tax calculations</b> • Know the discount price via entering the original price and discount percentage. • Find out how much you can save intuitively.  Additional functions: • Simple, intuitive and user-friendly design with large buttons and optional vibration. • Customizable precision and decimal place."
23F8FC0F3B61B280AAD509DD627E065F14C2F9400F06C24DD5F186E747AB7646,all.in.one.calculator,PRODUCTIVITY,"<b>The original All-In-One Calculator for Android</b> It's a FREE, complete and easy to use multi calculator & converter.  <b>What does it do?</b> Designed with simplicity in mind, it helps you solve everyday problems. From simple or complex calculations, to unit and currency conversions, percentages, proportions, areas, volumes, etc... it does it all. And it does it good!  <b>This is the PERFECT Calculator</b> Passionate development combined with constant feedback we receive from our users resulted in that we think is the best multi calculator on the store.  Featuring over 75 FREE Calculators and Unit Converters packed in with a Simple or Scientific Calculator, it's the only calculator you will need from now on on your device.  <b>Oh, and did we say it is completely FREE?</b> Yes, it is free. We think everyone should enjoy this.  If you are a student, teacher, engineer, handyman, contractor or just somebody who struggles with math & conversions, you really should give this one a try. • Use it for simple or complex calculations • Convert units or currencies in the same app • Enjoy easier homework or school assignments • Learn. See step by step solutions to your calculations  So, on with the features...  <b>MAIN CALCULATOR</b> • Simple or Scientific layout • Editable input & cursor • Copy & Paste support • Calculation history • Memory buttons • Function graphing • Dec, Hex & Binary • Floating calculator • Widget  <b>75 CALCULATORS & CONVERTERS</b> • Algebra, Geometry, Unit Converters, Finance, Health & Misc • Currency converter with 160 currencies (available offline) • Instant results delivered as you type • Step-by-step solution & formulas • Smart search for faster navigation • Create shortcuts on home screen  <b>Algebra</b> • Percentage calculator • Proportion calculator • Ratio calculator • Average calculator - arithmetic, geometric and harmonic means • Equation solver - linear, quadratic and equation system • Combinations and permutations • Decimal to fraction • Fraction simplifier • Prime number checker • Greatest common factor & Lowest common multiple calculator • Random number generator  <b>Geometry</b> • Shape calculators for square, rectangle, parallelogram, trapezoid, rhombus, triangle, pentagon, hexagon, circle, circle arc, ellipse • Body calculators for cube, rect. prism, square pyramid, sq. pyramid frustum, cylinder, cone, conical frustum, sphere, spherical cap, spherical frustum, ellipsoid  <b>Unit converters</b> • Acceleration converter • Angle converter • Length converter • Energy converter • Force converter • Torque converter • Area converter • Volume converter • Volumetric flow converter • Weight converter • Temperature converter • Pressure converter • Power converter • Speed converter • Mileage converter • Time converter • Digital storage converter • Data transfer speed converter • Numeric base converter • Roman numerals converter • Shoe size converter • Ring size converter • Cooking converter  <b>Finance</b> • Currency converter with 160 currencies available offline • Unit price calculator • Sales tax calculator • Tip calculator • Loan calculator • Simple / Compound interest calculator  <b>Health</b> • Body mass index - BMI • Daily calories burn • Body fat percentage  <b>Miscellaneous</b> • Age calculator • Date calculator • Time calculator • Mileage calculator • Ohm's law calculator - voltage, current, resistance and power  Developed in Transylvania 🇷🇴"
F27D3DEE8E3846E618B1681A4B6330CA0AE4CCFF4FC0E2313DBA2696828FA774,com.desmos.scientific,EDUCATION,"Move beyond arithmetic with the Desmos scientific calculator! In addition to the basic operations, take advantage of a variety of built-in functions for exploring trigonometry, statistics, combinatorics, and more. Or, define and evaluate your own functions -- all for free.  At Desmos, we imagine a world of universal math literacy where math is accessible and enjoyable for all students. To that end, we’ve built a simple yet powerful scientific calculator that runs on the same blazingly fast math engine as our next-generation graphing calculator, but with a more streamlined set of features, for those times when you just don’t need a graph. It’s intuitive, beautiful, and completely free.  Features:  Arithmetic: In addition to the basic operations, the scientific calculator also supports exponentiation, radicals, absolute value, logarithms, rounding, and percentages.  Trigonometry: Evaluate the fundamental trigonometric functions and their inverses, using either radians or degrees for angle measure.  Statistics: Compute the mean and standard deviation (sample or population) of a list of data.  Combinatorics: Count combinations and permutations and calculate factorials.  Other features: - Works offline, no internet connection required. - Create and evaluate your own functions using familiar function notation. - Assign values to variables for later use. - View multiple expressions at once. Unlike many scientific calculators, all of your previous work remains visible on the screen. - The “ans” key always holds the value of your last computation so that you never have to remember or copy a result. If you change an earlier expression, the “ans” value updates automatically. - Did we mention it’s free?  Learn more at www.desmos.com, and visit www.desmos.com/scientific to see the free, online version of our scientific calculator."
5E474D7F6ABFDB13A149B9E013214D8354B7EA3808EE22722F5A2EC6B02DC8AE,com.transsion.calculator,TOOLS,"1.Basic calculations: Do calculations such as addition, subtraction, multiplication and division. 2.Scientific calculation: Do scientific operations such as achieving trigonometric, logarithms. 3.Currency converter:  Support currency exchange rate conversion of major countries in the world,real-time exchange rate update Simultaneously convert currencies of three countries Automatically locate your position and use the currency of your area as preset currency. 4.History: You can enter it by pulling down the ""History"" icon in input area, and you can view  the previous calculation formulas and results in the history."
9B0DF25E1F8938B553B330E643D0F1B041698FDB67A13B89C7F8CD94D79FE52D,com.myscript.calculator,TOOLS,"Calculator 2 turns your device into an interactive piece of paper. Simply write a calculation and it gets you the result in real time. Develop it further with editing gestures or by adding new elements anywhere. Reuse previous results with drag and drop. Calculator 2 interprets everything you do on the fly.  Calculator 2 is based on MyScript Interactive Ink®, the next step for digital ink. It is the successor of the award-winning first handwriting calculator.   BENEFITS AND FEATURES  • Write calculations in an intuitive and natural way without a keyboard. • Erase easily by using scratch-out gestures to remove symbols and numbers. • Drag and drop numbers from and to the canvas, the memory bar or to an external app. • Copy your results to the clipboard or export them to other apps. • Fractions: Display results using decimals, fractions or mixed numbers. • Multi-line: Continue the same calculation on the next line or write several calculations on multiple lines. • Memory: Save results into memory. Reuse them anytime in your calculations. • History: Retrieve all your past calculations to reuse or export.  SUPPORTED OPERATORS  • Basic operations: +, -, ×, ÷, /, ·, : • Powers, roots, exponentials: 7², √, ∛, e³ • Miscellaneous operations: %, |5|, 3! • Brackets: ( ) • Trigonometry: sin, cos, tan, cot, cosh, sinh, tanh, coth • Inverse trigonometry: asin, acos, atan, acot, arcsin, arccos, arctan, arccot, acosh, asinh, atanh, acoth, arcosh, arsinh, artanh, arcoth • Logarithms: ln, log • Constants: π, e, phi  For help and support, create a ticket at https://myscri.pt/support."
