sha256,pkgName,categoryID,description
39F00E499473CCE40984206476CCE5D9EB02A65AB8A074C37BB4CBA134EDB2A2,com.splite.browser.private,COMMUNICATION,"TUC Browser is an awesome app to manage all social media apps in one app. No need to install all apps. Run all social in one lite app  Save your phone storage & data by installing this app. This app contains all social sites which you can access in one app no need install all respective apps. This app has all social media which you need. More sites to be added soon..  Browse websites fast & safely no need to compromise on your browsing history. TUC Browser is lite too having low app size so it saves your phone storage.  More features coming soon...  <b>Disclaimer: </b>Please note that the logos used in this app or in the app Avatar are the trademarks of their respective owners. They are used for identification purpose only. Please make sure to contact us when ever you have a question about trademark logos, we promise your logo will be removed in 1 day.  All graphics and media used are under CCO or public Domain. This is not an official app. We are not affiliated with any of the services accessed through this app. This app only directs the user to avail required service and we are not responsible for any financial or technical difficulties faced by the user due to network failure, device failure or any other complications. User of this app is solely responsible for sharing of his personal data with the social networking sites listed in this app. We are in no way have control over your data, all the information you access are through the official sites of listed social networks."
66680D7B93CF56DB0D54F834D7C37135BED7C8FC401A3A10DE281D2E5028F544,com.outcoder.browser,COMMUNICATION,"Surfy Browser is a <b>daringly different web browser.</b> Created by a mom and dad team.  Besides it's fluid interface, it's packed with features such as immersive full-screen browsing, passcode and fingerprint protection, ad blocking, tracking prevention, text-to-speech, menu and toolbar customization, instant theme colors, and much more.  ""It's unique approach is practical and original... Someone has finally realized that the features a user needs when browsing from a smartphone aren’t the same as on a desktop computer"" - uptodown.com  <b>App of the week on Gizmodo UK!</b> Gizmodo says: ""It's nice and simple really, you open up the browser's settings menu and set up a passcode just like you would with any mobile device.""  ✔ Private. Protect browsing and individual bookmarks with a passcode or fingerprint  ✔ Personal. Instantly change colors or set your favorite photo as a background ✔ Build your own toolbar and menus with Surfy's unique customization features  ✔ Listen to pages with text-to-speech ✔ Immersive full screen browsing ✔ Swipeable tabs  ✔ Incognito mode at start-up  ✔ Ad blocker ✔ Prevents websites from tracking you ✔ Pin pages and passcode lock them to the Launchpad ✔ Instant search results from the address bar ✔ Mobile optimization, which can reduce data usage down to as little as 20%  ✔ Save Passwords and Logins  ✔ Desktop mode ✔ Multiple search providers: Google, Bing, DuckDuckGo, Yahoo!, Baidu, Sogou, Yandex ✔ Searchable history ✔ Searchable bookmarks  ✔ Clear cookies and cache with history ✔ Set desktop or reading mode for individual tabs ✔ Share pages via Email SMS, Facebook, Twitter, LinkedIn, & NFC  ✔ Night dimmer  ✔ Save images & open links via context menu  ✔ Find on Page   And much much more...  Do not compromise your mobile browsing experience. Reduce data usage by as much as <b>80%</b>. Enjoy full screen reading, enable private browsing, passcode and fingerprint protect browsing sessions, save images, download files."
F990593D882B16CE1AA7901653EDFF076F1A77273F0DB679A356FA4BD3340054,com.outcoder.ibrowser,BUSINESS,"Today, more and more organizations are choosing the web for delivering information and for line of business applications. Rich user experiences can be delivered to devices without being coupled to any particular platform. Yet, the question arises, how do you safely and securely allow end-users to consume web content from an enterprise device?  Airlock Browser provides secure browsing and allows organizations to configure the browser to meet the unique needs of their business and end-users. Airlock Browser allows organizations to take advantage of mobile browsing without security risks, while offering deep integration features that connect the web with the device, such as barcode scanning support for web pages.  This app uses the Device Administrator permission."
77227DB90FEF020E1DE331897DDB9B786853469A7A9986EDA3D5BD293F605A8B,internet.browser63,COMMUNICATION,"Browser 4G is an extremely fast browser for any android phone running . 4G system provides mobile ultra-broadband internet access, using brand new technologies created specifically for fourth generation of mobile communication technology standards. That’s the reason why Browser 4G gives its users fast and exciting internet surfing in social networks, heavily loaded websites with photos, videos and etc.  Super fast browsing speed, Tab function, Your favorite websites available in one click, Constant and modern updates, Full privacy  Disclaimer: 1. All websites featured in the app have gone through a permission process, making sure content is reproduced post contact via email, telephone, affiliate management services, etc. If the owners of any of the websites are to notice any violation of terms & conditions, please bring to our notice immediately via email. 2. All content on the app is third-party content owned by the respective website. Each website follows independent terms of use and privacy policies. Please read their terms & conditions carefully before use. In case you have a concern, you could get in touch with us via email. Action will be taken within 90 minutes"
AD2A31EDE99DF04300D5DB920950CF5CCF57E17D73CCD7C01ADB539E9B0568EA,com.nsc.hunt_browser,COMMUNICATION,"Hunt Browser is an lightweight mobile browser which provides you a fast and secure surfing experience.  You can earn free cash & data or use your earnings just for browsing the internet! Use Hunt Browser no different than how you use any other browser app, but earn rewards at the same time!  Fast Browsing:- You can open any website from this browser very soon.  Save for Offline Browsing:- Make sure your Android Hunt Browser stays safe & private with extensive security settings, add-ons, and features like Do Not Track.  Secure:- Incognito browsing protects your privacy.  Earn Hunt Points:- You can earn hand coins by browsing here.   FEATURES  1. Offline mode to browse the downloaded web page  2. Notification bar quick search  3. Popular quick search engine: Google, Yahoo, and other default search engine  4. Secure Browsing  5. Web surfing speed acceleration  6. Fast download  7. Font Size Customized  8. Text search   Links to Other Sites This Service may contain links to other sites. If you click on a third-party link, you will be directed to that site. Note that these external sites are not operated by us. Therefore, we strongly advise you to review the Privacy Policy of these websites. We have no control over and assume no responsibility for the content, privacy policies, or practices of any third-party sites or services.  Download this browser and browse very fast.."
4F161A9AEAE28C30447CF16A9E02CCF2D46794FDB6590D62788F4A8ACDC1A0C8,com.darkbrowser,COMMUNICATION,"The Fastest, Secure and the best Incognito mobile web browser for android  This is a light weight mobile browser which brings you an amazing web experience  ® Fast Browsing : Optimized web browsing for fastest browsing experience. ® Secure : Incognito browsing protects your privacy. ® Bar code & QR code : Support scan Bar code and QR Code. ® Custom Download : Customize the download start time.  Key Features:  - Simple UI Design - Incognito Browser - Tabbed Internet Browsing - Voice Search - Custom Download Option (Timer Download) - Bar code Scanner & Qr Code Scanner - Homepage - History - Easy to add Bookmarks - Share option  Please download and have a try for more features.  It's designed to work on fast network with the latest security and privacy features to help you stay safe with the internet"
D6F35A860777D478C0BD469C84AD5C50AFD52D0D3C6533986BD6B6DFAAEEA6F7,com.hdbrowser,COMMUNICATION,HD Browser is an lightweight mobile browser which provides you a fast and secure surfing experience. Download HD Browser and try the best experience of android browser.  ★ Fast Browsing: Optimized for web browsing to make a great browsing experience! ★ Light-weight: HD Browser is a light weight Browser. ★ Secure: Incognito browsing protects your privacy.   FEATURES ✓ Simple and elegant UI Design. ✓ Bookmarks. ✓ History. ✓ Incognito Browsing. ✓ Easy Download. ✓ Night Mode. ✓ Full Screen Mode.
4FFBC1572EC9EAF37E59980C6DDF266D41495A5D7D12393D50679CC5B3DA5B12,com.imht.super.ultimate.proxy.browser,TOOLS,"This application is a web proxy browser that unblock sites online with its auto proxy ability.  Features of Proxy Browser  - No registration required, no settings required - No speed limitation, no bandwidth limitation - No root access needed - Encrypts your internet traffic - Unblocks all blocked websites - Hides your IP address from internet traffic through our anonymous proxy servers - Unblock website such as Facebook, Google, YouTube, Twitter, Wikipedia at work, school, while traveling ... - Browser web proxy supports play videos - No need to configure or setup proxy server - Unblock Sites, for incognito browsing, very fast and secure, totally free vpn proxy browser.  Super Ultimate Proxy Browser is a browser that allows you to access the open internet. In computer networks , a proxy server is a server a computer system or unblock websites games an application that acts as an intermediary for requests from clients seeking resources from other servers. A client connects proxy browser to the proxy server, requesting some service, such as a file, connection, web page,unblock facebook websites free, or other resource available from a different server and the proxy server evaluates the request as a way to simplify and control its complexity. Proxies were invented to add structure and unblock website proxy software encapsulation to distributed systems. Today, unblock websites app most proxies are web proxies, facilitating access to content on the World Wide Web and providing anonymity."
DF42AA7C81D6754E92E1F78A422E7085E63EF24A08AE97D31FF3B20260737F31,com.mini.web.browser,TOOLS,"<b>U Browser is one of the best free web browser for Android devices with private space,ad blocker,video download and private browsing, He is especially useful for Android phone users with lower specifications and less storage space.</b>  U Browser is a lightweight mobile browser which can give you a fast and secure surfing experience. With the Powerful Ad blocker function can clean most of annoying pop-ups, banner ads,video ads and give you a comfortable browsing experience.   U Browser has many other useful features, such as video download, private dpace, screenshot, QR Code, night mode.  U browser does not support YouTube website video download.  Main Features:  ★ <b>Powerful Ad Blocker</b>  ★ <b>Video Download</b> ★ <b>Private Space</b> ★ <b>Incognito Mode</b> ★ <b>Screenshot</b> ★ <b>Offline Web pages</b> ★ <b>Bookmarks & History</b> ★ <b>Find In Page</b> ★ <b>Night Mode</b>   ★ <b>Download Manager</b> ★ <b>QR Code</b>  ★ <b>Ad Blocker </b> Powerful ad blocking feature that automatically filters ad content during browsing. Help users save traffic, increase battery life, and increase page load speed. ★ <b>Video Download </b> Easy to download videos on many websites, support multiple formats  ★ <b>Private Space</b> Create a new privacy space, browse the website and download videos and separate from normal mode to keeps your privacy protected ★ <b>Incognito Mode </b> Browse the webpage in privacy mode without leaving any history, completely protecting your privacy ★ <b>Screenshot </b> Easily save screenshots of webpages and provide graffiti editing    ★ <b>offline web pages </b>  You can save any webpage you like, and you can reopen it even when you are offline.    ★ <b>No Image Mode </b>   Supports no picture at all and no picture under WIFI, saving your data traffic without WIFI ★ <b>Download Manager </b> With multi-thread download technology, download speed is faster       Help us improve our products: If you have any questions or suggestions, please contact me via email <b>umesbrowser@gmail.com</b> , We will try our best to solve any problems for you."
4182ED73BBC5BFEE07C725C50C54C41FBB577D15807E304F2CD2295BFFB502BF,com.kuto.browser,COMMUNICATION,"* Simple Browser KUTO Mini Browser is designed for minimalism and you will not find any advertisement  * Customized Browser You can easily customize KUTO Mini Browser, such as Menu Bar style, Theme  * Private Browser You can set a pattern to lock your browser records and hide your download files  * Fastest Browser KUTO Mini Browser is smooth for most android devices  Here are some features of KUTO Mini Browser: ※ Privacy space ※ Bookmarks ※ History ※ Theme ※ Web page save ※ QR scan ※ Ad block ※ Fast Download"
9C583C5D530D16FCF3FE6897B1A31D4DA2407D2DCAAA39BCFB7C8DC9C1BE3F33,com.jimeem.fast.lite.browser,COMMUNICATION,"Lite Browser is totally free with 20+ features  this is an lightweight and most fast mobile browser  this Lite Browser is 100% free for all android user and its too Fast to browsing..    secure browser - browser lite - fast browser  EATURES  ★ lightweight and most fast ★ Easy to understand to user ★ Smart Design for Smart User ★ Manage URL box Position  ★ Adblock - Block website ads easily ★ Bookmarks Import & Export ★ History saved ★ Take Screenshot in just one Click in menu ★ Multi-Tabs Manage ★ Change Tabs using just Swipe ★ Add Shortcut site to feature fast access ★ Easy find word from whole webpage ★ Easy Share website URL ★ Access webpage using Volume buttons ★ Cookies saved ★ JavaScript supported ★ Multi window supported ★ Set your favorite search engine ★ SSL and HTTP supported.  This Browser is same like Firefox, Opera, Lightweight ,Opera browser, UC Browser, Indian Browser"
D641A37FBA109C027BC9F79C7E362EE9723FF03D243E2CD974692DDBAF37DA88,secure.explorer.web.browser,SOCIAL,"Web Browser Lite is an ultra lightweight mobile browser and web explorer which can give you rapid browsing speed and secure surfing experience. Web Browser Lite can protect you from malicious threats and protect your privacy. One of the Most Trusted Browser for Privacy. It designed for both Android phone and tablet.  Key Features: - Ultra lightweight - Web surfing speed acceleration - Secure Browsing - Incognito browsing. Private browse the web without saving any web surfing history. - Homepage Speed Dial - Personalized bookmarks - History - Easy save your favorite sites - Text search - Fast download - Super easy copy/paste - Small Footprint - Full-screen mode - Search engine switch - Quick search: Internet, Yahoo, Bing, and other default search engines - Supports Adobe Flash Player  - User Agent settings - Font size adjustment - Advanced Gesture feature - Sharing - Super-easy and intuitive ways to share mobile contents through Facebook, Twitter, Email, SMS and other social media channels. - Fast navigation  Free download to try this fast, safe, lightweight and smart Android Mobile Browser;"
A38C06E0DFED65E7AE28CCCA461A6E2F5EEE20F316B93B22618B009722C09880,fast.private.secure.browser,SOCIAL,"Web Browser is a fast, secure, lightweight and smart internet explorer browser for Android, with fast loading speed and one of the Most Trusted Browser for Privacy.  Save and Private Browsing, tracking protection can block parts of Web pages that may track your browsing activity. Web Browser News has a built-in news feed that helps you find more content you’ll love.  Key Features: - Browsing speed acceleration - Browse privately: Use private tabs to go incognito anywhere on the internet without leaving a trace on your device. - Homepage shortcuts - Easy save your favorite sites - Bookmarks & History  - A range of news channels - Lightweight - Fast downloads - Super easy copy/paste - Night Mode - read more comfortably at night. - Text size settings - - Read comfortably on any screen - Data Saving - Quick search: Google, Yahoo, Bing, and other default search engines - Scan QR code - User Agent settings - Supports Adobe Flash Player  - Advanced Gesture feature - Sharing - Super-easy and intuitive ways to share mobile contents through Facebook, Twitter, Email, SMS and other social media channels. - Advanced Settings  Web Browser gives you the power to take back control of your Web browsing experience. ------------------------------ Disclaimer： All news sources and blogs are powered by NewsAPI.org"
59E5606815DE8CF940816385472DA1BAC8432C26FE7882CB5151BF91DA63ABAB,netexplore.internetweb.browser4g,TOOLS,Browser 4G is an extremely fast browser for your Android phone.  This app is perfect for 4G system mobile networks for ultra-broadband internet access.  4G also known as fourth generation in mobile communication technology standards allows exciting internet browsing and surfing social networks.  Browser 4G is able to load heavy websites with photos and videos quickly.  Features include: - Updated Beautiful Modern User Interface UI - Fast browsing speed - Browse multiple websites with tab function - Bookmarked favorite websites available in one click - Full privacy in private mode  Browser 4G is a internet web browser based on the Google Android webkit and is compatible with most modern Android versions for all users and countries.
A3E37BBAF32F6763663392FCB72C31849CF6BFA758C19DA8DD14D1C41ACB0FC6,com.robinapps.speedbrowser,PRODUCTIVITY,"Speed Browser for Android is the free web browser that puts the power of the open web in your hands. This is fast, easy to use and very light weight.  Search the web at blazing speeds Keep your favorite sites with bookmarks.  27fa9957bd  Extremely Small - Small size with powerful functions - Never runs process in background - Exit completely with one click - Less memory usage & lower power consumption - You can Request for desktop page. - You can change useragent - supports flash"
BF6758FDE77B5163670ABFA0BD099C9CEA912986285AD2356DE5C59BC0BB23B9,explore.web.browser,COMMUNICATION,"Web Browser for Android is the free web browser. The Web Browser is fast and easy to use, with the latest security and privacy features to help you stay safe on the internet.  Features: - Tabbed Internet Browsing - Incognito Mode: Private browse the web without saving any browser history. - Security: Keep your browsing safe & private.  - Fast: Get to the internet faster, with quick start-up and page load times  - Supports Adobe Flash Player  - Supports Homepage, Bookmarks, History, Small Footprint and Full-screen mode. - Super easy copy/paste - Quick search by popular search engines - User Agent settings - Advanced Gesture feature - Sharing: Super-easy and intuitive ways to share mobile contents through social media channels. - QR Code Scanner - Advanced Settings - Uses the Native JavaScript and WebKit Engine So file size is smaller"
8CDD503F6CDC14F5D6D1DFE3278FF5509A49DF83103BBF9D5ABE493FBA769FEC,com.orbitum.browser,COMMUNICATION,"Fast browser that blocks annoying ads!  Browse internet pages on your mobile phone using Orbitum for Android.  It looks great with a shiny new material design and loads web pages blazing fast!  Here’s why Orbitum is special:  - Optimized for Speed - fast page load times and reduced data usage; - A built-in adblocker will help you to get rid of annoying fraudulent ads and SMS scams - Secure - keeps your browsing safe and private; - Autosuggest – the browser understands the site you want to visit from the first letters of the URL you have entered; - Voice Search - we use Google voice search technology, which allows to browse the web without typing; - Quick Access - every new tab has a set of your favourite sites for quick access and you can easily edit them;  Please don’t hesitate to submit your feedback and help us make Orbitum the best browser for mobile. You can reach out using the contact form on our website: http://orbitum.com/feedback/  About Orbitum We’re a small team of web developers from St. Petersburg Check our website - http://orbitum.com Follow us on Twitter – https://twitter.com/orbitumbrowser"
062631DCE4AD0F41964B2DD8DBE442720AA0FC50B0DE9FDA9EF78617055AF34D,singh.narendra.webbrowser,COMMUNICATION,"Web Browser - Light & Fast is Lightest and Fastest web browser.  Web Browser - Light & Fast has lots of Features in a tiny package. It also contains 3 different clean and beautiful user interfaces with multiple tabs, Fullscreen mode & Incognito mode.  Web Browser - Light & Fast has lots of Security and Privacy Features including Incognito mode.  No extra Permissions required. Only mandatory permissions for web browser to work.  <b>Features:</b>  <b>Light & Fast:</b> Get faster browsing experience with very light browser. No lagging and memory problem due to very small size.  <b>Multiple User Interfaces:</b> Web Browser has 3 different user interfaces so you never get bored from same ui on your smartphone and Tablet. It is designed for both phone and tablet.  <b>Multiple Tabs:</b> Enjoy tabbed browsing experience like pc with quick switching between tabs.  <b>Incognito Mode:</b> Browse the web privately and securely using Incognito mode.  <b>FullScreen Mode:</b> FullScreen mode for better browsing experience.It also has fullscreen video player for better viewing experience.  <b>Bookmarks and History:</b> Quick access to your bookmarks and History. You can also export and import your bookmarks and history.  <b>Security & Privacy:</b> Incognito browsing & option to keep or delete history, cookies, cache and password.  <b>Personalized Search:</b> Search the web from your home screen using any search engine. You can set google search, yahoo search, duckduckgo, bing or any search engine as your default search engine.  <b>User Agent Setting:</b> You can change user agent to any phone or desktop as per your need.  <b>Screenshot:</b> Take screenshot of any in-app screen or webpage.  <b>Web2Pdf:</b> Convert any webpage into pdf.  <b>Web2Image:</b> Convert any webpage into image.  <b>No Image Mode:</b> Browse web faster with  No image mode and save more than 80% data.  <b>Individual Website Settings:</b> Now you can set different setting for different websites. Using this feature you can see which website has access to your location and stored data on your phone or tablet.  You can remove location access and data for individual websites as per your wish.  <b>Tabs Restoration:</b> Restore Tabs from previous session.  <b>Easy Share & Find on page:</b> Share any web page quickly and search the whole page in one click.  <b>Accessibility Setting:</b> Change font size and Text scaling.  Web Browser - Light & Fast is a super fast browser with lots of features in a tiny package."
0B11032814D6E20135F800FDE78E053B7694E604DD13DB8E393D2011B68F9257,com.powerpoint45.lucidbrowser,COMMUNICATION,"Lucid Browser is a free and open source web browser designed to be small, light, fast, and simple. The app itself is as small as about 4 MB, and the Donate version is only about 2 MB. The browser uses a custom homepage that loads locally for quick start-ups. Although it is small in size, it packs a punch with all the features you would normally see in a mobile browser. For example, you can import bookmarks from other browsers that use file formats of HTML or JSON. The browser also allows for complete management of bookmarks with folder categorization. By default, Lucid Browser uses  Ecosia, a project designed to help plant trees. Lucid Browser also comes with many settings and ways to personalize the look. It is easy to use, very handy, and allows you to surf the net with speed.  You can find the source code here: https://github.com/powerpoint45/Lucid-Browser  You can join the Lucid Browser Beta Group here: https://plus.google.com/communities/115941379151486219066"
