sha256,pkgName,categoryID,description
5D3A71AEFED4297268966A04A0FBF27BCB3F958C158F82C879FB08F22D582F56,com.talpa.hibrowser,COMMUNICATION,"<b>Hi Browser is your private browser and mobile desktop browser with custom news recommendation, free video downloader, ad blocker, and quick scan web pages that help you save mobile data, also protect your private information.</b>   <b>😀Why choose Hi Browser?  √The free ad blocker can block annoying ads when you search in Hi browser and help you implement safe and free Adblock.  √Incognito browsing mode that you can conduct the private search as a private browser and keep your privacy protected all the time.  √Dark web mode gives you a better experience in a low-light environment. √Video downloader to play and download wonderful and favorite videos with AdBlock as you like.  √Private incognito browser mode to freely browse and search for information.  √Breaking news recommendations keep you up to date on local news.</b>   <font color=""red""><b>-------All Functions-------</b></font>  <b>⭐Smart Video Downloader  Fast and Easy</b>  With Hi browser which is a multifunction private browser that has fast and free video sniffer, you can download easily and quickly all videos and movies from mainstream websites and any social media application, like Instagram, WhatsApp, Telegram, Snapchat, and Facebook to your devices.   <b>⭐AD Blocker  Safe and Private</b>  A plug-ins-free adblocker blocks ads that prevent your privacy from being invaded and Adblock stop ads impact your user experience on hi browser, also incognito keeps you from being tracked on the web browser.   <b>⭐Fast web page search  Convenient and Quick</b>  By enabling quick web search for notification panel in settings, you can incognito and private search directly and safely in the notification panel.   <b>⭐No Images mode  Fast and Economical</b>  Web browser with No Images mode will help you save your mobile data and money in the hi browser, also implement the private browser experience.   <b>⭐Incognito Mode  Safe and Privacy</b>  The private hi browser has Incognito mode that allows you to browse and search the web pages privacy and incognito without leaving any search or browsing history.   <b>⭐Bookmark management  Customized and Fast</b>  Bookmark web pages at any time and visit your favorite web with one tap.   <b>⭐Night mode  Protect your eyes</b>  Turn on the Night mode for a great visual search experience when you browse web pages in low-light environments.   <font color=""red""><b>-------Q&A-------</b></font>  <b>1.How to turn on incognito mode on hi browser?</b>  Open the Me tab in hi browser, “Incognito” will appear on the screen page, click the button on the right to open incognito mode. Incognito mode can protect your privacy.   <b>2.How to use the video downloader?</b>  Search the video or movie you want to download, there will be a download button below the video, click the download button to launch the video downloader then you can watch it in the hi browser.   <b>3.Why use adblocker?</b>  Hi browser is a safe and private browser with a free ad blocker, search with adblocker allows the web pages to load faster and reduce annoying ads on the web, also can save your data and money.   <b>4.What kind of video can be downloaded in hi browser?</b>  Hi Browser’s video sniffer can automatically identify the media resources in the URL. You can download videos on social media channels like Instagram, Facebook, WhatsApp, and so on, also use video downloader to download the favorite movies and interesting videos you searched on the web."
9B3E8A5FE0E3060DBC1214D4626B1CA5EE8F614A42AE236B774A0DCFB5C11310,com.ucturbo,COMMUNICATION,"<b>UC Browser Turbo 2020 is a new app of UC Browser Team. It is a fast, simple, data saving and secure web browser for Android phone. </b>  UC Turbo brings you fast video download, mini ads block, data saver, free cloud acceleration(powerful as VPN), share files to whatsapp, easy to search, private & safe browsing, video playing in background, watch cricket matches offline, pesonalized wall picture HD, multi-language and homepage customizable to optimize your using experience.  ✪<b>Main features</b>✪ ■ Minimalist Design ■ Fast Video Download ■ Free Cloud Acceleration ■ Private Space ■ Data Saving ■ Useful Tools Kit ■ Switch Tab on Toolbar ■ Secure Browsing ■ Ad Block ■ Video playing in background  ■ Homepage Customizable  ■ Watch Video Offline  ■ Night Mode ■ Personalized Wallpaper HD ■ Support Multi-language  <b>Minimalist Design</b> No news flow, no push message, simple but smart design brings you clean and convenient browsing experience. <b>Fast Video Download</b> Our servers speed up and stabilize downloads. By setting high download threads, your download speed may enhance a lot. <b>Free Cloud Acceleration</b> Free cloud acceleration help you visit websites and watch videos around the world anytime at anywhere.  <b>Private Space</b> Users enable to hide downloaded online videos or files and encrypt with password, creating a privately-owned space. <b>Data Saving</b> UC Browser Turbo helps you use less mobile data to control your data budget. Whether you're downloading or browsing, UC Turbo always saves 90% data. <b>Useful Tools Kit</b> With a series of tools like status downloader, network speed test, image search, you just need to open UC Turbo to own them. <b>Switch Tab on Toolbar</b> It is a special feature which can save your time and give you smooth browsing. Just move your finger on toolbar, tabs can be switched quickly. Open and Delete options are added now! <b>Secure Browsing</b> Incognito mode helps you to browse in private. Your browsing history will not be recorded in this mode. <b>Ad Block</b> Ad Block function blocks different forms of ads that effect your browsing experience. Also you can mark them manually to block ads with same style in future. <b>Video playing in background</b> It supports one-tab to play videos in background, even with incognito mode. You can listen your videos when you do other things. <b>Personalized Wallpaper HD</b> Set your favorite photos on your phone as wallpapers and share them to social platform with one click. <b>Homepage Customizable</b> You can decide your own homepage. Add your favorite sites to homepage from Bookmarks (add sites to Bookmarks first), or delete all built-in sites to have a blank homepage. You can also set your own picture as unique wallpaper. It’s all up to you. <b>Watch Video Offline </b> Download your favorite videos in advance so that you can watch them anywhere or anytime as you wish, even in situation without any network. <b>Support Multi-language</b> Multi-language customized for you. Choose the language that suits you to achieve barrier-free browsing. <b>Night Mode</b> Night mode is more eye friendly and allows you to browse more comfortably at night.  For help & feedback, please go to feedback pages in Settings. Thank you.  More about UC Turbo Facebook: https://www.facebook.com/UC-Turbo-100571184627491/ Official Website: https://turbo.ucweb.com"
1A3952203297DE979D2ED1A3D39BD2795D95E77567DF720D74E46AF1FD2C57A4,com.wInternetbrowser_10959527,TOOLS,Super fast Internet browser is a free fast web browser for android devices with Fast Download and better surfing  Data Saving and helps you access information with smooth experience.  this browser can protect your privacy by blocking trackers trackers collect your browsing information with this feature you can browse fast and secure You can read all the news every moment with Internet browser
47FCD61411D85DBC7417477024FAD06C6A49BF6A7C7ADF98B775012C1DFE9978,com.citrix.browser.droid,BUSINESS,"Citrix Secure Web is a simple, yet robust mobile web browser that does the job. Keeps you connected. Securely. On the go.  Be it an enterprise or a BYOD program, you can confidently turn your mobile device into a business tool – Access the Internet and your corporate intranet though single sign-on. The app works seamlessly with Citrix Secure Mail and Citrix QuickEdit. With XenMobile, you can also manage the app with security policies that suit your organization's needs.    Features:  •	Support for Samsung DeX •	Single sign-on •	Bookmarks for favorite pages •	Ability to download files securely •	Ability to block pop-ups •	Secure intranet access  Got any feedback or requests for new features or enhancements? Write to us at secureappsandroidsupport@citrix.com  Thanks for using our app!"
A68970C4EFDD31D2C81C578E73FABF7C4526221FA42B2480D8CF9463A98D51A8,pure.lite.browser,COMMUNICATION,"<b>Pure Browser is a small size, fast and lightweight browser with powerful Ad Blocker and Video Downloader, especially useful for Android user phones that feature lower specifications and less storage space.</b>  <b>Main Features</b> ★ Tiny Size ★ Ad Blocker ★ Video Downloader ★ Incognito Browsing  & Night Mode ★ Screenshot ★ QR-Code Scaner ★ Offline Webpages ★ Bookmarks & History ★ Page Translate ★ Find In Page ★ Minimalistic & Super Fast   ★ Various Colorful Themes  ★ <b>Minimalistic & Super Fast</b> Only 3M in size, takes up less resources, is lightweight and very fast. ★ <b>Security & privacy</b> Doesn't collect user data, protects your data security and privacy. ★ <b>Ad Blocker</b> Powerful ad blocking feature that automatically filters ad content and push notifications during browsing. It helps you block most unwanted ads. ★ <b>Video Download</b> Powerful video download capabilities to help you easily download most website videos. ★ <b>Incognito Mode</b> Browse webpages in privacy mode without leaving any history, completely protecting your privacy.  ★ <b>Night Mode</b> Protect your eyes with a unique nighttime browsing mode when browsing a webpage in low light.   ★ <b>More features</b> QR Code,Save Page,Text-Only,Screenshot,Full Screen,Find In Page,Page Translate,Bookmarks Import/Export.     <b>Help us improve our products:</b> If you have any questions or suggestions, please contact me via email <b>pureminibrowser@gmail.com</b> , I will try my best to solve any problems for you.  Pure Browser is a powerful Internet Explorer web browser application, a dedicated browser downloader or video downloader application for you to browse. Don't miss downloading such a smart browser or dedicated browser downloader application. Install the high-performance dedicated browser downloader application now!"
D9ACF22C1B0952D8EF6B4B528A91338D557582B03BBC382468A4E0D33AE20AFC,com.pure.mini.browser,COMMUNICATION,"Mini Browser can gives you a great browsing experience in a tiny package size. It’s a lightweight browser and no add ads, no push notification, no background service, no collect user data, He is especially useful for Android phone users with lower specifications and less storage space.  Mini Browser does not support YouTube video sites or video downloads of any copyrighted sites  Main Features: ★ Tiny Size ★ Ad Blocker ★ Video Download ★ Incognito Mode ★ Screenshot ★ QRCode Scaner ★ Offline Webpages ★ Bookmarks & History ★ Page Translate ★ Find In Page ★ Night Mode ★ No Image Mode   ★ Download Manager  ★ Tiny Size Despite his small package size, but has a great browsing experience. ★ Ad Blocker Powerful ad blocking feature that automatically filters ad content during browsing. Help users save traffic, increase battery life, and increase page load speed. ★ Video Download easy to download videos on a lots of websites, support multiple formats  ★ Screenshot Easily save screenshots of web pages and provide graffiti editing    ★ offline web pages  You can save any webpage you like, and you can reopen it even when you are offline.    ★ Incognito Mode Browse the webpage in privacy mode without leaving any history, completely protecting your privacy ★ Night Mode Protect your eyes with a unique nighttime browsing mode when browsing the webpage in low light   ★ No Image Mode   Supports no picture at all and no picture under WIFI, saving your data traffic without WIFI ★ Page Translate The webpage Translator function offers multiple languages which is powered by Google Translate"
E3B1B933006AB2E691CE37EBE2B5ABF8286E53E2C968AFF4C614CC91ED38C5D0,com.citrix.browser.droid.cigna,BUSINESS,"Cigna Web is a simple, yet robust mobile web browser that does the job. Keeps you connected. Securely. On the go.  Be it an enterprise or a BYOD program, you can confidently turn your mobile device into a business tool – Access the Internet and your corporate intranet though single sign-on. The app works seamlessly with Cigna Mail and Cigna Mobile Edit. With XenMobile, you can also manage the app with security policies that suit your organization's needs.    Features:  •	Support for Samsung DeX •	Single sign-on •	Bookmarks for favorite pages •	Ability to download files securely •	Ability to block pop-ups •	Full VPN tunneling  Got any feedback or requests for new features or enhancements? Write to us at secureappsandroidsupport@citrix.com Thanks for using our app!"
0009C92EE9402FB85707EEC484B5094932E385444D93925EA46B8975B605C932,com.webbrowserbeta,SOCIAL,"This Web Browser Beta Pro Is Fastest Browser For All Android User And Smothly Speed, Dark Theme Is The Great Interface in this browser. Web Browser Beta Pro is Nice Browser."
333E2D5796BAF353F7001997F64455A98756DAD74C22B191809F1D1AAD24DF35,com.swiftariel.browser.cherry,COMMUNICATION,"Cherry Browser is full featured browser that makes web browsing easy and faster. It uses material design, doesn't track you, give you more options to protect your privacy.   <b>Main Features:</b>  ⭐<b>High Quality Browsing</b> Videos & Webpages  ⭐<b>Incognito Browsing</b> We don't track the websites you visits.Go anywhere on the Internet without leaving a trace.   ⭐<b>Fast Browsing</b> Preload technology greatly optimizes browsing speed.  ⭐<b>Hot App+</b> Collect all the hot and handy sites.Such as Facebook, Twitter, Instagram for quick access.  ⭐<b>Simple Interface</b> Cherry's interface was carefully crafted so you can browse as efficiently as possible. Simple interface elevate your browsing experience.  ⭐<b>Search</b> Cherry browser support many search engines and can choose your search engine.We support Google, Yahoo, Ask, AOL, Baidu and Bing.  Help us improve our products:  If you have any questions or suggestions, please contact me via email swiftariel1969@gmail.com , We will try our best to solve any problems for you."
823A06A5516FCB7513AB12532780AE1F930391D3C45F1DA1D4018F77831284B1,com.ume.browser.cust,TOOLS,"<b>Ume Browser is one of the best free web browser for Android devices with Ad blocker, Private Browsing and Data saving.</b>  <b>Main Features:</b> ★ Ad Blocker ★ Video Download ★ Incognito Mode ★ Screenshot ★ Offline Web pages ★ Bookmarks & History ★ Find In Page ★ No Image Mode   ★ Download Manager  ★ <b>Ad Blocker</b> Powerful ad blocking feature that automatically filters ad content during browsing. Help users save traffic, increase battery life, and increase page load speed. ★ <b>Video Download</b> easy to download videos on many websites, support multiple formats  ★ <b>Screenshot</b> Easily save screenshots of web pages and provide graffiti editing    ★ <b>offline web pages</b> You can save any web pages you like, and you can reopen it even when you are offline.    ★ <b>Incognito Mode</b> Browse the web pages in privacy mode without leaving any history, completely protecting your privacy ★ <b>No Image Mode</b>   Supports no picture at all and no picture under WIFI, saving your data traffic without WIFI ★ <b>Download Manager</b> With multi-thread download technology, download speed is faster       <b>Help us improve our products:</b> If you have any questions or suggestions, please contact me via email <b>umesbrowser@gmail.com</b>, We will try our best to solve any problems for you."
8F7A0F8346C0E63479C6BFC5457CD2F5CAB073081676EA9A163EE6493299917B,com.ume.browser.northamerica,TOOLS,"This browser provides you great surfing experience in the internet.  Top features  ● Ads Block: Integrated Ad Blocker to effectively block annoying ads, pop-ups, banners, as well as some specific JavaScript, to give you a comfortable browsing experience and make the page loading with a rapid speed, also reduce the internet data usage for users.  ● Private browsing: Set Incognito to use private tab to go anywhere on the Internet without leaving a trace on your device.  ● Smart News feed: Keeps you to be up-to-date with the personalized News.   ● Personalized Search: Easily switch search engine with multiple options.  ● Downloads: Easy access to manage your downloaded files.  ● Quick Share: Remember your most recently visiting web to help you easily share content to Facebook, Twitter, Skype and more.  ● Font size adjustment  ●  Personalized bookmarks  ●  Multi-tabs switch  ● Data saving  ● Customized Home page setting"
9B10B1200F012301444D424DF797DEDF6E14F8C1307610158B5976B3A3F6D460,com.ume.browser.international,TOOLS,"This browser provides intrusiveed for your surfing in the internet.  Top features  ● Ads Block: Browser integrated Ad Blocker to effectively block annoying ads, pop-ups, banners, as well as some specific JavaScript, to give you a comfortable browsing experience and make the page loading with a rapid speed, also reduce the internet data usage for users.  ● Private browsing: Set Incognito to use private tab to go anywhere on the Internet without leaving a trace on your device.  ● Smart News feed: Keeps you to be up-to-date with the personalized News.   ● Personalized Search: Easily switch search engine with multiple options.  ● Downloads: Easy access to manage your downloaded files.  ● Quick Share: Remember your most recently visiting web to help you easily share content to Facebook, Twitter, Skype and more.  ● Font size adjustment  ●  Personalized bookmarks  ●  Multi-tabs switch  ● Data saving  ● Customized Home page setting"
1B886933D99046ACB1CD1BC59C3570DB36D0E673407A241C4A965F52FFF2B568,com.ume.browser.euas,TOOLS,"Browser is a smart browser which is able to bring you better, faster experience with less data traffic. Saving:Window mode, costs extremely little data traffic; Top speed: Accerlate via cloud, faster than ever; Concise:Clear UI, simpler operation; Stable: stable and reliable."
6F102896832A08DC619F9F4174F7021CFE4433E6582DCC28192263FE31FE77F4,com.ume.browser.newage,COMMUNICATION,"<b>U Browser is one of the best free web browser for Android devices with personal space,video download and private browsing, it is especially useful for Android phone users with lower specifications and less storage space.</b>  U Browser is a lightweight mobile browser which can give you a fast and secure surfing experience. With the Powerful Ad blocker function can clean most of annoying pop-ups, banner ads,video ads and give you a comfortable browsing experience.   U Browser has many other useful features, free video download, personal space, screenshot, QR Code, night mode.  U browser does not support YouTube website video download.  Main Features:  ★ <b>Video Download</b> ★ <b>Privacy Search</b> ★ <b>Personal Space</b> ★ <b>Incognito Mode</b> ★ <b>Screenshot</b> ★ <b>Offline Web pages</b> ★ <b>Bookmarks & History</b> ★ <b>Find In Page</b> ★ <b>Night Mode</b>   ★ <b>Download Manager</b> ★ <b>QR Code</b>  ★ <b>Video Download </b> Easy to download videos on many websites, support multiple formats  ★ <b>Privacy Search </b> Privado search engine (optional in settings) can keep all your search private ★ <b>Personal Space</b> In personal space, you can browse the website and download videos without any trace, and it will not show any history record. Personal space is separate from normal mode to keep your privacy protected ★ <b>Incognito Mode </b> Browse the webpage in privacy mode without leaving any history, completely protecting your privacy ★ <b>Screenshot </b> Easily save screenshots of webpages and provide graffiti editing    ★ <b>offline web pages </b>  You can save any webpage you like, and you can reopen it even when you are offline.    ★ <b>No Image Mode </b>   Supports no picture at all and no picture under WIFI, saving your data traffic without WIFI ★ <b>Download Manager </b> With multi-thread download technology, download speed is faster       Help us improve our products: If you have any questions or suggestions, please contact me via email <b>umesbrowser@gmail.com</b> , We will try our best to solve any problems for you."
3641DA6444C448A7315CCE7BD4BF3199718027E4E0DD06D560130D85A9682681,com.uc.browser1,COMMUNICATION,"CMC Browser is a small size, fast and lightweight browser with powerful Ad Blocker and Video Downloader, especially useful for Android user phones that feature lower specifications and less storage space.  ★ Ads-block The Ads-block is a powerful tool of CMC Browser. With the Ads-block function, CMC Browser can also effectively block annoying ads, pop-ups, banners, as well as some specific Javascript Browser is a small size, fast and lightweight browser with powerful Ad Blocker and Video Downloader, especially useful for Android user phones that feature lower specifications and less storage space.  give you a comfortable browsing experience. Furthermore, the Ads-block of CMC Browser can not only make the page loading speed faster but also reduce the internet data usage for the user.   Main Features ★ Tiny Size ★ Ad Blocker ★ Video Downloader ★ Incognito Browsing & Night Mode ★ Screenshot ★ QR-Code Scaner ★ Offline Webpages ★ Bookmarks & History ★ Page Translate ★ Find In Page ★ Minimalistic & Super Fast  ★ Various Colorful Themes  ★ Browsing speed acceleration Preload mechanism to speed up browsing."
98CA6D2D91BE29587E7CB4F511D3624B0E8E9125AFA0B4AC2EF701E13DB6D9B5,com.karmkeedabrowsers,COMMUNICATION,"Fast and secure browser surf the internet faster as never before, respects the users privacy and it is light weight web browser.   It is a high-performance small-sized Internet browser built for those who don't want the cumbersome size of other browser. Web Browser with the latest security and privacy features to help you stay safe on the internet.  Key Features: - Incognito Mode. Private browse the web without saving any browser history. - Fast Start Times - Super easy copy/paste - Homepage - Bookmarks - History -dark mode -various site -play game for free -Support Multi-language -uc browser  This browser is made for new generation. It is like mini uc browser.  In generally we face storage problem in our smartphone due to many apps.  But in this browser top shopping, game, food, recharge etc sites can access.   So download browser now."
CCB7C064461AFCF90E65F5CD8C88A7B3A43544E0536FA31FEA6A394D7E06DC8F,com.yandex.browser.beta,TOOLS,"Find out first about Yandex Browser’s upcoming features by testing the new version of the program before its official release.  Please note, the beta version may be unstable and is intended for experienced users who are willing to report bugs and problems. You can send your feedback through the browser settings or to mbrowser-beta@support.yandex.com. Your messages will help us make our browser better.  If you already have the major release of Yandex Browser installed, you won’t need to delete it – the beta will work in parallel.  By downloading the application, You accept the terms of the License agreement https://yandex.com/legal/browser_agreement/"
F881757F81F2F39A7BBDF2CCC435D64F38E15102606AB16D30E790CC7E670927,com.yandex.browser.alpha,TOOLS,"<b>Experimental version of a quick and intuitive Yandex Browser.</b>  <b>Use Chromium extension stores</b> such as Chrome Web Store or Opera Addons to increase what you can do with Yandex Browser.  <b>Get rid of annoying ads</b> on websites with ad blocking.  <b>Protect your personal data</b> when using public Wi-Fi networks and stay away from harmful or fraudulent pages with the browser’s active security system Protect.  <b>Hide unrelated interface elements</b> — ads, site menus, buttons, or widgets — and leave only the relevant text and accompanying images on the screen with Reader Mode.  <b>Surf the web in private</b> using Incognito Mode — Yandex Browser will not keep track of your passwords, search queries, or browsing history in this mode.  <b>Customize your Yandex Browser</b> with a wide array of backgrounds in the wallpaper library to suit any style or mood.   If you have any questions or suggestions, you can contact us straight from the app, or via https://browser.yandex.com/feedback.  By downloading the application, You accept the terms of the License agreement https://yandex.com/legal/browser_agreement/"
