sha256,pkgName,categoryID,description
C2F694BCD73C2A242BC4D4DFE1B8837FC4A48CC694D08EF068C7D6E4CF5E1835,com.spyscanner.spyware.antispywaredetector.antivirusdetector,TOOLS,"Intelligent protection against espionage & Against (un)known spyware Anti Spy detects not only known spy apps but also Spy-, SMS-, and GPS trackers, as well as monitoring apps often used by government agencies in some countries.  The AI engine monitors the behavior of apps and processes. As a result, any opportunity to spy on you using spyware, trojans, and other malware is proactively prevented.  Even unknown spy headers are reported thanks to the real-time scanner and heuristic scanning methods.  An ideal combination Anti Spy is perfect for security solutions such as antivirus scanners and is suitable for excellent privacy protection in conjunction with our Firewall AI Android, Camera Guard™, and Micro Guard™.  Guarantee from Protectstar™ Protectstar™ Anti Spy does not collect any personal data of the user on any medium. The app is also ad-free. Like all our apps! Vaccination against malware If the Antivirus AI scanner detects a new Trojan, the protection modules initiate defensive measures in a matter of seconds.  If suspicious spyware is detected on a user's smartphone in Paris, the meta-information is subjected to in-depth analysis in the AI Cloud. If the malware becomes a new threat, all global users are immediately ""vaccinated"" against it. And all this without having to carry out a single product update.  The more you use Antivirus AI, the better the detection and the higher the overall protection of all users worldwide.  Combining strengths Conventional antivirus scanners use a signature-based model, so the scanner knows what the malware looks like. Today, however, malware is changing its behavior to evade detection by traditional technologies. Free antivirus and phone security for Android™ devices from Kaspersky  Kaspersky Security for Android is a FREE-to-download antivirus solution that helps secure your phones and tablets – which can be even more vulnerable than computers – from online dangers.  Features in detail  🛡 Antivirus protection When our defense technologies detect malware, spyware or other threats, Kaspersky Security & VPN for Android acts as a virus cleaner. This means it repels viruses, and blocks dangerous apps, links, downloads and files.  🔍 Background scan Our Android antivirus comes with a powerful background scan that checks apps, files and more for threats such as malware, ransomware and phishing.  Anti Spy Scanner & Spyware Scanner. ★★★★★ Protection against espionage apps ★★★★★ Engine based on Artificial Intelligence (AI) ★★★★★ Detection of known spy apps, Backdoors, SMS/call fraud, commercial spyware, malware, viruses, trojans, ransomware, RAT, and more that governments or law enforcement agencies often use ★★★★★ Detection of spies, SMS, monitoring apps, and GPS trackers ★★★★★ Protectstar™ apps are preferred by more than 5,000,000 users in 175 countries Do you think someone is spying on you right now?  Is somebody reading your conversations, recording what you type and copying your passwords?  Download Incognito - Spyware Detector and WhatsApp Security to help protect you from harmful spyware and stalkwerware.  Do you need anti spy protection?  Incognito is a FREE, easy to use, privacy protection, anti spy app. We are not anti malware or anti virus, we are Anti Spy.  Our anti spy app is a scanner, detector, and cleaner of spy ware, stalker ware and surveillance software. Incognito protects you against cyber threats from spy companies and from unauthorized tracking, surveillance, monitoring, hacking of personal information and identity theft. Top Features: • High Risk Apps Feature Scan all apps of your mobile phone and find app which is from unknown resources or from 3rd party Websites. • One clicks widget to block/unblock camera (Working on android 9 or Low Versions) • Spyware Finder Feature finds the spyware from list and then its shows match results on your Smart Phone Screen. • Apps Manager Feature helps user to Uninstall apps System and User Apps."
65928C825CB4F6DA2C34516F3D24E389CECB1A091C44E4A037AC714EFE7454A4,com.npav.newindiaantivirus,TOOLS,"NPAV Mobile Security app provides features to reduce the risk of it or to protect users from these malicious apps. It will provide protection from various threads, malware, and spyware that can threaten your privacy and cause Ineffable damage.  Features :  Scan : After clicking on the Scan button it will start completing mobile scanning. Users can also able abort a scanning by pressing the abort button. After completion of the scanning process, it will display the scan summary.  Schedule Scan : Schedule your Scan Timing as per your need (Daily / Weekly)  Apps Usage : Apps Usage shows the summary of the total time you spend on different apps.  Secure Payment : Secure your payment information while making payments anywhere.  Motion Alarm : This feature notifies the user with a ringtone if anyone touches or tries to steal the user's device in their absence.  Weak Setting Scan : The settings like the Developer option, and USB Debugging may be harmful to your device. This option scans and disables weak settings.  Secure QR Scanner : Using this functionality, users can know whether any URL or data contained in the URL is safe or unsafe before opening it.  Photo Vault :  This feature is used to hide pictures behind a password.  App Manager : This feature lists all apps installed by users with the app size and installation date.  Users can search, share, and uninstall the specific app to optimize memory and open apps on the play store.  Privacy Control : It is used to check what permissions are used by apps installed on your device.  Some malicious apps take unnecessary permissions that won't be needed to work and can leak your data or monitor your device. So you can find the list of permissions used by apps and can handle it here.  For this, 2 categories are app lists on the basis of permissions they used and permissions list used by any app.  Vulnerable Apps : This feature finds the malicious or unverified(not verified from the play store)application that may be harmful to your device and provides an option to delete it.  Lock an App : This feature locks any application user doesn't want to be opened without his/her permission.  System Information : Easy listing of hardware and software available in the system here.  My Account : If a user enables this option, all the hardware and software-related details of all the devices associated with the same user will be available in the same place on the cloud. Users can access it and use features to manipulate it remotely using our app ""my account"" or web portal ""myaccount.npav.net""."
88D353FF11D3D3F6F143553B797FE4E1CBF79F5533184ED6507DB0E15CDCB87E,com.revesoft.reveantivirus,TOOLS,"REVE Antivirus Mobile Security provides free real-time protection for Android phones and tablets from viruses, malware, and spyware. This mobile antivirus has an anti-theft feature, which helps to track your mobile phone if lost or stolen. Additionally, you can manage all your devices via the REVE Antivirus dashboard.  Download REVE mobile antivirus now.   REVE Antivirus provides robust mobile security against all kinds of dangerous threats. This free mobile antivirus has the virus scanner, which scans all apps and efficiently removes malware and spyware. REVE Antivirus helps parents monitor their kid’s online activities via Live Notification on a mobile app.   Its Privacy Advisor notifies you about the apps that affect your privacy. You can review the permissions granted to the apps via REVE Mobile Antivirus  Check out the amazing features of REVE Antivirus Mobile Security:  •	Live alerts: Get instant notifications on mobile app when a user visits a website specified under surveillance or blocking rule, on any of your PC devices. Also, you get virus detection alerts in the mobile app if any virus is detected in any of your PC where REVE Antivirus is installed.   •	Virus Scanner: REVE Mobile Security scans and removes malicious files and content from your SD Card or phone. Real-time scanning of the apps on installation. REVE Mobile Antivirus protects your data from viruses, malware, and spyware.  •	Anti-theft: Protects the data of your mobile when it is lost or stolen.  It helps you to lock the device and wipe out all the data of your phone by sending a pre-defined message from a trusted number (friend or family) which is saved on your app. You can also manage and secure the data of your phone through REVE Antivirus Dashboard. With its alarm feature, trace your misplaced device easily. You can also track the exact location of your mobile phone when it is lost or stolen.   •	Applock: Protects your privacy with the Applock feature. You can lock any app using a password. Saves the photo of the intruder who tries to unlock your locked app by the wrong entry of password three times.  •	Parental Control: Allows you to manage parental control settings of your PC from your mobile app. You can block websites on the basis of category or switch to surveillance mode and get live alerts about the online activities going on your PC.   •	Privacy Advisor: Helps you to review your apps that are installed on your phone and their permissions which may affect your privacy.  •	Automatic Virus Updates: Regular automated virus update protecting you against all kinds of internet threats.  •	Reports: Get an overall security status of the total scanned files and the ones infected.  This app uses the Device Administrator permission. This permission allows you to remotely lock, wipe and start alarm remotely your device from myaccount.reveantivirus.com  Get in Touch with us –  Website: https://www.reveantivirus.com/  Facebook: https://www.facebook.com/reveantivirus/  Twitter: https://twitter.com/REVEAntivirus  YouTube: https://www.youtube.com/channel/UCm5BObaSoy9f2WopLP09tdQ/featured"
EDE9D8AFFB919A47F7D0CEDA7CB909088B457AA10CC59865918D789EC898F793,com.antivirus.cleaner.for.android.vpn.app.lock.bsafe,TOOLS,"Get your mobile protection for phones and tablets.  With so many hackers and threats being discovered per day, you must remain protected!  Antivirus Cleaner BSafe VPN is a security app that provides Antivirus and VPN (virtual private network) features.  Antivirus will keep you safe from harmful virus infections, malware, suspicious hidden files or trojans, with our daily checks and updates of the virus database!  VPN feature will mask your IP address, helping you to surf the web safely and keep anonymous, protecting your data and unblocking geographically restricted websites. Enabling the VPN feature, you'll be increasing your internet safety and security.  How to use Antivirus Cleaner BSafe VPN features?  - Open the app; - One click to start any of the features. - During the AV analysis, a deeper scan will be running on the background. Don't waste your time waiting for the results. In the end, we will notify you of the results and show you the threats list. - To update to the latest virus database, click on Update on main menu and then, click on Download and Update Now.  How to use VPN feature?  - On main menu, click on VPN. - Click on servers list and choose the vpn you want to use, then click Connect (for better connectivity, you might be advised to disable battery optimization regarding Antivirus Cleaner BSafe). - After that, user will get a connection request to set up the VPN. - A screen will be shown with VPN connection details. Please note that sometimes, using a VPN can slow down your internet connection. - A Key symbol will be shown at the top of your screen everytime the VPN feature is enabled and VPN info will be shown on device notification panel. - To disable VPN, just go to VPN menu and click Disconnect, or you can also do it on notification panel.  All our apps features are very effective and simple!  With just one click, you will start your mobile security analysis.  No app Registration or Login required for our features.  Looking for more, like AppLock? We also have it on our Pro version, for Android up to 9.0! Just chose the license package that works best for you. If you choose one month subscription, you'll be enabling your 7 days free trial.  Here are Antivirus Cleaner BSafe VPN most valuable features: - Protection - Performance - Free version for unlimited time - Pro version (optional): Enable your free trial and get full antivirus analysis and no more ads. He provide several security features at a very reasonable cost.  Antivirus Cleaner BSafe VPN will be your all-in-one security mobile app:  - Security & protection - Daily virus database check and updates - Scan apps and files - Scheduled scan - 1 Tap to scan - App manager - VPN (virtual private network) - App Lock and privacy control (optional and up to Android 9.0) - Suitable for most of Android devices - Free version available - Pro version with free trial available - Remove ads (optional)  If you want your android device to keep protected and in full speed, you'll love Antivirus Cleaner BSafe VPN.  Scan your device... BSafe forever!  Contacts: www.facebook.com/BSafeLabs apps@bsafelabs.com  Privacy Policy: https://bsafelabs.com/privacy/"
8A9FC7F885C308861D9DA0B4C1A5C57AEF26F6C9B66ED37AB808C73A4C6E6DA9,com.antivpn.securevpnantivirus,TOOLS,"Want to connect with the best and most secure VPN Connection to reach out to your desired blocked websites..?  Boost your smart device speed by killing stricken viruses that slow down your device and apps. This Antivirus Cleaner app helps you to protect your smart device from harmful viruses. Easy and simple to use Antivirus Cleaner which permits users to manage all apps in one place and uninstall unwanted apps with one click. Simple and secure way to protect against viruses and other types of stricken viruses with full of mobile security  This Super Fast Secure Proxy lets you connect with the best and most secure VPN Connection through worldwide Proxy Servers. Easy, quick, and secure way to connect with the best Virtual Private network through a smart device to instant access blocked videos, games, social apps, messaging apps, and also websites with securing your IP Address. Just one tap on your desired VPN Country connection and reach out to all the blocked content by hiding your IP Address and easy to view the download and upload speed of any connection.   FEATURES: ▪ Antivirus Cleaner to clean up your device from stricken viruses ▪ Antivirus and virus cleaners protect against harmful virus ▪ One click to protect your device with virus and antivirus ▪ Our antivirus virus cleaner scans and removes Stricken Viruses ▪ Antivirus Cleaner scans from files, apps, and downloads and cleans with one click ▪ Simple way to uninstall unwanted apps in one place with a single click ▪ Secure Proxy Connection to connect with the best VPN Connection ▪ Worldwide VPN servers to unblock all your desired websites and videos ▪  Instant connect and get access to blocked videos, games, social apps, and websites ▪ Secure VPN servers protect against public WiFi hotspots ▪ Hide IP address while browsing blocked content online ▪ Keep your data, online browsing, locations, and IP addresses private when using a VPN ▪ Secure way to connect with VPN Servers and secure your IP Address ▪ Easy to view location updates with upload and download speed ▪ Simple easy and clear UI design"
F98C22979591A0BF3244242EE14FBA004BB1609DF819EE014C4F56754C6BF1F2,com.antiviruslite.viruscleaner,TOOLS,"Antivirus Lite is the leading antivirus for android phones free and virus protection application on Android. With a capacity of only 1Mb, you can run this mobile antivirus software smoothly on all mobile devices, free antivirus. Antivirus Lite is a special shortened version designed for phones with memory less than 1GB.  This antivirus app for android will help protect your phone from any viruses, malware and Trojans; Comprehensive protection for your phone with antivirus and mobile security. Detects all risks, viruses and spyware, dangerous applications. Keep you away from all potential threats, such as viruses and spyware, antivirus for android, to protect your personal information from theft and spam. Free virus removal for android  As a antivirus protection for android and security tool for Android, deep scanning makes the phone cleaner and safe, virus detector and remover. Antivirus Lite (phone protection and free antivirus for android) also protects you by protecting Android (phone security scanning, virus scanning, anti-malware, anti-virus and anti-virus for mobile). Best antivirus app for android, virus remover for android phone.  <b> Highlights of Antivirus Lite: </b>  - APK size is just over 1Mb for virus removal for android. - Easy to install and run fast - Anti malware virus remover, trojan virus remover for android. - User-friendly interface easy to use - Lowest energy consumption - Designed for phones with memory less than 1GB - Keep your privacy safe - Virus removal and cleaner for android, best antivirus and malware removal. - Virus scan, virus killer, virus remover. - Anti-virus software with the best virus scanning and removal features. - Scan, detect and kill viruses to protect your phone - Scan applications, games, settings and files in real time - Quickly detect all threats to the phone, virus remover for android. - Virus and malware removal for android, anti malware and spyware for android. - Anti adware for android phones free - Best security app for android virus protection free - Protect your phone from hazards with antivirus software.  Antivirus Lite helps protect your phone from viruses, malware, adware and spyware!  <b> Download the BEST antivirus cleaner for android app NOW! </b>"
BB417D3A2393542BEBCCD95FB63E4568C66B4719ACFA4F7FA777C0F8BA057297,com.conspirationap.antivirusformobileandroidphonecleanerguia,TOOLS,"<p>You feel that the operation of your mobile is out of the ordinary download free clean virus for mobile, it is time that you start with this antivirus guide to remove virus from direct access to see how to examine it in case it has any virus inside it I make it operate out of the ordinary.</p> <p>Take advantage of the fact that with the high range of <strong>free antivirus for android</strong> you can keep it clean of the harmful elements download clean virus for free cell phone to what they expose it for that reason with Antivirus for Mobile Android Phone Cleaner Guide specials in giving you the precise and easy indications for Let them work.</p> <p>Note: the intention of this guide to download optimizer cleaner cleans the phone and viruses is that you learn to clean my phone from viruses for free to how antivirus programs work to eliminate direct access viruses against viruses that infect mobile phones and damage them. more serious than others.</p> <p>With all the good disposition put into practice download free cell cleaner any of these programs download free virus cleaner for cell phone that with this special guide you will see the best of the current in terms of mechanisms to keep the android clean because you will learn how to clean the Easy virus cell with few steps executed.</p> <p>Within this guide the best antivirus application for android special you will learn virus cleaner for mobile free download necessary details for:</p> <p>• The best and most current of android phone antivirus • a good antivirus for free android you will only find it by this special guide on it • you can search for free antivirus for mobile calmly by seeing the guide in this antivirus app to download free for mobile • from this application you can download free virus cleaner for mobile • with the manual you will see the antivirus to remove the shortcut from your mobile • Windows tool to remove the most updated viruses • special antivirus to remove shortcuts from my usb from your mobile • you will have the explanations with the <strong>antivirus guide for your free and modern mobile phone</strong> for you to read because it is necessary to install antivirus on android • you will know the best virus cleaner for android for better operation • what I want an antivirus for my special cell phone to keep it clean all the time • best of all, the modern android virus detector for current phones • why cell phones need antivirus just by this guide you will understand • you will see that it is good to install antivirus on android from the moment of its acquisition.</p> <p>Take advantage of this antivirus app for mobile phones without ads where you can easily download a free cell phone cleaner, the guide that antivirus recommends for my tablet that you have all the elements to keep your mobile in optimal condition.</p> <p><strong>Attention</strong>: it is only a guide to download free antivirus application for cell phone with the simplest step by step cell phone trash cleaner so that from it you can take the best <strong>antivirus programs to clean android for free</strong>, it is the most useful thing you can place on your mobile .</p> <p>Every detail within this excellent free antivirus application guide for android is essential for you to activate application to clean android virus, free antivirus programs for my cell phone that has this way you will see that the mobile will have an optimal operation.</p> <p>Take advantage of the best of this tutorial program to remove virus shortcut where the details that are in the best application to clean the cell phone are very simple and understandable to put them into practice look for antivirus for android at the same time that you understand all the explanations of the guide .</p>"
AC51299E5C5E6E1A0982DC34E463CF60D9851A936A4672F8F697EF8C329E7ED8,zaths.com.mobileantivirus,TOOLS,"Free Antivirus is an awesome application and crafted beautifully for our valuable users as it detects the virus and tells our user to delete that specific application which is causing issues. Free Antivirus is easy to use and very user friendly. Free Antivirus has more than one functions as it will definitely boost ram. Free Antivirus also fetches all the sensors in ur mobile and shows it to user. Free Antivirus also clean junks on a single click. Free Antivirus is designed very beautifully as it has beautiful animations as liked by the users.  <b>virus Cleaner</b> Virus are really bad for mobile health as it slows down the mobile antivirus cleaner.A mobile phone virus is a malicious computer program that targets cellular phones and other wireless PDAs Antivirus Cleaner... These texts and emails can lead other users to open or download the virus.Antivirus Cleaner Mobile phone viruses can also come in the form of malware that spreads through downloaded apps virus Cleaner. What happens when your phone gets a virus? Overheating of the phone and poor performance: When your phone is infected by malware such as viruses, worms or adware, they use up your phone's resources to spread their malicious intent. It is no surprise then that your phone will start heating up under the strain. Free Antivirus will help you to solve all these issues as it runs in the background and keeps mobile safe.  Free Antivirus has will access your mobile sensors and lets you know about the performance of all the sensors. Virus Cleaner application is easy to use and reliable as it cleans all the non play store apps which seems to have virus to virus cleaner. Free Antivirus has awesome features and designed with basics in mind to make users feel home and than virus cleaner is crafted beautifully. Virus is bad instead its worst for the mobile health and it makes it slow as hell so it is best to clean your device after regular intervals through free antivirus. Virus cleaner also has some different options for the users we love and one of them is to clean your mobile's ram so you can enjoy the speed of your device till you keep free antivirus with you for virus cleaner.  Virus cleaner can also make your day special when your device will be fast and whatever you do is done at merit of speed plus the most entertaining and reliable functionality of free antivirus application is that it will inform you when ever your device is at risk or some application or virus will try to slow down your device than free antivirus will play its most important role of sending users a notification that your device is at risk kindly clean your device and the click of user on the virus cleaner notification will clean the mobile with the help of free antivirus.  Main parts of virus cleaner. Virus cleaner has best colors which never hurt eyes in free antivirus. Free antivirus is designed by the best of the best for virus cleaner.  Animations used in this application are used to entertain users at the most we can through virus cleaner.  Download the app and enjoy as the rest will be handled by the application. Privacy Policy: https://gist.github.com/zaths/194f9afe9c82025e1f42db6f388a72d4"
