sha256,pkgName,categoryID,description
C7563187A874CF1C6E41EA7F9C3226FCF96449C7D66C2DCDEFA7B6AED2C214E7,com.yupptv.scope,ENTERTAINMENT,"Are you tired of spending a lot of money on individual subscriptions to SonyLIV, Zee5, aha, EPIC On, and YuppTV? Well, it’s absolutely time to change how things work. Because we brought you an app that compiles all of them in one space.  What does the Scopevideo by YuppTV do?  The Scopevideo app is an aggregator of multiple OTT applications that could be allowed to watch under a single subscription. We collect video streaming material from all of these apps and provide it in a consistent interface to help you decide what to watch. With the help of a Scopevideo subscription, you can find and watch popular and recent content titles without having to sign into each of these applications separately; our single sign-on capability takes care of that.  Use our app with ease:  Hand-picked for you... (Shh...it’s a secret) Our tailored content recommendations are a combination of manual curation and AI-powered recommendations. The information is curated based on prominent industry expert viewpoints, and the AI-powered recommendation engine creates a 360-degree user profile to present users with appropriate recommendations according to their liking. Just like you want it...(*winks*) Users can also search for content by sorting and filtering by genre, language, cast & crew, year of release, and so on. In addition to this, regular search and voice search capabilities are offered too. Let’s get the communication game on... (Sheesh! Somebody’s going to make new connections) - This app also has plenty of interactive features. Like, while viewing live TV, users can engage in live conversation, participate in live polls, and request programming of their choice. Through live quiz shows and other social interactive elements, content producers and broadcasters may communicate with their viewers in real-time.  Here are some other great features of Scopevideo App:  One-touch Access: With a simple touch, you can watch any content available across various premium OTT Apps.  One Destination: 300+ Live TV channels, 5000+ Movies, and 1000+ TV Shows gathered from numerous OTT apps in one location. (*screams in enthusiasm*)  All-in-One Subscription: Access to various premium OTT applications such as ZEE5, AHA, Hotstar, SonyLIV, and YuppTV – with a single subscription. (Do you need any other reason now? *Sigh*)  Content Curation: Now, let’s not forget the fact that we have handpicked content which has been done based on various attributes of content.  Personalized Content Discovery: Discover the most significant and interesting content titles that are tailored to each user's preferences.  TV Everywhere: Access all features and services at any time and on any device. (Yass! Now no one fights for remote control)  Jason Newton once said “Perfection is a Myth” - Just like every other thing including you and me, we are not perfect, but you know what’s more important? The zeal to be. Our developers are constantly striving to provide seamless experience to all the users. And we can proudly say that with each day that passes we only got better. With you joining us, we can make the world of entertainment a much better place for us and the coming generations.  To begin using the app, simply follow these simple steps.  1. Get the app and install it on your device.  2. Register for an account by simply entering your cell phone number/ E-mail address.  3. Once the OTP has been verified, you can begin exploring the material.  4. Click on the item you wish to watch, which will take you to the appropriate OTT app to watch it.  5. If you do not have the OTT app installed, you will be requested to do so.  **We have partnered with some of the leading ISPs of the country and Scopevideo subscriptions are currently exclusively accessible to selected broadband customers only. If your ISP is not offering Scopevideo as part of the bundled offering, you can ask to reach out to us. Consumers of BSNL can acquire this subscription by visiting the BSNL broadband self-care page. **"
2DE302F1EAF73003C68515B901A882C8714704E045924492E2421D49E391A590,com.boomerang.boomerangapp,ENTERTAINMENT,"BOOMERANG packs over 5,000 of your favorite cartoons and movies into one place. From A to ZOINKS, watch Scooby-Doo, Looney Tunes, Tom and Jerry, The Smurfs, The Jetsons, The Flintstones, and much more.  With BOOMERANG, you can: * Watch unlimited cartoons! * Stream cartoons on your favorite screens — TV, phone, tablet, computer. * Get access to a mix of original cartoons and timeless classics to entertain the whole family!  BOOMERANG is only accessible in the U.S.  By downloading the app, you agree to the BOOMERANG TERMS OF USE and PRIVACY POLICY.  Boomerang Terms of Use: https://www.boomerang.com/terms Boomerang Privacy Policy: https://www.boomerang.com/privacy-static.html Do Not Sell My Personal Information: privacycenter.wb.com/do-not-sell  HOW IT WORKS & CANCELING YOUR PLAN You don’t need a TV provider to enjoy BOOMERANG! Just download the app and start a FREE 7-DAY TRIAL (new customers only). Your subscription starts when your trial ends. After your free trial ends, your account will be charged the monthly or annual subscription rate until you cancel. To avoid being charged, cancel at least 24-hours before the end of your free trial or current billing period. There’s no refund or credit for partial monthly or yearly subscription periods.  If you subscribe through Google Play, you can cancel on this device in the Google Play Store > My Apps > Subscriptions."
FE227E8E4F5F8AAFB92286D58E073DB90EB003DB0C8F514C923E202B03D04F97,ca.virginmobile.tv.android,ENTERTAINMENT,"The TV app allows Virgin Plus TV  Members to enjoy the hottest live and on-demand shows on their favourite devices, anytime.   With the TV app you can:  - Watch your TV programming on the screen of your choice. - See what’s trending at any time and easily search for shows. - Pause and rewind live TV. - Watch TV while you do other things, with the picture-in-picture feature - Download subscription on-demand content to watch offline. - Enjoy immersive Dolby Digital 5.1 surround sound audio on supported live and on demand content.  Need help? Contact us: TV_app_support@virginplus.ca  Requirements: - Available to Virgin Plus TV Members. - Available on unmodified Android devices with OS 5.0 or higher.  To learn more, visit: virginplus.ca/tv"
070B4DFE92B912523002954878E447DB12454D7B825FFEDC470C1D182A1D157F,com.quickplay.android.bellmediaplayer,ENTERTAINMENT,"The Fibe TV app allows Bell TV clients to enjoy their TV content anywhere.   With the best TV app you can:  - Watch your TV programming on the screen of your choice. - Set, watch, manage and download recordings to watch them anywhere even without Wi-Fi.* - Download select movies and series from on demand channels.  - See what’s trending at any time and easily search for shows. - Pause and rewind live TV. - Rent or purchase movies. - Watch your TV content in a smaller window while browsing on your mobile device, or watching on Bell Streamer with the picture-in-picture feature.  - Enjoy immersive Dolby Digital 5.1 surround sound on available content.  * Recording features are exclusive to select Fibe and Satellite TV clients. See requirements for eligibility.    Need help? Contact us: fibetvappsupport@bell.ca  Requirements: - Recording features are exclusive to Fibe TV clients in Ontario, Québec and Atlantic provinces as well as to connected Satellite TV clients. - Available on unmodified Android devices with OS 5.0 or higher.  To learn more, visit: Bell Fibe TV clients:  bell.ca/fibetvapp Bell Aliant Fibe TV clients: bellaliant.ca/fibetvapp Satellite TV clients: bell.ca/tvapp Fibe TV app clients: fibetvapp"
8DC696FA2112FB1D196C17BB407A509BE3245701786AFFDD2F8DBE3DE3E3C359,com.hbo.hbonow,ENTERTAINMENT,"HBO Max is a premium streaming app that combines all of HBO with even more must-see TV shows, blockbuster movies, and exclusive Max Originals. It’s everything you love, all in one place. All of HBO. All of the greatest TV and hit movies. All yours. Available anytime to stream on your favorite screens.   With unlimited access to thousands of hours of entertainment, we’ve got something for everyone in your family. Keep up with fresh episodes from the latest HBO shows and fall back in love with the iconic TV everyone’s still talking about. Watch new movies from D.C. and Warner Bros, plus the comedies, dramas, and classics you love.   So kick back in your comfiest loungewear and find your next favorite from one of our curated hubs, including HBO, D.C., the Cartoon Network Collection, Classics curated by TCM, Sesame Workshop, and more. With HBO Max, you’ll always find something new to stream.    Here’s what’s waiting for you:  • All of HBO with even more critically-acclaimed movies, binge-worthy TV shows, and Max Originals. • Bingeable collections hand-picked by our editorial experts—not robots. • One-of-a-kind kids experience with flexible parental controls. • HBO Max Hubs devoted to beloved brands including HBO, the Adult Swim Collection, the Cartoon Network Collection, Looney Tunes, Classics curated by TCM, DC, and more. • Download episodes and movies to your phone or tablet to watch offline, anytime. • Up to five viewer profiles with customizable profile images.    Content and feature availability on HBO Max may vary by region. Some titles and features shown above may not be available in your country.  HBO Max is only accessible in certain territories.  For help, please visit help.HBOMax.com.  Privacy Policy: https://www.hbomax.com/privacy Terms of Use: https://www.hbomax.com/terms-of-use For California residents only, manage sharing your data at: http://warnermediaprivacy.com/do-not-sell"
EFFE47977546E63454BC9143D18917596AF9194473F17FF299A9B4A622018C60,ca.cbc.android.cbctv,ENTERTAINMENT,"Start streaming for free with CBC Gem.  Watch the best shows and movies from across Canada and around the world - all for free. Not only can you watch hundreds of your favourite episodes of shows on demand, you can watch CBC TV live. CBC Gem is home to hit CBC TV shows like Sort Of, Son of a Critch and The Great Canadian Baking Show, along with exclusive series like Normal People, Ghosts, and more.  CBC Gem features:  Stream CBC TV Live  Find full episodes (new episodes added daily)  Explore exclusive TV series from around the world  Discover acclaimed Canadian feature films  Check out ad-free kids programming  Closed captioning and described video  Content is only available to stream within Canada  Sign up for a CBC account to get even more!  CBC Account - FREE  Stream your local CBC TV channel live - access all 14 channels from across the country  Watch past seasons of your favourite shows on demand  Pick up where you left off on any device  Stream CBC News Explore   CBC Gem Premium  Subscribe to Premium to enjoy additional features and content:  Watch on-demand episodes ad-free  Stream CBC News Network live 24/7  Surround Sound  Try Premium free for one month, then continue your subscription for $4.99/month plus taxes. It’s easy to get started - just download CBC Gem, sign up for a CBC account and start your free trial. Cancel anytime."
780A97A5ABED682FC457930D467944688DDCBC77FA2246621315AD5D63E9835F,com.peacocktv.peacockandroid,ENTERTAINMENT,"Download Peacock, NBCUniversal’s streaming service. Peacock has all your favorite culture- defining entertainment, all in one place.  With Peacock, stream exclusive Originals, new movies from theaters like Puss in Boots: The Last Wish, thousands of TV shows — including Days of our Lives, Yellowstone, and The Office: Superfan Episodes — plus current programming from Bravo and NBC.  Stay up to date with live news and stream all your favorite live sports and events including WWE, MLB Sunday Leadoff, golf, Premier League, and so much more.  Here’s what you get with PEACOCK:  • Instant access to hundreds of movies from major Hollywood studios such as Universal, DreamWorks Animation, and Focus Features. • Thousands of hours of TV series, including full seasons of buzzworthy faves and bingeworthy classics. • Peacock Channels – playing your favorite entertainment and news. Scroll less and watch more with the SNL Vault, Fallon Tonight, NBC Sports on Peacock, WWE, NBC News NOW, TODAY All Day, True Crime, and Dateline 24/7. • Hit Spanish-language TV shows and news from Telemundo. • Up to 6 personal profiles to optimize your viewing experience.  With PEACOCK PREMIUM ($4.99/month), stream the full library of movies, episodes, and seasons — plus live sports and events. Tons to watch. Lots to love.  • Stream new movies from theaters and full seasons of exclusive premium TV like Yellowstone and The Office. • Every WWE Premium Live Event —including WrestleMania and SummerSlam — plus series, docs, and the WWE Vault. • Exclusive Peacock Originals, including Bel-Air, Poker Face, The Real Housewives of Miami, The Traitors, Queen’s Court, and more. • Live sports, including exclusive Premier League soccer matches, figure skating, golf, MLB Sunday Leadoff, IndyCar, and Super Motocross. • The streaming home for your Bravo faves, including The Real Housewives of Atlanta, Below Deck, and more. Dedicated Hallmark Media Hub featuring live and on-demand programming from Hallmark Channel, Hallmark Movies & Mysteries, and Hallmark Drama. • Current-season NBC hits like the One Chicago franchise, The Voice, Law & Order: SVU, Night Court, and Saturday Night Live. • Full library of Kids and Family entertainment.  With PEACOCK PREMIUM PLUS ($9.99/month), get everything included in Peacock Premium as well as:  • Stream Peacock ad-free.* • Stream your local NBC channel, 24/7. • Download available titles to your mobile device and watch later, anywhere.  *Due to streaming rights, a small amount of programming will still contain ads (Peacock Channels, events, a few shows and movies, and local content).  Content availability may vary over time.  Please note: Use of the Peacock app is limited to the United States and its territories. Video is accessible via 3G, 4G, 5G, LTE and Wi-Fi networks. Data charges may apply.  If applicable, subscription charges begin after any promotional period of Peacock Premium/Peacock Premium Plus concludes. You will be charged on a recurring basis as described above, minus applied offers plus applicable taxes. Your subscription will auto-renew until you cancel. Cancel at any time by visiting your account in the Peacock App. By subscribing, you agree to the preceding subscription terms and our Terms of Use and Privacy Policy below.  Sign up at www.peacocktv.com Terms of Use: www.peacocktv.com/terms Privacy Policy: www.peacocktv.com/privacy Customer Help: www.peacocktv.com/help Your Privacy Choices: www.peacocktv.com/do-not-sell-my-info CA Notice: https://www.peacocktv.com/ca-notice  This app features Nielsen proprietary measurement software, which will allow you to contribute to market research, like Nielsen’s TV Ratings. To learn more about our digital measurement products and your choices in regard to them, please visit http://www.nielsen.com/digitalprivacy for more information."
9C2F1CE72344A1150133893D23343EDA14A3D97E099AFE61B1B28430BD16E6CC,com.stremio.one,ENTERTAINMENT,"Stremio is a video streaming application, that allows you to watch and organize video content from different services, including movies, series, live TV and video channels. The content is aggregated by an addon system providing streams from various sources. Disclaimer: this application may show videos in their original aspect ratio"
08B712E346BDAA30E3FA7B2071E6314665B26F741B9A95E0ABAE8893E803A7C2,com.directv.dtvlatam,ENTERTAINMENT,"D GO has all the entertainment you are looking just in one place. Live and streaming TV experience, the best in sports, local channels, news, and   the   most   popular   series   and   movies   ON-DEMAND,   whenever   and wherever you want to watch them. No contracts, so you decide when you cancel the service.  How to sign up:  Sign up is extremely easy: Just visit the web site and choose which plan is  best for you and then create an account! Then, all you need to do is log in to the app. Easy, right? And gets even better! Start enjoying DGO  immediately, because you have 7 free days of service.  And there is even more: Watch DGO in all your devices: Smart Tvs, Tablets and Smart phones and others, TV via Streaming up to 2 simultaneous devices!  Also, you can count on exclusive DIRECTV SPORTS signals, the best of local and worldwide sports. Access exclusive shows and series from ON-DIRECTV right here, you have ON-DEMAND catalog with more than ten thousand of titles between series, Documentaries and Movies. Have fun with the family and enjoy children's contents in our Kids section. ¡All the major channels are right here, only in DGO!  Now download the app, sit back, and get ready to live the best of TV and Streaming together.  More information: Live programing, so you watch it when and where you want, the channels vary based on your plan and region where you are. News about your country and worldwide are on DGO!  Try it and let us know about your experience. What  are you  waiting for? Download the app or  upgrade and come  and experience   the   best   live   sports   and   news,   movie   releases   and   exclusive content.  If you need help, about plans, limitations and terms and conditions, visit our website and go to help or contact us at respuestas@directvgo.com.  DIRECTV's brands and other intellectual properties contained in them are property to THE DIRECTV GROUP, INC."
FB827A785D8ACCA54850ABCA6934593BF911C764331DB5CBD223E46B8C2094EC,com.showtime.standalone,ENTERTAINMENT,"SHOWTIME is your one-stop destination for critically acclaimed original series, star-studded movies, thought-provoking documentaries, pulse-pounding sports, and so much more. And the best part? New titles are added all the time, so there’s always something great to watch.  Downloading SHOWTIME will unlock:  •	Exclusive access to new episodes of SHOWTIME original series, like Dexter: New Blood, Yellowjackets, Billions, The Chi and more. •	Star-studded movies and exclusive groundbreaking docs •	The home of combat sports, with exclusive access to SHOWTIME Championship Boxing and Bellator MMA™ •	Unlimited access to our library of fan favorites, including Homeland, Shameless, and The Affair •	Stream wherever, whenever, and cancel any time •	Always commercial-free   No cable subscription necessary and you may cancel any time. Subscription available to anyone with a high-speed internet connection in the U.S.    *You will not be charged for the SHOWTIME streaming service during the free trial period. TO CANCEL YOUR SUBSCRIPTION AND AVOID BEING CHARGED, YOU MUST CANCEL BEFORE THE END OF THE FREE TRIAL PERIOD. To keep your subscription once your trial period is over, you will not have to do anything.  ©2022 Showtime Digital Inc., a subsidiary of Showtime Networks Inc. SHOWTIME and related marks are trademarks of Showtime Networks Inc., a Paramount Company. All rights reserved. SHOWTIME is accessible for viewing solely in the United States and its territories and possessions.   Privacy Policy https://www.viacomcbsprivacy.com/policy Cookies Policy https://www.viacomcbsprivacy.com/cookies Do Not Sell My Personal Information https://www.viacomcbsprivacy.com/donotsell"
A8D30F9E908F5B37AB4F0FCFFFFC71CA5D47C004A5F6EE42D7D064C1822DCC6F,com.graymatrix.did,ENTERTAINMENT,"Brace yourself for Rama Raju & Komaram Bheem from Rajamouli's Epic Tale RRR on ZEE5. Brace yourself for RRR on ZEE5. RRR's Rampage continues on ZEE5. Watch This Epic Tale of Friendship vs Promise only @ ZEE5. Watch with English Subtitles. Audio available in Telugu, Tamil, Malayalam & Kannada.  Choose & watch from The Kashmir Files, Valimai,  Bangarraju, Antim and many more Blockbuster movies and web series on ZEE5.   Subscribe to ZEE5 to enjoy 4500+ Movies, 200+ Web Series, Before TV & Ad-free content, Regional content, Live News, in your own language!  With the new, improved & lighter ZEE5 app, now stream to your heart’s content smoothly and lightning fast!   Reasons to join ZEE5: •	4500+ Movies •	200+ Web Series •	Watch latest episodes of your favourite TV shows Before TV telecast •	Ad-free content •	Video content dubbed in 7 languages  •	11 display languages & 12 content languages  •	Download and watch offline •	Live TV guide for channel programming  •	90+ Live News channels •	Catch up with your favourite ZEE network shows  •	Smart search including voice search  •	Personalized recommendation  •	Seamless video playback   Movies: Binge watch on 4500+ Blockbuster movies and be the first to watch upcoming movies. Whether its action, comedy romance, drama or thriller, we have a movie just for you, in your favourite language too! Subscribe to ZEE5 to watch films in Hindi, Tamil, Bengali, Malayalam, Telugu, Kannada and other languages! You can also watch 1500+ Blockbusters for absolutely free! Binge-worthy movies on ZEE5: Radhe, Silence…Can You Hear It?, Kaagaz, Nail Polish, Omerta, Yaara, Hacked, Judgementall Hai Kya, Uri: The Surgical Strike, Simmba, Badlapur, The Tashkent Files & more!  TV Shows: Catch up with your favourite shows anytime, anywhere for absolutely free! To watch the latest episode of your favourite show before its TV telecast, subscribe to Premium!  On ZEE5, you’ll find all the popular TV shows from the ZEE network in Hindi, Tamil, Bengali, Malayalam, Telugu, Kannada, Marathi & more! Popular TV shows on ZEE5: Kumkum Bhagya, Kundali Bhagya, Gattimela, Sembaruthi, Jothe Jotheyali, Kalyana Vaibhogam, Tujhse Hai Raabta, Krishnakoli, Chala Hawa Yeu Dya and more!  Web Series: ZEE5 has the maximum number of Web Series for you to enjoy! Now binge watch every day on 200+ thrilling Originals and other Web Series! Binge-worthy Web Series on ZEE5: Abhay S1 & S2, Rangbaaz, State of siege: 26/11, Code M, Mentalhood, Pitchers, Tripling, Bicchoo Ka Khel, Jeet Ki Zid, Kaafir and more!  Best of International Series on ZEE5:  Explore the best of shows from across the globe. Watch amazing Pakistani, Turkish, Korean & Spanish shows here for absolutely free!  Acclaimed international shows on ZEE5: The Young Pope, Pablo Escobar, Churails, Suno Chanda, Baaghi, Maat, Diyar-e-Dil, Bin Roye, Mann Mayal, Tum Kon Piya, Shehr-e-Zaat and more.   Live News & TV:  Stay up to date with all the latest news and watch stories from India & the world unfold! Watch top business videos, cricket scores, debates, live news and more only on ZEE5.  With access to 90+ live TV channels including, ZEE Marathi, ZEE News, BBC World, CNN, Aaj Tak, ZEE Business, Asianet news live, TV9 Kannada live, ABP news live & more, always stay one step ahead!  Kids: We’re making childhood fun with an amazing line-up for content especially for Kids!  Popular Kids Shows on ZEE5: Chhota Bheem, Krishna Makhan Chor, Gadget Guru Ganesha, Monsters & Pirates, Krishna Balram- The Warrior Princess & more!  Music Videos: Groove to the latest music with an amazing library of music videos. Check out the latest pop releases, Bollywood songs, old melodies, party songs and more!   Disclaimer: Availability of some content may differ based on content rights as per individual countries or regions.  Visit us on: https://www.zee5.com/  Please refer to terms and conditions for details: https://www.zee5.com/termsofuse  For details on privacy policy, please visit https://www.zee5.com/privacypolicy"
