sha256,pkgName,categoryID,description
FA4D3A08DA79E1DC34D7704A6065054D0C7291B6A1D105EA22CFD48EF33FF201,com.dstvmobile.android,ENTERTAINMENT,"As a DStv customer you can enjoy the shows, movies and sport you love with the DStv streaming app. Download now and get watching!  Never miss your favourite TV shows, sports team or breaking news with the DStv app, watch live on your smartphone, tablet or Android TV; catch up on the latest episodes and movies or download to watch offline later on your mobile app.  Kids hogging the remote? You can watch 2 streams online at the same time and catch up on your soapies or the latest episode of that series you’ve been enjoying. Out with friends but don’t want to miss the big game? Tune in on your phone and never miss your live sports again. Power outages getting you down? Sit back and relax while you catch up on your downloaded movies. As a DStv customer you can enjoy all of these features on the DStv app.  - Watch it as it happens, tune in and start live streaming selected TV channels via 3G/4G or WIFI. - Missed it live, catch it later by watching a selection of the most popular shows, sport highlights, and movies on Catch Up. - Don’t want to use mobile data to watch shows or movies, download up to 25 videos on Catch Up while on WIFI to enjoy offline later across 4 mobile devices.  - Want your own experience based on the sport, shows and movies you like to watch, setup up to 6 profiles to personalise each family members viewing experience. - Want to plan your viewing in advance, add Catch Up items to your watchlist to come back to later or access the full 8-day TV Guide and set reminders to arrange your viewing.  - Need to keep the kids entertained, our Kids section on the mobile app is a safe and fun viewing environment with PIN controlled access so your kids can enjoy the coolest shows and movies unattended.  The DStv mobile app gives you the freedom to watch your best-loved DStv entertainment when you’re on the move.  If you don’t have DStv, no problem, just download the app, sign-up, and start watching our selection of free live streaming channels and video on your smartphone, tablet or Android TV (available in South Africa only). As long as you’ve got the data, you’re good to go.   *The Live TV and Catch Up content on the DStv app will be as per your subscription package and country. Due to geo-blocking this content can only be played within the countries in the DStv territories.  For legal reasons, the DStv app is not available on uncertified Google devices. Please ensure that you are using a Google-certified device by going to Google Play Store Menu -> Settings -> Device Certification. Contact details: Facebook: /DStv - https://www.facebook.com/DStvSouthAfrica Twitter: @DStvCare - https://twitter.com/DStvCare Our Call centre: 011 289 222"
D7DB2B4B2099EF11FC22D8EEF42CDB654E386C073FA3920849E4E8BCCB537359,com.cbs.app,ENTERTAINMENT,"Welcome to A Mountain of Entertainment. Stream tens of thousands of full episodes—including favorites from CBS, Nickelodeon, Nick Jr., Comedy Central, BET, MTV and Smithsonian Channel—plus exclusive shows, brand-new originals, and live sporting events like UEFA Champions League and the NFL on CBS, when you subscribe to Paramount+.  • Watch full episodes on demand from hit series like Survivor, NCIS, SpongeBob SquarePants, Ink Master and more! (Plus, it’s all ad-free with the Premium plan.*) • Obsess over originals. Watch subscriber-only originals such as Halo, Star Trek: Picard, 1883, iCarly, SEAL Team, and The Good Fight. • Make every night a movie night with blockbuster hits and fan-favorite films from Paramount Pictures, MGM and more. • Access 24/7 live streams with around-the-clock news coverage on CBS News, scores + highlights on CBS Sports HQ and entertainment news on ET Live, plus 20 live channels of curated favorites. • Create up to 6 individual profiles for each member of your household. Have kids? Use our Kids Mode profile feature.  Watch live sports like NFL on CBS & UEFA Champions League. • Save your faves with our watchlist feature, My List.  Stream your local, live CBS station (Premium plan only). • Catch the best in live events including NCAA March Madness, The Masters Tournament, The GRAMMYs and more (Premium plan only). • Download and watch offline* (Premium plan only). • Stream even MORE originals, movies & sports when you get the Paramount+ with SHOWTIME bundle.  Try Paramount+ FREE now. After your trial, it’s only $4.99/month or $49.99/year for the Essential plan, or $9.99/month or $99.99/year for the ad-free Premium plan.*   Download the app now to get started.  *Live TV includes commercials and select shows have promotional interruptions. Downloaded content is accessible for earlier of 30 days from date of download or 48 hours from start of playback. Content availability subject to change. Please note use of the Paramount+ app is limited to United States. Paramount+ promotional offers for new subscribers only. Live TV subject to availability. Prices shown are in U.S. dollars. Other restrictions apply.  Your subscription will automatically renew after any applicable promotional period and your Google Play account will be charged the subscription price on a recurring basis until you cancel.  You can cancel your subscription at any time through your Google Play account settings.  If you cancel your subscription, the cancellation will go into effect at the end of your current subscription period, as applicable. You will have continued access to the Paramount+ Service for the remainder of your paid subscription period.  Please note: This app features Nielsen’s proprietary measurement software which will allow you to contribute to market research, like Nielsen’s TV Ratings. Please visit http://www.nielsen.com/digitalprivacy for more information.  Paramount+ Subscription Terms: www.pplus.legal/subscription  ViacomCBS Privacy Policy: https://www.viacomcbsprivacy.com/policy  Cookie Policy: https://www.viacomcbsprivacy.com/cookies  Do Not Sell My Personal Information: https://www.viacomcbsprivacy.com/donotsell"
1A3EE95DD31F728201EA120791FE2CA7C43357B9FAEBA0002A3E09228BF8BBAD,com.Funimation.FunimationNow,ENTERTAINMENT,"Stream Anime. Anytime. Anywhere.  Start watching the largest collection of English-dubbed anime and hundreds of subtitled shows from Japan on the Funimation app for Android. Stream on your time and from any place. Start your 14-day free trial today!   Funimation’s expansive library of HD, ad-free anime features movies, OVAs, extras, and the hottest, top trending shows like Demon Slayer, Fruits Basket, Black Clover, and Attack on Titan. And classics like Fullmetal Alchemist: Brotherhood and Black Butler — or smash hits like My Hero Academia!  Your anime adventures are about to begin!  Other benefits include:   Watch Ad-Free  Stream hundreds of new and classic anime without those pesky commercial interruptions.  Subs & Dubs Simulcasts straight from Japan — plus new dubbed episodes within two weeks of their Japanese broadcast.  Watch Offline Download your favorite episodes and watch on the go.  Full Control  Hooked on a new show? Add it and your favorites to the queue, skip forward or backwards in ten-second increments.  Do Not Sell My Info (For US users only):  https://privacyportal-cdn.onetrust.com/dsarwebform/d19e506f-1a64-463d-94e4-914dd635817d/b9eb997c-9ede-451b-8fd4-29891782a928.html"
D7F4673DCF5AA97AA77DBB9121417A83233BE38FA921675398A58E69F773D6A2,com.sling,ENTERTAINMENT,"The TV you love for a price you’ll love.  Stream live sports, news, popular shows, movies & more. Get customizable channel packages, 120K+ movies and shows On Demand and 50 hours of DVR storage included. No hidden fees and no long-term contracts. Pause or customize your service at any time.  Sports Sling has the live sports you can’t do without. Stream college basketball, NFL, MLB, NBA, NHL, college football, MLS soccer, golf, NASCAR, combat sports and more. Catch your favorite sports on ESPN, ESPN2, ESPN3, TNT, TBS, FOX Sports 1 and more. From college to pro, soccer to football, it’s all on Sling!  News Sling keeps you up to date on breaking news with channels like CNN, FOX News, MSNBC and Bloomberg, plus free channels like ABC News Live.  Entertainment Stream today’s most popular shows and movies live and On Demand. Sign up and start watching channels like Bravo, Freeform, A&E, Investigation Discovery, TBS, TNT and so much more.   Lifestyle Get your daily dose of gossip, home envy, competition and reality drama. Take on DIY projects with HGTV and satisfy your cravings for new recipes with the Food Network. Plus, get access to Hallmark, Cooking Channel, truTV, TBS, Bravo and more.  Kids’ Shows There’s plenty for the whole family to watch with channels like Boomerang, Cartoon Network, The Disney Channel, Disney XD, Disney Jr. and more.     International Sling TV is one of the best international streaming services in the U.S., offering programs in 22 languages, including Spanish, Hindi & Arabic.    Watch More On Demand Choose from over 120K binge-worthy shows and movies On Demand. Access hundreds of titles available for On Demand viewing. Rent new blockbuster movies to watch On Demand and purchase the biggest live pay-per-view events to stream on your favorite devices.   Record Live You’ll automatically receive 50 hours of DVR storage with your Sling subscription! If that’s not enough, you can upgrade to DVR Plus and record up to 200 hours of storage. Record your must-watch sports, news and shows, then, watch them on your schedule.  Sling Free Stay informed and entertained with thousands of hours of FREE live and On Demand TV with Sling Free. No credit card required. Stream full seasons of hit shows like Hell’s Kitchen or Forensic Files, watch free movies and see what’s trending for paid Sling subscribers.    Sling Channel Lineups Choose from three base subscriptions.  Sling Orange offers 30+ channels perfect for families and sports fans for $40/mo.  Sling Blue offers 40+ channels perfect for entertainment and news for $40/mo.  Sling Orange & Blue gives you every channel from both packages for $55/mo.  Download the Sling app on your favorite devices including iOS and Android, Amazon Fire TV, Roku, Google Chromecast, smart TVs, game consoles, and more. Sign up and start watching today!  Please note: This app features Nielsen’s proprietary measurement software that will allow you to contribute to market research, like Nielsen’s TV Ratings. Please see www.nielsen.com/digitalprivacy for more information."
A535A2B27228763B4CA36367A5074F85AF008B21ADB0ED1F3F25BB19E7E9179E,tv.pluto.android,ENTERTAINMENT,"The leading free streaming TV and movie service is available to you! Watch 100s of live TV channels and 1000s of movies and TV shows, all streaming free. Pluto TV also offers over 45 channels in Spanish, including native language and dubbed movies, reality TV, telenovelas, crime, sports and more. Pluto TV is 100% free and legal: no credit cards, contracts, or bills.  Pluto TV has the best in hit movies, cult classics and blockbuster films. You’ll find something for you and the whole family on Pluto TV, with hits such as “Forrest Gump,” “Boogie Nights” and “Super 8.” Ready for action? “Top Gun,” “Face/Off” and “The Italian Job” will keep you on your toes. Looking for laughs? We’ve got “Major League,” “Good Burger” and “Harold & Kumar Go to White Castle.” ¿Te gustan las películas? Ve “No Manches Frida” y la telenovela “Doña Bárbara” en español.  Choose from our library of 1000s of on-demand movies and TV shows or from our 27 exclusive movie channels including:  The biggest hit movies -Full seasons of your favorite shows -Chilling true crime and drama series -Hilarious comedy shows and stand-up specials -Spanish-language movies & shows -The wildest reality TV shows -The latest breaking news -Live sports, classic games, news and analysis  Your favorite shows are streaming 24/7 on Pluto TV. Catch full seasons of CSI, Star Trek: The Next Generation, RuPaul’s Drag Race, and Narcos on their own channels, and watch classics like Survivor, Beavis & Butthead, Unsolved Mysteries and more whenever you want.  Check back often, so you don’t miss the great new movies and shows we’re adding to our on-demand library every day from top content providers like Paramount, CBS, MGM, Sony and Lionsgate! Binge on 1000s of movies and TV shows any time you want!  Stream now, pay never when you download Pluto TV today.  Privacy Policy: https://privacy.paramount.com/en/policy Cookie Policy: https://privacy.paramount.com/en/cookies Do Not Sell My Personal Information: https://www.viacomprivacy.com/vdns.html Terms of Use: corporate.pluto.tv/terms-of-use/"
26D3A125B4ECD7ADF37E990EE7BC4BACCDF8BB24C16DFE84D23F78E7C417C698,tv.lfstrm.smotreshka,ENTERTAINMENT,"In one app, Smotrеshka offers five streaming services and more than 300 TV channels. Watch PREMIER, START, Amediateka, viju, and more.tv, along with movies, football, cartoons, and series on up to 5 devices, anywhere with Internet access.  The app is available on smartphones, tablets, Smart TV, web browsers, set-top boxes, including Apple TV, and supports AirPlay and Google Cast.  Smotreshka features over 20,000 movies, series, and cartoons from time-tested classics to the most recent releases from 5 popular streaming services. The Cinema tab is a constantly updated collection of extraordinary films.  Looking for a movie or TV show? End-to-end search in the app makes it easy to find the content you need. TV channel broadcasts are sorted by genre and type and archived for up to 14 days. Pause, hold, or set a reminder to watch a show later.  Add a channel to ""Favorites"" for quick access. Based on your TV profile, the personalized recommendation system suggests similar-themed channels and programs.  Most of 300+ channels are available in HD and 4K. Home Internet, 3G/LTE, or Wi-Fi are all suitable - bitrate auto-tuning enables the app to be used even with a slow Internet connection.  The terms of the user agreement can be found here: https://smotreshka.tv/user_agreement"
A339303F0148F3C232A0C575772A1D318E8AEC5459216FE363138DB0C9A6C34E,com.kpn.epg,ENTERTAINMENT,"Using the KPN iTV Online app, you can watch your favorite films and programs on your smartphone or tablet. The iTV app offers the following features:  - Watch live TV wherever and whenever you want. Even on holiday!* - Check what’s on using the Guide - View and manage your recordings** - Access On Demand films and series using the Search page, wherever you are - Discover new programs or films with suggestions on the Homepage   * The iTV app can only be used in the EU. For an overview of the participating countries, check www.kpn.com/itvapp ** Only in combination with the Opnemen Pakket   How does the iTV app work? The iTV app has been renewed, improved and stabilized. The app looks different, too, which enables you to find content more easily. For a more extensive explanation about the new app, check www.kpn.com/itvapp.   You can log in with your KPN ID or your subscription number and PIN-code.   Please note that the app is available for devices with Android 5.0 or higher.   How much does it cost? Customers with Interactive TV from KPN can download the app for free.   Conditions This App is a Supplementary Service in the sense of the Terms and Conditions for Electronic Communication Services between you and KPN. KPN reserves the right to block the service in the case of an excessive number of devices used with the Interactive TV app. As such, KPN keeps track of the number of devices for which your iTV subscription was used to log in to the app."
E1EFC6FA4C4EA68B1EF78DC8CBD9D56D14D4CC528A34FFCE695054D23820E3C2,air.com.vudu.air.DownloaderTablet,ENTERTAINMENT,"Movies, anywhere. Want to buy, stream, rent or watch them for free? Get the free Vudu app and instantly watch movies and TV shows wherever and whenever you want, on your phone or on the device of your choice. Join us freely – no subscriptions and no contracts to sign here! Watch new movies and shows weeks before they hit the shelves and other subscription streaming services. Stream with stunning clarity and sound in up to 4K UHD, with Dolby Vision HDR and Dolby Atmos audio on select devices. Or watch thousands of titles free with limited commercials with Vudu Movies On Us – now also on the Android TV app.   Discover 7 reasons why you'll love Vudu:  YOUR PHONE = YOUR ENTIRE LIBRARY A movie library on your phone? Vudu makes it all possible. All your movies and TV shows can now be found on your phone, and yes, even the brand new ones! Our library can also keep you busy for ages: with over 100,000 movies and shows, the possibility to link your Disney Movies Anywhere account, and new ones coming out every month, you'll always have something to enjoy.  WATCH WHAT YOU WANT, HOWEVER YOU WANT Stream, rent, or own? Download and watch offline? Do you want to pay? You get to decide exactly how you want to watch your TV shows and movies.  FREE MOVIES Movies, for free. (Really.) With Movies On Us, a Vudu exclusive, you can watch thousands of movies with limited and short commercials, and not have to pay.  DOWNLOAD & WATCH OFFLINE If you buy or rent a movie or a TV show, Vudu lets you download it on your phone. Enjoy your library offline! And forget about buffering: you won't depend on a flimsy Wi-Fi signal to stream anymore.  NO SUBSCRIPTION Only pay for what you want to watch. Don't pay for a catalogue of shows you don't want to watch: get only what you want.  TURN PHYSICAL INTO DIGITAL You already own a physical copy of a movie? With Disc to Digital, scan a UPC and convert hard copies into digital format in one click only. Download what you own and enjoy your movies offline.  SEAMLESS INTEGRATION Vudu is supported by Google Chromecast. That's right, you don't have to limit yourself to your phone screen: go big and watch your new movie on your home TV set.   Like our app? Please rate and review it. And let us know your comments at Googleplay@vudu.com.  Learn more about Vudu UHD at http://www.vudu.com/UHD  By downloading, installing & using this App, you agree to Fandango’s Privacy Policy (https://www.fandango.com/policies/privacy-policy) and Terms and Policies (https://www.fandango.com/policies/terms-and-policies). Your Privacy Choices: https://www.vudu.com/privacy"
C21B58A2CED8ECCE5EE7CE03BBF4A2554D4DE45D0B5B3A1125BD550C8EB1A659,com.zattoo.player,ENTERTAINMENT,"Zattoo lets you stream all your favorite TV channels in one app: at home and on the go. That's how modern TV works: <b>Simple. Good value. Multiscreen.</b>  Watch blockbusters, series, live sport, exciting documentaries, and entertainment at home on your smart TV or away on your smartphone. With Zattoo you can access TV anywhere with internet. Free yourself from cables and satellites and try the television of the future with the test winner for image quality.    Subscriptions can be tested for 30 days free of charge. Zattoo will give you a heads up when the trial period ends. You can also cancel your subscription at any time. So no risk.  With Ultimate, we offer you <b>a very attractive alternative to traditional cable and satellite television</b>, especially for big-screen TVs, thanks to: • Full HD quality for the most popular TV channels  • Up to 4 concurrent streams  • Timeshift functionality  • The ability to record and save shows   All Zattoo packages include:  • Additional content in our On Demand library  • TV Guide and personalised TV recommendations   With our subscription offers Ultimate and Premium you get our restart and pause functions, so you’re no longer tied to broadcasting times and you can also stream all content anywhere in the EU.   Private channels such as Pro7, Sat1, Kabeleins, RTL, RTL2 etc. are available with the Premium or Ultimate subscription.  Broadcasters cou can stream for free with Zattoo:  • All German public broadcasters: Das Erste, ZDF, arte, 3sat…  • Sports and special interest channels such as Eurosport, Sport1, Tele 5, WELT, HGTV, DMAX, TLC....  • Stations for children and the younger generation: Comedy Central, Nickelodeon, KIKA, …   "
2C637A5A7EE5D5BC9C146D9DD4819C3169FBD05CE3B733E63B6D735207732A0B,com.google.android.youtube,VIDEO_PLAYERS,"Get the official YouTube app on Android phones and tablets. See what the world is watching -- from the hottest music videos to what’s popular in gaming, fashion, beauty, news, learning and more. Subscribe to channels you love, create content of your own, share with friends, and watch on any device.  Watch and subscribe  ● Browse personal recommendations on Home ● See the latest from your favorite channels in Subscriptions  ● Look up videos you’ve watched, liked, and saved for later in Library   Explore different topics, what’s popular, and on the rise (available in select countries) ● Stay up to date on what’s popular in music, gaming, beauty, news, learning and more ● See what’s trending on YouTube and around the world on Explore ● Learn about the coolest Creators, Gamers, and Artists on the Rise (available in select countries)  Connect with the YouTube community ● Keep up with your favorites creators with Posts, Stories, Premieres, and Live streams ● Join the conversation with comments and interact with creators and other community members  Create content from your mobile device ● Create or upload your own videos directly in the app  ● Engage with your audience in real time with live streaming right from the app  Find the experience that fits you and your family (available in select countries) ● Every family has their own approach to online video. Learn about your options: the YouTube Kids app or a new parent supervised experience on YouTube at youtube.com/myfamily  Support creators you love with channel memberships (available in select countries) ● Join channels that offer paid monthly memberships and support their work ● Get access to exclusive perks from the channel & become part of their members community ● Stand out in comments and live chats with a loyalty badge next to your username  Upgrade to YouTube Premium (available in select countries) ● Watch videos uninterrupted by ads, while using other apps, or when the screen is locked ● Save videos for when you really need them – like when you’re on a plane or commuting ● Get access to YouTube Music Premium as part of your benefits"
7163895157AE307EE0B258C69B59448F35EAEFB0F50A2AD353B4AA809BFAA70B,com.google.android.videos,VIDEO_PLAYERS,"Google TV, previously Play Movies & TV, makes it easy to find and enjoy the entertainment you love in one place. With Google TV, you'll be able to:  <b>Find what to watch next</b> Browse 700,000+ movies and TV episodes from across your streaming apps, all in one place and organized into topics and genres. Discover new things with recommendations based on what you love and what’s trending across the services you already have access to. Search for titles to see which streaming apps offer them. <b>See the latest releases</b> Buy or rent the newest movies and shows right in the Shop tab. Purchases are stored in your Library and can be downloaded to watch when you're not connected. Watch instantly on your laptop, Android phone or tablet, or on your TV with Google TV or on Play Movies & TV where available.  <b>One list for all your discoveries</b> Add interesting shows and movies to your Watchlist to keep track of your new discoveries and view them later. The Watchlist is shared between all your devices, so you can even add to your Watchlist from your TV or phone and laptop through Search on any browser. <b>Use your phone as your remote </b> With a remote built right into the app, you can find something great to watch even when the couch has eaten your remote. And you can use your phone’s keyboard to quickly type complicated passwords, movie names or search terms on your Google TV or other Android TV OS device. <i>Pantaya is a service only available in the US. Separate subscriptions required for certain streaming services or access to certain content.</i>"
