sha256,pkgName,categoryID,description
0B137F3B9B65FE41C3B1127D4F5BF6F6E9B131EF5B07AF2520DC7A7ACB9C95B9,tv.molotov.app,ENTERTAINMENT,"Regardez facilement toute la télévision française en streaming avec Molotov. Naviguez parmi de nombreux programmes : actualités et infos, séries TV françaises et US, films, sport, documentaires, télé-réalité, programmes enfants, divertissement…  Profitez de fonctionnalités gratuites :  • LES CHAÎNES DE LA TNT EN DIRECT ET EN REPLAY*  : France 2, France 3, France 5, Arte, C8, NRJ12, LCP-Public Sénat, France 4, BFM TV, CNews, CSTAR, L’Equipe, RMC Story, RMC Découverte, Chérie 25, France Info, la chaîne de l’INA, Brut, France 24, BFM Business, LCP 100%, Public Sénat.   • MINI-PLAYER : Gardez un œil sur vos programmes sportifs préférés et ne loupez aucune action.  •  DIFFUSEZ SUR VOTRE TÉLÉ : Avec une clé Chromecast* ou sur Apple TV, diffusez les programmes que vous aimez en direct, en replay et en qualité HD.  •  MULTI-ÉCRANS : Commencez la lecture d’un programme TV sur votre mobile, votre tablette ou votre ordinateur et terminez-la sur un autre écran grâce à la reprise multi-écrans.   Pour profiter d’une plus large sélection de programmes, ajoutez une ou plusieurs options selon vos intérêts.   Abonnez-vous et profitez des avantages SANS ENGAGEMENT :   •  ENREGISTREMENT* : Enregistrez vos séries, films, documentaires, magazines, dessins animés, ou programmes sportifs préférés et regardez-les quand vous voulez.   • CHAÎNES PREMIUM EN DIRECT ET EN REPLAY: TF1, M6, W9, TMC, TFX, Gulli, 6ter, LCI, TV5Monde, RTL9, Paris Première, Téva, Comedy central, Crime District, AB1, KTO, Euronews, i24News français, BSmart, CNN, France 24 (anglais, espagnol, arabe), i24news (anglais, arabe),...  • BOUQUETS PREMIUM : OCS, CINE+, Adult Swim, Toonami, FILMO, Lionsgate+,...  • ACCESSIBLE PARTOUT EN EUROPE** : En voyage ? Ne ratez rien de vos émissions favorites avec Molotov.   • DIFFUSION EN SIMULTANÉ* : Jusqu’à 4 écrans disponibles.  • CONTRÔLE DU DIRECT : En retard ? Reprenez vos programmes au début*. Absent ? Mettez sur pause.  -------  * Selon les chaînes et programmes. ** Fonctionnalité réservée aux résidents français (France métropolitaine et Drom Com). *** Selon compatibilité de l'équipement et du réseau  Détail des programmes :   TF1 (Star Academy, Ici tout commence, Demain nous appartient, Téléfoot, Football - Coupe du monde 2022 : le mag, le Late avec Alain Chabat, cérémonie d'ouverture de la coupe du monde 2022 au Qatar, match de football Qatar - Equateur, match France Australie, match de football France - Danemark, match de football France Tunisie), France 2 (Un si grand soleil, On n’est pas couché) , France 3 (Plus belle la vie, Les enquêtes de Murdoch, Tout le sport), France 5 (C dans l’air, C à vous, La maison France 5, Echappées Belles), M6 (Bull, Kaamelott, Top Chef, L'Amour est dans le pré, Pekin Express, Capital, Zone interdite, Enquête exclusive, Scènes de ménage, NCIS, Le meilleur pâtissier), Arte, C8 (Touche pas à mon poste, TPMP), W9 (Les Marseillais, Un dîner presque parfait, Les Cinquante), LCP-Public Sénat, France 4 (Taratata), BFM TV (Le live BFM, BFM Story, Le 20H, Le journal du mondial, BFM Foot), CNews, CSTAR (Top clip, Top streaming, Top album), Gulli, France O, L’Equipe (Football, L’équipe Mercato, L'Equipe du soir, L'Equipe Foot), 6Ter (Marvel), Numéro 23, RMC Découverte, FranceInfo, la chaîne de l’INA, TV5 Monde, France 24 (Le journal du mondial), BFM Business, EuroNews, Cheddar, LCP 100%, Public Sénat, Fashion TV (Fashion Week), Luxe TV, Luxe TV 4K, Winamax TV.   OCS (Game of Thrones, House of the Dragon, The Handmaid’s Tale, The Walking Dead), CINE+, Adult Swim (Rick et Morty)  Conditions d'utilisation : https://www.molotov.tv/legal/terms"
3DC2D6B20779DCEFA89A5F083045915441BB07B78AE6F10EF7A43FD5208F487A,com.iqonic.streamit,ENTERTAINMENT,"STREAMIT – Flutter Full App For Video Streaming With Wordpress Backend is a powerful media and video streaming WordPress project. Build your netflix like flutter app with this easy-to-customize and feature-rich video straming app. Streamit - Best Video Streaming App is a perfect package for video, movie, show streaming related mobile app. Flutter Full App For Video Streaming With Wordpress Backend also allows you to to create a list of movies, videos and TV shows. It has a user interface with an amazing UX, and multiple homepage versions. Streamit gives a very rich native feel and is optimized for fast responsiveness.  Have you ever wished to build a your own netflix like video streaming app similar to YouTube, Netflix or a simple video-based app using WordPress? Streamit lets you create a mobile app for both iOS and Android within minutes.  What benefits you get with Streamit?  Streamit is an absolute match for media streaming app based projects. It has a well crafted demo to create a new website. Streamit has a wonderful typographic appeal to make your buyers and subscribers focus on every word you write and increase sales.  App Features:  - Search TV Shows, Movies, and Videos - Autoplay Trailer - Quik Episode Viewer - Dynamic Dashboard - Caste Video to Smart TV - Genre Section - Caste Section - Embedded Video Support - YouTube Video Support - Vimeo Support - Recommended Movies - Upcoming Movies - TV Shows - Episode - Multi-Language Support - RTL Support - Banner Slider - Watchlist - Like Functionality"
09FF1002B1E6DE7CFBCA5F8F183D7BABD2525F69C8E8CEAC8D33C111FD294A9E,com.watchit.vod,ENTERTAINMENT,"WATCH IT is your main video on-demand service for Arabic content online. With an exclusive collection of various entertainment options of movies and TV shows, you will always find what you are looking for on WATCH IT.   What you’ll get when you download WATCH IT:  Original WATCH IT productions You will get access to exclusive WATCH IT Originals that can’t be found elsewhere    The biggest library of Arabic and Egyptian content worldwide Library includes an exclusive selection of Arabic and Egyptian movies as well as it is home to all top Egyptian shows and entertainment programs    Multiple profiles and customization Create different profiles for members of your household with the ability to customize each profile    Safe, Family-friendly experience Library’s content is safe for all members of your family in addition to designated profiles for your kids    Multiple Devices Log onto your account from different devices and watch different content on up to 3 devices at the same time    Browse the library You can preview the library before you log in and preview content before you can watch it"
E70C641F0A8CDAD3D8FE644BF9068E62CB90F23F3A1E4F03B64EF886C31FC887,com.viva.vivamax,ENTERTAINMENT,"Original Pinoy entertainment at its best. All the top Filipino blockbuster movies and hit television series from every genre.   All of these at your fingertips.  Only from Vivamax. Atin 'to!  Here’s what you can do with Vivamax: 1. Stream all you want. Browse your favorite Pinoy content and stream them straight on your device. 2. Add titles to your Watchlist and binge on. 3. Save your data. Download Pinoy titles on your device and watch them offline anytime, anywhere. 4. Watch new titles and proudly Filipino made Originals, exclusive on Vivamax. Atin ‘to! 5. Enjoy uninterrupted viewing. Access the biggest library of Filipino content with no ad interruptions."
F95DD68AA472B6B52C4F601068B3C9BC9BC4F88C1D3C0744691C1463732A8F1D,com.dramafever.shudder,ENTERTAINMENT,"Called “one of the best streaming services in the world” by RogerEbert.com and described by Thrillist as “pretty much everything a horror fan could want,” Shudder is the premium streaming service offering the best selection of horror, thriller and supernatural movies and series, from Hollywood favorites and cult classics to original shows and critically acclaimed new films you won’t find anywhere else.  Don’t miss out — try Shudder commitment-free for 7 days and get unlimited access to the full library of films and TV series, uncut and ad-free. Watch on your phone, tablet, or TV with your Google Chromecast.  Plans start at only $4.75/month when you sign up for an annual membership. Sign up and start streaming today."
F5DCF31B58288D1D87AABAD3B6EC9E740EC260DE2196141B23D68EBB008ECC85,com.univision.prendetv,ENTERTAINMENT,"Enjoy ViX, the world's largest Spanish-language streaming service application, always FREE. We have more than 100 live and on-demand TV channels for you, with novelas, movies, comedies, series and 24/7 news.   Download NOW! Open the app and start enjoying our FREE streaming service immediately on all your favorite devices. Watch ViX anywhere, anytime.  ViX offers the best in series, Hollywood movies, funny comedies and live sports. On ViX you'll never have time to get bored. It's totally FREE!   Unlimited entertainment, anywhere, anytime.   ● Enjoy full episodes of your favorite shows/novelas. ● Classic comedies that make you laugh out loud. ● Dramas, action, reality TV and documentaries ● FREE movies   ● The best of live soccer ● 24/7 news ● TV for every member of the family ● No credit card or subscription required ● Totally FREE, you won't spend a penny!   And to access even more content, subscribe to see much more of what you love.    ● The best original series produced in your language. ● Exclusive movie premieres every week ● Best-in-class live sports such as UEFA Champions League, Liga MX and the most popular soccer classics in Latin America. ● Cancel whenever you want  *Some content will only appear in certain regions or countries.  ViX is owned and operated by Televisa Univision and is part of the Univision family of companies"
54FDA4BA36CD4F7942FCA53DA1670B1E55493C42B9E07CC2B80D367C3AE3DA79,com.starz.starzplay.android,ENTERTAINMENT,"Start your free trial now. LIONSGATE+ delivers a deep library of entertainment told from fresh perspectives. Stream or download bold original series like Dangerous Liaisons, P-Valley and Power Book III: Raising Kanan, with many premiering the same day as the US. In the mood for a movie? There’s no shortage of curated hits like Spider-Man, Reservoir Dogs and Nocturnal Animals. With new shows and movies being added all the time, LIONSGATE+ is a must-have app. Start your free trial now!  Here’s what you get: - New captivating series and curated movies added every month - Unlimited HD streaming and downloads. Going somewhere without wi-fi? No problem. Download what you want to watch and enjoy it whenever, wherever - Stream on up to 4 devices at the same time - Cancel anytime.  Ready to get started? Here’s what to do next: 1) Download the LIONSGATE+ app. 2) Start your free trial. You can cancel at any time. 3) Create your LIONSGATE+ profile and enjoy hours of content on Android devices. 4) After your free trial period, pay monthly subscription   STARZ / Lionsgate"
C5A16B0EC3922CFAA19C6475D03E68F4E0EBC13D976657D38AB0116280A6451E,com.streamlabs,VIDEO_PLAYERS,"Streamlabs is the best free video live streaming app for creators. Play mobile games and stream your screen or broadcast your camera to social platforms such as Twitch, YouTube, Facebook, and more!  With similar features as Streamlabs Desktop packed on your mobile device, you can chat with people all over the world as they watch your epic gameplay and live broadcast everyday adventures in real-time. The app also works with Streamlabs widgets like the Alert Box, Chat Box, Event ist, and more! Take your stream to the next level with Streamlabs Ultra and unlock exclusive features like multistream and professional mobile themes.  ⭐️ STREAM TO ANY PLATFORM Unlike other apps that have you join yet another social live streaming network, Streamlabs links to your existing channels so you can go live and chat with fans whenever you want! Custom RTMP destinations are also supported, all you need is your URL and stream key. Stream to platforms like Twitch, YouTube, Facebook, Loola, Trovo, Nimo, and more. One app, infinite destinations!  ⭐️ STREAM GAMES Game streaming made simple. Whether you’re playing PUBG Mobile, Call of Duty Mobile, Free Fire, Clash Royale, Pokemon GO, or any other mobile game, the app makes it easy to share gameplay with your fans. You can add a microphone, stream internal audio, or mix different sources together inside the app.  ⭐️ BROADCAST YOUR CAMERA Swap between front and rear cameras and stream high quality video to your fans. Whether you’re a travel vlogger, musician, podcaster, or are just chatting, the app lets you take your audience with you on the go.  ⭐️ PERSONALIZE YOUR STREAM Customize your stream with professional mobile themes. Make your stream unique by adding beautiful overlays in a few easy clicks. You can also add your own logo, other images, and text to your stream.  ⭐️ ALL YOUR WIDGETS Simply select the widgets you’d like to include in your mobile stream and we’ll do the rest. Available widgets include Alert Box, Chat Box, Event List, Donation Ticket, The Jar, Donation Goal, and many more to come!  ⭐️ DISCONNECT PROTECTION Get your very own private server hosted on the Streamlabs Cloud. This ensures if your mobile real-time stream gets disconnected, your stream won’t go offline and lose all your precious viewers. Unlimited bandwidth and private server included for free in Ultra.  ⭐️ CUSTOMIZE EVERYTHING Like Streamlabs Desktop, the Streamlabs mobile app gives you full customization of your stream. Adjust the bitrate, frames per second, audio sampling rate, which events trigger alerts on stream and much, much more. Customize whatever you want, there's no one way to make an omlet.  ⭐️ REWARDS Get rewarded for streaming more. Earn points by going live, setting up your account, and broadcasting to new destinations. Redeem your points inside the app on exclusive rewards like multistream and free mobile themes.  Start streaming in seconds and share your experiences with the world using the Streamlabs mobile app.  Your fans are waiting!  Privacy Policy: https://streamlabs.com/privacy Terms of Service: https://streamlabs.com/terms"
F44AEF7DBE107001F8F85AFEE79372C4E59FC758200CB26CE6132F798EDB0D51,air.ITVMobilePlayer,ENTERTAINMENT,"Stream all of ITV and so much more only on ITVX, the UK’s freshest streaming service. So fresh, you’ll find more new shows for free than anywhere else. All coming to a screen near you each and every week. Share the biggest moments in TV – the moments that bring us together. Watch the nation’s biggest live events – the events that connect us. It’s all yours to play with so tune into what you’re into, whenever you want.   ITVX is the new home of ITV Hub. But bigger, better and fresher than ever. It’s full of films that refresh regularly, thousands of iconic British and American box sets, and exclusive series. Hilarious sitcoms, irreverent game shows, classic dramas, cult classics and event extras. Live. On demand. Catch up. And feel like you’re right there in the stands with world-class sport straight to your screen as it happens. It’s all fresh, and it’s all free. Let’s go.    Go Premium to stream even more fresh shows and films including the very best of BritBox. All ad-free. Whether you’re at home, or on the go across multiple screens.    ITVX is right here, right now. Stream free.  *Ad-free applies to our on demand library only and programmes may contain ITV promotions where contractually required. Live TV plays with ads."
F2A3575307B587D65CC5F3622EB29A94F5B91FAF7EED04FE683B56F17D042E09,com.discovery.dplay,ENTERTAINMENT,"discovery+ is the place for Reality, True Crime, Paranormal, Documentaries, Live Sport and so much more. Stream your favourite brands, including Discovery, TLC, Quest, Really, Quest Red, Food Network and more. From surprising human stories, to eye-opening documentaries and bold, exclusive Originals - there's something for everyone!   Start watching now!  With discovery+ you get: • Your favourite shows and personalities from the best TV brands including Discovery Channel, TLC, Quest, Really and more • Front-row seats to Roland Garros, Grand Tour cycling, snooker, motorsports and so much more • All the drama of 90 Day Fiancé! discovery+ is the only place to catch all the must-see moments and exclusive new series • Exclusive discovery+ Originals - can’t-miss, exciting new series you won't see anywhere else • Fresh new episodes and series added all the time - from reality and true crime to paranormal, documentaries, live sports and more • Full access to watch anytime, anywhere on your mobile device, tablet, computer and connected TV*  Features: • Browse or search with ease across the best in: True Crime, Paranormal & Reality, Sport and Documentaries • Catch the action in Cycling, Tennis, Snooker and Motorsports, live and on demand • Watch anytime, anywhere* • Create up to five personalised profiles • Pick up episodes where you left off across your favourite devices • Save episodes to watch later with My List  Start watching now!  *Internet required.  Free content available when you download the app. Premium content requires a subscription. If your plan comes with a free trial, you'll be charged as a recurring transaction starting at the end of your free trial (unless you cancel during the free trial). Payment automatically renews unless you cancel before the end of the current subscription period. If you subscribed via the Google Play Store, you can manage your subscription or cancel there. If you subscribed to discovery+ via web, you can manage or cancel your subscription in the Account section. discovery+ is available to customers in the UK and Ireland.  Terms of Use: corporate.discovery.com/discoveryplus/legal/terms-of-use/en  Privacy Notice: corporate.discovery.com/discoveryplus/legal/privacy/  Cookies & Tracking Technologies Notices: corporate.discovery.com/discoveryplus/legal/cookies-and-tracking-technologies-notice/  Help Centre UK: support.discoveryplus.com/hc/en-gb  Help Centre Ireland support.discoveryplus.com/hc/en-ie  We may work with third-party advertising companies and other partners that help us deliver tailored advertisements to you. To opt-out of behavioral tracking on mobile devices, you may use the DAA AppChoices Tool, available at http://www.aboutads.info/appchoices.  This app features Nielsen’s proprietary measurement software, which will allow you to contribute to market research, such a Nielsen TV Ratings. To opt out of Nielsen measurement on mobile devices visit Nielsen’s mobile opt-out pagehttps://sites.nielsen.com/legal/privacy-statement/nielsen_app_output/#."
971FC4E8D3357514F03A20EB6494DE22A0F65BE30A4752EA9754236CEE6EB61A,com.jio.media.ondemand,ENTERTAINMENT,"JioCinema – Watch Tata IPL for free on all networks.  Commentary in Hindi, English, Bhojpuri, Bangla, Marathi, Gujarati, Tamil, Telugu, Kannada, Malayalam, Punjabi, and Odia. Sharpest 4K picture. Immersive Dolby Atmos Sound. Control Camera Angles. Hear your Favourite Experts. Highlights & Updates. Amazing HYPE. Watch now.  JioCinema, your favourite video streaming app to watch live sports, entertainment, TV shows, movies, original web shows, LIVE cricket, match highlights for free.  With a fresh look, non-stop entertainment, and wonderful experiences, this on-demand video streaming platform brings over 1 lakh+ hours of exciting Movies, TV shows Originals & Videos. Along with this you can also enjoy LIVE sports, match highlights & interviews of your favourite players, all for free. You can browse through Hindi, English, Tamil, Kannada, Marathi, Telugu, Bengali, Gujarati, Bhojpuri, Malayalam, Punjabi & dubbed content.  For the Love of Sports - Live Streaming  We have an all-new tab for your favourite sports where you can live stream top sports content for free. Be it, Kohli and Rohit’s super sixes, or Messi, Neymar, Mbappe & Ronaldo’s goals or Stephen Curry’s long hoops, or smashes from Nadal, you can live stream and enjoy events for free.  Along with this we have 2022 FIFA World Cup, FIFA U-17 Women’s World Cup, UEFA Champions/ Conference League 2022/23, Championship League, Premier League, Liga Serie A, Soccer Events, Indian Premier League (IPL) & many more action events across the globe at 4k Ultra high quality for free.  In addition to this, you can watch highlights of Football, Basketball, Cricket, Tennis and much more. And with our latest feature watch-party, you can enjoy the matches together with your friends, family & loved ones.  Coz’ we all love little drama  For your daily dose of TV, we bring to you popular TV shows like Bigg Boss 16, Naagin, Pishachini, MTV Hustle 2.0, Udaariyaan, MTV Roadies & more. We also bring to you Korean dramas dubbed in Hindi like Melting Heart, Bride of the century & many more.  Movies … Masti… Magic  There is something for everyone! Explore our diverse range of movies across genres ranging from drama, action, comedy to romance. Start with some super-hit recommendations from our library which includes Dasvi, Mimi, Roohi, Love Aaj Kal, One Day: Justice Delivered, Luka Chuppi, Stree, Andhadhun, Baazaar & more.  Entertaining Videos & Sneak Peaks  Now enjoy your favourite Bollywood classics in under 30min. Never miss out on the Extra Masala of your favourite reality shows Watch Unseen-Undekha, Highlights, Cutless many more. Also, get a sneak-peek on the latest trailers and enjoy an ultimate collection of the finest music videos from artists across the world.  JioCinema Features  All new sports tab with for free Live Streaming, Match Highlights, Score cards and commentary for major cricket and football matches like FIFA World Cup 2022, UEFA, Indian Premier League (IPL), International ODIs, Premier League, FIFA U17.  Streaming available for both Jio & Non-Jio users at free of cost Chromecast support to watch your favourite movies & shows on TV With Picture-in-Picture mode, stream while simultaneously checking your office emails  Enjoy matches together with the new watch-party feature Resume watching from where you left off across any compatible device Choose the quality at which you want the video to be played Get entertained without any advertisement pop-ups Watch movies, Indian TV shows, web series, animated movies, Bollywood interviews, K pop and browse the app simultaneously - by just dragging and docking the player  Keeping up with the trend by having Auto-Play on the Video screen Also available on the web: www.jiocinema.com Multiple audio support also on JioCinema web With JioCinema you will never run out of entertainment 😊  HAPPY BINGING!  Follow us on: Instagram: https://instagram.com/officialjiocinema Facebook: https://www.facebook.com/JioCinema/ Twitter: https://twitter.com/JioCinema"
081729252DCA6F35766F02E2E47C42C1E3BB5618C0E14FEAD642723D8D1109E6,com.batanga.vix,ENTERTAINMENT,"VIX is a streaming service with more than 20,000 hours of content to watch on demand. Watch entire movies, soap operas, and TV shows in Spanish. Latino entertainment. No credit card or subscription required. Choose your favorite genre: action, comedy, horror, drama, family, religious, romance, documentaries, or animation. Download today and start watching!  What are you going to love most about VIX?  -Thousands of hours of movies and shows -We’re constantly adding new content -Choose what you want to watch, when you want to watch it, with less commercials than standard TV -Available on smartphones, computers, Smart TVs and ROKU, Fire TV, Android TV, and Apple TV devices  *The videos are presented in their original aspect ratio which may not fill the entire screen  Privacy Policy: https://www.vix.com/privacy User Terms and Conditions: https://www.vix.com/tv/terms.html  VIX es un servicio de streaming con más de 20 mil horas de contenido para ver on demand. Mira películas completas, novelas y series de TV en español. Entretenimiento latino. Escoge tu categoría preferida: acción, comedia, terror, drama, familiar, películas cristianas, románticas, telenovelas, documentales, shows y dibujos animados.  ¿Qué es lo que más te gustará de VIX?  -Miles de horas de contenidos de cine y televisión -Agregamos programas y películas todo el tiempo.  -Elige lo que quiere ver, cuando quieras verlo, con menos anuncios que en la tele. -Disponible para celulares smartphone, computadora, smart TV y dispositivos Roku, Fire TV, Android TV y Apple TV.  *Los videos se presentan en su aspecto original que puede no llenar toda la pantalla  Consulta la Declaración de privacidad en https://www.vix.com/privacy Para conocer todas las condiciones de uso acceda a este enlace https://www.vix.com/tv/terms.html"
