sha256,pkgName,categoryID,description
4503DAA20D8DF33325527FAA0B92D156C4B05CF0F7C4385912EB54D7DAAA4EC2,com.mxtech.videoplayer.ad,VIDEO_PLAYERS,"Powerful video and music player with advanced hardware acceleration and subtitle supports  <b>a) HARDWARE ACCELERATION</b> - Hardware acceleration can be applied to more videos with the help of new HW+ decoder.  <b>b) MULTI-CORE DECODING</b> - MX Player is the first Android video player which supports multi-core decoding. Test results proved that multi-core device's performance is up to 70% better than single-core devices.  <b>c) PINCH TO ZOOM, ZOOM AND PAN</b> - Easily zoom in and out by pinching and swiping across the screen. Zoom and Pan are also available by option.  <b>d) SUBTITLE GESTURES</b> - Scroll forward/backward to move to next/previous text, Up/down to move text up and down, Zoom in/out to change text size.  <b>e) Privacy Folder</b> - Hide your secret videos to your private folder and protect your privacy.  <b>f) KIDS LOCK</b> - Keep your kids entertained without having to worry that they can make calls or touch other apps.  <b>Subtitle formats:</b>  - DVD, DVB, SSA/*ASS* subtitle tracks. - SubStation Alpha(.ssa/.*ass*) with full styling. - SAMI(.smi) with Ruby tag support. - SubRip(.srt) - MicroDVD(.sub) - VobSub(.sub/.idx) - SubViewer2.0(.sub) - MPL2(.mpl) - TMPlayer(.txt) - Teletext - PJS(.pjs) - WebVTT(.vtt)  ****** Permission Details: ––––––––––––––––––– * ""READ_EXTERNAL_STORAGE"" is required to read your media files in your primary & secondary storages. * ""WRITE_EXTERNAL_STORAGE"" is required to rename or delete files and to store the downloaded subtitles. * ""LOCATION"" permission is required to help find nearby friends. * ""NETWORK"" and ""WIFI"" permissions are required to get the network status which is required for various activities like license checking, update checking etc.  * ""BLUETOOTH"" permission is required in order to improve AV sync when the Bluetooth headset is connected. * ""CAMERA"" permission is required to scan QR code. * ""INTERNET"" is required to play internet streams. * ""VIBRATE"" is required to control the vibration feedback. * ""WAKE_LOCK"" is required to prevent your phone from sleeping while watching any video. * ""KILL_BACKGROUND_PROCESSES"" is required to stop the MX Player services used in background play. * ""DISABLE_KEYGUARD"" is required to temporarily prevent secure screen lock when Kids Lock is used. * ""SYSTEM_ALERT_WINDOW"" is required to block some keys when Kids Lock is used. * ""DRAW OVER OTHER APPS"" is required to block system buttons when input blocking is activated on the playback screen.  ****** If you are facing ""package file is invalid"" error, please install it again from product home page (https://mx.j2inter.com/download) ******   If you have any questions, please visit our Facebook Page or XDA MX Player forum. <b>https://www.facebook.com/MXPlayer</b> <b>http://forum.xda-developers.com/apps/mx-player</b>  Some of the screens are from the Elephants Dreams licensed under the Creative Commons Attribution 2.5. (c) copyright 2006, Blender Foundation / Netherlands Media Art Institute / www.elephantsdream.org  Some of the screens are from the Big Buck Bunny licensed under the Creative Commons Attribution 3.0 Unported. (c) copyright 2008, Blender Foundation / www.bigbuckbunny.org"
E08690D744CA383B05240A1164B17CD8B90FAE3485742B5714C7519F1AC09B76,video.player.videoplayer,VIDEO_PLAYERS,"Video Player All Format is a professional video playback tool.   XPlayer supports setting passwords for your <b>private album</b>, protects your <b>private videos</b> from being deleted or seen by other people.   Video Player All Format supports <b>ALL video formats, 4K/ultra HD</b> video files, and plays them with high-definition. It is one of the best HD video players for android tablets and android phones.   KEY FEATURES: ●  Keep your video safe with <b>private folder</b>. ●  Support ALL video formats, including <b>MKV</b>, MP4, M4V, AVI, MOV, 3GP, FLV, WMV, RMVB, TS etc. ●  Ultra HD video player, support 4K. ●  <b>Hardware acceleration</b>. ●  Cast videos to TV with <b>Chromecast</b>. ●  Support <b>subtitle</b> downloader and more. ●  Play video in <b>pop-up window</b>, split screen or <b>background</b>. ●  <b>Night Mode</b>, <b>Quick Mute</b> & <b>Playback Speed</b>. ●  Identify ALL video files on your device and SD Card automatically. ●  Manage or share videos easily. ●  Easy to control volume, brightness and playing progress. ●  Multi playback option: auto-rotation, aspect-ratio, screen-lock etc.   ●  Video player hd for both android tablet and android phone.   HD Player with speed control HD player helps you enjoy full hd playback with slow motion & fast motion advanced settings. You can change media speed from 0.5 to 2.0 easily with this HD Player.   Floating Video Player Video popup enables multitasking. The floating video player overrides other apps and it can be moved and resized easily. Enjoy video on the split-screen and use other apps as usual.  Background Video Player Enjoy video on the background just like a music playback. Now you can watch a video in the way of listening to books.  Files manager Identify ALL video files on your device and SD Card automatically. In addition, manage or share videos easily.  Video Player for android tablet Support all devices, watch videos on both android tablet and android phone.   Video player with casting to TV Video player for Chromecast. Cast videos to android TV with Chromecast easily. It’s the best chromecast apps for android free.   Easy to use Easy to control volume, brightness and playing progress by sliding on playback screen.   All Format Video Player Play all format video, including MKV, MP4, M4V, AVI, MOV, 3GP, FLV, WMV, RMVB, TS etc.   HD Video Player Play HD, full HD & 4k video smoothly, moreover play video in slow motion.  XPlayer video player all format is a totally HD video player for android, simple and powerful. Any video formats are supported. All-in-one media player for different formats. We are open to any suggestions for better user experience. Please feel free to contact us at xplayer.feedback@gmail.com"
83DA8098DAE74843DF93234361E864605263E79BE13CDE724DF438F6694FEEBD,com.transsion.magicshow,VIDEO_PLAYERS,"Visha is a practical and stylish app with powerful local video and audio playback capabilities. In addition, you can also watch online videos, use sniffing downloads, and have a wide range of custom skins to choose from. The specific feature descriptions are as follows: Edit Video： - Video cut ■ Play Video： -Browse all your local video files and play status videos, trailers, movies and any other videos stored in your device. - Classify videos by downloading sources to help you find videos quickly. - Background play function - Floating play function - playback speed control - History List - Support double click to fast forward and fast backward. - Auto pause mode after playback. -Multiple audio tracks for videos - Subtitle downloads ■ Play Music： - Locate and manage all audio files from your phone memory and SD card - Audio timer for auto-shutdown  - Audio file filtering and sorting  - Audio equalizer ■ online Video： - Online video content from multiple countries, including movies, TV shows, and variety shows  - Playlist collection ■ Download： - Video downloads  - Audio downloads  Personalization features:  Customizable skins  Contact for business inquiries: Join our official group:https://chat.whatsapp.com/IDflRYYwf5vC51nS9toNXi"
1C7729B1C884EBF5DD8F321FB81EF22F1CD08ADAD42F65C377A6B7171C1EAF09,org.xbmc.kodi,VIDEO_PLAYERS,"<b>Kodi® media center</b> is an award-winning free and open source cross-platform software media player and entertainment hub for digital media for HTPCs (Home theater PCs). It uses a 10-foot user interface designed to be a media player for the living-room, using a remote control as the primary input device. Its graphical user interface (GUI) allows the user to easily browse and view videos, photos, podcasts, and music from a harddrive, optical disc, local network, and the internet using only a few buttons.    <b>IMPORTANT:</b> The official Kodi version does not contain any content what so ever. This means that you should provide your own content from a local or remote storage location, DVD, Blu-Ray or any other media carrier that you own. Additionally Kodi allows you to install third-party plugins that may provide access to content that is freely available on the official content provider website. Any other means of watching illegal content which would otherwise be paid for is not endorsed or approved by Team Kodi.      <i>Estuary</i> is the new standard skin and is designed to be fast and user friendly.  With the skin <i>Estouchy</i>, Kodi has now been enhanced to better work with larger 5"" or up phones and tablets. Kodi is not designed or recommended for use with smaller phones.     <b>Disclaimer:</b> - Kodi does not supply or include any media or content. - Users must provide their own content or install one of the third party plug-ins - Kodi has no affiliation with any third-part plug-in or add-on provider what so ever. - We do <u>not</u> endorse the streaming of copyright protected material without permission of the copyright holder. - In order to upgrade from a previous version you must have installed an official released version by Team Kodi. Any other version may cause failure to upgrade.  <b>License and development:</b> Kodi® is a trademark of the XBMC Foundation. For further details you can visit http://kodi.wiki/view/Official:Trademark_Policy   Kodi® is fully Open-Source and released under the GPLv2.0+ license. It includes many third-party libraries which use compatible licenses. Due to the inclusion of some GPLv3.0 libraries the entire application becomes GPLv3.0 as binary. Should you wish to help on future development you can do so by visiting our forum for further questions.  "
A2A9BB60CD8C6528CDB57FF32E8CF84C8FAE2BE5BB3B13DC03FC533FEBF9CB19,com.mb.android,VIDEO_PLAYERS,"Bringing all of your personal media together into one place is easy with Emby! Emby unites your personal videos, music, and photos and streams them to your devices.   Get the free Emby Server at https://emby.media (required as part of your Emby install).  • Emby automatically converts your media on-the-fly to play on any device. • Emby organizes your media into an elegant display with artwork, rich metadata and related content. • Easily share your media with friends and family. • Rich parental control and management features allow you to easily control access for your entire family. • Watch Live TV and manage your DVR (with supported TV Tuner)  This app is free to browse your media collection and cast to other devices. Playback requires either a one-time in-app purchase, or an active Emby Premiere subscription. Other premium features such as downloading require an Emby Premiere subscription."
20101940BC48B71F513E8481835CA4EA47D7E357C02BA091112A94F972C39F3D,video.player.audio.player.music,VIDEO_PLAYERS,"video player is one of the best in audio video player category. it supports all types of video format and audio format. video player also plays ultra high definition video files too. equalizer helps you to make your audio playing super cool. enjoy ultimate high quality video player. music player with mp3 cutter makes your favorite song to ring tone features - plays AVI , MP3 , WAV , AAC , MOV , MP4 , WMV , RMVB, FLAC , 3GP , M4V , MKV , TS , MPG , FLV , etc - thumbnail of video and mp3 files. - subtitle support for videos - mp3 cutter for making the ringtone - plays all types video and audio formats including HD videos - mp3 player with equalizer - bass booster for extra bass - multiple widgets  Disclaimer: video player is based on VLC for Android Beta, and licensed under the GNU General Public License version 3 or later . GNU General Public License: http://www.gnu.org/licenses/"
FFA192C4D53662F7DFAAE959D06D56C29F206CD2E2B8E3B9656D3E2E4137A08B,com.mine.videoplayer,VIDEO_PLAYERS,"Video Player is one of the most easy control Video Player tools and It can plays most multimedia files as well as discs, devices.  We ensure that your file is played in the original resolution, through the optimization of the encoding format file playback speed and effectiveness to achieve the best results.   <b>Key Features:</b> * Hide your private videos via PIN code & pattern locked secure vault. * Protect private videos via encryption, the safest place for your sensitive files. * Supports most of popular video and audio file formats. * Quick start, smooth playback support. * Small memory, simple operation.  * Smart media library for audio and video files, easier and faster to find all your media files. * Browse folders directly. * Support for multi-track audio and subtitles.  * Supports auto-rotation, aspect-ratio adjustments. * Supports gestures to control volume and brightness. * Playback speed control. * Includes a widget for audio control * Supports audio headsets control, cover art and a complete audio media library. * History playlist.  It is both an audio and a video player. The most powerful Media player in Android Market. The best way to enjoy your movie and music. Please enjoy the smooth playback experience by Video Player!"
DE1A2CEAEE17BDB801252D09C003CF71B59D18A39FA29B7A1A2193AEA995F226,com.gretech.gomplayerko,VIDEO_PLAYERS,"NO.1 Video Player  Enjoy the easiest and most convenient free player on mobiles with the same reputation as GOM Media Player!  We support all basic functions. We support non-encoding, speed control, finger gesture, subtitle management, section movement, light control, etc.  [Features] 1. Variety of non-encoded video files including mp4 types can be played. 2. You can play 360 videos 3. Convenient UI, such as sliding menus and intuitive screen options. 4. You can manage the list of your favourite videos. 5. You can screenshot the screen while it is being played. 6. We support sleep timer function 7. It is possible to connect to Dropbox, GoogleDrive, OneDrive, WebDAV, and FTP 8. We support advanced settings  *EAC3 and DTS codecs are pay-codecs and they can only be used on the devices that support them.  ■ Please contact GOM customer centre anytime if you are experiencing any problems. - https://www.gomlab.com/support/ - gomlab@gomcorp.com"
9979AC8E8174B5AF381780F5A8B45365E0E9B8802A59856617180457C5C14F6F,org.videolan.vlc,VIDEO_PLAYERS,"VLC media player is a free and open source cross-platform multimedia player that plays most multimedia files as well as discs, devices, and network streaming protocols.  This is the port of VLC media player to the Android™ platform. VLC for Android can play any video and audio files, as well as network streams, network shares and drives, and DVD ISOs, like the desktop version of VLC.  VLC for Android is a full audio player, with a complete database, an equalizer and filters, playing all weird audio formats.  VLC is intended for everyone, is totally free, has no ads, no in-app-purchases, no spying and is developed by passionate volunteers. All the source code is available for free.   Features –––––––– VLC for Android™ plays most local video and audio files, as well as network streams (including adaptive streaming), DVD ISOs, like the desktop version of VLC. It also support disk shares.  All formats are supported, including MKV, MP4, AVI, MOV, Ogg, FLAC, TS, M2TS, Wv and AAC. All codecs are included with no separate downloads. It supports subtitles, Teletext and Closed Captions.  VLC for Android has a media library for audio and video files, and allows to browse folders directly.  VLC has support for multi-track audio and subtitles. It supports auto-rotation, aspect-ratio adjustments and gestures to control volume, brightness and seeking.  It also includes a widget for audio control, supports audio headsets control, cover art and a complete audio media library.   Permissions –––––––––––– VLC for Android needs access to those categories: • ""Photos/Media/Files"" to read your all media files :) • ""Storage"" to read your all media files on SD cards :) • ""Other"" to check network connections, change the volume, set the ringtone, run on Android TV and display the popup view, see below for details.  Permission Details : • It needs ""read the contents of your USB storage"", in to order to read your media files on it. • It needs ""modify or delete the contents of your USB storage"", in order to allow deletion of files and store subtitles.  • It needs ""full network access"", to open network and internet streams. • It needs ""prevent phone from sleeping"" in order to prevent... your phone from sleeping when watching a video. • It needs ""change your audio settings"", in order to change audio volume. • It needs ""modify system settings"", in order to allow you to change your audio ringtone. • It needs ""view network connections"" in order to monitor whether device is connected or not. • It needs ""draw over other apps"" to start the custom picture-in-picture widget. • It needs ""control vibration"" to give feedback on the controls. • It needs ""run at startup"" to set recommendations on Android TV launcher screen, only used on Android TV devices. • It needs ""microphone"" to provide voice search on Android TV devices, only asked on Android TV devices."
260887C636C2921E887CB592B3592DF4EA04DB562CEAC0229579743009434632,com.pathwin.cnxplayer,VIDEO_PLAYERS,"Play ALL video formats, <b>4K/ultra HD/2160p</b>, All Codecs & Subtitle in powerful & secure 4K UHD Media Player and Experience Breath taking visual quality.  ▶ <u><b>Unique & Cool Features</b></u> ▶ of Best 4K Full UHD / HDR video player for Mobile & Tablet      ◽ Powered by <b>High Performance Playback Core</b> & Hardware Acceleration HW+ Hardware Decoding       ◽ <b>Theatre Mode </b> Quick & Easy video Play & browsing video gallery together      ◽ <b>Adjust Saturation</b> Only 4K UHD Video Player with Saturation video filters      ◽ <b>Cast videos to TV</b> Firestick & Chromecast      ◽ <b>Battery Saving</b> Highly optimized <b>4K HW+</b> Hardware Decoding      ◽ <b>No full screen ads while watching videos</b>. Uninterrupted movie Playing ads free video player  ▶ <u><b>Play All Videos - No conversion </b></u> ▶       ◽ Powerful <b>H.265, X265, HEVC, H.264, X264, AVC, VP9, VP8, VC1 MPEG-4 & MPEG-2 </b> All codecs Video Player      ◽ All Formats Video Player - <b>MP4, MKV, 4K, TS, WEBM, XVID, AVI, FLV, VOB, 3GP, MOV </b>Movie Player      ◽ All resolutions supported Play <b>4K, 2160p, 1080p, HD, full HD, 4K Ultra HD</b> videos      ◽ <b>Professional 10-bit HDR</b> Video Player [pro]      ◽ Play all audio codecs <b>AAC-LC, HE-AACv1, HE-AACv2, MP3, MP2, MP1 & Ogg Vorbis</b>      ◽ <b>URL Network Stream Player</b> – Play MPEG DASH, HTTP Progressive & HLS, MPD  ▶ <u><b>Cast Videos to TV [pro]</b></u> ▶      ◽ Quick Cast videos to <b>Fire TV stick</b> with support for remote control      ◽ Play videos to TV via <b>Chromecast</b>  ▶ <u><b>Unique & Cool Interface </b></u> ▶       ◽ <b>Theatre Mode</b> – Play all videos in Theatre mode and browse the media gallery simultaneously      ◽ <b>Best User Interface & video management</b> – Choose to arrange All videos in Grid view or in List view. Browse more videos in single go      ◽ <b>Natural & Intuitive Gesture</b> – Skip videos by Double tap, fast forward, rewind, seek video, Adjust Volume, Change Brightness with cool screen gestures make video viewing a breeze      ◽ <b>Colorful themes</b> – Choose from different theme modes      ◽ <b>Floating window Media Player</b> – Switch to Pop out Mini Player for Multitasking on mobile & tablet  ▶ <u><b>Powerful Playback Core </b></u> ▶       ◽ Highly optimized video codecs with <b>Hardware Acceleration HW+</b>      ◽ <b>Save battery</b> hence longer hours of video viewing      ◽ Video Player with <b>Hardware Decoding</b>   ▶  <u><b>Video Playback settings</b></u> ▶        ◽ Video filters Saturation, Contrast & brightness. <b>Adjust Saturation in TOP 4K UHD Video Player & enhance video quality</b>      ◽ <b>Adjust Playback speed</b> between 0.5x to 2x. Play videos in slow & fast motion      ◽ <b>Auto rotate</b> video depending upon mobile or tablet orientation      ◽ <b>Repeat All</b> or No video in loop      ◽ <b>Crop & Stretch </b>Video in top 4K Ultra HD High quality Video Player      ◽ <b>Switch Decoder</b> - Hardware decoder & Software Decoder  ▶ <u><b>Play All Subtitles </b></u> ▶       ◽ <b>Multiple language Subtitles</b> - Japanese, Korean, Hindi, Arabic, English, French, Spanish, German, Portuguese      ◽ <b>ASS, SSA, SRT, PGS, SAMI, Subrip</b> & more      ◽ Change Subtitle <b>color, text alignment and size</b>   ▶ <u><b>Video Management </b></u> ▶       ◽ <b>Wifi Video Transfer</b> –Transfer videos from mobile to any PC or from any PC to mobile via easy to use Wifi Video Management feature      ◽ <b>Delete Videos</b> – Preview & Delete Multiple videos or single video      ◽ <b>Hide Videos</b> – Hide videos in Media Gallery by using the Hide & show feature. A fantastic feature for making personal Video Gallery      ◽ <b>Video History</b> – Manage history of videos played      ◽ <b>Search Video</b> – Search video in video library      ◽ <b>Sort Videos</b> – Sort video collection by name, size or date   <b>support@cnxplayer.com</b> Support: https://support.cnxplayer.com/android.php Privacy : https://cnxplayer.com/privacy.php"
567434D539E3FA56431DA8F66B75649C2BE3E78FC12ED72E05F4B47EDD5FDDD9,videoplayer.mediaplayer.hdplayer,VIDEO_PLAYERS,"Video Player for Android is the best video player in the market. Enjoy high quality videos plays smoothly . Video player supports all video formats including AVI , MP4 , WMV , RMVB , MKV , 3GP , M4V , MOV , TS , MPG , FLV etc. One of the best and essential application for your device .  Features:  1 lists all video files 2 music player with equalizer and presets 3 bass and treble adjustment 4 support for all video and audio formats 5 multiple subtitle formats support 6 video streaming support 7 quick start and smooth and easy playback with video resume   ------------------------------------------------------------------------------------------ Disclaimer： This app is based on VLC for Android Beta, and licensed under the GNU General Public License ver3 or later. GNU General Public License: http://www.gnu.org/licenses/ You can get the source code following this link: https://github.com/FunPanda08/VLCPlayer_Android"
DC25A41927A64EF6E789B2792362C469298497068DC8D8772CD776A230466624,com.olimsoft.android.oplayer,VIDEO_PLAYERS,"★ ★ ★Under development for 12 Years ★ ★ ★ ★ ★ ★DTS & DivX officially supported ★ ★ ★  OPlayer is a professional media playback tool. It supports almost all media formats, It is one of the best HD video player for android tablet and android phone.   KEY FEATURES: ● Support MOST video formats, including MKV, MP4, M4V, AVI, MOV, 3GP, FLV, WMV, RMVB, TS etc. ● Ultra HD video player, support 4K. ● Hardware acceleration. ● Keep your video safe with gesture unlock. ● Cast videos to TV with Chromecast. ● Support subtitle downloader and more. ● Play video in pop-up window, split screen or back-ground. ● Night Mode, Quick Mute & Playback Speed. ● Identify ALL video files on your device and SD Card automatically. ● Full featured file manager, including move/cut/paste ... ● Manage or share videos easily. ● Easy to control volume, brightness and playing progress. ● Multi playback option: auto-rotation, aspect-ratio, screen-lock etc.  ● Video player hd for both android tablet and android phone.  Video Player OPlayer is a <b>MKV Player</b>, <b>DVD Player</b>, <b>AVI player</b>, <b>FLV Player</b>, and supports almost all video formats, such as MP4, M4V, MOV, 3GP, FLV, WMV, RMVB, TS etc.  Music Player OPlayer supports almost all audio formats, including WMA, FLAC, MP3, OGG, MIDI, AMR, AAC, DTS, M4A etc.  HD Video Player Play HD, full <b>HD & 4k</b> video smoothly with HW decoding.  Floating Video Player Video popup enables multitasking. The floating video player overrides other apps and it can be moved and resized easily. Enjoy video on the split-screen and use other apps as usual.  Background Video Player Enjoy video on the background just like a music playback. Now you can watch a video in the way of listening to books.  Video Player for android tablet Support all devices, watch videos on both android tablet and android phone.  Video player with casting to TV Video player for Chromecast. Cast videos to android TV with Chromecast easily. It’s the best chromecast apps for android free.  Easy to use Easy to control volume, brightness and playing progress by sliding on playback screen.  Files manager Identify ALL video files on your device and SD Card automatically. In addition, manage or share videos easily.  We are open to any suggestions for better user experience. Please feel free to contact us at olimsoft@gmail.com."
