sha256,pkgName,categoryID,description
63A04CEDC7716CAB3C1E1FEEFF88E7ABE6F4BA274603DFBF82E64304FB39E093,uplayer.video.player,VIDEO_PLAYERS,"Want to get the best Video Player experience on your device?  Stunning, beautifully crafted HD Video Player app for android packed with powerful features.It can play All video formats  Including 4K ultra HD video files with high definition.It is the best video player fulfil all your media player needs and attractive user Interface gives you the best user experience.  Key Features :  ● Video player supports all video formats  including MP4, MOV, M4V, MKV, WMV, RMVB, FLV, AVI, 3GP, TS etc. ● Support for PAN and ZOOM video files. ● Play HD and 4K videos. ● Create Video Playlist and add your favourite videos to it. ● Folder Explorer with CUT ,COPY and PASTE. ● Video Resume, Playback Speed, Night Mode & Timer. ● Play videos in POP-UP window. ● Equalizer support with treble and voice clarity adjustments. ● Video Locker protects your personal video from others when use your device. ● Support for Subtitle Download. ● Video Cutter,MP3 Cutter and Video to MP3 Converter. ● Powerful Music Player with 5 Band Equalizer and Bass Boost. ● Cast videos to TV with Chromecast. ● Fast forward ,fast backward. ● Find and delete video files with Duplicate Video Finder and save your space. ● Multi-Select video files and play, share or delete. ● Easy gesture control of brightness and volume.  Playback speed You can adjust video playback speed of HD video player from .25x to 4x.  Floating Video Player Floating video play option helps you to interact with other apps while watching movies.  Files manager Identify ALL video files on your device including SD Card and manage them easily.  Background Video Player Background video play feature plays video in background like music player.   UPlayer  is a totally FREE HD video player for android that can handle all format video files. Send your feature request and suggestions about UPlayer at arunnanthalath@gmail.com"
6804EF65B70D5ECF0E4A6AF318B6C352F83805F5582C72BAB72523F37B0BC0F0,free.online.hd.video.player,VIDEO_PLAYERS,"Video player All Format for Android supports ALL video formats, 4K/ultra HD video files, is a best HD video player with advanced hardware acceleration, smart playback, easy using, stylish design, and also protects your private video from being deleted or seen when people use your device. Video Player All Format is a professional video playback and manger tool. Video Player automatically identifies all video files, plays with high-definition, make you enjoy the fast and smooth HD video playback quality. HD Video player is the essential software for your Android devices. It’s definitely your best partner to enjoy the videos and movies playing!   <b>All Format Video Player:</b> Video Player supports all popular video formats, including 3GP, AVI, FLV, M4V, MKV, MOV, MP4, WMV, etc.  <b>Set password for private videos:</b> Secure password for your private videos in a folder to hide and manage them. Access the private videos through secure steps and you don’t need to worried about anything. If forgot the password, you can find back your password by your security questions.  <b>Smart manage classified videos:</b> Video Player can Identify ALL video files on your device and SD Card automatically, allowing you to quickly locate and play the video. It helps you to manage your videos better. In addition, you can quickly rename, cut, delete and share your videos in a convenient way.  <b>High quality and HD playing:</b>  Video Player using hardware decoding, take advantage of hardware acceleration. You can startup quickly in all of your devices up to Android 8.0 and enjoy the best HD videos played with a HD quality and smoothly speed to get the most perfect movies playing experience.  <b>Smart playback your videos:</b> Video Player is a best videos manager which helps you remember the last played progress, and auto playback in a HD Quality. Perfect stitching to the atmosphere of the previous movie scene.   <b>Easy and convenient control:</b> Video Player supports gestures to easily adjust the screen brightness and video volume when you are watching the video.  And you can click the button to quickly control the videos’ progresses and the last or next video to play. In addition, locking screen, floating window playback, horizontal and vertical screen switching, trimming current interface, adjusting screen sizes features are ready for you!  <b>Stylish design & colorful themes:</b> Video Player is designed by a simple stylish style and images filleted. And you can select your favorite one of six colorful themes to make your exclusive video player.  HD Video Player is a powerful and private smart playback video player. We are struggle for bringing you the most perfect experience in the HD video player. Hope you can enjoy the fun of movies playing in video player.  Notice: Video player is a free video player, but not supporting for downloading the online videos. All online videos are provided by YouTube complying with uses terms."
F38D3EFED179D2F1818193B04995C6A3229C75BD2C3FA0EDA8C1A9735511BE17,dn.video.player,VIDEO_PLAYERS,"The best All format video player for Android with  subtitle support.Listen to music with High quality equalizer. Browse and play music songs by genres , albums , artists , songs and folder.   Video Player Features  - Multi Select files by long press. - Hardware Acceleration. - Video player supports all video formats, including , MP4, M4V, AVI, MOV, 3GP, FLV, WMV, RMVB, TS etc - Video Queue with reorder. - Subtitle Support with subtitle delay adjustment. - Find Duplicate video files. - Video Lock and Unlock. - Quick Mute. - Night Mode. - Sleep Timer. - Sort video by date, title , count , path etc. - Share video files with friends. - Gesture Volume and Brightness Control. - Video Resume playback. - Playback Speed control - Repeat and Shuffle option. - Select Audio track in video. - Audio Delay adjustment. - Gesture Video seek. - Quick delete video. - Search media files.   Music Player Features  - Support for Chromecast. - 5 band graphical Equalizer. - Music player supports almost all types of audio formats including mp3 , midi ,wav , flac raw aac files. - Music Tag Editor support. - MP3 Cutter support. - Bass and Virtualizer effect. - Music queue with drag and sort feature. - Playlist Support with reorder. - Find all duplicate Music files. - Queue with play list reorder - Support for play list. - Change album art. - Attractive widget and lock screen playback. - Set music as ringtone. - Exclude music folder. - Send Entire playlist to friends. - Recently added music files. - Audio presets support. - Add music to favorites in a single tap. - Exclude mini songs. - Play , next or previous by phone shake. - Play song by folder.  This application is a totally free HD video player that supports any kind of media files.Grab your own copy today itself.  Permissions required:  WRITE_EXTERNAL_STORAGE permission is required to rename or delete of files. RECORD_AUDIO permission is required to show music visualizer. READ_EXTERNAL_STORAGE permission is required to read your media files in storage."
558E103212E59792CD1FE00FABBF57E70C8F4C52699CA8754CB364B0C72E012A,com.real.RealPlayerMobile,VIDEO_PLAYERS,"Brand New RealPlayer Mobile!  It’s a big release!   WHAT’S NEW?  ·  Reduce eye strain and enjoy better videos with Dark Mode ·  Speed up or slow down the video you’re watching ·  Use Keychain for easy login ·  Access folders as you would on your PC ·  Select multiple files at once  Sync downloads between your phone and your PC and vice versa.   Save videos on your phone to your computer seamlessly. Or transfer those downloaded videos on your PC to your phone in one click.     RealPlayer Mobile is a fantastic media player, downloader, and streamer for all video lovers, and continues to be the must-have companion for PC users of RealPlayer!  ·  Cast any video from your phone to the big screen with Chromecast or AirPlay.  ·  Access your RealPlayer PC library from anywhere with secure remote access.  ·  Stream videos from your PC or RealPlayer Cloud.  ·  Sync videos to watch them offline when on the road.   ·  Back-up your videos to the RealPlayer Cloud, and access them from any device.  To get started simply sign-in with the same credentials on your device and PC, and you are on your way!  RealPlayer mobile offers in-app subscription options to stream off-device content, get 25GB cloud storage, simultaneous and unlimited speed PC downloads from thousands of sites, remote access, library duplicate removal, DVD burning and more. Subscription prices vary from $4.99 to $2.99 per month and can be canceled at any time.  Now available in English, Spanish, Japanese, French, German and Chinese!  Have feedback? Or feature suggestions? Ping us at realplayermobile@realnetworks.com. We care about all submissions."
C1BA8618BDF1A332AD2B3AD1361651D147EE1FB1EE335E42E14767988E6C14E2,com.skydot.video.player.hd.player4k.media.highres.hq.hdplayer.allformat.videoplayer.fast.mediaplayer,VIDEO_PLAYERS,"<b>Video Player</b> is a simple and light weight video playback tool which supports all formats. With an attractive user interface, the app gives you the best user experience and gives many features to easily manage and play videos. It supports 4K/ultra HD video files, and plays them with high-definition.  You can watch movies 🎥, favourite songs 🎶, memories 📷 watch games🏏 and other local video clips📼 on your device.  Key Features of <b>Video Player:</b>  📱 <b>Supports Multiple Video Formats:</b> You can play all format videos, including MP4, MKV, M4V, AVI, MOV, 3GP, FLV, WMV, RMVB, TS, etc.  ⏯️ <b>Playback Controls:</b> The video player gives the user many controls like adjusting the playback speed (from 0.25x to 4x), pause, play, scroll forward/backward to navigate inside the video.  🖐️ <b>Gesture Controls:</b> To control the brightness and the volume, you can just swipe vertically on the video on each sides.  🔳 <b>Control Player Size:</b> You can change the video size to fullscreen, fit to screen and crop modes.  ❤️ <b>Favourite Videos:</b> For the videos you like the most, you can add them to the favourites list and manage it easily.  📁 <b>Browse Folders:</b> If you want to browse through folders to find the video, you can use this section of the app.  🔍 <b>Search:</b> Fast and accurate search feature enables you to find the video you want to watch.  🌗 <b>Dark Theme:</b> The app also supports dark theme to make the app experience relaxing also making the battery last long and efficient.  <b>Other features include:</b>  ● Listing all videos on your device & SD card in one single list. ● Quick and simple search option. ● Lock option in the video player to prevent touching. ● Add videos to favourite list. ● Multi select video files and share or delete. ● Options like rename, details etc. ● Easy gesture control of brightness and volume. ● Multi-playback option: auto-rotation, aspect-ratio, screen-lock etc. ● Attractive Mobile and Tablet UI. ● Night Mode to protect eyes from blue light, Quick Mute option in Player screen. ● Next & Previous buttons in the Player. ● Auto Play & Loop Video (Repeat) options. ● Play, Pause, Next, Previous controls through headphone. ● Bluetooth earphone controls support.  DOWNLOAD <b>VIDEO PLAYER</b> TO ENJOY WATCHING VIDEOS ON YOUR DEVICE!  Your feedback is important to us. Write us on <b>support@skydot.tech</b>"
25E83ED0FC1E67F2F078D60324B59B6099704DD33AA8B50148F8680E2B747D48,com.recorder.music.bstech.videoplayer,VIDEO_PLAYERS,"<b>Powerful video player with advanced hardware acceleration and subtitle support. Video player is the best video app to play music & video. It is simple operation, quick start, smooth playback. It supports all types of video format and audio format. Video player can plays all ultra high definition video (HD video, 4k video) files too. </b>Equalizer features can helps you to make your audio playing super cool. Mp3 and music player can play your favorite songs.  HARDWARE ACCELERATION - Hardware acceleration can be applied to more videos with the help of new HW+ decoder. SUBTITLE SUPPORTED - You can load subtitle file .srt from your device KIDS LOCK - Keep your kids entertained without having to worry that they can make calls or touch other apps.  Features: - Plays all video & audio files - Built-in 5 Band Equalizer with Bass Boost, 3D Reverb Effects, Virtualizer & 10 amazing presets. - Small memory - Play in background - Music player - Cool music player Widget. - Play music & video by folder - have mp3 music with equalizer - Thumbnail of video and music files. - Supports multiple subtitle formats, automatic synchronization - Mp3 player - Plays all types video and audio formats including HD videos - Video format: AVI, MP3, WAV, AAC, MOV, MP4, WMV, RMVB, FLAC, 3GP, M4V, MKV, TS, MPG,FLV...  Subtitle formats: - MicroDVD(.sub) - VobSub(.sub/.idx) - SubViewer2.0(.sub) - SubRip(.srt) - TMPlayer(.txt) - Teletext - PJS(.pjs) - WebVTT(.vtt) - MPL2(.mpl) - DVD, DVB, SSA/ASS subtitle tracks. - SubStation Alpha(.ssa/.ass) with full styling. - SAMI(.smi) with Ruby tag support.   It's best video player. We are striving hard to make this music player perfect for you. In any case,if you notice any bugs or crashes, kindly REPORT it by sending a mail to us at: recorder.appteam@gmail.com"
CC4A2F1698C883E1676A47FF9CDA6DB5EB6D2E46A7FFC7F993B2DB32D87EFE05,com.zeasoft.videoplayer,VIDEO_PLAYERS,"Zea player is a <strong> FREE Mkv and Flv video player app for android </strong> fone and tablets. It is a professional HD video playback tool for ALL video & audio formats (MKV videos, FLV videos, M4V videos, Mp3 Songs, etc). <h2>  FLV Video Player </h2> Zea Player is a perfect media player that can play all formats of high-resolution videos, music, and subtitle files. Zea player is the best HD video player for all formats. it is also the best Flv player, Mkv player mp4 & mp3 player app.  ▶  FEATURES : - Users hide audio videos and images 🎼 ( Free private folder ). - Supported dual audio tracks and online subtitles downloads. - Users can play music songs 🎧 and play videos in the background. - Stream with Url,  User can play any type of video with a Video URL. - Users can watch movies with subtitles, and also download subtitles for movies. - Easy to control volume 🗣, brightness, Zoom, and playing progress. - You can zoom your videos with two fingers. - Support all media formats, including Mkv, mp4, m4v, Avi, MOV, 3gp, Flv, WMV, Rmvb, ts, ultra HD, and  Mkv player .  Zea Player app supports setting passwords for your private files and protects your private video, audio, and images from being deleted or seen by other people.  <h3> 4k Mkv video player and Flv video player </h3> ""Zea Player"" app supports video pop-ups so you can enjoy the latest Bollywood movies, music videos, and Bollywood Dance Choreography anytime anywhere. It allows you to easily add captions and sync and download subtitles to videos and movies.  - Easily use gesture control to adjust playback speed, brightness, and volume. video playback continues from the last position smartly. you can play any movie player with subtitles, and download its subtitles in English or other languages.  <h2> Video Player all Format - Flv Player </h2> Now you can play your videos with URL in stream function, Zea app also supports Mkv videos in local and URL player. so we can say Zea player is a FREE HD video player for all formats. it is an <strong> Mkv video player for android </strong> for Mkv video files.  Zea Player is a perfect media player that can play all forms of high-resolution videos, music, and subtitle files. <strong> WMB player:- </strong> In the Zea player app you can play your Wmb formats videos easily.  <h2> 4k mkv player:- </h2>  Users can play Flv videos easily. Zea app also supports FLV and other video formats like Mkv Avi etc, it is a 100% Flv player for android.   -  Zea Player is one of the <strong> best HD video players </strong> for android tablets and android phones. It allows you to easily add captions and sync and download subtitles to videos and movies.  <h3> Best mp4 background player </h3> Background play functions to keep playing the video when switching to other apps or turning off the phone screen. Zea Player plays audio as well as video, <strong> mp4 background player </strong>. in the Zea player app, you can play your video in the background. Zea Player is the best music player For Android users.   <h2> Movie Player for android </h2> Browse all your local video files and play status videos, trailers, movies, and any other videos stored on your device. You can play any video & movie in 1080p without buffering.   <h3> Mkv Video Player App For Android </h3> Browse all your local video files and play status videos, trailers, movies, and any other videos stored on your device.  In conclusion, Zea Player is an excellent option for anyone who wants a versatile and user-friendly video and <strong> movie player, </strong> and a music player app for android. With its wide range of features and support for a variety of file formats, it is one of the most comprehensive and powerful media players available today. Download now and experience the future of video and music playback with Zea Player.  . Please feel free to contact us at Sunilgiripradhan@gmail.com  ⭐ Thank You"
5DDB71A156BA6BFBA8DC28C8D14A7CBE9781F8B038AD7A65AAC7FF34ACC2762B,com.rz.night.player,VIDEO_PLAYERS,"<b>The first video player for Android with speech loudness enhancing feature, optimization and normalization sound for the most comfortable viewing.</b>  - <b>Play all video files, support all codecs, all formats, streams, IPTV channels, m3u</b> - <b>Voice enhancing feature</b> - <b>Increasing speech volume</b> - <b>Smoothing sharp drops in sound</b> - <b>Normalization loudness of special effects</b> - <b>Smart volume correction of the entire audio track</b> - <b>Voice amplification</b> - <b>Clear voice feature</b> - <b>Amplification loudness of dialogues</b> - <b>Remove noise</b>  In all films, TV shows, cartoons, and so on, there are volume differences and sharp drops that make viewing the video not comfortable, especially if you are watching movies at night. Volume drops, too loud special effects, the sound of gunfire and, for all that, the speech is too quiet, if it annoys you - then this video player is for you!  Night Video Player uses its unique and super fast algorithm to detect human voice, and process audio on the fly, while watching a video. As a result, with the Night Video Player you will move to a completely different, qualitatively new level of perception of your favorite movies, where <b>you can better hear and understand the human speech of actors, clearly hear conversations in a whisper, some audio elements that used to be too quiet compared to other sounds and you just could not hear them.</b> And with all this, you will not be disturbed by loud shots, screams, and all other harsh sounds, the player makes them quieter and more pleasant for perception.   *** * Perfect player for night watching movies with voice amplification feature. Watch movies at night with maximum comfort! With Night Video Player will never again you or your child wake up from harsh sounds * Ideal for watching movies in the original, without dubbing. With Night Video Player You will better hear and understand the speech of the actors * The player reads all video formats - MKV, MP4, AVI, MOV, Ogg, FLAC, TS, M2TS, Wv, etc. * FULL HD, 4K, support for all codecs - AC-3, AAC, HEVC (H.265), VP9, H264, MPEG, AAC, OGG, etc. * IPTV player. Enjoy with any m3u playlists (M3U/M3U8). Video player plays even unformatted and text m3u iptv playlists. * Subtitle support * Playlist support * Chromecast support * Popup player * Tablet and Android TV optimization * Night Video Player doesn't have any suspicious permissions and without ads * Select audio track feature  The night video player has three audio processing modes:  * <b>Original sound. </b>  - <i>play original audio without normalization.</i>  * <b>Smart night mode. </b> <i>In this 'night mode', smart leveling of special-effects will be applied, the volume of the human voice will be increased. The entire audio track will also be normalized. Also, night mode video player make voice more clear and understandable.</i> <i>Uses intelligent voice optimizer</i> <i>Voice enhancer</i>  * <b>Soft sound mode </b> Almost the same as 'night mode', plus  <i>voice optimizer based on audio compressors</i> - <i>'clear voice play'</i> - <i>removing noises</i> - <i>bring up the loudness of 'very quiet dialogues' and make voices it more clear</i>  How works sound normalizer engine in video player: In first, is carried out detection voice, speech, too quiet and too loud audio fragments are determined as well. Voice puts into sound enhancer, which increase volume, like sound booster. Effects and noises put into sound normalizer, normalize peaks, high contrast, etc. At last, all fragments is merged back.  Try and enjoy playing all videos on all formats with our player with REAL NIGHT COMFORTABLE MODE  * All graphic material which is used in Clear Voice Player are free and all FILMS are fictional."
03A61D5903145B49ED668B3BF2A6A16D03BCC7CFB990ED6F6AF5B9DE6F9F2D49,com.amtech.videoplayer.amplayer,VIDEO_PLAYERS,"You can watch all the shows, movies and other videos directly from your phone storage or SD card.  4K ULTRA HD Video Player - AM Player - ALL FORMAT supports all multimedia video formats, 4K ultra full hd videos and videos can also be saved from deleted or being seen in private videos when other peoples are using your device.  4K ULTRA HD Video Player - AM Player - ALL FORMAT supports all video formats like HD, full HD & 4K videos, FLV, MKV , 3GP , MPG , TS , MOV , M4V , MP4 ,WMV ,etc . Main Features: 	1. Videos are selected automatically from your phone storage or SD card.         2. Videos can be selected by select option .         3. Videos can be renamed or deleted.         4. 4K ULTRA HD Video Player - AM Player - ALL FORMAT provides volume up and down to the right side of screen and screen brightness on the left side of screen.         5. 4K ULTRA HD Video Player - AM Player - ALL FORMAT also provides Night Mode and Quick Mute.         6. Videos can be moved forward or backward by sliding on screen.         7. Move to the next video or play previous video by clicking on icons.         8. Videos can be played Pop-up window , Split screen and Background.         9. Change the theme of video player according to your liking.         10. Lock and Unlock the screen by clicking on the icon.         11. Multi playback option like auto rotation , aspect ratio etc.         12. 4K ULTRA HD Video Player - AM Player - ALL FORMAT is best for your android phone and android tablet."
F826A474071269A4A0A9340279816CFBB71B695BAE1CEDC49DED5688015C85FD,com.nirmallabs.mediaplayer.musicplayer.videoplayer,VIDEO_PLAYERS,"This Video Player All Format is a professional video playback tool. It supports ALL video formats, 4K/ultra HD video files, and plays them with high-definition.  This Media Player is one of the best HD video player for android phone. Video Player All Format also protects your private video from being deleted or seen when people use your device.  KEY FEATURES of Nirmal Media Player: ● Support ALL video formats, including MKV, MP4, M4V, AVI, MOV, 3GP, FLV, WMV, RMVB, TS etc. ● Ultra HD video player, support 4K. ● Hardware acceleration. ● Night Mode, Quick Mute & Playback Speed. ● Identify ALL video files on your device and SD Card automatically. ● Manage or share videos easily. ● Easy to control volume, brightness and playing progress. ● Multi playback option: auto-rotation, aspect-ratio, screen-lock etc. ● Video player hd for android phone.  HD Player with speed control HD player helps you enjoy full hd playback with slow motion & fast motion advanced settings.  Video Player for android Phones, Which Supports Dark Theme.  Easy to use Easy to control volume, brightness and playing progress by sliding on playback screen.  Files manager Identify ALL video files on your device and SD Card automatically. In addition, manage or share videos easily.  All Format Video Player Play all format video, including MKV, MP4, M4V, AVI, MOV, 3GP, FLV, WMV, RMVB, TS etc.  HD Video Player Can Play HD, full HD & 4k video smoothly, moreover play video in slow motion.  Nirmal Player video player all format is a totally FREE HD video player for android, simple and powerful. Any video formats are supported. All-in-one media player for different formats. We are open to any suggestions for better user experience."
