sha256,pkgName,categoryID,description
B1C76FFECEACC9B54731CA5FA2767D5E217A140730534751AF2D7D1D26FC8D13,com.resizeable.video.player.equalizer,VIDEO_PLAYERS,"This is amazing HD Video Player Where You Will Get All Feature In A Single App. You Will Never Seen Such Types Of Amazing Features With Video. This is very light weight app with amazing features.  ★★★ <b>Pop Up Video View Is The Best Floating View (Multi Window View)</b>      >> <b>Always On Top</b> Video Feature      >> Video Window Can Be <b>Re sized</b>.      >> You Can Perform Play Pause Next Previous Play Song From Playlist And <b>Minimize It</b>.      >> You can do another work when video is playing.      >> Perform <b>multitasking</b> multi window Operations.      >> Multi Window View for all android devices.  ★★★ Brightness And Contrast      >> You Can Customized Brightness According To Your Need.      >> Set Contrast And RGB Color Value.  ★★★ Equalizer And Presets      >> Inbuilt <b>5 Band Music Equalizer</b> With Master Preset.      >> <b>10 Equalizer Presets</b> Who Improve Your Video Sound Quality.      ## Upcoming Features In Sounds:            # Bass Booster And Treble Booster  ★★★ Language Audio Support :       >> You can change subtitle, Placing subtitle Same Folder to Video File.  ★★★ Other Features        >> Fetch Device All Video In single time.       >> You can lock video when you want.       >> Landscape And Portrait mode both are supported.  ★★★  <b>Presets Details ::</b>      ★★ Normal      ★★ Classic      ★★ Dance      ★★ Flat      ★★ Folk      ★★ Heavy Metal      ★★ Hip Hop      ★★ Jazz      ★★ Pop      ★★ Rock"
A44EEFBC7326BA6C499DCD208747EF92AABE313B9E943DD50C8A6B4714E49630,com.video_s.player_hd,VIDEO_PLAYERS,"Video Player is support HD quality videos and audio files .video player smoother and easy to use support all type of video format MPG, MOV, RM a, VOB, ASF, MKV, F4V, TS, TP, M3U, AVI, MP4, M4V, WMV, FLV, M3U8, RMVB, MPEG, . This  video player  quickly to find and listing your sd card videos and audio files   main function    . Smooth playback of video files   . Automatically scan and listing audieo and video file in your sd card   . Display Thumbnail of all videos in your SD card   . play all type of video  and audieo format"
E9728B6A4AA2BDA5AA28B70DC519C24837FA693C081434FCE4A568354DD9CB06,dolphin.video.players,VIDEO_PLAYERS,"★★★★★ <b> Your video player cannot play Flash videos or other video formats? Tired of using video decoder to reformat video every time, when you just want to play Flash? Do you want to watch YouTube videos and free movies online, but your media player for android can only play local videos? If your answer is YES, Dolphin Video Player is the best choice for you!  With Dolphin Video, you can watch Live Streaming for TV, soccer, and other interesting events. Complete collection of on demand video for news, sinetron, soccer, horror, korean drama, TV shows, music, dangdut, latest songs, celeb gossip, funny videos and all other video genres for FREE.</b>   🚀<b>Great Features</b>🚀 <b>✔Flash Support</b>  Dolphin Video Player for Android can plays <b>all ultra high definition video (HD video) files</b> including Flash (flv, swf). Relax and enjoy your favorite videos, free movies, TV shows, music clips, imax videos, game stream, sport’s live stream, TV series and any other kind of videos on your phone or watch it online. Most video formats are supported (Flash (flv, swf), avi, 3gp, mpeg, mp4, mpeg-ts, mpeg-4 sp, mpga, webm, mkv, m4a, wmv, rm, rmvb, mp3, ogg, m3u8, aac, m4v, wav, vob, mpg, tp, dat, asf, mov, etc.), so you do not need to look for a video decoder to reformat video. <b>✔Free, no duration limit</b>  The app is completely free, as a media player, Dolphin Video can not only play high-definition videos, movies and flash files, but also play music. <b>✔Simple and convenient</b>  You don’t need to install flash player to playback flash videos using Dolphin Video Player.  <b>✔One Finger Control</b>  Regulate volume, brightness or jump to any point in the video by swiping left/right or up/down on the screen. You also can rotate screen orientation while watching movies; <b>✔Smart File Manager</b>  Dolphin Video Player will automatically identify all video files saved on your phone, so you can easily playback them;  <b>✔Play Videos online</b>  Just paste the URL of the video file you want to playback in to the search box and watch it online! You can watch streamed videos using our free video player as well; <b>✔Search Videos online</b>  Enjoy watching videos from YouTube, Dailymotion, Vimeo, Twitch, movie channel on Netflix and any other video website you like! Go browsing with the best media browser Dolphin!   <b>Supported video formats </b> Flash (flv, swf), avi, 3gp, divx, mp4, mpeg-ts, mpeg-4 sp, mpga, webm, mkv, quicktime, h.263, h.264 avc, h.265 hevc, vp8, vp9, m4a, wmv, rmvb, mp3, ogg, m3u, m3u8, aac, m4v, wav, vob, mpg, tp, wpl, dat, asf, mov, etc. If you found a video format, which wasn’t supported by Dolphin Video Player for android, but can be supported by any other video players, please send us feedback at help@dolphin.com and we will try our best to fix it!    <b>Supported Network Protocols</b> • RTSP (RTP, SDP) • HTTP/HTTPS progressive streaming • HTTP/HTTPS live streaming  Dolphin Video Player is a free video player for Android, which developed by the Dolphin Browser Team. You also can use it with Dolphin Browser, the best media browser with extensive Flash support, Private Mode and the most customizable browsing experience on the market. We have already reached over 150 Million downloads on Android and iOS worldwide and are very happy to receive positive feedback from you every day. To get more Dolphin Add-ons please visit: http://bit.ly/AndroidAdd-onList   <b>❤ We love hearing from you. Contact us at help@dolphin.com and rate us today!</b>   🐬 Join the Dolphin Browser community on:  Facebook: https://www.facebook.com/DolphinFans Twitter: https://twitter.com/dolphinbrowser Google+: https://plus.google.com/communities/105383868011227937315 YouTube: https://www.youtube.com/channel/UC8LCMnZ-o4esHwtZT-FR8ig VK: https://vk.com/dolphinbrowser Learn more on our website: http://www.dolphin.com/  If you are looking for a flash player for android or epic internet video player, Dolphin Video Player is the best choice for you!"
B6BE6476B8764F657EF8C3D0ED8BCD1CF7C2BDB0D247EF47AD5D29258308D714,com.burijas.videoplayer,VIDEO_PLAYERS,"You will be able to watch videos from all popular formats with HD video player. Amazing is the product of a work. The quality of the videos with this application, you can watch movies and music videos. This program gives you music, videos, movies, allows you to access files as folders. All video on your device, audio files and music brings to the screen by scanning. It supports all video and audio formats. Some of the popular formats: mp3, 3gp, avi, F4Fs, MOV, FLV, MPG, OGA, VOC, TTA, mp4v, MPEG, MPEG4, AMR, M4A, VOB, WMV and all formats. You control the sound with equalizer. In the Settings section, bass, dance, classical, smooth, you can select the treble and more. Provide volume control. Height voice and low-volume adjustment to make. Video option pass quickly. Putting your video watching lock. After the lock would not put anything on the video. Music player and media player is very simple. Your hand will not do anything now with video lock screen, even if accidental tissue. You can watch movies in the highest quality in a comfortable way. Freezing and deceleration is no problem. Features: * Video playback also offers the best quality service. * When setting do. * Monitoring during shutdown option during the lock. * Full screen mode. Full screen mode available. * Media player settings. The music player support. * Create and modify the list. * The playback speed adjustment. * Set the sleep time. * In the past the search option. * Making sound setting. Audio amplifier and mitigation options available. * Subtitles files to add and subtract. * Subtitles condition exists. * Video management and operation. Watching movies is very simple. Free. * Small images. Appear in the form of frame. * Headset settings. * HD video with images sharper and more vivid.   Disclaimer:  This app: VLC Beta based, and is licensed under the GNU General Public License v3 or later.  Some of the screens are from the ""Big Buck Bunny"" and ""Elephants Dream"" licensed under the Creative Commons Attribution 3.0 Unported. (c) copyright 2008, Blender Foundation/ www.bigbuckbunny.org (c) copyright 2006, Blender Foundation / orange.blender.org/"
01902E41410BD0730511CCC0880C7D0DA7AF38374B473651021992A454E327C7,com.hiwapps.videoplayer,VIDEO_PLAYERS,"A gorgeous video player with high picture quality and the best equipment. HD video player that offers the most spectacular environments as needed. Very easy to use. Music, movies and videos can be watched in a very comfortable way. Quickly scan the device. Very useful and efficient tool. You can listen to music in an easy way. Video player for Android provides the best experience. Media player and mp3 player feature is available. You can watch videos in a relaxed way your tablet and phone. HD video player is a highly secure and resolution.  Supported formats:  For Video: 3GP, 3GPP, AVI, FLV, F4F, mov, mp4, mp4v, mpeg, mpeg4, ogv, vob, wmv, 3gp, avi, DivX, OGM, GVI, RM, RMVB, MKV, mxg, nufer, rec , OGM, OGX, VOB, TOD, MTV and all other formats.  For audio: MP3, MPG, MV, AAC, OGG, RAM, VOC, TTA, WMA, MPA, MLP, MID, AMR, M4A, ASF, VQF, WAV, MPC, S3M and all other formats.  Features:  - Free HD video player. - Is a unique application that supports all video and audio formats. - All files smooth playback. - Quick start. - Playlist. - Playback of HD video files. - You can make sound settings. - Fast and quality. Media player, music player and mp3 player feature is available. - Automatic definition file on the device. - Time adjustment. - Supports subtitles. Add subtitle file. - Full screen support. - Equalizer is available. You can make all the settings required. - Past browsing. - Adjust the opening and closing times. - Easy to use - Acceleration available. - List format.  Disclaimer:  This application is based on VLC for Android Beta, and is licensed under the GNU General Public License v3 or later. VLC for Android Beta original project: http://git.videolan.org/?p=vlc-ports/android.git GNU General Public License: http://www.gnu.org/licenses/"
C5B4D5A161F3DB7112C42DB7537B6DB14492023C3C3039E1A46248C8DCB13C2F,com.ats.kxvideoplayer,VIDEO_PLAYERS,"A Light-weight High Definition Video Player for all Android Devices.  KX Player – Full HD Video Player is one of the Best Video players to play Full HD videos for All Android Devices – Android Phones and Android Tablets. You get access to complete video listing with Recently Added Videos at the top of video list.  KX Player – Full HD Video player supports all Video Formats including 4K/ultra HD video,MP4, MKV, WMV, TS, 3GP, WEBM, AVI, MOV, etc.  KX Player – Full HD Video Player also list videos according to the Folders and directories in which videos are stored in your device so that you can easily play your preferred videos from the folders of your choice.  You can rotate Screen Orientation with just a button click without rotating the phone to view videos.  KX Player - Full HD Video player enables you to resume videos from where you left watching. You don't need to start over the video from beginning again and scroll forward.  KX Player – Full HD Video Player allows you to share your favorite videos with your friends and colleagues through various social networking platforms.  KX Player – Full HD Video Player has a user-friendly video playback controls with Full Screen video playback and faster start up.  You can also Delete the videos you don’t want in your mobile device. It will free up the memory space.  You can also view the total number of videos present in your device and also in each folder, along with the Size of each Video.   Key Features of KX Player – Full HD Video Player:  •	Identifies All Video files in your device’s Internal Storage and SD Card automatically and you get access to complete video listing to choose and play a video.  •	Complete Video Listing with Recently Added Videos at the Top of Video List.  •	Folder wise Video Listing with Easy Navigation  •	Plays all video formats - 4K/ultra HD, MP4, MKV, WMV, TS, 3GP, WEBM, AVI, MOV, etc.  •	User-friendly Video Playback Controls.  •	Auto Rotate - Plays videos automatically to fit the best Screen Orientation.  •	Resume Videos from where your left over watching  •	Easy Video Share option  •	Video Delete option  •	Light weight and Low Memory Consumption  •	Multi Device Support – All current Android version Phones and Tablets  •	Video Count and Video Size display   KX Player - Full HD All Format Video Player is simple yet powerful and fast video player with very less memory consumption and supports all video formats and multiple devices. It is a must have app for all to enjoy their favourite videos in a click on their Android devices."
90C210D32ABC00917FF89207847FCB454907A1DD8571A9AC038AB10CDB88E1BD,jp.gr.java_conf.kuni.videoplayerfree,VIDEO_PLAYERS,"It is a video player unique little. I think when you find the scene you want to see the movie, and you want to fast-forward or rewind. At such times, you can see a little scene of destination. Vanity, I can see pieces of certain parts of the video as side by side in a continuous manner.  Seeing is not believing in one review! Please try once!  How to fast-forward, rewind Just move your finger to the left and right by touching the screen.  How to zoom When you pinch out, the video screen will zoom.  Caution Ads will be displayed during playback of video so free version. Playback is possible to continue by closing the ad  keywords： video, movie, forward, player, zoom, fast-forward, rewind  Verification device Xperia GX  Function addition 2014/1/20 - Add file selection mode 2013/10/23 - Add pinch zoom  history 2014/3/9 - UI Changed  2014/3/8 - bug fix  2014/1/22 - bug fix  2014/1/20 - add files selection mode  2013/10/27 - bug fix  2013/10/25 - Improved Behavior  2013/10/24 - bug fix  2013/10/23 - Add pinch zoom  2013/10/18 - bug fix"
FE83C766B2EE26AA53588D8144A92A73151CF4470DDC805E45AA74128860B1ED,media.video.hdplayer.videoplayer,VIDEO_PLAYERS,"HD Video Player for Android, the most quality and powerful video player in the market. You can easily enjoy smooth and HD quality playback effects.  Also, it's the easiest-to-use video player on the market.  The smart auto search and folder list view make you more convenient to find all video files.  HD Video Player for Android perfectly supports all popular video formats. Including avi，m4v，mp4，wmv，flv，mpeg，mpg，mov，rm，vob，asf，mkv，f4v，ts，tp，m3u，m3u8  Key Features: - automatic identify all mobile phone video files - supports all video and audio playback formats - supports multiple subtitle formats, automatic synchronization - using hardware decoding, take advantage of hardware acceleration - small memory, simple operation, quick start, smooth playback support - Flash formats video - flv, asf videos - Thumbnail displays of videos - HD video playing memory optimization - Recent Play list - show all video folder list  We ensure you will love this video player after using it.If you are pursuing a video player with the better user experience and user interface，HD Video Player for Android will be your best choice."
342262B28F83F847AF0830C10667A54880583245EE91AB01B698BB6557FA4821,com.miui.videoplayer,ENTERTAINMENT,"We've added some new features to make your viewing experience even better: Powerful zoom is right at your fingertips. Mi Video supports 25%-500% zoom. Search online for subtitles, even for local videos. Select the language you need, hassle-free. Choose between 16:9 or 4:3 aspect ratios.  Mi Video is a powerful local video player and downloader preferred by millions of users. With Mi Video, you can play, download, stream, and manage your videos all in one place.  High requirements for the video player? Don't worry, we're exactly the video player you need, amazing video player for your phone and pad with attractive user Interface and powerful play functions such as background play function, pop-up play function. High requirements for the video downloader? Endless of trending videos from Instagram, Likee, facebook, Trumblr, Snapchat, Tiktok, you can download videos of all these media, enjoy fun content any time and any where, and share them to Whatsapp.  Looking for a perfect video player? Mi Video is committed to creating an excellent video player and providing high-quality playback experience  for users of all mobile phone brands such as Samsung, Motorola, Huawei, OPPO, VIVO and so on!  Video player - Mi Video supports all major video file formats, including MKV, MP4, M4V, MOV, AVI, and more. - Background playback is convenient and full-featured: You can double tap the screen to pause or resume playback. Smart gesture controls allow you to adjust volume, brightness, or playback progress in a simple and intuitive way. You can easily zoom in and out on the played videos. - Subtitles are available in multiple languages.  Free video downloader - Want to save online videos on your device and watch them later? Mi Video can download videos from all major social media platforms. - Downloading videos seems too complicated? Our new interface makes video downloads simple and trouble-free. - Use the ""Help"" section of our app to learn how you can download videos. - Mi Video supports downloading multiple videos at the same time. You can also select your preferred resolution!  Online streaming - Mi Video offers a huge online streaming library: pranks, games, sports, news - you'll always find something to your taste. - When you don't know what to watch next, you can always check out our selection of the videos trending around the world or dive into built-in Facebook Watch feed.  File manager - All-new design allows you to find the videos you need in no time. - Create password-protected folders to store videos intended for your eyes only.  We keep updating Mi Video to make video playback, downloading, and file management even more convenient.   Mi Video is a perfect way to enjoy your videos. If you like Mi Video, give us some stars! ⭐⭐⭐⭐⭐  If you have any questions, feel free to drop us a line at mivideo-feedback@xiaomi.com or use the in-app feedback channel. Your feedback helps us make Mi Video better!"
8484A78B7BBBBA34CC69D58C986788D67B460F4EF7BD9780687B4958E237665C,saxvideo.beautifulgirlvideo.hdvideoplayer,VIDEO_PLAYERS,"HD Video Player, you can enjoy fast & stable 4K playback with equalizer & subtitle. It is also a video downloader, which helps you get online hot videos with flash speed. And you can even hide your personal videos in the private folder safely with this powerful video player.  For getting more entertainment watch videos and get unlimited entertainment.  Features:  ● Supports multiple subtitle formats, automatic synchronization ● Speed ​​up, reduce the speed of playing videos ● Customize the video frame currently playing ● Timer off video ● Find video files, music files by name. ● Video playback continues from the last position. ● Control video speed, and quick mute.   Floating Video Player Video popup enables multitasking. The floating video player overrides other apps and it can be moved and resized easily. Enjoy video on the split-screen and use other apps as usual.  Background Video Player Enjoy video on the background just like a music playback. Now you can enjoy the video and save battery for your phone.  Outstanding sound effects Our app applied frequency equalizer, thus ensuring the speed and effectiveness of the video for you to personalize your audio experience.  Enjoy ANY media on your smartphone and see why we are one of the best all video player apps.  Thanking to you For Using This app, give us your feedback, rating and Consider for Future updates.   If you find any issue related to this application Do not hesitate to contact us or Mail us.  Thank you..."
F1607A43FFDE22ECD7D49EBFC2C5CBEC5A5B6B65AB5AB5DF8891EE4A276DD164,com.videoplayer.mediaplayer.hdvideoplayer,VIDEO_PLAYERS,"If you are looking for the best media player to enjoy your favorite videos with full gesture control. Just install our HD video player & get all media files in one place and play your favorite videos in HD quality with all format video player. HD video player provides all media player features you need to play videos and gives an attractive user interface that gives you the best user experience. The video player app quickly fetches all media files available on your device and arranges them on the dashboard. You can classify all media files by the downloading sources that help you to play your favorite video quickly. All format media player enables you to share, rename or delete any video you want.   <b>All Format Video Player</b> Play all format videos including MKV, MP4, M4V, AVI, MOV, 3GP, FLV, WMV, RMVB, TS, etc.  <b>HD Video Player</b> Play HD, Ultra HD, 1080p & 4k video files smoothly in an HD video player all formats.  <b>Files manager</b> Identify all video files on your device and SD Card automatically. In addition, manage or share videos easily.  <b>Background playback</b> HD media player enables you to play video in the background just like a music playback. keep playing videos even after switching to another app or turning off the screen  <b>HD player with speed control</b> Users can quickly change the video playback speed in the range from 0.5x to 2x with this media player.  <b>Smart Gesture control</b> Easily use gesture control to adjust the volume, brightness, and playing progress by sliding on the playback screen.  <h2>KEY FEATURES: </h2> ● Support ALL video formats, including MKV, MP4, M4V, AVI, MOV, 3GP, FLV, WMV, RMVB, TS, etc. ● Ultra HD video player, support 4K. ● Hardware acceleration. ● Night mode, quick mute & full-screen view. ● Identify all video files on your device and SD Card automatically. ● Manage or share videos easily. ● Easily rename files or delete duplicate videos. ● Easy to control volume, brightness, and playing progress. ● Enable you to keep playing video when switching to another app or turn off the device screen ● A-B Repeat & loop mode available in media player. ● Video player HD for both android tablets and android phones.   For feedback and suggestion: tripplanner.gps2020@gmail.com."
84A276E823EC8D5F5D148EBDADA4E08C11181B6B7C3D62BDA43FB0F238984450,video.player.videoplayer.hd.fullhd,VIDEO_PLAYERS,"The <b>HD Video Player All Format Pro</b> mobile app is the perfect solution for anyone who wants to enjoy their favorite videos and music on the go. This app is designed to play videos in Full HD 1080p resolution, making it ideal for watching movies and TV shows in high definition.   In addition to videos, the Movie Player app also comes with a built-in <b>Music Player</b> that allows you to listen to your favorite music offline anytime, anywhere. The app also features an <b>equalizer</b> function that lets you adjust the sound quality to ensure the best listening experience for your favorite tracks.  The Video Player app also includes several other useful features: 🟣 private folder - еhe app's ability to create personal folders allows you to keep your media files organized and easily accessible. 🟣 video cutter - enables you to trim/cut your videos without having to use a separate editing app. 🟣 play media files in the background - you can continue to play your media files even when you switch to another app or lock your screen. 🟣 supports storage of files on SD card - ensuring that you have enough space to store all your media files.  🟣 the app also comes with many themes to choose from, allowing you to customize the look and feel of the app to suit your style.  🟣 one of the main advantages of the Video Player app is its <b>ability to play most video and audio formats</b>, eliminating the need to download additional codecs or media players. With the app's easy-to-use interface, you can easily manage your media files and organize them in different folders.  The Video Player Lite is designed to be user-friendly and easy to use. Whether you're commuting to work or traveling, the Live Media Player app is the perfect companion for anyone who wants to enjoy high-quality video and audio on the go.  With its support for a wide range of video and audio formats, the Video Player app is the perfect solution for anyone who wants to play their media files without worrying about compatibility issues.  Overall, the Video & Music Max Player app is the perfect real media player for anyone who wants to enjoy their favorite videos and music on their mobile device. With its user-friendly interface, support for most formats (AVI, MP3, WAV, AAC, MOV, MP4, WMV, RMVB, FLAC, 3GP, M4V, MKV, TS, MPG, FLV, and other), and powerful features, this app is a must-have for anyone who wants to take their media experience to the next level."
