sha256,pkgName,categoryID,description
F4315263B9ACF96AC51783F3D69177F9B69D0B43C68D78506FD2DF7D5C8BA1E8,com.hd.video.player.best.mediaplayer.fast.videoplayer.glob,VIDEO_PLAYERS,"Video player / media is fast and best video player for all formats (wmv,avi,mp4,flv,av,mpg,mkv). HD Video Player (wmv,avi,mp4,flv,av,mpg,mkv)2020 Free is easy to use video player for every user.Video player play video smoothly.video player also play music like  music player.its a real player which detect movies automatically from your mobile sd card or internal memory of mobile and show in the list.  HD video player support almost all the video formats like AVI, 3GP, M4V, MOV, MP4, WMV, RMVB, MKV, TS, MPG, FLV, etc.Video Player is an easy,fast,best and small, but powerful HD Video Player and Movie player for your android device. This Video Player using the hardware decoding, with the most smallest size and smaller memory usage, which make your video play more faster and smoother HD playback! It is one of the best HD video player for android tablet and android phone.Video player for Android has a media library for audio and video files, and allows to browse folders directly. Movie player or media player has support for multi-track audio and subtitles. It supports auto-rotation, aspect-ratio adjustments and gestures to control volume, brightness and seeking. Video Player for Android is the best video player in the market. Enjoy high quality videos plays smoothly .HD Video player play all formats videos so we can call fast video player and best video player.  HD Video Player Features: * video Player have quick start  * wmv player support auto-rotation, aspect-ratio adjustments. * Easy Volume control in video playing. * avi player support floating play window, more easy to control your device when playing videos * Automatically recognize all video playback files on your phone. * movie player browse files and folders in storage * fast video player swipe controls for volume * Plays all the video formats smoothly, supports hd, full hd and 4k videos. * Small size, small memory usage and High Efficiency playback * with best video player easy take video Screen shoot when play back * supports multiple subtitle formats, automatic synchronization * using hardware decoding, take advantage of hardware acceleration * small memory, simple operation, quick start, smooth playback support * List all the video files and find them quickly * Hide video files, protect your privacy. * automatic identifiy all mobile phone video files * supports all video and audio playback formats * Play HD, full HD & 4k video smoothly, moreover play video in slow motion. * Quick start up and small size Video Player App. * HD and Smoothly Play video and movie files * Remember recent video play history   Video player means real video player is specifically designed for personalized experience for watching videos,lecture videos and movies.  Even there have lots of video player but this is in small size,fast and best video player for all formats (wmv,avi,mp4,flv,av,mpg,mkv)."
8015E436FB951C43B6A2FA7A31AF0FC4CBADC36A396E9158B5762BF49EA4C538,com.fundroid.videoplayer,VIDEO_PLAYERS,"HD Video Player, you can enjoy fast & stable 4K playback with equalizer & subtitle. It is also a video downloader, which helps you get online hot videos with flash speed. And you can even hide your personal videos in the private folder safely with this powerful video player.  HD Video Player is a professional multimedia player for android phone and tablet. Full HD Video Player supports ALL video formats, 4K/ultra HD videos, and plays them with high-definition, sound effect and subtitle. HD Video Player also protects your private videos from being seen or deleted wrongly by others.  VidFun Video Player All Format is a professional video player tool. It supports ALL video formats, 4K/ultra HD. VidFun Video Player supports many video formats and plays with high video definition. You can add videos on the favourite list. HD video player helps you full HD playback with Slow motion and fast motion.  Video Player All Format is a professional video playback tool. It supports ALL video formats, 4K/ultra HD video files, and plays them with high-definition. It is one of the Best HD Video Player for android tablet and android phone. HD Movie Video Player also protects your private video from being deleted or seen when people use your device.  Features: ● VidFun Video player Suport All Format videos. ● Play video, play music, photo gallery. ● Cast videos to TV with Chromecast. ● Support subtitle downloader and more. ● Play video in pop-up window, split screen or background. ● Night Mode, Quick Mute & Playback Speed. ● Play video, play music by folder ● Video and Movie player, music player ● Supports multiple subtitle formats, automatic synchronization ● Plays multi types video formats HD videos and Music: MP4, M4A, FMP4, WebM, MKV, MP3, Ogg, WAV, MPEG-TS, MPEG-PS, FLV and ADTS (AAC). ● Speed ​​up, reduce the speed of playing videos ● Customize the video frame currently playing ● Find video files, music files by name. ● Video playback continues from the last position. ● Control video playback speed, and quick mute. ● Powerful folder view to play music. ● Select multiple video and play, share or delete. ● Save video playback history  Floating Video Player Video popup enables multitasking. The floating video player overrides other apps and it can be moved and resized easily. Enjoy video on the split-screen and use other apps as usual.  All Format Video Player Play all format video & audio, including AVI, MP3, WAV, AAC, MOV, MP4, WMV, RMVB, FLAC, 3GP, M4V, MKV, TS, MPG, FLV, etc.  Video Player HD with slow motion Video Player HD plays full HD & 4k video smoothly with slow motion. It is the easiest Video Player HD for android, free and powerful.  Background Video Player Enjoy video on the background just like a music playback. Now you can enjoy the video and save battery for your phone.  Outstanding sound effects Our app applied frequency equalizer, thus ensuring the speed and effectiveness of the video for you to personalize your audio experience.  HD video player plays and supports all type of videos and audio files like AVI, 3GP, MKV, TS, MPG , M4V, MOV, MP4, WMV, RMVB, FLV and MP3. You use this Free HD Video Player and click on videos and all videos in your mobile organized quickly. When you click on audios then all audio songs open. HD video player plays all types of videos and play all length of videos.  HD Player is a free multimedia player for the Android. Now you can watch all popular video formats on your phone with hardware acceleration for faster and smoother HD playback with unparalleled ease and comfort. Best HD Video Player supports all popular videos formats, including AVI, 3GP, MKV, TS, MPG, M4V, MOV, MP4, WMV, RMVB, FLV, etc.  Thank you for taking the time to review our application. Regarding any query related to any image or icon or screenshot or video, please send your suggestion and problems to our email fundroidapps27@gmail.com. We are happy to help you."
F17C91258EF2D4491B4CF34E3554399F23342A9E456E4AF67B9FFD5DF6F18EF4,co.video.videoplayer,VIDEO_PLAYERS,"<b> Co Video Player - HD player all formats</b> is a powerful video player with advanced hardware acceleration. It is a highly efficient video playback tool that uses your device's default decoder for decoding, thus ensuring the playback is in the original resolution. It is also an ultra HD video that supports 4K, you can easily improve the sound and picture quality of your video and enjoy yourself like you are in the cinema.  📀   Video Player is very easy and convenient to use, just copy the video from your PC or download from the Internet, you can watch it directly without conversion. With this Video Player, you can watch free movies at home!    ⏩<b>Support all video formats</b> Video player supports almost all video formats including AVI, MP4, WMV, RMVB, MKV, 3GP, M4V, MOV, TS, MPG, FLV, etc, depending on your device's decoder.  ⏩<b>Smart playback</b> Remember the last video playing progress and recognize the videos that are added recently.   ⏩<b>Convenient file manager</b> Scan all video files in your device automatically. Arrange video folders according to name, date and amount ascend/descend. You can keep your video safe with private folder by encrypting the videos with password.   ⏩<b>Floating pop-up player</b> Watch your videos in full screen or use the floating popup for multitasking, customize the size to your needs, and move the floating popup player wherever you want on the screen.   ⏩<b>Audio play</b> Enjoy video on the background just as audio playback, you can watch a video in the way of listening music.    ⏩<b>Trendy design theme</b> Multicolor theme for you to choose: Light, Dark, Cyan, Violet, Azure, and Magenta.  ⏩<b>Other features</b> - Video network stream - Thumbnail of video - Sleep timer - Playback speed - Screenshot - Multi-screen ratio - Small memory - Quick mute - Sliding to control the volume or brightness   <b> Co Video player </b> is designed for everyone, you can use it to play videos either on your android mobile or your android tablet and enjoy cinema effect. Video Player is a free media player that supports all video formats. Come and download this <b>Video Player</b>now!"
7ECFFD43DBFFA209D7E43F5DE2BD6B428BCD126BB4814C9595D738501FF85F08,com.ultplayer.videoplayer,ENTERTAINMENT,"Ult Player is a free video player for Android. The player is a simple, fast video playback tool. It supports a lot of video formats. It is one of the best video players for android tablet and android phone.  Files manager - Ult Player use system file manager for finding your video. You can work with it right from the first minutes.  Easy to use - Easy to control volume and playing progress by sliding on the playback screen.  Multi Size Functionalities/ Screen Resize - Play Full size video. - Watch Portrait Mode or Landscape Mode.  Ult Player is offline video player from your phone only. Not online video player. We are open to any suggestions for better user experience. Please feel free to contact us."
EC0371AB463C3ED1AF0EE6207612FD9D0E095FBD1E1412882A9B51CC0C3164E3,hdvideoplayer.videodownloader.hdvideoprojector.livvidiocall.statusdownload.lockvideos,TOOLS,"HD Video Downloader With Video Player app to enjoy fast & stable 4K playback in Nice View with social media video downloader.  HD Video Player | Play It all type of videos: # Browse all your local video files and play status videos, trailers, movies,films and any other videos stored in your device. # Background play function to keep playing the video when switch to other apps or turn off the phone screen # Floating play function to adjust the player's floating window and use other apps at the same time # Easily use gesture control to adjust playback speed, brightness and volume. video playback continuous from the last position smartly  📽▶HD Video Downloader: Download It all videos: - Select the video website or social media site like Facebook, Instagram, Whatsapp, twitter and save full hindi movie - Many Features to say its Best Video downloader 2️0️2️1.   HD Video Player Features: 1) Play HD, Full HD, 1080P, 4K & Ultra 4K videos 2) Support ALL Video Formats including: MKV, MP4, M4V, MOV, 3GP, FLV, F4V, WEBM, etc. 3) Play in Pop-up Window or Floating Window 4) Best HD video player, Video downloader, video status saver, photo status saver and Girls Wallpapers. 5) Automatically detect videos in the phone storage or SD Card 6) Screen Locker prevent misuse when the video is playing 7) Smart gesture operation 8) HD Video Downloader | Video Player for both Android Phone and Tablet  #Pop-up & Floating Video Player Enjoy video in the background just like a music playback to save battery. Watch video in pop-up window, split screen for convenient multitasking.  #Easy to use Nice Ui and easy navigation. Easy to control volume, brightness and playing progress by sliding on playback screen.  #WAStatus saver Keep your whatsapp status videos and images save on mobile.  We are working very hard to provide better experience as a Excellent HD video player. image & video status saver, Video Downloader & Girls HD Wallapaper.!"
97A69E6C97E3BD3773C89CC78B1E42B9CB4176C4D5CC9B1F75C593F6F2744349,com.pragati.hdvideoplayer,VIDEO_PLAYERS,"Full HD Video Player supports all video formats like 4K, HD,HQ, Ultra HD, 1080P, subtitle, HW Decode, HD Sound, Dual Audio.  HD video is an advanced video player for android.   Our Video player is an alternative video player of MXX Player, BLC for Android , KMPlayer & All Video Format. So download our official HD player app to play videos with advance support and watch unlimited free movies in all languages, TV Shows, Original web series, Live Tv, Songs, Music Video.   All formats media player is free to use and support most multimedia files as well as disc, devices, and networks streaming photo   So you want to get access to the best video player experience on mobile.?   Here we are with stunning UI /UX Design with powerful video player features. You can enjoy all format video including 4K ultra HD video files with high definition.   Key Features Of This Application  -  HD Video players support all video formats including MP4, MOV, M4V, MKV, WMV, RMVB, FLV, AVI, 3GP, 1080P, HD, 4k, Ultra HD etc. - Complete supports for zoom in & zoom out videos. - Amazing video player features like- copy, paste & cut, video play, resume, forward, backward, night mode, Timer. - Small memory - Play in background - Music player - Cool music player Widget. - Play video in pop-up window & in view mode. - Smart music player with Dolby sounds quality. - Video down loader option - Share any video with your friends and social media. - Select & delete duplicate video files in your devices. - Video cutter, MP3 Cutter, and Video maker option are working. - Keep your private video safe with a password protector option are available. - Play video from SD Card, USB, Pen Drive and mobile devices. - Smart Android video player with multi-core decoding Features. - Easy to control volume, brightness and playing progress. - Support auto-rotation, aspect-ratio adjustments in your devices. - Sliding the video screen to control the volume, screen brightness and the progress.  Benefits of this application - Video player         you can use all video player functionality in this application. and all formats are support this application like MP4, MOV, M4V,MKV, WMV, RMVB, FLV, AVI, 3GP, 1080P, HD, 4k, Ultra HD etc.  - Photo editing         This application include in photo editing option. you can easily manage your photo and set many type of effect like Beauty Camera Effects.and many type filters use in your photo. and you can easily share your photo in social media.  - Gallery        This application include gallery option in this application. gallery with latest graphics instead of old one. Use special gallery.   Thank you for downloading."
943ED762F75FA7993CCB536712E1F4040DCCDBA2029C0CD65149EAD8FF3BCBB2,playit.mixplayer.wxvideoplayer,VIDEO_PLAYERS,"<h4>Mix Player: Video player HD</h4> The Mix Video Player app is one of the most easily controlled video player tools, and it can play all types of media formats. The HD Media Player app supports 4K and Ultra HD videos. The Mix player is the media player in all formats with unique features. The HD Video Player app provides All Format supports ALL video formats, 4K / ultra HD video files and plays them in high resolution. It is one of the best HD video players for Android phones and Android tablets. The mix player app supports all video formats, including MKV, MP4, M4V, AVI, MOV, 3GP, FLV, WMV, RMVB and TS etc. Now you can watch all videos with a single tab and play that video. <h4>Features: 🎬 Mix Player HD video Audio🎬</h4> <b>📺Video player for all formats:</b> Supports most of the popular video formats for your Android device. <b>🎦HD media player:</b> Fast, convenient, easy to use and can generate amazing and fun sound effects. <b>📹Simple Play it videos:</b> Just tab any video and play it smoothly. <b>🎥MP4 Player:</b> Play all video formats, including MP4, HD and 4K. <b>🎼Music player:</b> Offline music player, song player, sound player, high quality mp3 player.  <b>🎶Multi-tasking:</b> background video player app plays video in the background like a music player. You can watch the video in the background and perform multitasking. <b>🎧Audio player:</b> Play your favorite audio tracks, music player and mp3 player. <b>🎵Video to mp3 player:</b> Extract audio from video. <b>📺Play My Videos:</b> Easy to use single tab control for brightness and volume. <h4>Classic media player</h4>  with speed control HD Player helps you enjoy full HD playback with advanced slow motion and fast movie settings. You can easily change the media speed from 0.5 to 2.0 with this HD player. And you can choose your favorite of six colorful themes to create your exclusive VCR. Mix player offers triple functionality of an audio player, VCR and Mp3 Converter. The most powerful video media player in Android Market. The best blending video player app to enjoy movies and music. For any complaints and feature request please email us at: tanybro878787@gmail.com"
EF563C28F2B889379868F1496B207A2DE8F2933BD3C0BF20BE159840B99B5FE9,com.play.hd.video.media.player.app,VIDEO_PLAYERS,"HD Video Player: Full HD Media Player is a stunning player for the Android device. HD video player is the latest phone video player, it has a powerful video decoding capability to easily support you play almost all max player stored on your phone. Full HD video player high volume supports all formats of video with high speed and clear graphics. You can easily control volume and brightness from the and forward video with a swipe. ultra-HD player is one of the best video players which supports multi-features.  HD Video Player: Full HD Media Player   Introduced online and local media folder with high Quality to supports all types of video formats. explorer library free video player is one of the best applications in the Android Play store. new HD video player uses hardware decoding which makes video play smooth and fast. HD Video Player: Full HD Media Player is easily tapped to open your all video files from your phone storage. MaxPreps will give you a better quality of any video. You can play your video automatically by clicking on a list of available videos.  the player supports almost all video formats, just depends on your phone or tablet. video player HD can play any video and audio files, as well as network streams, like the desktop version of VLC. mp4 player app is a smart and convenient video player for android. Let you feel the unprecedented audition enjoy. To improve your video sound quality. music player HD but smart and powerful video player that works perfectly for your phone. HD Video Player: Full HD Media Player   App is very simple to use with a great and smooth video playback experience.  HD Video Player: Full HD Media Player   App you can quickly rename, cut, delete, and conveniently share your videos.  video player supports gestures to easily adjust the screen brightness and video volume when you are watching the high-quality video player play video. HD Video Player: Full HD Media Player is a simple operation, fast and smooth playback.  This full HD video player app all format full HD media player has a speed controlling feature through which users can control the speed or customize the video speed as they wanted or needed. It is one of the best players for tablets and android phones.  HD Video Player: Full HD Media Player also protects your private video from being deleted or seen when people use your device. Video player is simple, fast start, powerful playback. It supports many types of video formats. It’s the best video player.  Video Player: HD video player plays all Format for free is an English player that plays your movie and protects your private video.  The full HD media player also plays ultra-high-definition video files too. With the shuffle to improve your video sound quality. It helps users to enjoy the mp4 player app with the best viewing experience HD Video Player: Full HD Media Player is User Friendly, attractive, supports faster, and provides smooth playing. The core function is to support music player video which is a powerful tool for playing Full HD on Android devices. <b>Main Features of Video player: HD media player   </b>  1.	Automatically detect all Videos on your phone or tablet. 2.	Plays all the video formats easily, supports HD videos. 3.	Small a size player so works quickly 4.	Video resume facility available  5.	Share video 6.	Rename video 7.	Video detail 8.	Delete video 9.	Floating screen 10.	Sorting videos 11.	Child lock 12.	Each folder will display its videos.  13.	Searching video"
8B0737D216F846F09C410CF90D4381DB3CD7AAE301454C9C686C76E734797197,com.hdvideoplayer.maxplayer.allinoneplayer,VIDEO_PLAYERS,"<h2><b>MAX Player - HD Video Player</b></h2>   <b>MAX Player - HD Video Player</b> is a free all format video player app in which you can play all formats of videos like MKV, MP4, M4V, AVI, MOV, 3GP, FLV, WMV, RMVB, TS etc. <b>Max Player - Video Player - XD Player</b> supports all android devices and plays videos very smoothly in all devices.  The <b>Video Player App</b> is the best app for video player and you can use it to play bollywood movies, hollywood movies, dance, songs, gana and many more with in full HD quality.  In this Video player enjoy high quality videos. play all video format.HD Video Player.A video player with equaliser. <b>MAX Player - HD Video Player</b> architecture has focused on stability, speed and smoothness of video player. With Equaliser, video cropping, advanced video decoder & all formats support, A-video player provides the best watching experience.  In this app <b>Max Player - Video Player HD</b> has the feature of background play which means you can play video and do other work while listening to music from this <b>background video player</b> feature.  The <b>Video Player all format</b> has the multiple back option like auto rotation, aspect ratio and screen lock.  This <b>Max Player - HD Video Player</b>has the feature of smart floating screen means you can do another task and enjoy the video at the same time with a smart split screen and enjoy another app as usual.  <h2><b>Key Features of MAX Player - HD Video Player</b></h2> The <b>video player app</b> plays all format videos. In this app you can play MKV, MP4, M4V, AVI, MOV, 3GP, FLV, WMV, RMVB, TS videos etc. This <b>Max video player app</b> fetch automatically all the videos from your gallery In this <b>Max Player - HD Video player</b> split screen, pop-up window and play background as an audio file feature. The <b>Max Player - video player</b> has the smart gesture feature of volume and brightness change. Powerful Equalizer with Bass Boost and Virtualize in mp3 player and mp4 player In this <b>Max video player app</b> smart playback options like Pinch to zoom, auto-rotation, aspect-ratio, and screen-lock. The <b>Max Player - HD Video player</b> has a Night Mode option to protect your eyes from blue light, and a Quick Mute option in the Player screen. <h2><b>Video Player HD</b></h2> is a totally FREE HD video player for android that can handle all format video files. And fetch automatically all videos from your gallery and play very easily. This is an all-in-one media player for different formats.  This Max Player - Video Player app provides us with the ability to take screenshots of our favorite scenes with just a single tap on the screenshot icon while watching any video. Along with this there is another Screen Lock feature also which provides us a facility to <b>lock out screen</b> to avoid accidental touches while Watching Videos.  #Please download and share this <b>MAX Player - HD Video Player</b> to your friends and others because it will help you to watch videos and also with the protection of eyes.   Thank You!"
8BEA5209BE6984B6D861CB221C679D536BA9E3BF2456BE1D5F20EA668563203D,hd.video.player.powerful,VIDEO_PLAYERS,"<b>HD Video Player</b> is the best video player on Android 💯. HD Video Player is powerful and simple to use. It can play <b>4K</b> and ultra HD video files. Video Player with tiny size and smaller memory usage, which make you watch video more faster and smoother.  <b>Key Features</b> ● <b>Ultra HD</b> video player, support 4K. ● Support ALL video formats, including MKV, MP4, M4V, AVI, MOV, 3GP, FLV, WMV, RMVB, TS etc. ● Hardware acceleration. ● <b>Tiny size</b>, apk only 5MB. ● Favor, delete, rename, share videos easily. ● Private folder keep your video safe. ● Fast forward ,fast backward. ● Find Similar video files. ● Easy gesture control of brightness and volume. ● Play Local and Network Stream video.  <b>HD Video Player with speed control</b> HD Video player helps you enjoy full hd playback with slow motion & fast motion advanced settings. You can change playing speed from 0.5 to 2.0 easily with this HD Video Player.  <b>Floating pop-up Video Player</b> Video floating popup enables multitasking. The floating video player overrides other apps and it can be moved and resized easily. Enjoy video on the split-screen and use other apps as usual.  <b>Powerful sound effects</b> HD Video Player build-in amazing equalizer, bass booster, and stereo surround sound effect, make you feel like being in the cinema.  <b>Files manager</b> Find All video files on your device including SD Card, and manage or share them easily.  Vid Player HD is the best and more faster video player with powerful features. Please send your feature request and suggestions about HD Video Player at carlrogers201400@gmail.com."
