sha256,pkgName,categoryID,description
9F81E9D590025640F78374EC51DDA233DB8DA29DF9BF3AE078E3F11C7C06FB3B,se.skanetrafiken.washington,TRAVEL_AND_LOCAL,"With the Skånetrafiken app you can: - Buy all types of tickets, including: Single, 24-hours, 30-days, Flex 10/30 and more. - Pay with Swish, card (Mastercard or Visa), or invoice from Swedbank Pay. You can also get email receipts of your purchases. - Find the quickest route on a map, and view the entire journey from door to door. - Create shortcuts (favorites) on the front screen for your most common journeys. - Receive information about ongoing disruptions affecting traffic, or journeys you have chosen to monitor. - Log in to My Account to have your tickets protected by our lost ticket guarantee, in case you lose your phone. - Lend your active 30-day ticket to a friend or family member (requires that you are logged in to My Account). - View estimated traveler occupancy for different journey alternatives.  Your views are valuable to us. Please give feedback, or ask for help via Skånetrafiken’s customer services."
9C43757A3EA6E273FE4442D8BA4D3EEA0ECB96392259985449EDBC0615800C46,com.whentransit.newyorkapp,MAPS_AND_NAVIGATION,"Never miss the bus again! IN NEW YORK with New York Bus Time App  New York Bus Time App uses Global Positioning GPS System hardware and wireless communications technology to track the real-time location of buses.   Get information about when the next bus will arrive at your stop, even if you are still at home, the office, shopping, or dining. All you need to do is put in your bus number or location in the search bar and it will tell you exactly where the bus is now download the app now and never wait anymore by the bus stop again!"
E6D3F4CF88AB82B16E9FCD43C6B50C66A3EA86FCA614F182B0C41EB6501A7708,bm.techyappsrt.winnipegtransitrt,MAPS_AND_NAVIGATION,"The only Winnipeg Transit Real Time App out there offering Navigo - your trip planner, with interactive commuting over the map along with real time buses arrival schedules at any given location in the city of Winnipeg.  Winnipeg Transit Real Time App Offers Following Features: - Dynamic real-time updates on buses - Stops nearby - Search by stop name, stop, or bus - Bus schedule auto refreshes every 30 seconds - Bus stops interaction from map itself - Set radius for nearby stops - Favourite your bus stops - Resizable map - See bus routes on map - See which buses offers WiFi and Bike Rack - Winnipeg Transit Navigo - Trip Planner - Transit service news and alerts - Facilities offered at the stop - comes in handy in winters a lot to see which bus stops have heated shelter.  This Winnipeg bus app will allow you to take bus around the city at your ease.  If you looking for advanced options like: 1) Would you like to be able to switch between devices and still access your favourite stops which you had on the last device? 2) Would you like to have your favourite stops stay and not disappear by mistake after an app update? 3) Would you like to be able to search nearby stops not just around your present location but also anywhere within the city just by dragging and moving the map? 4) Would you like to see the direction arrows on routes? 5) Would you also wanna be surprised by more features?  If your answer to all of the above questions is a BIG YES then download our another free app - ""𝐓𝐫𝐚𝐧𝐬𝐢𝐭 𝐋𝐢𝐧𝐞𝐬: 𝐂𝐚𝐧𝐚𝐝𝐚 𝐓𝐫𝐚𝐧𝐬𝐢𝐭 𝐑𝐞𝐚𝐥-𝐓𝐢𝐦𝐞"" and select your desired city out of 45+ Canadian cities currently in service on the app.  Download: https://play.google.com/store/apps/details?id=bm.techyappsrt.transitlinesrt  http://transitlinesapp.com  Please rate the app 5 stars if you like it  For any suggestions, questions, or feedback please feel free to email me."
4AF6841BE42B474ABD21D06193AAE43250F459F30F6103CDC9878EF2D700DB57,org.mtransit.android.ca_toronto_ttc_subway,MAPS_AND_NAVIGATION,"This app adds TTC subways information to MonTransit.  This app provides the schedule as well as real time service alerts and news from @TTCnotices & @TTChelps on Twitter.  These subways serve Toronto in Ontario, Canada.  Once this application is installed, the MonTransit app will display subways information (schedule...).  This application only has a temporary icon: download the MonTransit app (free) in the ""More ..."" section bellow or by following this Google Play link https://goo.gl/pCk5mV  You can install this application on the SD card but it is not recommended.  The information comes from the GTFS file provided by the City of Toronto. https://open.toronto.ca/dataset/ttc-routes-and-schedules/  This application is free and open-source: https://github.com/mtransitapps/ca-toronto-ttc-subway-android  This app is not related with the Toronto Transit Commission and City of Toronto.  Permissions: - Other: required for real-time service alerts and to read news from Twitter"
288A8326B2683EF5EB74F567264AA5283911B9FD779745D81BD4954EFB69501A,org.mtransit.android.ca_ottawa_oc_transpo_bus,MAPS_AND_NAVIGATION,"This application adds Ottawa OC Transpo buses information to MonTransit.  This app contains the bus schedule (offline and real-time) and the latest news from www.octranspo.com and @OC_Transpo and @OCTranspoLive on Twitter.  OC Transpo buses serve Ottawa in Ontario, Canada.  Once this application is installed, the MonTransit app will display buses information (schedule...).  This application only has a temporary icon: download the MonTransit app (free) in the ""More ..."" section bellow or by following this Google Play link https://goo.gl/pCk5mV  You can install this application on the SD card but it is not recommended.  The information comes from the GTFS file provided by OC Transpo and the City of Ottawa https://www.octranspo.com/en/plan-your-trip/travel-tools/developers/  This application is free and open-source: https://github.com/mtransitapps/ca-ottawa-oc-transpo-bus-android  This app is not related with OC Transpo.  Permissions: - Other: required to load OC Transpo Live Next Bus Arrivals & read news from www.octranspo.com and Twitter."
4ACA73330E9483AAF9BFBBC87EC02371B0EA9CB41330582A959E972CF65E9B22,com.barsbay.transittrackerchicago,MAPS_AND_NAVIGATION,"<i>Formerly ""Transit Tracker: Chicago CTA""</i>    <b>Depot is a powerful tracker for the buses and trains of the Chicago Transit Authority (CTA).</b>   - <b>Get quick answers:</b> See the stops and routes that are closest to you and save the ones you use most for easy access - <b>No need to keep opening up the app:</b> Track arrival times in your notification bar or right on your home screen with Depot widgets - <b>Don't waste time in the cold:</b> Set an alarm that lets you know when to leave the house - <b>Sit back and relax:</b> Depot can notify you when your stop is coming up - <b>In the mood to bike instead?</b> Depot also shows you a list of available Divvy bikes and stations    Depot Chicago is easy to use, features a sleek design, and <b>does not have any ads.</b> All transit data comes directly from the Chicago Transit Authority.    Permissions requested: Location - The app uses your location to show you nearby CTA bus stops and train stations. Photo/Media/Files - The app stores certain CTA data locally on your device so that it does not have to use the internet every time it needs to access that data. This saves you time and data usage."
A2AE2F7A4B037844514CF5EB6B999C19762DCB97862B9E51B30FC0AF1816A47A,sg.com.transitlink,TRAVEL_AND_LOCAL,"TL SimplyGo mobile app is an initiative by Transit Link Pte Ltd to bring the TransitLink SimplyGo Portal and the current suite of eServices on its corporate website (www.transitlink.com.sg) to the mobile platform.  The functions of TL SimplyGo mobile app include:  Customisable homepage  ===== * Customisable Homepage dashboard to facilitate access to your preferred functions   Journey Planner ===== * New Journey Planner function to allow planning of journey between locations using various public transport options, saved your preferred services and locations for quick access of information * Check out the bus services, bus routes, fares, estimated travel time and bus arrival times   My Cards & Trip Details ===== * Add your travel cards to your TransitLink SimplyGo Account * View and track any 30 days of your transaction records, up to the last 180 days * Submit your travel claims and view status online * Pay for penalty fees conveniently through the app   Top-Up & Concession Pass ===== * Top-up your SimplyGo card or purchase concession pass for your SimplyGo Concession card   eVouchers ====== * View and redeem the electronic transport vouchers under your registered CEPAS Card(s)   Travel Guide ===== * Bus / Bus Interchange Enquiry Check out the bus routes, fares, estimated travel time and bus arrival times  * MRT / LRT Fares & Travel Times Enquiry With our easy-to-use interactive map, choose your boarding & alighting points to find out the fares, estimated travel time and train arrival times  * MRT Station Map Enquiry Check out where are the bus stops and interchanges near the MRT stations   Concession Cards ====== * New Concession Card Application  Apply for your concession card at your convenience  * Lost Concession Card Replacement  Why Q at our CCRO when you can apply for a lost replacement immediately?  * Lost Concession Card Enquiry Lost your concession card? Check here to see if it is with TransitLink before you apply for a replacement  * Application for Card Conversion Send in your online application to convert your current concession card if you meet the eligibility criteria   Claims ====== * Being overcharged? Bus breakdown? You may file your claim via this function  We thank you for using TL SimplyGo mobile app and do let us know if you have any feedback on the application via the Feedback function."
07FC32F729EE7CD0505D860F6C235633B5745A4AA907D082D08C7B1D9CAE1DED,com.lighthouseaustralia.transit,MAPS_AND_NAVIGATION,"Quickly lookup when the next Adelaide Metro train, tram or bus is leaving your stop.  Features: -Simple interface. -Real Time departure times. -Filter stop departures by destination or route. -Small timetable download. -Search by stop or route. -Save favourite trips. -Departure reminder. -Share your arrival time. -Use GPS to find nearest stops. -No network access required after initial download.  This app works best if you find the trips you are interested in using the published timetable or Google maps. Once you know the stops and route you are interested in this application gives you a quick, easy and offline way of finding when the next service departs.  If you would like something added or you find any problems please let us know at support@lighthouseaustralia.com  The Data used by this application is available free of charge from Adelaide Metro at www.adelaidemetro.com.au"
BB586442ECA8CE63B391E2C6516763DEE8477B5AD4FD47D12C79C03E7BB09947,ge.com.ttc.transit,MAPS_AND_NAVIGATION,"Metro, bus and ropeway operator in city Tbilisi - Tbilisi Transport Company offers official public transport application for Tbilisi bus and metro. Application offers online and offline features.  ►	Journey Planner - Find out the best way to reach your destination       √	Select source and/or destination by:                 ▪	Current location                ▪	Street name                ▪	Stop name or ID                ▪	Point on map        √	Select options               ▪		Travel by (metro, bus or both)               ▪		Trip option (Quick trip, Fewest transfers)               ▪		Maximum walk distance ►	Realtime Bus arrival prediction       √	Select stop by:                ▪       Current location                ▪	Street name                ▪	Stop name or ID (you can Filter stops by route)                ▪	Point on map ►	View busses in real-time         √	Select route – select direction and view buses location in realtime ►	MAP (always Up-to-date)         √	View Tbilisi Metro lines and stations on Tbilisi map        √	View Tbilisi Bus route and stops on  Tbilisi map ►	Timetables (available offline)         √	View timetables by route number and stop ID                ▪	Select nearby stops (with GPS location), stop by name, street name or ID ►	Favorites         √	Save frequently used stops in favorites to access them later quickly ►	Information         √	Contact us         √	Fares up-to-date information about fares         √	Contactless card “Metromoney”  Keywords: Tbilisi, metro, subway, underground, bus, public transport, transportation, transit, network map, realtime, live, journey planner"
CCD66C4941D07943FB23BF2F55AF1CADAFB4AA3ED9C9C82A67AA5C7BD1C6BCB9,com.anilvasani.nyctransit,MAPS_AND_NAVIGATION,"NYC Transit App get you MTA NYC Buses arrival times on your phone. Take control of NYC Buses by your thumb. NYC Transit App provides service for Bronx, Brooklyn, Manhattan, Queens and Staten Island in New York City for MTA bus & subway.  Features: - Real-time NYC buses arrival times - Save frequent stops to your favorite - Find nearest stops via GPS - Find stops using routes - Get real-time buses and streetcars locations on Map - Stops list on map with route path - No hassle to press refresh. Built-in auto-refresh functionality - Pull To Refresh functionality - Share NYC buses arrival times with your friends - Customizable (Rename stops, Delete stops, Change nearby radius for stop search, Turn on/off auto-refresh, Change layout) - User Friendly with Interactive Interface - MTA Trip Planner available (Plan your trip around New York includes MTA Bronx bus, MTA Brooklyn Bus, MTA Queens Bus, MTA Manhattan Bus, Subway, Rail, MTA Staten Island bus) - See MTA Bus Full Schedule Arrivals on a stop - Save mta subway , bus schedule on main screen - Track MTA Subway real-time with GPS - See what's affecting your mta bus, subway service in real-time using service alerts - MTA Bus, Subway offline maps available  MTA Transit is a hopstop nyc app. Use tip planner to travel around new york city. Real-time nyc mta service alerts gives you ease of access to your Bronx, Brooklyn, Manhattan, Queens and Staten Island buses & subway.   * Your suggestion would be much appreciated. Please do so to improve the efficiency.  Note: This app is in no way affiliated or endorsed by the NYC MTA.  *includes real-time info(eg bus time & subway time in NYC New York, bus tracker & subway, train tracker in New York City, NextBus in New York, mta tracker, nyc subway tracker, mta bus schedule, nyc trip planner)"
9D9BEED439B1271828C9A48A9A3D3F757B4D976A53262FF2A7186D0F492A7218,com.transitfe,TRAVEL_AND_LOCAL,"Kochi1 - The official App of Axis Bank Ltd. and Kochi Metro Rail Limited      Kochi1 App is a one-stop application for all your travel and payment needs in Kochi.  The new Kochi1 app is much more than just booking metro QR tickets. A resident or a tourist, young or old, anyone can travel and explore Kochi city with an all-in-one platform at their fingertips. The app will allow you to plan end-to-end trips within the city using journey planner; quick-book tickets in just a few clicks; view bus and metro timings; explore the city; get notifications of local offers & updates and manage the Kochi1 card.   The card is truly multimodal – not only does it include metro and bus, be happy during your air travel as well. Apply for Kochi1 card using Kochi1 app and avail free lounge access at airports.    Exciting things you can do with the Kochi1 App:  	•	Whether you already have your Kochi1 Card or not, you can buy QR ticket on-the-go via the Kochi1 App and pay using debit/credit card, UPI, Net Banking or Kochi1 Card  	•	Get a one-way or a round-trip metro QR ticket and obtain easy refunds when you cancel metro ticket 	•	View ticket usage status when you enter and exit metro gates 	•	Book your QR ticket within 2 clicks using Quick-Book for your frequent routes 	•	Make your Kochi1 Card secure by enabling / disabling contactless and e-commerce transactions and managing their limits 	•	Explore local Offers, get latest updates and find nearby station at your fingertips   	•	Check metro and bus details such as timings, fares, route-map, etc.    	•	Seamless registration with multiple options: Kochi1 Card details, Axis Bank customer ID or as a completely new user   	•	Receive notifications on what’s new / latest updates on the Kochi1 card  	•	Book up to 6 tickets at one go  	•	Cancel your unused mobile QR tickets easily using Kochi1 App. *Conditions apply. Check FAQ for more details 	•	Add money to your Kochi1 card with your favourite payment mode - debit / credit card, UPI and Net Banking 	•	Check your Kochi1 card balance instantly and recharge for future use 	•	Take the fastest, cheapest or shortest route to your destination using Kochi1 App Journey Planner 	•	Plan end-to-end trip within the city using Journey Planner in Kochi1 App 	•	New to Kochi? Get to know the nearest metro station and get directions to it 	•	Login securely using fingerprint and 6-digit MPIN 	•	Already registered on Kochi1 app without a Kochi1 card? Link it later Block your Kochi1 card temporarily or permanently in case you have misplaced it 	•	Explore tourist places, ATMs, parks, malls, restaurants and more places near you 	•	Know the end-to-end process to complete full-KYC for Kochi1 Card Book QR tickets for metro and water metro at your fingertips with multiple payment options 	•	Contact your family & friends in case of emergencies 	•	Now enable / disable transactions of your Kochi1 Card and adjust their limits using Manage Limit feature of Kochi1 App 	•	Now manage e-balance and chip limit of your Kochi1 Card using Manage Limit feature of Kochi1 App  Online Metro ticket booking: 	•	Login to the Kochi1 App 	•	Click on the tickets tab on the right bottom of the page 	•	Enter you from and to destination 	•	Choose one way or round trip as per you convenience 	•	Click on book ticket to proceed 	•	Choose your convenient mode of payment 	•	Now it is all done, your QR ticket is generated now and you are ready to travel  Use Kochi1 card anywhere and everywhere and forget the hassle of carrying cash and multiple cards. Link the Kochi1 card to Kochi1 app and recharge online to avail exciting offers. Just walk your way to metro gates, no stopping anywhere. Future release would provide you with water metro ticket booking via, adding another mode to our wide offering. Download the app and live the metro life. Send us your feedback and suggestion on transitapp.support@axisbank.com"
374EF23EBF8E313856D9DBFACF682B58977A8173C6EC5D12CE9ED825D7A7CC1E,com.transitin.trackmytrain,TRAVEL_AND_LOCAL,"<b>Track my train</b> is an Unique App designed for Indian Railway travellers with goal of providing accurate details of the running trains to them.  <b> Offline Train App </b>  With the everchanging Train Timetables, Users find it difficult to keep a track of all of that and Considering the poor internet on Railway tracks, We have come up with an offline solution to this.     Track My Train works completely offline and users can track the train with accurate position and delay prediction whenever they are inside the trains using connected cell tower / GPS .This App requires internet only When user is outside train.  <b> Powerful and Accurate Train Status </b> Get the accurate train status with minute to minute reporting  and delay prediction for the upcoming stations powered by Machine Learning Algorithms.The app learns train arrival patterns on the go and presents you with the best and accurate data than any other app.  <b> What distinguishes our App  from Others ? </b> 👉 Most Up to date train information Offline 👉 Powerful and Accurate Train Delay Prediction  👉 Train Location without Internet - By Cell tower 👉 Use App in 9 Languages 👉 Comprehensive Information about Train without Internet 👉 Explore all details about train or station   <b>Speaks Train Status </b> You need not check open and peep into the app every minute for train updates as it can speak and announces train location updates as and when train is moving (Something which is not there is any other app)  <b> All Train Related Information Without Internet </b> Know Coach position ,seating info ,platform number ,train rake type, reversal direction ,running days and even Inaugural date! without internet. Track My Train provides you with very comprehensive information about train offline , You can also easily check when the train is crossing state boundaries.  <b> Always Up to date Information </b> Whenever Indian Railways makes an change in Train schedules, Track My train syncs it immediately and provides the user with up to date information. No other offline train app like 'where is my train' or others have this much accurate and most upto date information   <b> Complaint to Railways Easily </b> - Is your coach not clean? - Is your Train late? - Is food not good? - Need medical help? - Are unreserved passengers present in reserved coach?  For all problems like this , you can complaint to railways directly from our app   <b> Plan and Track your Journey Easily </b> Check PNR status in 1 click, Get live updates about train cancellation / divertion in route.  <b> Comprehensive Information  </b> Track My Train contains comprehensive information about all railway station and trains including station address, history , navigation to station.  <b> Easy UI </b> Not only Track My Train is fast and accurate ,it is also easy to use .We designed it keeping in mind the user comfort .The Amazing dark mode will never let your eyes strain while you are tracking the train.You can access the app in 9 Languages (you can hear train status , view all station and train names in your  preferred language)  ☑ हिन्दी        ☑ తెలుగు        ☑ বাংলা  ☑ தமிழ்       ☑ मराठी           ☑ ગુજરાતી  ☑ ಕನ್ನಡ       ☑ മലയാളം     ☑ English"
D60C9A40EF23F5A591DAA10266B8BEE21D9D81DFEFD6DEC053748D6557039F69,com.latransit.lametro_app,MAPS_AND_NAVIGATION,"Never miss the bus and train again with this LA Metro & Bus Tracker APP.  The app uses Global Positioning GPS System to track the real-time location of buses and trains. With this app you will Know when the next bus and train will arrive at your stop, even if you are still at home, at the office, shopping or dining.  🥇#1 app in the market  📰Featured in major news networks 👌Nominated  ""Accu Fame""  🏆#1 Grand Prize Winner by ""NYC Tech Award""  ⭐Favorite transit app by ""City Ranker""   `App Features   🕗Live Status 🚉Schedules & Real Time Arrivals 🗺️Offline Maps 🔔Alert Notifications ❤️Favorite Routes & Stops  📲 🚊THE APP is designed to be simple fast and easy to use!  Download the app below and never wait by the bus stop again!  👍🏻 https://www.facebook.com/WhenTransit  ❤️Start loving your way!  🕘Whentransit.com"
B5CFF3B357BF5DBA60BA2F01876664ABAB6AA52A205B5C774B556D1BEA4BE494,com.sasyabook.runningtrainstatus,TRAVEL_AND_LOCAL,"<b>Train ticket booking with zero cancellation fee option. </b>  Live running train status, timetable, station status, PNR enquiry with prediction, a unique berth & seat calc, and reservation date calc.  Stop wondering ""Where is my train?"" and amaze your co-travellers by telling them ""Hmmmm.. we are running twenty minutes late"", without looking outside!  For the first time ever, introducing split RAC and Confirmation chances for PNR prediction.  Now you can find out if your ticket is likely to end up RAC or confirmed!  You can also add home screen widgets for ultra-quick, one-touch access to train, station & PNR status and time tables, and even search trains by voice with with ""Train Mic"", in app & new widget.  Featuring the handy berth & seat calculator: for the times when you want to quickly know whether its a lower berth or an aisle seat...  ...and the reservation date calculator: to find the reservation opening date for a given date of travel and set reminders for it.  Share live status, timetables, and trains between two stations with dynamic links from the app which will show up-to-date information when received.  Our train ticket booking is simple, quick, and easy with zero-fee cancellation option. Try it out today!  Sources of information: Live Train Status shown in the app is crowd sourced from users, and verified with information made available in the National Train Enquiry System (NTES - enquiry.indianrail.gov.in).  Disclaimer: This app is not affiliated with Centre for Railway Information Systems (CRIS) / NTES. We are an RailYatri affiliated IRCTC Authorized Partner."
