sha256,pkgName,categoryID,description
42F553FC6E431673C697EB018E0DB5AA981ADF770391C5E71B8E4F7F402CA267,ch.sbb.mobile.android.b2c,MAPS_AND_NAVIGATION,"SBB Mobile: your personal travel companion for public transport.  Want to know ahead of time if your train will arrive on time? Want to have quicker access to your ticket during ticket inspection? Want to be able to find your way better at the station and have reliable map information? We have good news for you! SBB Mobile can do it all. And much more.  The heart of the app is the new navigation bar with the following menu points and content.   <b>Plan</b>  • Plan your journey with a simple timetable search via the touch timetable or use your current position as the origin or destination, locating it on the map.  • Buy your ticket for the whole of Switzerland in just two clicks. Your travelcards on the SwissPass are applied. • Travel particularly affordably with supersaver tickets or Saver Day Passes.  <b>Trips</b> • Save your trip and we will provide you with all the information you need during your journey under ‘Single Trips’: everything from departure and arrival times, platform information and service disruptions to train formations and walking routes.  • Set up your personal commuter route under ‘Commuting’ and receive push notifications about rail service disruptions. • The app accompanies you from door to door as you travel and you will receive information about delays, disruption and interchange times via push notification.   <b>EasyRide</b> • Check in, hop on and head off – across the entire GA Travelcard network. • EasyRide calculates the right ticket for your journey on the basis of the routes you travelled and charges you the relevant amount subsequently.  <b>Tickets & Travelcards</b> • Show your public transport travelcards digitally with SwissPass Mobile. • It also gives you an overview of your valid and expired tickets and travelcards on the SwissPass.  <b>Shop & Services</b> • Buy regional transport tickets and Day Passes for the GA Travelcard area of validity quickly and easily without searching the timetable.  • In the ‘Services’ section, you can find lots of useful links about travel.  <b>Profile</b> • Straightforward access to your personal settings and our customer support.      <b>Contact us.</b> If you have any questions, feel free to get in touch:  https://www.sbb.ch/en/timetable/mobile-apps/sbb-mobile/contact.html  <b>Data security and authorisations.</b> What permissions does SBB Mobile need and why?  <b>Location</b> For connections from your current location, the GPS function must be activated so that SBB Mobile can find the nearest stop. This also applies if you want to have the nearest stop displayed in the timetable.  <b>Calendar and e-mail</b> You can save connections in your own calendar and send them by e-mail (to friends, an external calendar). SBB Mobile requires read and write permissions to be able to import your desired connection into the calendar.  <b>Access to the camera</b> SBB Mobile requires access to your camera to take pictures directly in the app for your personalised touch timetable.   <b>Internet access</b> SBB Mobile requires internet access to search the timetable as well as for ticket purchases.  <b>Memory</b> To support offline functions, e.g. station/stop list, connections (history) and purchased tickets, SBB Mobile requires access to your device’s memory (saving app-specific settings)."
4801D12183F7A268B3DB0116625D28787F5B36810A1FB99260B715A29B669F26,com.grofsoft.tripview.lite,TRAVEL_AND_LOCAL,"TripView displays Sydney and Melbourne public transport timetable data on your phone. It features a summary view showing your next services, as well as a full timetable viewer. All timetable data is stored on your phone, so it can be used offline.  Features:     - Trackwork and service interruption information     - Interactive maps (create your trip by clicking on your station/stop)     - Multi-modal trip editor (customise exact change locations / lines)     - Real-time delay information and vehicle map (subject to data availability)  Additional features in the full version of TripView:     - Save your trips     - No advertisements     - Organise trips into folders     - Alarms  NOTE: Best efforts are taken to ensure timetable accuracy, but no guarantees are made. If you find an error in the timetable, please email support@tripview.com.au with details. No guarantees are made about real-time data availability. If the transit operator doesn't provide real-time data for a particular service, TripView will revert to showing the scheduled time, as per the timetable."
707B3BEEBAF1F667F486EA60DC71A8262F5A5B0CD2B2AECF137432EAC887E6EC,uk.co.nationalrail.google,MAPS_AND_NAVIGATION,"Stay on track with the free National Rail Enquiries App, Great Britain’s number one destination for train timetables and travel information. Get live train times and cheap tickets from all the major train line operators.  National Rail Enquiries lets you plan, book and keep up to date with all your train travel in one easy app. Manage your journeys across the Great Britain train network with My Travel, plan new routes with our comprehensive journey planner and receive real time travel updates. Personalised to you, you can check timetables, set up travel alerts, find out about train disruption quickly, track your train and save your favourite journeys. You can also find cheap train fares.  Features:  • Click to buy tickets - We link you directly to the train operator so you can find the cheapest fares. No booking or credit card fees.  • My Travel – Set up personalised travel updates. Save your favourite journeys and stations. Find the next train departure home and get relevant live updates from across the network at a glance.  • Journey Planner - Plan your journeys with up-to-the-minute travel information and track the progress of trains and as well as being alerted to disruptions on the line along your route.  • Live Train Times - View real-time departures and arrivals boards for any station in Great Britain.  • Progress Tracking - Find out exactly where a train is along a route, from A to B and everything in between.  • Watch a Train - Pin a train to My Travel to watch its progress across the network with a single tap.  • Real Time Push Notifications - Get timetable disruption alerts sent straight to your phone or watch as they happen.  • Wake-up alerts - Avoid missing your stop or getting caught out when the train divides or arrives at its destination.  • London Underground and DLR - Plan your journey to or from London Zone 1 Underground and DLR stations.  • Taking you from A to B, put in a postcode and get the best route planner to the nearest station  National Rail Enquiries gives you live times and all the journey planner information you need about fares so you can buy cheap tickets for all journeys with the major train line operators across Great Britain:     Arriva Trains Wales     c2c     Caledonian Sleeper     Chiltern Railways     CrossCountry     East Midlands Trains     Eurostar     Gatwick Express     Grand Central     Great Northern     Great Western Railway     Greater Anglia     Heathrow Connect     Heathrow Express     Hull Trains     Island Line     London Midland     London Overground     London Underground     Merseyrail     Northern     ScotRail     South West Trains     Southeastern     Southern     Stansted Express     TfL Rail     Thameslink     TransPennine Express     Virgin Trains     Virgin Trains East Coast"
EADC7E829FCD9749BB84962527C0E347DC276D7FE71F0628DFCD08FDF318123A,ru.yandex.rasp,MAPS_AND_NAVIGATION,"Up-to-date suburban train times always in your pocket. Find out when your next train leaves, the ticket price and platform number all with a simple tap on your phone screen. View your favourites and history even when you're offline.  Get train timetables for more than 70 regions in Russia, Kazakhstan and Armenia (see the full geographical range athttp://rasp.yandex.ru/info/geo).  Timetables are updated automatically and take into account both delays and cancellations.  Key features: - suburban and regional train timetables for any day; - precise information on soonest departures, ticket prices and platform numbers; - access selected routes when offline; - automatic updating when RZD timetables change; - buy train tickets to and from Moscow airports."
86C0D75334605A9C8006A0C2623494D0F958ACAEC354CF5CC57BAAEE37CBE82F,com.moblin.israeltrain,TRAVEL_AND_LOCAL,"We've launched a new app for you that allows you to plan your journey quickly, efficiently and conveniently, including search history and viewing nearby stations.    Additional services will make your travel experience more convenient and efficient: - Reminders of getting off the train - Add the train ride to the calendar - Ride sharing  - View station information   In addition, the app coordinates references to the following services: - Contact customer service - Coordinating accessible travel - Request for compensation - Lost and found - Appealing for a payment requirement - Payment of debt"
DD281688C0996CB4F05827803718462C6E8786523315A5855CB707E044D7C51E,eu.baroncelli.oraritrenitalia,TRAVEL_AND_LOCAL,"<b>Trenìt!</b> is the most popular app to search for trains schedules and prices in Italy, available for <b>Android</b>, <b>iOS</b> and <b>Web</b> (www.trenit.app).   Its first version was released in September 2009 with the name <i>Italian Trains Timetable</i>, and it became <i>Trenìt!</i> in May 2014.  <b>Main features</b>: - search Trenitalia, Italo, Trenord, Ferrovie del Sud Est and many other trains - detailed infos about trains status, with the possibility of receiving notifications - complete view of all types of available tickets - possible to sort results by time, price and duration of the trip - direct links to purchase tickets directly from the train companies - list of all stops, with arrival and departure times - map of the journey with all stops - optimized for tablets (with dual-pane in landscape) - possible to share the details of a trip (via email, Facebook, Whatsapp, etc.) - app available in multiple languages"
0640B08AC42FF790E19E70DF6A4F18B53C4C46865470E192C9032344068E938A,com.pal.train,MAPS_AND_NAVIGATION,"Travellers love TrainPal because now they can travel further for less.  TrainPal is a money-saving, rail and bus ticketing platform helping travellers to explore Europe by train and bus. TrainPal enables you to compare and book tickets at the best possible prices. Whether you’re planning to travel within the UK, a summer trip to Spain or Germany, or even planning your holiday to Italy, TrainPal will meet your needs. Since its launch, TrainPal has been featured in the AppStore and Google Play, and it was also featured on The Gadget Show on Channel 5.  Wherever you want to go, you can rely on cheaper train and coach tickets.   Why TrainPal? - Split-ticketing: TrainPal can help travellers save up to 95.25% of the original rail fare in the UK. In addition to the traditional split-ticketing features, TrainPal also offers a flexible split-ticketing option to help travellers save even more. - Smart Journey Planner: Search, compare & book cheaper train/coach tickets. TrainPal simplifies your booking experience, saving you time and money. - Travel with Ease - TrainPal helps train travelers travel across European. - E-tickets – paperless & contactless: TrainPal offers electronic tickets on all routes supporting e-tickets, saving the time and hassle of having to queue to collect train tickets. - Smarter customer service: Refunding and changing tickets is easy on the TrainPal app. A refund for flexible tickets can be simply submitted and changed for Advance tickets in your TrainPal app, without having to contact customer service. - Effortless expense receipts: Travellers can apply for expense receipts with a single click on the TrainPal app. - 24/7 customer support: Our friendly customer service team are always ready to help. - Secure payment: Customer and bank information are securely held and encrypted to ensure a safe and secure payment experience. - Fast checkout: No need to register to book tickets, making booking speedy and simple. - Discounted fares: TrainPal supports all railcards and helps you find the best deal by booking in advance. - Payments: Book train and coach tickets with Apple Pay, and all major credit and debit cards.  Our Partners We work with more than 1000 trusted transport partners across Europe including Eurostar, Virgin Trains, Trenitalia, NTV Italo, LNER, GWR, DB, Renfe, and more. TrainPal launched coach booking services in early November 2019 and we now cover 47 countries and over 200 popular coach operators, such as National Express and Megabus.  Travel Further, For Less.  Download the free TrainPal app and embark on your train, coach, or bus journey through the UK, Italy, Germany or Spain, with cheaper tickets.   We care about your privacy and payment security. All payment information is encrypted and protected to a PCI compliant standard. TrainPal charges no booking fees and is ad-free too. Our payment system is powered by Ctrip*. The Ctrip Group has signed an agreement with the Rail Delivery Group and is an authorised worldwide vendor of National Rail tickets. Ctrip has been a NASDAQ listed company since 2003 (NASDAQ: CTRP) and is a leading global Online Travel Agency.    *(international brand – trip.com).   Follow TrainPal on social media: https://en-gb.facebook.com/thetrainpal/ https://twitter.com/thetrainpal   Our website: https://www.mytrainpal.com/"
B7ABBDDFDEA0E5A5D193AEC68ECCBA56DFF50B81079F6C3435AFA091FE0EB862,com.rails.red,TRAVEL_AND_LOCAL,"redRail <b>IRCTC Authorized Partner</b> app for <b>train ticket booking</b>.  Fastest confirmed tickets, Tatkal railway booking, Instant Refund, Check <b>PNR status</b>, <b>Live Train status</b>, 24/7 customer support for Indian railway ticket booking.    Trusted by millions of customers, redRail is a train ticket booking app by redBus (MakeMyTrip Company) for the easiest train ticket booking experience in India. redRail by redBus is the <b>Authorised IRCTC Partner</b>. India’s fastest railway reservation app which allows you to check PNR status, train schedule, and live running status of your train.  redRail features come in handy when you are left wondering <b>where is my train</b> or want to get an update on your PNR status. Here’s what you can do with the redRail - train ticket booking app:  <b>Book IRCTC Train tickets</b> ✔️ redRail is the Authorised Partner of IRCTC for online train ticket booking ✔️ One stop platform for railway reservation, check PNR status, live train status, platform number etc. ✔️ Easy tracking of seat availability on trains operating on desired routes  ✔️ Instant booking of train ticket with confirmation via SMS and WhatsApp ✔️ Get complete train information ranging from train schedule to live status ✔️ Recover forgotten IRCTC Password ✔️ ₹0 IRCTC cancellation charges ✔️️️ Increase your chance of getting a confirmed train ticket with the redRail alternate trains on the same route.  <b>How does train ticket booking work?</b>  1. Enter source to destination journey details 2. Select Train & Class 3. Use IRCTC Login id & enter passenger details 4. Select payment method & make payment 5. Enter your IRCTC password  <b>Live Train Running Status</b>  You can get NTES live train status on redRail easily:  ✔️ Best railway app for Where is my train tracking to find the train’s exact time to arrive at the destination ✔️ Check if the train is delayed or on time ✔️ Enter the train number and spot your train with estimated arrival time with the help of the GPS feature for over 5000 trains of Indian Railways ✔️ Know your railway platform number with platform locator and know your coach position before boarding the train  <b> Check PNR Status on Train Enquiry </b>  PNR is a record which includes details like train information, and personal information such as name, contact details etc.  ✔️ Learn about the train’s PNR enquiry through redRail notifications ✔️ Get a real-time answer for whether your PNR is confirmed or not ✔️ Check PNR Status and confirmation probability to know the chances of confirmation of your waitlisted tickets.  <b>Get Train Schedule</b> ✔️ Know all popular train schedules. ✔️ Get the Arrival and Departure time for all halting stations.  <b>User-friendly Interface for IRCTC Train Ticket Booking</b> - Train ticket booking is extremely easy with redRail’s simple interface  -  confirm tkt booking can be made within 5 minutes with all information in one place - Easy navigation  <b>Check Train Ticket Fare</b> - Get information about the IRCTC fare of popular Indian trains like Duronto, Rajdhani, Shatabdi, Garib Rath, Sampark Kranti, Vande Bharat, Jan Shatabdi, Intercity Express etc., - Enjoy hassle-free refund for online ticket booking cancellations through redRail train app  <b>Customer Support</b> - 24/7 customer support for IRCTC train booking  - Get quick answers to all train enquiries through redRail, the fastest railway app in India.  <b>Is redRail app safe?</b> redRail is an authorised partner of IRCTC, and therefore, all information available is authentic. When you book train tickets through redRail, we  ensure that all IRCTC guidelines are followed. So, you don't have to worry about any issues while booking.  <b> Why to use redRail to Book Train Ticket?</b>  Reasons to opt redRail for Train Ticket Booking:  - Authorized Partner of IRCTC - Cancellation Possible with Refund - Round-the-Clock Customer Assistance  For queries/feedback on IRCTC train ticket booking AppFeedback@redrail.in"
69490D753554F46A0D46CAE09573B8D614AB096FCD7726F9F4C5A192CEB5CB84,com.LamaApps.BusesDueLondon,TRAVEL_AND_LOCAL,"Meet London's best Bus app that is making everyone's public transport journeys easier. <b>Buses Due provides you with live bus times and helpful transport information.</b> Try it yourself for FREE.  <h2><b>Bus times you can count on</b></h2>Get live bus countdown times for bus stops nearby in London. This transit app gives you accurate bus arrival times for bus stops in London. Save your regular routes to your favourites for fast access. Check your bus timetable before setting out to avoid waiting in the cold. Know exactly when to start your journey!  <h2><b>Public transport journey planner</b></h2>Navigating around London using public transport has never been easier! Using our journey planner, you get the best, disruption free travel directions in advance. Want to know if your bus is on diversion? Open the app and check the service status for disruptions affecting bus routes served by your bus stop.  <h2><b>Beautifully designed bus tracker app</b></h2>Powered with live transit data, Buses Due has been designed with a simple user interface. It will make travelling in London a whole lot easier and faster.  Main features: ✔ Find bus stops nearby. ✔ Live bus times. ✔ Bus service status and disruptions. ✔ Public transport journey planner. ✔ Bus routes on map. ✔ Favourite bus stops. ✔ Choice between dark or light display themes.   Join the crowd who are travelling London efficiently. Live in London or plan to visit soon? This is the essential app for you. <b>Install Buses Due now for FREE!</b>"
D6457E0033949B6DA9D7079B161633C55AE40B8849A9872FCC49EDA2CD78013D,com.checkmybus.androidapp,TRAVEL_AND_LOCAL,"CheckMyBus – search and compare millions of connections and find the perfect bus for you.  Are you planning a trip, and you are not sure how to reach your destination?  Millions of happy travelers already used CheckMyBus – be the next!  With just a few clicks, you will be able to search and compare all the buses to your destination and find the best bus for your necessities. And of course, our App and service is free of charge!  WHY USE CHECKMYBUS  We work with hundreds of companies from around the world, to offer you the cheapest routes available. Our bus network is expanding day by day, and we apply no additional fees to the ticket price.  NOT JUST BUSES – CheckMyBus collaborates also with train, flight and carpooling companies, to give you even more options to reach your destination.  TRAVEL AROUND THE WORLD – With CheckMyBus you can find buses and other transports in the majority of North America, South America, Europe, South Africa, Australia, New Zealand and even Southeast Asia.  AN APP FOR EVERYONE – The App of CheckMyBus is available in 8 languages (including Mexican Spanish and Brazilian Portuguese), and you can compare the prices in 20 different currencies.  HOW TO USE THE CHECKMYBUS APP  Insert the info about your trip: origin, destination and departure date. Add a return date if you already know when you will travel back. Travelling as a group? Select the number of adults or children coming with you. When you are set, click on “Find now” to see all the possible connections between the two cities.  Too many connections? Don’t worry! Use the button on the bottom right to access the Filters. Here you can change the order in which the results are displayed or reduce the number of results shown.  In the Filters section you have many options: select the preferred way of travel, price levels, payment methods, departure and arrival times. You can also decide to show only your preferred companies, if available, and select specific stations from where to depart or where to arrive. Set the filters how you want, and then search for the offer that suits you best!  Once you have found the best offer for you, click on it. You will then be redirected to our partner’s store page, where you will be able to book your ticket.  CheckMyBus, we make bus travel simple."
365825F2A96FA13A5C97648F3227C862DCBA7968C5CB2D5D23B0870DACBC5021,de.hafas.android.rejseplanen,TRAVEL_AND_LOCAL,"The Danish Journey Planner  Features:   * search for journeys between all addresses, stations, stops and points of interest in all of Denmark * see departures from your nearest stops or stations * see a map of your walk to the station or stop (Google Maps) * see current status of most trains, the Copenhagen Metro and busses * access your previous searches easily * use the ""Take me home"" button which with one touch will show you a journey from where you are now to your home address * follow your most used journeys and get an alarm if something is changed on the journey"
D4E12A50D2CAF3DD3762D9CDB5DDBD5AC2A1ECAC796CC0D541056988082093A5,com.joulespersecond.seattlebusbot,MAPS_AND_NAVIGATION,"Never miss the bus again!  OneBusAway serves up fresh, real-time transit information in the following regions:  * Rogue Valley, Oregon (RVTD) * San Diego, California (SDMTS) * Seattle/Tacoma/Puget Sound, Washington (Sound Transit, KCM, Pierce Transit, Intercity Transit, and more) * Spokane, Washington * Tampa Bay, Florida (HART) * Washington, D.C. (WMATA) * York Region Transit, Canada (YRT / Viva)  * More coming soon!  Find nearby stops on a map, choose from a list of favorite stops, add shortcuts to your phone's home screen, and set reminders for frequently used trips.  - Like hacking things?  OneBusAway is open-source!  Find out how you can help at http://onebusaway.org.  - Problems with arrival times?  Real-time arrival information comes from your local transit agency.  Please tap on the arrival time and select ""Report problem with trip"" to tell them what went wrong.  Or, reach them via email by tapping ""Menu->Help->Contact Us"".  - Problems with the app itself (e.g., crashes)?  Please submit a crash report if prompted, or email us via android-app@onebusaway.org.  - Want a sneak-peak at new versions?  Sign up to be a beta tester at http://bit.ly/oba-android-beta.  - Want to know why we request certain device permissions?  Find out at http://bit.ly/OBA-Android-permissions."
2FF03B84E5E4B8FC63868A74AA379C13C183DFA91FF607E1B26910A18702C859,com.att.android.tfa,TRAVEL_AND_LOCAL,"Information on routes, timetables and stops for urban transport buses in Athens.  KEY FEATURES  Schedules & Arrivals in real time: * Routes. See real-time location of buses. * Route arrivals for stops.  Trip Planner: *Find the nearest bus stop and provides real time info about arrivals and bus locations and suggests the best route to your destination. * Select departure, destination and time of departure or arrival and receive direction for the optimal route using public transportation (bus).   Contact: If you have questions or comments, please email us at oasa@oasa.gr Please note that the application requires access to mobile  data and works best with enabled location service."
0B765C8DD7EA9B8F6B77F8732E64C6B7CF0769802807E04DCFCED105227C2D91,com.saptco.android.afc,TRAVEL_AND_LOCAL,"Eastern Region Bus - ticket for city transport in a smartphone for Dammam, Saudi Arabia.  The Eastern Region Bus mobile application is part of the Dammam Transport. The user of the application can purchase an electronic ticket for public transport and present it for control by the controller or using a special device installed in the vehicle.  To use the application, the user must:  Install the application on mobile device. Perform the necessary actions to register in the application (use of the application by unregistered users is not allowed). Payment for a transport ticket is made using electronic means of payment (payment cards) and other legal methods of online payment. Payment is made in compliance with the requirements of the PCI DSS standard.  As the number of participating cities increases, the mobile application is updated, and new features are added."
