sha256,pkgName,categoryID,description
E7F4028903F22C065AA840393433D5EEA4FA484746D6DC9AC40426A1C34E5F4D,com.voolenstudios.beach.photo.editor,PHOTOGRAPHY,"Beach photo editor and frames an outright background changer and photo frame placer. We have developed this app to accomplish people’s wish of getting out on to beach and have fun with their loved ones by clicking pictures. Our app exactly does the same by changing the background of your normal pictures to the one of beach realistically with at most professional excellence. This app is gives you wide range of realistic backgrounds, stickers and frames related to beaches .  Key features  •	Tools for background changing. •	Allows you to take pictures from the camera and also allows you to import from your gallery. •	Allows you to easily crop and flip images. •	One can easily cut an image from its background that to in a hand free manner and can be used further. •	Our default backgrounds, stickers and frames can be added to your images within no time  •	 Easiest editing tools to make your edit realistic. •	Effects added. •	Easy save and share options. Options Provided •	Camera :  redirects to your device’s camera so that you can click the image to be edited. •	 Gallery : to import the image to be edited from your gallery. •	Crop : for cropping the image to your desired dimensions by means of free crop. •	Cut : to cut the selected object from an image by means of free hand cutting. •	Erase : to erase the minor errors made during the cutting process. •	Effects : to add instant color to your images. •	Backgrounds: clicking upon any of desired backgrounds of beaches then the image which was previously processed by cutting, erasing gets placed automatically  •	Stickers: consisting of tattoos, sunglasses, boats etc for adding some visual complexity. •	Text : so that you can add texts of different fonts. •	Color bg : to place color of your choice to be your background. •	set wall : to set your beautiful edits as your device’s wallpaper just by a mere click •	Adjusting tools: to adjust the background blur, sticker and photo opacity. •	Frames: for instant use."
741D7AC2A7798D0AFD07E41F745E9B9A7582EC448FCA5945DF74ABAA7444A593,com.GrabbingGamestudios.Waterfall.photo.editor,PHOTOGRAPHY,"Waterfall photo editor frames is the app with background images, frames & stickers. It has wonderful collection of waterfall backgrounds, frames and stickers. This app is completely a user-friendly. We took extra care while designing and developing each & every functionality of the app. Our aim is to keep this app as friendly as possible and it must be easily operated every individual. This app contains beautiful waterfalls backgrounds & frames collection. By adding these wonderful backgrounds with your pictures you will feel like you are in those areas. Your photos with these backgrounds will give you an amazing look. Features and usage guidelines •	Take Selfie or Photo with your camera or pick the photo from the  gallery •	It has Crop image option to remove unwanted area from the selected image •	Select and set photo background with your photo.  •	Pick the Stickers from the options and drag it to the correct position, rotate it, multi touch to resize it. •	It has flip option to apply on stickers and text. •	It has lot of other features like adjusting brightness, contrast, saturation and you can do lot of modifications with the effects option. •     Effects will make your photo beautiful. •	You can save the final edited image and share it with your friends and on any social media network."
F5198983B78FFA1081CD50B3E80B3B124DD8589826ABA60FBDEB65573ED6EE66,com.GrabbingGamestudios.Greenhill.photo.editor,PHOTOGRAPHY,"Green hill photo frame editor is the app with background pictures & frames. It has wonderful collection of backgrounds and frames. It is full of fun to use this app. This app is completely a user-friendly App. We took extra care while designing and developing each & every functionality. Our aim is this app must be a user friendly app and it must be easily operated by anyone. You can erase the background of your photos & selfies and directly set these backgrounds or frames. You can crop your image and set it on any background in the list to make it as a photo frame. Features: Take selfie or photo with your camera or select gallery photos This app has crop image option to remove unwanted area from it Unwanted background can be removed by erase option. Select and set background with your photo.  Select stickers from the list and place it in the right place, rotate it or touch to resize it and fit on your face. Color effects will make your pic colorful and beautiful Final image can be set as device wallpaper. You can save the final image edited in this app and share with your friends."
04F3AB6153F8DEF29F0161F25027B0055B723A6D9058BF535B4188BF4657EDD8,com.GrabbingGamestudios.City.photo.editor,PHOTOGRAPHY,"City photo editor: photo frame is one of a kind photo editor that helps you to edit your photos with a less committed effort, that’s what modern world is after to make hectic processes turned to be an enjoyable, comforting process to all. We provide these sort of app that help you edit your pictures to pleasing ones with the small changes that are made using our app features. Beautiful city backgrounds, frames and stickers that are proven to be rich in every possible aspect are given, just in case you feel it handy to edit your pictures can be added within in no time.  Our app is designed to be user friendly app. To ensure this we look after everything that is being given in the app cautiously while designing and developing them. Our only aim is to provide an app that can be used to do some wonderful editing with ease by everyone.     Key features Best background remover that helps you to remove background of any picture by cut and erase options. Beautiful effects that are designed to bring out the true colors of your images. Cut option is made easier as you here have to just draw an outline of your subject in the picture that you wish to be there in your app and later make your selection precise. Erase option is just a hand eraser by which you erase the unwanted parts or the errors made in your selection so that get satisfied with the precision of your selection. Then opt for backgrounds that are designed to enlighten the beauty of cities that are provided in both in landscapes and portraits. If you think you might run out of time doing this process opt for readymade frames that are provisioned with white space indicating where your image gets directly placed on to your images. Also try adding our  text features that allows you to add different gradients, textures,  colors and shadows to your images. Adjusting tools such as of background blur, brightness, contrast and saturation are provided with sliders have fun playing with the sliders to find out what suits your particular image. Save and share your edits just by a mere click."
B7E056F4CDEFEB32F99F138CDE5E6437FC14C71C9D3582A995DF026D4D22F5F5,com.GrabbingGamestudios.Nature.photo.editor,PHOTOGRAPHY,Nature photo editor:  frames  is a photo editor app with beautiful nature background pictures & frames available in portrait and landscape modes. It has a wonderful collection of background and lot of other eye catching images with the wide variety of frames. You will be fully entertained and satisfied with the usage of this app with the colorful nature pictures. It is completely a user-friendly app. We took much more care while designing and developing this app. Our motive is to make every user to use this app effortlessly. It has a wide range of background and frame image collections. It has lot of stickers.   Features and functionalities: Take a selfie or pick any picture of your choice from the gallery and use that as the background and customize it as per your choice  Use crop image functionality to remove objectionable area from your photo Using erase option you can remove the non-required area from your picture. Set the photo background with your picture. Pick any sticker of your choice from the list and place it in the right position on the backgrounds or frames and add extra look to your picture. You can even rotate it for the proper placement. Use color effects to make your picture beautiful. Set the final image as your mobile wallpaper and share it with your friends or you can post it on any social networking site
3D4A72DB86241FC878D8E1DE695058329B5DC376004EB901118271ACE17BBF0B,mirror.photo.editor.addimage3d.app.frame.effect.best2017,ENTERTAINMENT,"3D Mirror Photo Collage Editor Create mirror and collage photos, edit any photo or stitch multiple photos into one collage photo with the Mirror Photo Collage Maker. Mirror Photo Blender provides a simplest and easiest way to blend two or more pictures together with advanced photo editing and enhancement options. Photo Blender camera that combines overlapping Great photos of your beautiful hands and perfect. Mirror Photo Collage Editor allows you to make mirror effect to a picture. You can cut your photos into different shapes like hexagon, rectangle, circle and much more. Photo Blender Collage support unlimited photo blend at a same time. You can also mix multiple picture and apply lighting bokeh effect on pic. Photo Overlays Camera provide advanced tools like double exposure, multi exposure, blending, mixing, effects, overlays and many more. With mirror photo collage maker, you can create many left-right, up-down reflection style of photos. You can apply many photo filters and frames to the mirror and collage photos. Download Mirror Photo Collage Editor for free now!  Mirror Photo Editor Feature List ::  ◎ Mirror Photo Maker - Select photo from Gallery or Camera your mirror photo will be generated automatic. - Different set of 14 mirror reflection effect provided. Left right mirror, up down mirror, repeat 4, reflect 4 reflections. - Apply best photo filter effect to your cool mirror photos. - Lots of different 3d mirror shape for your best photos. Creative and totally unique. - Edit your mirror photos easily with our best photo editor. - Give your mirror photo to overlays, texture, brightness, warmth, contrast, saturation, blur and cartoon effect. - Crop your mirror photo to selective crop ratio with advance crop tools.  ◎ Photo Blender Camera - Select Background from your gallery or we give you best HD background for your cool creation. - Select Photo from your Gallery album and Mix and blend two or more image with advanced blending tools. - Adjust photo blur and photo feather to background to look you photos more perfect. - Adjust Contrast, Brightness, Saturation and Sharpness according to your pics. - Rotate your photos horizontally or vertically or flip right or left easily. - Apply Cool photo filter effect over your photos and make your pics more beautiful. - We give you different overlays theme to set over your final photo creation. - Add Photo border & Border frame to your final pics to make it more awesome. - You can easily adjust border size and color with just one tap. - Compare functionally will help you to compare your original pics to your editing pics.  ◎ Photo Editor - Best and First Square cascade effect to make your photo more beautiful. - Select the cascade range of photos and choose range of blur effect that make your photo more awesome. - PIP Collage Editor lets you set a photo in another photo with the creative frame. Easily making your photo more stunning than other photo frames! - Photo mixer let you to add multiple photos of your choice for photo size as you want. - Simple touch gestures to rotate, re size, and delete any photos. - Set best texture background to your creative photo collage. Best HD texture theme background give you for your photo collage. - Add multiple photo text to your photo collage.  - you can change text style, apply shadow and set background color and transparency easily. - Two finger gesture to move around photos,resize photos and rotate photos.  If you enjoy using our app. Please take a moment to review us and give your comment to help us further development. Thanks for your support! If you like this app, then share with your friends and family as many as you can. Regarding any query and problem of this Mirror Photo Collage Editor app, then mail us. We happy to help you to solve any query and problem."
5FB01D7847391E0185AFBCE6EEC4426E0403AD54D56068739A31E4FE642E9F83,com.baby.photo.collage.baby.photo.frame.baby.photo.editor.sweet.baby.girl.maker,PHOTOGRAPHY,"Baby Photo Collage Baby Collage is a photo collage app that will turn your pictures into a masterpiece. All that you need is fantasy. Create your baby picture collage using our Baby Collage app and share it with your beloved or friends. These Baby collage will show them your care and will make them smile. Send baby shower wishes to all your friends with this free photo editor of Baby Collage Maker. With multi style Baby collage was designed which very cute, lovely, friendly. Baby Photo Collage Maker is one of a kind photo-editing app that is beyond your expectation. It was made by high quality standard and it is extremely easy to use. Make a fancy Baby collage of your friends and lovers photos, embellish it and send these personalized gifts to some special person. Everybody will surely fall in love with this Baby Collage Editor. Baby Collage Editor with a friendly interface, simple design, easy to use: with just a few simple steps as select frame, select images, rotate, zoom in, zoom out, move, save that you have a extremely artistic photographs. Customize the photo border, background, photo grid, filter and more with our photo editor! You can even use our powerful web search feature to find the perfect photos to add to your Baby collage. Decorate your photos with these incredible Baby photo collage and you can save the photo, share with friends and family. After make your creative photo frame, it’s time to show your creation to the world. Share your Baby photo collage pic to any social media app. Download this Baby Photo Collage Maker right away, and turn your best pictures into a wonderful photo collage.  :: Baby Photo Collage ::  * Choose from 200+ designed Baby layout styles and instantly create Baby photo collages. * Select 1 to 9 multiple photo from your gallery album and choose variety of Baby collage layouts. * Adjust Grid Customize Collage Layouts with Size, Space and Corner. * Adjust Seek bar and make your grid collage beautiful. * Set whole collage photo ratio as you want. * Lots of Editing Tools provide like Swap, Fill, Rotate, Zoom, delete, set filter and move easily. * Set Beautiful Baby Texture background to your pics. We give you lots of texture set for you. * Stickers and Emoji to add expressions to your photo. * Use beard, mustache, wig, goggles etc.. stickers to make funny images. * Snappy photo editor filters for snap effects. * Add Multiple Text with font style and font color to your photos.  ::: Photo PIP Effect with Camera :::  * You can select from gallery and take Selfie from the camera and make Selfie camera PIP image and share it to your friends. * We give you lots of PIP Style frame to make your photos more beautiful. * Change Foreground and background easily just single tap.  ::: Scrapbook Photo Mixer :::  * Create your own scrapbook photo and share to any social media app. * Select 1 to 9 multiple photo from your gallery album and arrange it to canvas as you want. * Change and set background to your scrapbook canvas.  ::: Blur Shape Effect :::  * Create Awesome Blur photos in shape style and share worldwide. * Adjust blur effect with simple seek bar. Change photo shape with easy-to-use. * Set your beautiful image as wallpaper directly from the app. * Save your beautiful photo to your sd card or our app gallery.  If you have any suggestion or any problem regarding Baby Photo Collage Maker app then contact us. We love to improve our app and user’s satisfaction. If you like this Baby Photo Collage Maker app then share with your friends and family. But before you do that, don’t forget to give your rate and review with best comment. Enjoy with this superb app."
0E35B46C674ECD727FD8718F45D252FA16B32A4288A979EE504E9BCA38475227,cut.paste.photo.effect.echo.crazy.mirror.magic.mirror.crazy.photo.editor.photoeffects.photo.blender.photo.mixer,PHOTOGRAPHY,"Cut Paste Photo Editor:: * Cut Paste Photo Editor is the best way to put yourself in famous places by replacing backgrounds with some of the famous background places. * Copy Paste Photo Editor lets you create unique collages by letting you copy and paste photos from gallery onto different collage backgrounds. You can add text to convey the message. * Alpha Cut Paste is the best to cut photos and paste photos on photo backgrounds that blends cut and pasted photos. * Photo Cut Paste Editor is easy to use and comes with advanced tools. * You can select one of many Famous Backgrounds with Backgrounds including Famous City Frames, Famous World Wonders and Awesome places Taj Mahal. Adjust your photo against the background. * Auto Photo Cut Paste provides a fast and easy way to create amazing custom pictures. Just touch the area of picture which you want to erase and Auto Cut Paste will automatically detect the entire area through color detection AI and it will erase that area for you so that you can paste that image on any other picture or on our existing HD backgrounds with Landscape and Potrait Mode.  Echo Mirror Magic :: * Want to show slow motion of your photo , want to show clones with mirror effect ? Then try our new Echo mirror magic effect app . Make your photo like echo of photo. * Echo Crazy Magic Mirror Editor app can be used for showing running, walking, jumping and many more postures with slow motion. Also this amazing mirror editor can be used to show crazy and magical mirror effects. * Using Crazy Mirror Photo Effects app you can see your picture in Twin Effects and Reflection Effect, Small to Big and Big to Small Effect, and many more effects.  Photo Blender Overlays :: * Blend your photos with creative some way. Download this Cut Paste Photo Editor app. This app is most powerful image editing application for making Blending photo.  * Photo Blender provides a simplest and easiest way to blend two or more pictures together with advance photo editing and enhancement options. * Create professional photo effects with advanced tools like double exposure, multi exposure, blending, mixing, effects, overlays and many more. With the Ultimate Photo Blender you can create an amazing poster of your photo by blending them into one.  List of App Feature ::  Photo Cut-Paste:: * Select the Photo you want to put against a Cut Paste by changing your photos background. * Fine Tune by cutting edges of Photo cut from step1 so that your photo looks beautiful agains any Famous Photo Background. * Select the background you want for your photo from Famous backgrounds offered. * Add the Photos to the background you selected and save the photo with new background.  Photo Overlays:: * Select Photo from your Gallery album and Mix and blend two or more image with advanced blending tools. * Select Background from your gallery or we give you best HD background for your cool creation. * Arrange your pics as you want and use to Edit pictures like professionals with many editing tools.  Echo Mirror Magic:: * Select your beautiful photo from your album Crop Photo Gallery. * Cut your photos that you want to that you can create replication mirrors. * Using advanced edit, you can trim and erase edges of cut photos and fine tune photos that are cut. * Zoom, Flip, Move your mirror effect to anywhere and set it according to your style. * You can change reflection Mirror Magic effect with your touch. * We give your different kind of Magic Mirror effect style.   If you have any suggestion or any problem regarding Cut Paste Photo Editor app then contact us. We love to improve our app and user’s satisfaction. If you like this Cut Paste Photo Editor app then share with your friends and family. But before you do that, don’t forget to give your rate and review with best comment. Enjoy with this superb app."
B55FB70E7FE8FD352F82E6223B83448B278D78257F7FFD5D2E74D8CED88591E9,com.voolenstudios.Sunset.photo.editor,PHOTOGRAPHY,"Sunset photo editor and frames is a potential photo background changer and frame adder app that makes you to edit your photos to be the ones clicked at a place with most beautiful sunset. Our beautiful, realistic backgrounds help you to edit your pictures to arts. Wide range of realistic stickers and frames are also provided for instant use. Our app is a user friendly app that allows our user to do your edits to your images in an easy way without any cumbersome process. Our app can use both the picture taken at that instant using the camera option provided in our app and also one can import the images from your gallery. Our app helps you to easily crop, flip your images for perfect dimensions just by a mere click. Also our best realistic sunset backgrounds provided by default in our app are designed in a way to fit to any of your images. Also our app consists of easiest tools for cutting an object from your images in a hand free manner and also an erase tool to erase the unwanted errors made during the cutting process.  Adjusting tools makes you to adjust the background blur, photo opacity and also sticker opacity so that you can edit your pictures with perfection. Many stickers of smileys, hats and birds help you to add some magic to your edits just by a mere click. Our app also provides you different beautiful frames to use it for instant edits by which you can place your image in the white space provided by default in our frames. Our unique effects add some instant value to your edits. Our easy share and save option helps you to easily share your images to your gallery and also to any of the social networking sites."
0D8CF72975470B9B043BCA46C66D1CB1D8B8784B129B543E6ADCB7E6F959051E,com.voolenstudios.Nature.photo.editor,PHOTOGRAPHY,"Nature photo editor and frames is an out and out photo background changer and frame adder that makes you to depict the beauty of nature to its best in each of your edits. Nature is the most admired all across the globe and is also very well known for its scenic beauty.  Here in our app we provide you everything that is necessary to make your edits depict the real will of nature by our wide range of beautiful backgrounds, stickers and frames. Our near realistic backgrounds of nature are designed in a way to fit into any of your images with at most perfection. We even add many more backgrounds to our apps in subsequent updates so can make many beautiful edits. Our app also you to easily flip, crop the image clicked at that moment by our camera redirect options or the image imported from your gallery for perfect dimensions. Our easiest editing tools for cutting an image from its unwanted background in an efficient way that too in a hand free manner. Also tools such as erase option that allows erasing even the minor errors made during the cutting process. Also subsequent adjusting tools to make your beautiful edits flawless that helps  you to seal the most minor errors by providing options to change background blur, photo opacity and sticker opacity. A wide range of stickers of domestic animals, plants etc are also provided so that you can add some sort of complexity to your edits in terms of objects. Also many different fonts of texts are also provided  in our app that helps you to add words to your edits. you can even add any color gradient as your background by using our best spectrum of colors provided. Setwall option that allows you to set your beautiful edits as the wallpaper of your device just by a mere click. Our effects can be added for giving beautiful finishing to your edits. Easy save and share options are also provided."
9CDC8F34A6D00BDCEFA25AB3C9B9B456B3D7F1641AFA0FCF2B1ABB3E174ECBB4,com.voolenstudios.Water.photo.editor,PHOTOGRAPHY,"Water photo editor and frames is a fun filled editing app for those who actually love to see water. Many people around the world love the soothing effect of water and also feel most excited while taking a picture with water. Our app allows you to make your images look alike that of the ones clicked with water.  Download our app for exciting range of stickers of boats, fishes and also flowers and for best background changing and frame adding. Key features •	Allows you to edit both the images taken by using the app and even edits an image imported from your gallery •	Easy flip, crop options. •	Astonishing backgrounds with real water backgrounds are provided. •	Easy cut and erase tools for selecting the object from a picture of your choice. •	Stickers of near realistic boats, fishes, water flowers etc. •	Different fonts of texts to add words to your edits. •	Best color gradient provided so that you can add any shade of a color as your background. •	Adjusting tools for making your edits flawless. •	Duplicate option helps you to replicate the selected image within the image. •	Set wall option that allows your beautiful edit to be the wallpaper your device just by a mere click. •	Many effects are provided for instant use. •	Easy save and share option."
